video_id,title,publishedAt,channelId,channelTitle,categoryId,trending_date,tags,view_count,likes,dislikes,comment_count,thumbnail_link,comments_disabled,ratings_disabled,description
"x5vsGz4cuXs","We Tried Makeup Hacks To Look Younger | Ok Tested","2019-11-29T12:51:58.000Z","UC7lmZqhJeTzeQQkqNvfmjqw","OK Tested","24","19.01.12","#FOREO|#LUNA2|#review|#cleansing|#FOREOLUNA2|#skincare|#cleansingbrush #howtolookyounger|#makeuphacks|#beauty|#makeup|#hacks|#beautyhacks|#modernhacks|#womenhacks|#oktested|#oktestedvideos|#oktestedakshay|#oktestedaakansha|#oktestedsonali|#oktestedantil|#oktestedarushi","253050","10923","415","449","https://i.ytimg.com/vi/x5vsGz4cuXs/default.jpg","False","False","Skincare or Makeup? What's our best bet to look younger?Check out the product here- https://foreo.se/cu16"
"LXggdvHzahs","Shabir Ahluwalia Gets His Half Century In Style With A Massive Sixer","2019-11-29T07:30:01.000Z","UCaPrFuNLsxMIr6Vwys5Xu7w","Celebrity Cricket League (CCL)","24","19.01.12","CCL|CCL4|Celebrity Cricket League|Live show|live programming|live on youtube|ccl live on youtube|ccl matches|ccl live matches|cricket matches|Sunil Shetty|Riteish Deshmukh|Shabir Ahluwalia|Raja|Mumbai Heroes|CCL 2019|CCL T10|CCL T20","396235","1940","143","0","https://i.ytimg.com/vi/LXggdvHzahs/default.jpg","True","False","#ShabirAhluwalia, #Raja, #RiteishDeshmukh, #SunilShettyAll updates visit us at http://www.ccl.in/Live Streaming : http://www.youtube.com/cclLive Updates : https://www.facebook.com/CCLLive Tweets : https://twitter.com/ccl"
"ightOe2GRhQ","Extra Jabardasth | 6th December 2019 | Extra Jabardasth Latest Promo - Rashmi,Sudigali Sudheer","2019-11-30T07:19:14.000Z","UCULLmfWqhMOeiWEV6hkMSCg","mallemalatv","24","19.01.12","Mallemalatv|Comedy Videos in Telugu|All Time Hit Comedy Shows|Non - Stop Back To Back Telugu Comedy Shows|Extra Jabardasth Promo|Extra Jabardasth Videos|Extra Jabardasth Video|Extra Jabardasth New Video|Sudigali Sudheer Comedy|Extra Jabardasth Promos|Sudigali Sudheer Punches|Sudheer Comedy|Getup Srinu Performance|roja punches|Rocking Rakesh Performance|Deevena Performance|Deevena Punches|Ali|Ali Punches","2345947","33847","3186","0","https://i.ytimg.com/vi/ightOe2GRhQ/default.jpg","True","False","Watch Extra Jabardasth Latest Promo 6th December 2019 Promo on Mallemalatv. Extra Jabardasth Host by #RashmiGautam #RojaSelvamani #Ali is the Judges.Enjoy and stay connected with us!! ►Subscribe us on Youtube: http://bit.ly/Mallemalatv►Like us: http://www.facebook.com/mallemalatv►Follow us: http://www.twitter.com/mallemalatv►Circle us: https://plus.google.com/+mallemalatv►Visit For More Political Updates: https://www.teluguin.com►Visit For More Film Updates: http://www.123telugu.com►Subscribe For Telugu Cooking Videos:  http://bit.ly/TeluguRuchi►For More Entertainment Download ETV Win App: http://bit.ly/ETVWinApp"
"s5OBlkarXro","Prathi Poovankozhi | Official Trailer |  Manju Warrier | Rosshan Andrrews | Gokulam Gopalan","2019-12-01T05:30:13.000Z","UCq6f9bBWaWTHl0FhH167RgA","GOODWILL ENTERTAINMENTS","10","19.01.12","Prathi Poovankozhi|prathi poovankozhi|trailer prathi poovankozhi|poovankozhi trailer|malayalam movie prathi poovankozhi|manju warrior prathi poovankozhi|Rosshan Andrrews|prathi poovankozhi songs|prathi poovankozhi teaser|2019 movie prathi poovankozhi|manju warrior movie|manju warrior movie prathi poovan kozhi|prathi poovankozhi malayalam movie|prathi poovan kozhi video song|manju warrier songs|Roshan Andrrews movie|prathi poovankozhi trailer","399892","18823","637","1014","https://i.ytimg.com/vi/s5OBlkarXro/default.jpg","False","False","Presenting you the Official Trailer Of Malayalam Movie #PrathiPoovankozhi Directed by #RosshanAndrrewsDirector : Rosshan AndrrewsWriter : Unni RProducer : Gokulam GopalanCo-Producers : VC Praveen, Baiju GopalanExecutive Producers : Krishnamoorthy, Sudhakar CherukuruDOP : G. BalamuruganEditor : Sreekar PrasadProduction Designer : Jyothish ShankarMakeup : Saji KorattyCostume Designer : Dhanya BalakrishnanMusic & Background Score : Gopi SundarLyricist : Anil PanachooranSound Designer : Rajakrishnan M.R.Action Directors : Dhilip Subbharayan & RajasekarChoreographer : BrindaVisual Effects & Titles : Digibricks Entertainment Pvt LTDSound Effects : Sync CinemaProduction Controller : Sidhu PanakkalDesign : Thought stationDistribution : Central Pictures#ManjuWarrierMUSIC ON : GOODWILL ENTERTAINMENTS DIGITAL PARTNER : AVENIR TECHNOLOGY ► Subscribe to Goodwill Entertainments: https://goo.gl/s92pm7► Like us on Facebook: https://goo.gl/2V6uNV|| ANTI-PIRACY WARNING ||This content is Copyrighted to GOODWILL ENTERTAINMENTS . Any unauthorized reproduction, redistribution or re-upload is strictly prohibited. Legal action will be taken against those who violate the copyright of the same"
"Dj-HNEZ59Z4","Avane Srimannarayana (Kannada) - Official Trailer | Rakshit Shetty | Pushkar Films | Shanvi | Sachin","2019-11-28T10:30:15.000Z","UCvBaJ5MfXVKfSiKP2beaNvw","Paramvah Studios","1","19.01.12","Avane Srimannarayana|Rakshit Shetty|Shanvi Srivastava|Madhusudhan Rao|Avane Srimannarayana Official Teaser|avane srimannarayana trailer|rakshith shetty|sandalwood|avane|paramvah studios|pushkar films|Pushkara Mallikarjunaiah|avane sriman narayana trailer|avane srimannarayana kannada movie trailer|avanesrimannarayana trailer|latest kannada trailer|kannada trending|kannada|ajaneesh loknath|avane srimannarayana songs|avane srimannarayana teaser","7474808","230867","4352","16908","https://i.ytimg.com/vi/Dj-HNEZ59Z4/default.jpg","False","False","Presenting the official trailer of 'AVANE SRIMANNARAYANA’ | Hero Becomes A Legend - Starring: Rakshit Shetty, Shanvi Srivastava, Balaji Manohar, Achyutha Kumar, Pramod Shetty, Madhusudhan Rao ► Visit us at: http://www.paramvah.com ► Subscribe: http://www.youtube.com/ParamvahStudios ► Like us on Facebook: https://www.facebook.com/AvaneSrimannarayana/Production House: Pushkar Films and Shree Devi EntertainersDirected by Sachin Produced by Pushkara Mallikarjunaiah and H.K. PrakashWritten by Rakshit Shetty & The Seven OddsMusic: Ajaneesh Loknath and Charan RajBackground Score: Ajaneesh LoknathDirector of Photography: Karm Chawla Editor: Sachin Seven Odds: Chandrajith Belliappa, Abhijith Mahesh, Anirudh Kodagi, Nagarjuna Sharma, AbhilashLyricist - Nagarjun SharmaStunts - VIKRAM MOR Choreography: Imran SardhariyaOnline Editing - Rakshith Kaup ,RithvikSound Engineer: Suresh GunaSound design and sound mix : Rajakrishnan, Four frames studios Executive Producers: Sudarshan D S, Hemant Kumar Production Design: Ullas Hydoor Costume Design: Arundathi Anjanappa VFX Pinaka Studios Marketing: The Big LittleDirection Team: Jairam H N, V Kiran, Ganesh Hegde, Ranganath R V, Karthik Vattikuti, B S Premdeep, Shoonya, M BangarappaPosters : Kaani Studio PRO: Sudheendra Venkatesh Production Manager: V PradeepSubtitles: Madhu DaithotaDigital Partner Divo#AvaneSrimannarayana #RakshitShetty #PushkaraM"
"74lJJ83p5mI","Pove Pora | 30th  November 2019  | Full Episode 124 | ETV Plus","2019-11-30T16:32:00.000Z","UCi1m4TnmmXGUIY4roVtvjDA","ETV Plus India","23","19.01.12","etv Plus|etv comedy show|3 Idiots|anchor ravi|Chinnadana Neekosam|express raja|hungama|Kick|Nandini Vs Nandini|Pataas|jabardasth|extra jabardasth|naga babu|roja|anchor anasuya|pove pora|comedy short films|yadamma raju|chalaki chanti|sudigali sudeer|anchor suma|comedy show|anchor sreemukhi|comedy skits in telugu|telugu comedy tracks|racha ravi|allare allari|sardaga kasepu|ejunction|anchor pradeep|pataas punches|anchor vishnupriya|getup srinu","297163","4988","342","342","https://i.ytimg.com/vi/74lJJ83p5mI/default.jpg","False","False","#PovePora #TeluguShow #ETVWinTo watch your ETV all channel’s programmes any where any time Download ETV Win App for both Android & IOS: https://f66tr.app.goo.gl/appsETV Telugu(Youtube) - http://bit.ly/2QR0yu9  Facebook - http://bit.ly/2L2GYYhETV Jabardasth(Youtube) - http://bit.ly/35xdqtuETV Dhee(Youtube) - http://bit.ly/2Ok8zWFETV Plus India(Youtube) - http://bit.ly/2OlEAOgFacebook - http://bit.ly/2DudC0tETV Abhiruchi(Youtube) - http://bit.ly/2OkEtTbFacebook - http://bit.ly/2OSrIhvETV Life(Youtube) - http://bit.ly/2OiKAY6Facebook - http://bit.ly/34tiqzkETV Telangana(Youtube) - http://bit.ly/33nRaAKFacebook - http://bit.ly/37GkVQFETV Andhra Pradesh(Youtube) - http://bit.ly/2OKARZzFacebook - http://bit.ly/2R0vs3k► Like us on Facebook : https://www.facebook.com/etvwin► Follow us on Instagram : https://www.instagram.com/etv_win/► Follow us on Twitter : https://twitter.com/ETV__Win► Visit Website : https://www.etvwin.com/► Pin us on Pinterest: https://in.pinterest.com/etv_win/"
"4-7Z13unFJk","Priyanka Reddy: Accused Shiva's Father Face To Face | TV5 News","2019-11-29T11:15:01.000Z","UCAR3h_9fLV82N2FH4cE4RKw","TV5 News","25","19.01.12","tv5|tv5 news|telugu news|Priyanka Reddy|Dr Priyanka Reddy|Priyanka Reddy news|Dr Priyanka Reddy news|Dr Priyanka Reddy news live","1700564","9983","1988","3748","https://i.ytimg.com/vi/4-7Z13unFJk/default.jpg","False","False","Priyanka Reddy: Accused Shiva's Father Face To Face | TV5 NewsSubscribe to TV5 News for Latest Happenings and Breaking news from Andhra and Telangana. For More Updates► TV5 News Live : https://goo.gl/UPacax► Subscribe to TV5 News Channel: http://goo.gl/NHJD9►Our Website : http://www.tv5news.in► Like us on Facebook: http://www.facebook.com/tv5newschannel► Follow us on Twitter: https://twitter.com/tv5newsnow► Circle us on TV5 News Channel G+: https://plus.google.com/+tv5newschannel► Follow us on Pinterest: https://www.pinterest.com/tv5newschannel"
"BvriphRrpUg","Behan Bhai Ki School Life | Bhen Bhai Ka Pyaar | Yogesh Kathuria","2019-11-29T05:58:02.000Z","UCnkNLPbMuBHpdwvblVL5kIA","Yogesh Kathuria","24","19.01.12","Yogesh Kathuria|Yogesh Kathuria Video|Yogesh Kathuria Comedy|Yogesh Kathuria New Video|Yogesh Bhen Bhai|Yogesh Kathuria Bhen Bhai|School Life|Yogesh Behan Bhai Ka Pyaar|Behan Bhai Ki School Life|BakLol Video|Yogesh BakLol Video|BakLol School Video|Yogesh Kathuria Viral Video|Bhen Bhai Ka Pyaar|Behan Bhai Ka Pyaar BakLol Video|Behan Bhai Ka Pyaar|Bhen vs Bhai|Raksha bandhan|school life part 2|school life part 2 Yogesh Kathuria","601022","13752","1327","640","https://i.ytimg.com/vi/BvriphRrpUg/default.jpg","False","False","Download VMate: http://bit.ly/2pZAthz Win Smartphones, TVs & Bumper Prize - Car & Join VMate Filmistaan: http://bit.ly/2L3lTwQ ! 3 Crore worth Prizes to be won!Behan Bhai Ki School Life | Part 2 | Yogesh Kathuria बहन भाई की स्कूल लाइफ | Yogesh KathuriaCast - 1) Yogesh Kathuria2) Aditi Sharma 3) Sushma Sharman4) Hemant Bhardwaj 5) Deepak Kathuria Produced By - Yogesh KathuriaShot By - Sahil Editing - Deepak Kathuria , Yogesh Kathuria Script - Dheeraj Gupta, Aashish Bhardwaj , Yogesh Kathuria Follow Me on Instagram - http://instagram.com/yogeshkathuria Managed By - Sociopool IndiaBusiness Inquries - contact@sociopool.com( Teamyogeshkathuria@gmail.com )Like , Comment , Share Search- Yogesh Kathuria Video,Yogesh Kathuria New Video,Yogesh Kathuria Comedy Video,Yogesh Kathuria Bhen Bhai Video, Yogesh Kathuria Behan Bhai Ka Pyaar, Yogesh Kathuria School Life, Behan Bhai Ki School Life, Yogesh Kathuria Bhen Bhai,Bhen Bhai Ka Pyaar, Yogesh Kathuria, Bhen Bhai Ka Pyaar, Bhen Bhai Ki School Life Part 2 , School Life Part 2 Yogesh, Yogesh Kathuria Part 2 Bhen Bhai, Yogesh Kathuria Vmate, Vmate Video, Vmate Yogesh Kathuria Thankyouu..."
"FdVuB1G2G_g","DARBAR (Tamil) - Chumma Kizhi (Lyric Video) | Rajinikanth | A.R. Murugadoss | Anirudh | Subaskaran","2019-11-27T11:32:52.000Z","UC5rGGthSt-CQue8V0bj1bWg","divomovies","10","19.01.12","Divo|DivoMovies|Divo Movies|Divo Music|Lyca Productions|subaskaran|darbar|rajinikanth|ar murugadoss|anirudh ravichander|nayanthara|nivetha thomas|santosh sivan|sreekar prasad|sunil shetty|yogi babu|darbar tamil movie|darbar rajinikanth|rajinikanth darbar|darbar movie|rajini darbar|darbar latest update|darbar ar murugadoss|chumma kizhi|chumma kizhi darbar|darbar chumma kizhi lyric video|sp balasubrahmanyam|darbar song spb|vivek lyricist","14183655","574004","35190","34906","https://i.ytimg.com/vi/FdVuB1G2G_g/default.jpg","False","False","Presenting the Official Lyric Video of 'Chumma Kizhi' from 'DARBAR (Tamil)'; Starring Rajinikanth & Nayanthara in lead roles, Music Composed by Anirudh Ravichander, Produced by Lyca Productions & Directed by AR Murugadoss.Listen to it exclusively in Gaana - http://gaa.na/ChummaKizhiSong : Chumma KizhiComposed by : Anirudh RavichanderLyricist : VivekVocals : S. P. Balasubrahmanyam & Anirudh RavichanderCheckout 'Chumma Kizhi' in Telugu & HindiTelugu - https://youtu.be/6ntQ6iAZFWk Hindi - https://youtu.be/uFY3ebQ9Rw0Set Your Favourite Callertunes of 'Chumma Kizhi'Chumma KizhiAirtel - Dial 5432117303424Vodafone - Dial 53711755076Idea - Dial 5678911755076BSNL - SMS BT 11755076 to 56700Chumma Kizhi (Naerma Unakkirundha)Airtel - Dial 5432117303352Vodafone - Dial 53711755075Idea - Dial 5678911755075BSNL - SMS BT 11755075 to 56700Chumma Kizhi (Neruppu Paeroda)Airtel - Dial 5432117303335Vodafone - Dial 53711755057Idea - Dial 5678911755057BSNL - SMS BT 11755057 to 56700Chumma Kizhi (Thalaivars Laugh)Airtel - Dial 5432117303392Vodafone - Dial 53711755060Idea - Dial 5678911755060BSNL - SMS BT 11755060 to 56700--------------------------------------------------------------Musician Credits :Trumpet, Trombone : MaxwellRhythm & Percussions (Mumbai) :Arranged & Conducted By : Dipesh VarmaPerformed By : Dipesh Varma, Keyur Barve, Omkar Salunkhe, Harshal BahadkarRhythm & Percussions (Chennai) :Performed & Additional Programmed By : Nagi & Siddharth NagarajanPerformed & Additional Programmed By : Kumaran SivamaniAdditional Rhythm Programmed By : Shashank VijayBacking Vocals : Ananthakrrishnan, Sajith Satya, Vivek, Inno GengaAdditional Backing Vocals, Hyderabad : Srikrishna Vishnubhotla, Aditya Iyengar, Saketh Komanduri, Conducted By Srikrishna VishnubhotlaKeyboards, Synth & Rhythm Programmed : Anirudh RavichanderAdditonal Keyboard & Synth Programmed : By Arish & Pradeep PJSound Effects : Suren GMusic Advisor : AnanthakrrishnanCreative Consultant : Sajith SatyaRecorded At :Albuquerque Records, Chennai By Srinivasan MYashraj Studios (Mumbai Rhythm & Percussions) By Vijay Dayal, Assisted By Chinmay MestryKodandapani Audio Labs, Chennai (S P Balasubrahmanyam Vocals) By Kannu KumaranSruthi Audio Lab,Hyderabad (Additional Backing Vocals) By Saketh KomanduriMixed By Vinay Sridhar & Srinivasan M At Albuquerque Records, ChennaiMastered By Shadab Rayeen, Assisted By Abhishek At New Edge Studios, MumbaiMastered For Itunes By Shadab RayeenMusic Co Ordinator : VelavanLyric Video Animated by : Arun Selvakumar (Divo)Line Producers : Sushanth Prasad, ManimaranCreative Head : Sudhir Viyas D--------------------------------------------------------------Lyca Productions 'Subaskaran' presents ‘DARBAR’Casts : Rajinikanth | Nayanthara | Nivetha Thomas | Suniel Shetty | Yogi Babu | Thambi Ramaiya | Sriman | Prateik Babbar | Jatin Sarna | Nawab Shah | Dalip TahilWritten & Directed by A.R. MurugadossProduced by SubaskaranMusic: Anirudh RavichanderCinematographer: Santosh Sivan ASC. ISCEditor: A. Sreekar PrasadArt Direction: T SanthanamStunts Choreography: Peter Hein | Ram-Laxman ChellaLyricist: VivekExecutive Producer: SundarrajBanner: Lyca ProductionsDigital Partner: DivoMusic On: RubaxStreaming Partner: GaanaLike Darbar Official Page for more updateshttps://www.facebook.com/DarbarOffl/In Association with Divohttps://www.facebook.com/divomovieshttps://www.twitter.com/divomovieshttps://www.instagram.com/divomovies#Darbar #Rajinikanth #AnirudhRavichander #SPB #Vivek #ARMurugadoss #SantoshSivan"
"_z_Q-YQMx_U","उद्धव ठाकरे का शक्ति परीक्षण LIVE","2019-11-30T11:31:35.000Z","UCAUNFgpgVisKPL3yq_-Nj-Q","News Tak","25","19.01.12","hindi news|news video|“newstak|news”|“news”|“|newstak”|news tak|news videos|exclusive|news tak videos|uddhav thackeray|floor test|maharashtra floor test|ncp|congress|shiv sena|maharashtra assembly floor test|floor test in maharashtra assembly|maharashtra floor test today|maharashtra floor test news|floor test in maharasht","744736","3951","751","62","https://i.ytimg.com/vi/_z_Q-YQMx_U/default.jpg","False","False","कृपया इस लिंक पर क्लिक करें और TAK ऐप डाउनलोड करें https://bit.ly/33A6Scr..For Advertising queries, please give us a missed call on  +917827000333   Or mail us at  Mobiletak@aajtak.com About News Tak (न्यूज़ तक):न्यूज़ तक (news tak) आपको देता है ख़बरों का बिल्कुल नया अंदाज । 40 सेकंड के छोटे गरमा-गरम वीडियो तो हैं ही साथ में न्यूज़ तक (news tak) के यू ट्यूब प्लेटफॉर्म पर आपको मिलेंगे दिलचस्प और EXCLUSIVE इंटरव्यू, वो भी अनकट..यहां आपको मिलेगा न्यूज़तक (news tak) स्पेशल, न्यूज़ तक (news tak) LIVE और भी बहुत कुछ। राजनीति, बॉलीवुड, देश-विदेश हर तरह की ख़बरों से जुड़े मनोरंजक वीडियो के लिए देखिए सिर्फ न्यूज़ तक (news tak)। क्या है वायरल होने वाले वीडियो की सच्चाई? ख़बर में ऐसा क्या था खास जो आप नहीं देख पाए? कोई भी ख़बर वायरल होने से पहले आप तक पहुंचाएगा न्यूज़ तक (news tak) । हर रोज दिलचस्प और गरमा-गरम वीडियो के लिए सब्सक्राइब कीजिए न्यूज़ तक (news tak)। ये है न्यूज़तक (news tak) का Official Channel.News Tak is the most revolutionary and credible news channel on YouTube. News Tak brings news to you in an innovative VOD style that is set to capture and satiate your thirst for NEWS. This is the most credible source of Live videos that bring to you PC done by all political parties. From exclusive interviews to politics, bolly & Viral videos, anything and everything that is happening around the world is on News Tak. We ensure that the truth behind viral videos reaches you.We save you from rumours. This is the most reliable source of news that you can rely on. Subscribe to the official channel of News Tak here.You can follow News Tak on:News Tak Youtube: https://www.youtube.com/newstakNews Tak Facebook: https://www.facebook.com/newstakofficialNews Tak Twitter: https://twitter.com/newstakofficialNews Tak Instagram: https://www.instagram.com/newstakofficial/"
"0XY2TocE-x8","EXTREME Iran Street Food Tour in Tehran, Iran! 500 KG LAMB PLATE + 7 INSANE Street Food in Iran!","2019-11-30T14:00:00.000Z","UCiAq_SU0ED1C6vWFMnw8Ekg","The Food Ranger","19","19.01.12","the food ranger|trevor james|food ranger|food|street food|iran|street food iran|tehran street food|tehran food tour|food in iran|iranian cuisine|iranian food|persian food|persian cuisine|street food tehran|trevor james iran|trevor james tehran|food ranger tehran|iran food|iran street food|tehran food|iran travel|tehran travel|iranian street food|iran tourism|best street food|street food videos|food videos|street food tour|bbq|rice|best","432202","12945","400","1789","https://i.ytimg.com/vi/0XY2TocE-x8/default.jpg","False","False","► More Street Food in Iran:  https://youtu.be/za2I-fRi5D8►Go Follow Mr. Taster: https://www.instagram.com/mr.taster►Thanks https://www.cometopersia.com for helping arrange this whole trip!!Street food in Iran is AMAZING! Today,  I'm (The Food Ranger, Trevor James)  bringing you in DEEP into Tehran, Iran, for a FULL ON street food tour with Mr. Taster!!! We're tasting INCREDIBLE kababs, SAFFRON RICE, meat platters, BBQ, Iranian HALEEM, BREAKFAST, and MORE!!!►The BEST VPNs For China: https://thefoodranger.com/best-vpn-for-china/Tehran is one of the oldest and most vibrant cities in the world and has one of the BEST street food scenes too! You need to travel to Iran to try the street food, especially the MEAT in Tehran! Everything is FULL of SAFFRON!!!Today, we're bringing you Foodrangin' for LOTS of TRADITIONAL and AUTHENTIC Iran Street Food - including the AMAZING 500 KG meat platter and going DEEP into one of the OLD BAZAARS of Tehran! We're also having Persian sandwiches and energy drinks too! My favourite was the butter kabab bowl1!These Iranian foods are incredibly DELICIOUS, and worth traveling to Iran for! You have to taste this food at least once in your lifetime!When you travel to Tehran, you will fall in  love with the street food as soon as you arrive! Today, we're starting out with a local Iranian BREAKFAST haleem and NOODLE dish! Serving 100's of people every day! It was found in downtown Tehran in an old bazaar, the Tajrish Bazaar, where there is hundreds of Iranian foods and spices to see! Shop name:  Haleem and Ashe Seyed Address: Tajrish Square, Tehran, Iranarea where there is street food everywhere! The haleem was SO THICK!!After this, we're going DEEPER into Tehran by stepping into this HUGE BAZAAR, where there are 1000's of street foods and stalls to visit! This is before we bring you to a MASSIVE IRANIAN MEAT feast in a TRADITIONAL IRANIAN restaurant!We found  a MASSIVE bakery serving traditional Iranian food like Persian bread soaked with date syrup!And then Mr. Taster brought us to the most buttery Koobideh kabab wrap! It was SOAKED with butter and incredibly juicy!Next up, we're going to a local Iranian food served in LUXURY style, the PERSIAN MEAT PLATTER at Setaregan Ghaza in Tehran!  Here, chef Kapitan Abhed uses his mastery to cook Iranian recipes and make the most tender kababs in the WORLD! AND he covers it in a SAFFRON OIL and tomato onion sauce served with SAFFRON RICE!!After tasting the meat platter in Tehran, Mr. Taster is bringing us to eat the MOST BUTTERY kabab bowl in Tehran, at Kabab Kasei Ardabil! And we're still going for MORE! We're going for the PERSIAN energy drink at Alibaba Majoon, using SAFFRON ICE CREAM, rose water, banana, nuts, flowers, coffee, and more, to make the MOST POWERFUL persian energy drink!!After this, we're finishing up by going for Iranian Sandwiches to finish the night!! Found at Yeganeh Sandwich,  Niloufar St, Khorramshahr, Tehran, Iran!I hope you're enjoying this big Iran street food video series! Thanks so much for watching, I would love to hear from you down below!There is much more street food in our Iran food videos series, get ready for the playlist of a lifetime!!► MERCH AVAILABLE HERE: https://shop.bonfire.com/thefoodranger/The Food Ranger YouTube: ► https://www.youtube.com/thefoodrangerThe Food Ranger Instagram:► https://www.instagram.com/thefoodrangerThe Food Ranger FB:► https://www.facebook.com/thefoodranger► MUSIC I USE (Great For YouTubers): http://share.epidemicsound.com/pf97L►3 Months FREE on ExpressVPN and 49% OFF! https://ExpressVPN.com/thefoodranger►My Street Food Blog: https://thefoodranger.comThanks so much for watching my Iran Street Food videos!►The BEST VPNs For China: https://thefoodranger.com/best-vpn-for-china/"
"OITZRhgpwxY","When You Date Your Sister's BestFriend Ft. Keshav Sadana, Rashmeet Kaur | Hasley India","2019-11-27T07:53:41.000Z","UCgM1AQcoM5TRlzsm1e66vrQ","Hasley India","23","19.01.12","hasley|india|harsh|beniwal|rishhsome|rishabh|rana|delhi|comedy|funny|laugh|sketch|mall|keshav sadhna|rashmeet kaur|sister's best friend|dating|bestfriend|sister|girlfriend|bhai|funny videos|desi|desi videos|hasley india funny videos|short videos|trending videos|laughter|brother|girlfriend vs sister|comedy video","1733275","80904","5066","2487","https://i.ytimg.com/vi/OITZRhgpwxY/default.jpg","False","False","Download Kuvera: http://bit.ly/2GFR66YKuvera is India’s First Free Direct Mutual Fund and Gold Investing Platform. Buy gold and win big this month on Kuvera. You meet someone on a dating app and you fall in love. But the fun part is your date comes out to be your sister's bestfriend!Who will you choose? Girlfriend Or Sister!Girlfriend ka pyaar ya behen ka vaar, kya hoga ek bhai ki zindagi mein.Channel Head: Ankit MadaanCast:Keshav SadhnaPaayal JainRashmeet KaurRavi RajputDirector:Shubham BajpaiAssistant DirectorSamarthScript Writer:Shubham BajpaiDOP:PradeepPost Production Head:Rohit ChadhaLine Producer:Kamal NindavatyaMake-UpJatin GuptaGraphics:Vijay KumarSocial Media:Mayank MishraLight SquadYogesh Managed By FameGameBusiness: hasleyindia@famegame.in"
