video_id,title,publishedAt,channelId,channelTitle,categoryId,trending_date,tags,view_count,likes,dislikes,comment_count,thumbnail_link,comments_disabled,ratings_disabled,description
"s7VYVuQWpWc","Plantão do Brasileirão: Rodada 29 #Futebol #GolsDaRodada","2019-11-01T14:41:00.000Z","UCBi24ZUXnSzpDJOPQS4djsQ","Reclamação do Dia","23","19.03.11","Humor|Comédia|Stand Up Comedy|Stand Up|Cleber Rosa|Kleber Rosa|Pouso Alegre|Humor Pouso Alegre|Cambuí|Humor Cambuí|Sul de Minas|Estiva|Camanducaia|Santa Rita do Sapucaí|Extrema|Itapeva MG|Varginha|Poços de Caldas|Piada|Humorista|Reclamação do Dia|Reclamação|Chico Da Tiana|starret|gols|flamengo|corinthians|futebol|campeonato brasileiro","113152","16877","112","394","https://i.ytimg.com/vi/s7VYVuQWpWc/default.jpg","False","False","E saiu mais um resumo sensacional da 29ª rodada do Brasileirão! SE INSCREVA NO CANAL :) Curta no Face: Facebook.com/ReclamacaoDoDiaSiga no Instagram: @ReclamacaoDoDiaNo Twitter: @ReclamacaoDiaSiga Cleber Rosa: Facebook.com/RosaCleberTwitter: @CleberRosaInstagram: @CleberRosa"
"gcLDE1lBDnw","Pesadelo na Cozinha: Cenas inéditas - Pé de Fava","2019-10-31T21:28:18.000Z","UCp7tUxXfE9jUtkMLGCzeXqA","Pesadelo na Cozinha","24","19.03.11","pé de fava|erick jacquin|pesadelo na cozinha|jacquin|freezer|desliga o freezer","558420","55558","253","2029","https://i.ytimg.com/vi/gcLDE1lBDnw/default.jpg","False","False","Em comemorración dos 1 milhão de inscritos no canal, materiais inéditos do #PesadeloNaCozinha estarão disponíveis todas as terças.Para começar, confira cenas exclusivas de um dos episódios que mais deixaram o chef #ErickJacquin irritado na 2ª temporada, o #PéDeFava.NÃO SEJA A VERGONHA DA PROFISSIÓN E INSCREVA-SE NO CANAL DO PESADELO NA COZINHA. TÁ ME OUVINDO?Siga Pesadelo na Cozinha nas redes sociais: Instagram: instagram.com/pesadelo.na.cozinhaTwitter: twitter.com/cozinhapesadelo"
"RA_8xltJw64","PUDIM SORVETE DE LEITE NINHO COBERTO DE CHOCOLATE (ft. Irmã) ♥ - Bruna Paula","2019-11-01T14:00:08.000Z","UCD5gsRPb5YK0d7IHY4ZO4kw","Bruna Paula","24","19.03.11","BOMBOM GIGANTE DE LEITE NINHO|BOMBOM GIGANTE|PUDIM SORVETE|PUDIM SORVETE DE NINHO|PUDIM SORVETE DE NINHO COM CHOCOLATE|PUDIM|SORVETE|SORVETE DE NINHO|SORVETE DE NINHO COM CHOCOLATE|bruna paula|casando aos dezoito|PUDIM SORVETE DE LEITE NINHO COBERTO DE CHOCOLATE","59317","10327","94","256","https://i.ytimg.com/vi/RA_8xltJw64/default.jpg","False","False","QUER ENVIAR ALGO ?Caixa Postal: 152 CEP: 13012970 Campinas - SP----------------------------------------------FACEBOOK: https://www.facebook.com/brunapaularealINSTAGRAM: https://www.instagram.com/brunapaularealCONTATO: casandoaosdezoito@gmail.com--------------------------------------------------------------MUSICAS DO VÍDEO: https://player.epidemicsound.com/--------------------------------------------------------------INGREDIENTES:Cobertura500g de chocolate ao leite ou meio amargoCreme de ninho2 latas de leite condensado500ml de leite integral1 xícara de leite em pó 4 gemas 2 colheres de manteiga ou margarina"
"i7DoPKY_Dn8","Mensagem de Deus para esta  SEXTA,1 Novembro","2019-11-01T10:13:12.000Z","UCZ7mpC3rXnK9-AqZM-H-fvg","Ana Paula Gomes","22","19.03.11","[none]","96103","21008","203","11031","https://i.ytimg.com/vi/i7DoPKY_Dn8/default.jpg","False","False","Gostou do nosso canal ? Deixa sempre o seu like joinha👍 para divulgar os vídeos, compartilhe e inscreva-se no canal.Ative o sininho para receber às notificações sempre que o canal for atualizado.Siga-me no Instagram ↘️ #@annapaulagomesofical A palavra de Deus nos diz que:A Salvação vem pela fé, e a fé vem pelo ouvir, e ouvir a Palavra de Deus. Romanos 10,17 Quer ser salva, ser uma pessoa cheia de fé? Então, permita que a Palavra de Deus se torne a sua rotina, e que faça parte do seu dia a dia, onde o seu café da manhã, almoço e jantar seja a dádiva de ouvir a Palavra de Deus. Crescei  na graça e na de Deus. Se nossos corações e mentes não são regados diariamente pela Palavra, também não há crescimento na fé e na prática do amor e do perdão.Vamos espalhar esta mensagem de  fé e esperança nas redes sociais. Compartilhe essa mensagem com um amigo que  está vivendo um momento onde parece impossível haver uma saída.Ide e anuncia o evangelho a toda criatura.."
"BwHYVsnu0jE","Depois de viagem de 12 dias, Bolsonaro chega ao Brasil e condena declaração do filho","2019-11-01T03:57:40.000Z","UCmpHPgeCBgvk_fDXZQKsnAA","Jornal da Record","25","19.03.11","Celso Freitas|Adriana Araújo|Jornal da Record|Rede Record|viagem de bolsonaro|jair bolsonaro|eduardo bolsonaro|ai-5","216634","6070","454","1395","https://i.ytimg.com/vi/BwHYVsnu0jE/default.jpg","False","False","O presidente Jair Bolsonaro desembarcou hoje de manhã (31) em Brasília depois da viagem de doze dias à Ásia e ao Oriente Médio. Ele cumpriu parte da agenda no Palácio da Alvorada. O presidente comentou e condenou a declaração do filho, o deputado Eduardo Bolsonaro, sobre a possibilidade de um decreto nos moldes do AI-5, de 1968, na ditadura militar. Posteriormente, Eduardo Bolsonaro pediu desculpas pela declaração.Confira nas multiplataformas do Jornal da Record os quatro boletins diários que vão ao ar também na Record TV e ainda uma versão exclusiva para o digital.#JornaldaRecord #Jornalismo #BolsonaroAI5"
"zQwQ2-iMr7o","Finalmente a GRANDE revanche: Fred x Falcão!","2019-10-31T22:00:13.000Z","UCacMjDLANAoJmxSzxweAV4w","Falcão 12","17","19.03.11","Falcão|Falcao|Falcão 12|futsal|futebol|indoor soccer|desafios|entrevistas de futebol|tricks|freestyle|dribles|carretilha|lambreta|soccer|best world player|brasil|Brazil|golaço|great goals|desafios de futebol|freestyle soccer|soccer skills|football skills|brazilian player|brazilian soccer|fred|nestle|realidade aumentada|versus|revanche|final|treinador|coaching|nescau|radical|finalização|lata|gigante","425310","44058","192","326","https://i.ytimg.com/vi/zQwQ2-iMr7o/default.jpg","False","False","É isso galera!A revanche que todos aguardavam finalmente chegou, Falcão perdeu no primeiro desafio contra o Fred e hoje ele vai tentar reverter essa situação! Quer ter o Falcão como seu treinador?Baixe agora mesmo o aplicativo Nestlé Realidade Aumentada nos links abaixo e divirta-se.IOs - https://apps.apple.com/br/app/nestle-realidade-aumentada/id1450612638 Android -  https://play.google.com/store/apps/details?id=br.com.FlexInterativa.NestleRA--Este é o Canal da Lenda, do Rei, do melhor jogador da história do Futsal! Se você quer ver desafios, entrevistas e viagens com um conteúdo recheado de boas histórias e convidados fora de série, você está no lugar certo! Só cuidado para não tomar uma carretilha!http://www.falcao12.com/CONTATO: imprensa@nwb.com.br--------------------------Experimente 1 mês grátis do banco de trilhas Epidemic Sound: http://bit.ly/epidemicnwb-------------------------IG: https://www.instagram.com/falcao12oficial/?hl=pt-br / https://www.instagram.com/nwb.oficial/?hl=pt-br"
"3ejbmiO4cGg","Para que pão, SÓ ISSO É UM CAFÉ DA MANHÃ PERFEITO INCRÍVEL ESSA NOVA OPÇÃO DE REFEIÇÃO.","2019-11-01T16:18:28.000Z","UCfrpgW6wypbf7O0Mk8Idq6A","Culinária em Casa","26","19.03.11","receitas rapidas|fácil|como fazer|culinária|simples|receita caseira|5 CAFÉS DA MANHÃ RÁPIDOS E SAUDÁVEIS|NÃO COMA PÃO NO CAFÉ DA MANHÃ! INCRÍVEL ESSA NOVA OPÇÃO DE REFEIÇÃO.|SEM SINAL - O palhaço (EPISÓDIO 3)|BINGO MISTERIOSO DE CACHORRO QUENTE 2 !!!|Não coma pão|faça essa receita deliciosa super saudável pra substituir o café da manhã|Batata Inglesa Pode na dieta? Low Carb x No Carb","40321","6907","131","120","https://i.ytimg.com/vi/3ejbmiO4cGg/default.jpg","False","False","NÃO COMA PÃO NO CAFÉ DA MANHÃ!   receita super saudávelNOSSA LOJA :http://bit.ly/Loja-Culinária-em-CasaClique aqui e adquira o porta temperoshttp://bit.ly/O-porta-temperos(11) 97427-8536Link do CANAL da minha filha DIÁRIO DA KIARA AQUI 👉http://bit.ly/Canal-da-KiaraMeu novo canal com receitas em 1 minuto!! Venha se inscrever e conhecer meu novo trabalho AQUI 👇http://bit.ly/novo-canal-da-luContato Profissional: culinariaemcasaoficial@gmail.comINSCREVA-SE  Culinária em CasaRedes SociaisFacebook: https://goo.gl/6K8jnSInstagram: https://goo.gl/mVRv4vhttps://lucianamirihad.blogspot.com#CulináriaemCasa"
"7lC_g7vdCTw","RASPEI O CABELO, MEU DEUS DO CÉU!!!","2019-10-31T14:33:41.000Z","UCR3vcUrhFUdzagng58ueI2w","Invento na Hora","24","19.03.11","raspei o cabelo|raspei a cabeça|cortei o cabelo|cortando cabelo|cabelo|careca|invento na hora|inventonahora|lucas lira|lucaslira","1970496","351060","2154","9300","https://i.ytimg.com/vi/7lC_g7vdCTw/default.jpg","False","False","● CLICA AQUI PRA SE INSCREVER 😂 → https://goo.gl/6RrS7C → INSTAGRAM: http://instagram.com/lucas_lira → TWITTER: http://www.twitter.com/lucas_lira → FACEBOOK: http://www.facebook.com/inventonahora"
"nZW-bnLnVZY","Diego & Victor Hugo - Infarto (Ao Vivo em Brasília)","2019-10-31T07:00:11.000Z","UCxQluRbQF3JzVH7zS6uX0cQ","DiegoEVictorHugoVEVO","10","19.03.11","Country/Sertanejo|Diego & Victor Hugo|Infarto|Sony Music Entertainment","550058","8292","191","172","https://i.ytimg.com/vi/nZW-bnLnVZY/default.jpg","False","False","Music video by Diego & Victor Hugo performing Infarto (Ao Vivo em Brasília). (C) 2019 Sony Music Entertainment ltda.http://vevo.ly/CBk7QC"
"uWrSPUYFBfE","Ariana Grande, Normani, Nicki Minaj - Bad To You (Charlie’s Angels Soundtrack)(Official Lyric Video)","2019-11-01T04:00:06.000Z","UC9CoOnJkIBMdeijd9qYoT_g","Ariana Grande","10","19.03.11","ariana grande|normani|nicki minaj|bad to you|charlies angels|soundtrack","2401729","196795","4326","8479","https://i.ytimg.com/vi/uWrSPUYFBfE/default.jpg","False","False","The Charlie’s Angels Original Motion Picture Soundtrack is available now: https://charliesangels.lnk.to/soundtrackLyric Video Created by: Katia Temkin"
"a-UaZzKmrx8","L7NNON - Função 🔥 (prod. Papatinho)","2019-10-31T15:00:32.000Z","UCjUOSfBPBQxjbWh1uqLvmdA","L7NNON","10","19.03.11","[none]","476123","69385","521","1477","https://i.ytimg.com/vi/a-UaZzKmrx8/default.jpg","False","False","Ficha Tëcnica:Artista: L7NNON / @l7nnonMúsica: FunçãoLetra/Voz: L7NNONCaptação: Chop / @chopptnBeat/Prod. Musical: Papatinho / @papatinhoMix/Master: 2F U-FLOW / @2f_uflow©️ 2019 PapatunesDireção: Cherry Rocha / @cherryrochaOperador de camera: Enzo Vieira / @enzovieiraAssistente de camera: João Pedro / @jp_dopradoEdição: Guiga Schwartz / @guigaschwartzDrone: Mauro César / @maurocutrimMaking of : Sergio  Lorena / @serginholorena"
"g_1hifPe8G4","26 FOTOS ASSUSTADORAS DE HALLOWEEN !!","2019-10-31T18:11:43.000Z","UCj0O6W8yDuLg3iraAXKgCrQ","Você Sabia?","24","19.03.11","halloween|fotos|fotos antigas|assustadoras|voce|Sabia|a historia|veja|as melhores","897548","164011","1447","4701","https://i.ytimg.com/vi/g_1hifPe8G4/default.jpg","False","False","26 FOTOS ASSUSTADORAS DE HALLOWEEN !!"
"lnuCyWksw2Q","🐔A Fazenda 11: Bifão é eliminada e Andrea se desespera + Gui e Hari disputarão a Prova de Fogo","2019-11-01T03:45:02.000Z","UC0LlPl_mWhIFqVxcH1l3xpQ","WebTVBrasileira","24","19.03.11","a fazenda 2019 estreia|marcos mion|record|estreia|a fazenda 11|16 participantes|2 milhões em prêmio|itapecerica da serra|fazendeiros|Rodrigo Carelli|estreia da décima primeira temporada do reality|comentando a fazenda 11|reality show|fazenda|afazenda11|estreia a fazenda|programa 31/10/2019|programa 31\/10\/2019|roça|chama vermelha|chama azul|poder do lampião|votaçao|quem foi eliminado da fazenda 11|prova de fogo|prova do fazendeiro","261493","18772","1100","2111","https://i.ytimg.com/vi/lnuCyWksw2Q/default.jpg","False","False","#AFazenda11 #FalandoDeAFazenda #WebTVBrasileiraBora COMPARTILHAR e COLABORAR para o CRESCIMENTO do CANAL👊🏻Suru-BÃO WebTVzeiros (GRUPO BATE-PAPO)http://www.discord.gg/webtvbrasileira💜Embelleze VDTorne-se um consultor: https://evmn.embellezevd.com/#!/join/2695Compre produtos exclusivos Embelleze VD: https://vitrine.embellezevd.com/minhaloja/WEBTVInscreva-se no canal WebTVZeiros Embelleze VD: https://www.youtube.com/channel/UC-H_NLtnwEwoYcrAecE99PQTire suas dúvidas pelo Whats: https://api.whatsapp.com/send?1=pt_BR&phone=5521964278799INSCREVA-SE: https://www.youtube.com/subscription_center?add_user=webtvbrasileira💥Se vc usa IOS, torne-se um membro do Clube WebTVBr clicando neste link: https://www.youtube.com/webtvbrasileira/joinPROGRAMAÇÃO DESTE MÊS:🔥#HoraDaFofoca AO VIVO: de Segunda a Sexta - 20h🐔#FalandoDeAFazenda AO VIVO: depois dos programas da RecordTV💥#Rapidinhas: sempre uma surpresa! Aqui e no instagram @WebTVBRasileira: https://www.instagram.com/webtvbrasileiraNA REDE:#WebTVBrasileiraTwitter: http://www.twitter.com/WebTVBrasileiraFacebook: http://www.facebook.com/MotionTVOficialInstagram: https://www.instagram.com/webtvbrasileira/Tati MartinsFacebook Page: http://www.facebook.com/TatiMartinsOficialFacebook Perfil: https://www.facebook.com/tati.martins.31508Instagram: https://www.instagram.com/tatimartinsofficial/Marcelo CarlosTwitter: https://twitter.com/marcelowebtvFacebook: https://www.facebook.com/marceloattbi?fref=tsInstagram: https://www.instagram.com/marcelowebtv/Participantes de A Fazenda 11, andréa nóbrega, aricia silva, bifão, diego grossi, drika marinho, guilherme leão, hari almeida, lucas viana, netto, phellipe haagensen, rodrigo phavanello, sabrina paiva, tati dias, thayse teixeira, tulio maravilha, viny vieira, jorge sousa"
"tjujvMkqWe4","THE WITCHER | TRAILER PRINCIPAL | NETFLIX","2019-10-31T16:00:10.000Z","UCc1l5mTmAv2GC_PXrBpqyKQ","Netflix Brasil","24","19.03.11","Superman|Freya Allan|The Witcher|Aventura|Mousesack|Henry Cavill|WITs3rMT!|Gerald|Blaviken|Trailer|PS4|Geralt de Rívia|Adam Levy|Livro|SDCC|Joey Batey|Anya Chalotra|Xbox|Playstation|Ciri|Dandelion|Jaskier|Stregobor|Netflix|Rivia|Série|Tissaia|Witcher|Lars Mikkelsen|Romance|Yennefer|Game of Thrones|comic con|O Último Desejo|Witcher 3|MyAnna Buring|Bardo|Andrzej Sapkowski|Fringilla|Game|Calanthe|Nilfgaard|Show|Filavandrel|Roach|Anna Shaffer|Fantasia","597310","42394","258","2207","https://i.ytimg.com/vi/tjujvMkqWe4/default.jpg","False","False","Você não pode fugir do destino só porque está com medo dele. Henry Cavill é Geralt de Rívia. The Witcher estreia em 20 de dezembro."
"cgBnLubYTus","Empate do FLAMENGO, o FICO de CARILLE e futuro de SAMPAOLI De Placa (01/11/2019)","2019-11-01T15:25:23.000Z","UCdkhkda5VQPbKSzx03HohMw","De Placa","17","19.03.11","De Placa|Debate futebol|Esporte Interativo|Goias x Flamengo|Jorge jesus Flamengo|Briga Gabigol e Arão|Piqué Neymar|sampaoli fora do Santos|Michael Goiás|Expulsão Cesar Flamengo|Falta filipe Luis gol do Goias|filipe luis falta|falta em filipe luis|VAR goiás x flamengo|empate goiás x flamengo|gols goiás x flamengo|sampaoli fica no santos|flamengo líder brasileirão|8 pontos diferença flamengo palmeiras|tropeço flamengo|ricardo marques ribeiro flamengo","79426","4127","149","72","https://i.ytimg.com/vi/cgBnLubYTus/default.jpg","False","False","No de Placa de hoje vamos falar muito sobre a o empate do Flamengo contra o Goiás, declaração polêmica de Piqué sobre a quase chegada de Neymar na última janela, declarações fortes de Sampaoli e tudo sobre a rodada do final de semana. Se inscreva no canal para não perder nenhum De Placa! De segunda a sexta, 10h30, com o melhor debate esportivo do Youtube!Acesse o portal do Esporte Interativo: http://www.esporteinterativo.com.br/"
"vlpPFJ3rNJE","A Dona do Pedaço: capítulo 141, quinta, 31 de outubro, na Globo","2019-10-31T20:47:38.000Z","UCEPRQVF6hxGGM9gi1ELaWHg","Globo","24","19.03.11","Globo|Rede Globo|TV|novelas","189582","2663","258","208","https://i.ytimg.com/vi/vlpPFJ3rNJE/default.jpg","False","False","Josiane (Agatha Moreira) volta para dar fim à vida deTéo (Rainer Cadete). Não perca na Globo! Assista a tudo em: https://globoplay.globo.com/a-dona-do-pedaco/p/11212/"
"9ulnSo2FYmQ","Horóscopo de NOVEMBRO de 2019 - por Márcia Fernandes","2019-11-01T01:00:13.000Z","UCFU3gn0coWqxh_1qzhv4AQg","Márcia Fernandes","22","19.03.11","márcia fernandes|sensitiva|astrologia|astróloga|numerologia|planetas|signos|horóscopo Novembro 2019|horóscopo|novembro 2019","117633","13417","163","284","https://i.ytimg.com/vi/9ulnSo2FYmQ/default.jpg","False","False","Horóscopo de NOVEMBRO de 2019 - por Márcia FernandesPrevisões Astrológicas no mês de NOVEMBRO 2019. Confira neste vídeo tudo sobre seu Signo.O décimo primeiro mês em nosso calendário atual representa uma transição entre o velho e o novo, o tempo de término e novos começos. Inúmeras culturas antigas reverenciavam os espíritos de seus ancestrais nesta época. E isto se reflete até hoje no dia de Finados.É o mês 11 que traz a força do número mestre, de aprendizado e coragem para enfrentar até aquilo que nos é desconhecido.Com o fim do ano se aproximando, este mês deve ser reservado para completar ou finalizar projetos e compromissos. O momento pede reflexão, reforma íntima e busca de novos ciclos.Na Astrologia, logo no início do mês, Vênus ingressa em Sagitário, permanecendo ali até o dia 25, favorecendo viagens e estudos.No dia 1, Mercúrio inicia seu movimento retrógrado e segue até o dia 20.Do dia 3 ao dia 6, Marte estará em tensão com Plutão, causando precipitações e discussões. Deveremos planejar muito bem nossas atitudes para não gerar arrependimentos.Deseja saber mais sobre o mês de NOVEMBRO e as previsões astrológicas sobre seu Signo? Então, acesse este link e boa sorte para você: https://www.marciafernandes.com.br/site/horoscopo-novembro-2019/Paz, luz Divina e um Novembro muito próspero a todos!"
"Vf9_JIExpKo","Jornal da Manhã - 01/11/19","2019-11-01T14:21:07.000Z","UCP391YRAjSOdM_bwievgaZA","Jovem Pan News","25","19.03.11","Jovem Pan|Notícias|Brasil|Política|Jornal da Manhã|Vera Magalhães|Josias de Souza|Denise Campos de Toledo|Bruno Garschagen|Ao vivo|Jovem Pan ao vivo|Jornal da manhã ao vivo|Jornal da manhã Jovem Pan|Bolsonaro|Jair Bolsonaro|Governo|STF|Supremo|integrajornaldamanha","153955","4846","398","36","https://i.ytimg.com/vi/Vf9_JIExpKo/default.jpg","False","False","Inscreva-se no nosso canal:http://www.youtube.com/c/jovempannewsEntre no nosso site:http://jovempan.com.br/Facebook:https://www.facebook.com/jovempannewsSiga no Twitter:https://twitter.com/JovemPanNewsInstagram:https://www.instagram.com/jovempannewsoficial/#JovemPan"
"teb4h5s7p3M","SOBREMESA DE 2 INGREDIENTES INSTANTÂNEA | PRONTA EM 15 MINUTOS | RECEITAS DA CRIS","2019-11-01T13:00:10.000Z","UCRbXS1MKrZ55Vm5G9336BKw","Receitas Da Cris","24","19.03.11","receitas da cris|cristina mesquita|cris do bolo de chocolate|mousse|mousse de leite ninho instantaneo|mousse de leite ninho com abacaxi|sobremesa facil|sobremesa rapida|sobremesa economica|sobremesa gelada|receita de verao|sobremesa de 15 minutos|sobremesa de 2 ingredientes|muito facil|muito rapido|mega facil|mega rapido|mousse de leite ninho|instantaneo|mousse fácil|sobremesa|food|leite ninho|cris","35562","6603","62","195","https://i.ytimg.com/vi/teb4h5s7p3M/default.jpg","False","False","A receita de hoje é de uma deliciosa sobremesa para aquele dia que você quer algo rápido e com poucos ingredientes !!Sem contar que fica deliciosa também.Mousse de leite ninho instantâneo!!!Então, bora anotar os ingredientes e assistir o passo a passo no vídeo !!Ingredientes-1/2 litro de água fervendo-3 pacotinhos de gelatina sabor abacaxi-aprox 15 pedras de gelo-2 xícaras e 1/2 de leite em póAs xícaras do vídeo são de 240 ml cada Receitas Da CrisCaixa Postal 13502 CEP: 80.420-981 Curitiba - PRMe sigam nas redes sociais:Facebook: http://goo.gl/XBwkeRFanpage: http://goo.gl/w3aTWlInstagram: @receitasdacrishttp://goo.gl/JU9fyhMúsicas usadas: http://www.epidemicsound.com/#receitasdacris#sobremesa#mousse"
"TM_nDGaZPug","7 FILMES ASSUSTADORES que NÃO SÃO DE TERROR! 🚫👻","2019-10-31T21:00:13.000Z","UCBFLqK7PAP9DQ3JpIrWFI7w","Pipocando","24","19.03.11","pipocando|rolandinho|bruno bock|cinema|séries|filmes|melhores filmes|piores filmes|cenas|listas|curiosidades|humor|FILMES ASSUSTADORES que NÃO SÃO DE TERROR|filmes de terror|filmes assustadores|filmes que não são de terror|filme assustador que não é de terror|o labirinto do fauno|harry potter|não são de terror|terror|filme assustador","255771","37688","267","868","https://i.ytimg.com/vi/TM_nDGaZPug/default.jpg","False","False","Se você teve medo do Homem Pálido em O Labirinto do Fauno ou dos dementadores de Harry Potter e o Prisioneiro de Azkaban, se prepara pra esses e outros filmes assustadores que não são de terror!------------------------------------------------------------------------------------Inscreva-se no canal: http://bit.ly/1T6Yve4Assista outras curiosidades: http://bit.ly/1e3e5r5Fanpage: https://www.facebook.com/pipocandooficial----------- ENCONTRE A GENTE POR AÍ ----------//ROLANDINHOhttp://twitter.com/rolandinhohttp://instagram.com/rolandinhobr//BRUNO BOCKhttp://twitter.com/delongashttp://instagram.com/brunobock"
"ocgU3OU90rk","[EPISODE] 2019 FESTA Family Portrait Shooting #1","2019-11-01T11:00:05.000Z","UCLkAepWjdylmXSltofFvsYQ","BANGTANTV","10","19.03.11","방탄소년단|BTS|BANGTAN|HIPHOP|알엠|RM|슈가|SUGA|제이홉|jhope|지민|JIMIN|뷔|정국|JUNGKOOK|진|JIN","1634449","354266","729","13386","https://i.ytimg.com/vi/ocgU3OU90rk/default.jpg","False","False","BTS Official Homepage http://bts.ibighit.comBTS Blog http://btsblog.ibighit.comBTS Facebook https://www.facebook.com/bangtan.official"
"sz3j7qVLEMA","SANTOS 1 X 0 BAHIA - Melhores Momentos - Brasileirão 2019 (31/10)","2019-11-01T00:44:47.000Z","UCs-6sCz2LJm1PrWQN4ErsPw","Esporte Interativo","17","19.03.11","esporte interativo|santos|bahia|santos x bahia|brasileirao|campeonato brasileiros|gols brasileirao|santos 1 x 0 bahia|brasileirao 2019|melhores momentos|sanchez|sampaoli|sp:ty=high|sp:dt=2019-10-31:19:15-03:00|sp:st=soccer|sp:li=braz|sp:ti:home=SANT|sp:ti:away=BAHI","233698","6126","183","595","https://i.ytimg.com/vi/sz3j7qVLEMA/default.jpg","False","False","O Santos recebeu o Bahia e venceu por 1 a 0, gol de Sánchez! Confira os melhores momentos da partida e veja os dois gols anulados pelo VAR, um para cada time.Siga o Bradesco:https://www.facebook.com/bradesco/                                                             https://www.instagram.com/bradesco/Siga o Sporting Bet:https://www.facebook.com/sportingbet.tv/                                                                       https://www.instagram.com/sportingbet.tvSiga a Chevrolet:https://www.facebook.com/chevroletbrasilhttps://www.instagram.com/chevroletbr/https://www.youtube.com/user/chevrole...https://twitter.com/chevroletbrasilAssine o EI PLUS e assista todos os jogos da Champions League e tenha acesso a vários conteúdos exclusivos do Esporte Interativo: http://bit.ly/2UfmdtUCANAIS:DE PLACA - http://bit.ly/2HxPlHlMFM - http://bit.ly/2KnSU6PDESAFIEI - http://bit.ly/2EZIjL6DE SOLA - http://bit.ly/2k0Xg90EI GAMES - http://bit.ly/2ufcveAAcesse o portal do Esporte Interativo: http://www.esporteinterativo.com.br/"
"VqT0qREUA5s","MINHA MULHER NÃO DEIXA - PARAFUSO SOLTO","2019-10-31T13:00:12.000Z","UCfV1FFayeqmW7HzOETTGZhw","Parafuso Solto","23","19.03.11","humor|comedia|rir|engraçado|juiz de fora|marquinho|kelly|piada|video|parafuso solto","333471","25469","502","374","https://i.ytimg.com/vi/VqT0qREUA5s/default.jpg","False","False","Muitos homens casados vão entender esse video perfeitamente. Sabe quando você quer fazer aquilo que voce mais gosta mas a sua mulher fica colocando barreiras? Confira o video!Elenco:Marquinho, Aline, Kelly e JosyEdição: Marquinho***NÃO ESQUEÇA DE SE INSCREVER E MARCAR NOTIFICAÇÕES**********************DEIXE UM LIKE POR FAVOR**********************Se inscreva também em nossos canais:Marcelo Parafuso Solto:https://goo.gl/2bpMLZMarquinho Parafuso Solto:https://goo.gl/5s9E3mMano Doido:https://goo.gl/9t5LH7Daniel Parafuso Soltohttps://goo.gl/cJ4sGA"
"w3Elf88HbUg","Bolsonaro lamenta declaração do filho sobre AI-5","2019-10-31T21:56:32.000Z","UCuiLR4p6wQ3xLEm15pEn1Xw","Record News","25","19.03.11","#recordnews|#recordtv|#jornal|#notícias|#bolsonaro|#eduardo|#ai-5","147541","2247","255","539","https://i.ytimg.com/vi/w3Elf88HbUg/default.jpg","False","False","presidente Jair Bolsonaro lamentou nesta quinta-feira (31) a declaração do seu filho, o deputado Eduardo Bolsonaro, que sugeriu em entrevista a edição de um novo AI-5 se a esquerda radicalizar."
"lx8MEaZqqHk","Caneta azul, azul caneta","2019-10-31T20:11:09.000Z","UCrKXYE-Y4saxVFPI7Fuuzyw","Davy Jones","24","19.03.11","vídeo com Davy Jones|Davy Jones|Dava Jonas|vlog|memes|meme|zueira|vídeo zueira|vídeo comentado|vlog de Davy Jones|caneta azul|azul caneta","422306","66340","737","4305","https://i.ytimg.com/vi/lx8MEaZqqHk/default.jpg","False","False","INSTAGRAM - https://www.instagram.com/odavyjones/TORNAR-SE UM APOIADOR - https://www.facebook.com/becomesupporter/GameplayRJCANAL DE LIVES -  https://www.fb.gg/gameplayrjCRIEI UM CANAL NOVO - https://www.youtube.com/watch?v=nL5C7hBN5BMMEU SITE - http://gameplayrj.com.br/Vídeo original: https://www.youtube.com/watch?v=BsIXE-0O8IYhttps://www.youtube.com/watch?v=nNlp9eJTbsoPodcast - http://2dpodcast.gameplayrj.com.br/Twitter - https://twitter.com/DavyJonesRJCAMISAS DO CANAL - https://www.lolja.com.br/gameplay-rj_qO28545953XtOcxSMCaixa Postal - 14606 Cep: 03632-970São Paulo - SP#CanetaAzul"
