video_id,title,publishedAt,channelId,channelTitle,categoryId,trending_date,tags,view_count,likes,dislikes,comment_count,thumbnail_link,comments_disabled,ratings_disabled,description
"srksXVEkfAs","Arnold Schwarzenegger Breaks Down His Most Iconic Characters | GQ","2019-10-29T17:25:06.000Z","UCsEukrAd64fqA7FjwkmZ_Dw","GQ","24","19.03.11","arnold schwarzenegger|iconic|arnold schwarzenegger movies|iconic characters|arnold schwarzenegger gq|arnold schwarzenegger interview|arnold schwarzenegger 2019|arnold schwarzenegger movie|arnold schwarzenegger iconic|arnold schwarzenegger iconic characters|arnold schwarzenegger character|arnold schwarzenegger terminator|arnold schwarzenegger predator|arnold schwarzenegger mr freeze|arnold schwarzenegger twins|arnold schwarzenegger pumping iron|gq|gq magazine","967980","31087","349","2954","https://i.ytimg.com/vi/srksXVEkfAs/default.jpg","False","False","Arnold Schwarzenegger breaks down his most iconic characters, including his roles in 'The Terminator,' 'The Terminator 2: Judgement Day,' 'Predator,' 'Batman & Robin,' 'Pumping Iron,' 'Conan the Barbarian,' 'Twins,' 'Kindergarten Cop,' 'Jingle All the Way,' 'Total Recall,' 'True Lies' and 'Terminator: Dark Fate.' TERMINATOR: DARK FATE IS IN THEATERS NOV. 1!Still haven’t subscribed to GQ on YouTube? ►► http://bit.ly/2iij5wtABOUT GQFor more than 50 years, GQ has been the premier men’s magazine, providing definitive coverage of style, culture, politics and more. In that tradition, GQ’s video channel covers every part of a man’s life, from entertainment and sports to fashion and grooming advice. So join celebrities from 2 Chainz, Stephen Curry and Channing Tatum to Amy Schumer, Kendall Jenner and Kate Upton for a look at the best in pop culture. Welcome to the modern man’s guide to style advice, dating tips, celebrity videos, music, sports and more.https://www.youtube.com/user/GQVideosArnold Schwarzenegger Breaks Down His Most Iconic Characters | GQ"
"s2lCkVHQYus","AirPods Pro Unboxing and Review!","2019-10-29T12:04:33.000Z","UCey_c7U86mJGz1VJWH5CYPA","iJustine","22","19.03.11","ijustine|Airpods pro|review|unboxing|compairison","2907698","78019","3906","9134","https://i.ytimg.com/vi/s2lCkVHQYus/default.jpg","False","False","Testing out the new Apple AirPods Pro!► SUBSCRIBE FOR MORE VIDEOS: http://www.youtube.com/subscription_center?add_user=ijustine🎶 MUSIC I USE - https://goo.gl/Pe7GTL BE MY FRIEND:http://instagram.com/ijustinehttp://facebook.com/ijustinehttp://twitter.com/ijustineSnapchat: iJustine► WHAT I USE TO MAKE VIDEOS: https://www.youtube.com/watch?v=YRCngWau2GE📷 GEAR:Sony a7 III: http://geni.us/UHuO6ASony a7S II: http://geni.us/B1tYeKZFE 24-70mm F2.8 GM Lens: http://geni.us/MhAPNERx100 V: http://geni.us/ZVGoJGoPro Hero 7: http://geni.us/uxuU1Insta 360 One X: http://geni.us/8tEtxKRx0: http://geni.us/BoXwFGrMemory Card: http://geni.us/zuulPoABECOME A CHANNEL MEMBER: https://www.youtube.com/channel/UCey_c7U86mJGz1VJWH5CYPA/join"
"_qDLxqfLHsQ","Is TikTok Spying On You? | The Daily Show With Trevor Noah","2019-10-29T17:17:29.000Z","UCsv4YOF2RBYh0NQ1vuHQ-hg","Comedy Central UK","23","19.03.11","comedy central|comedy central uk|the daily show with trevor noah|trevor noah|the daily show|daily show new episode|new daily show|political humour|political comedy|trump and foreign help|us election 2020|presidential election 2020|trump administration|donald trump|Impeachment|Trump Impeachment|Democrats Launch Impeachment|Impeach Trump|Trump and Ukraine|Trump's phone call|whistleblower|alphabet song|TikTok|best of tiktok|new alphabet song","432853","8115","170","520","https://i.ytimg.com/vi/_qDLxqfLHsQ/default.jpg","False","False","Senators call for a security probe into TikTok and Trevor takes issue with a new version of the Alphabet Song.Subscribe to Comedy Central UK: http://bit.ly/1gaKaZOCheck out the Comedy Central UK website: http://bit.ly/1iBXF6jGet social with Comedy Central UK:Twitter:  https://twitter.com/ComedyCentralUKFacebook: https://www.facebook.com/comedycentraluk"
"luNn6ovoKVw","Mavic Mini - How small will these ACTUALLY get?","2019-10-30T13:01:11.000Z","UC3DkFux8Iv-aYnTRWzwaiBA","Peter McKinnon","22","19.03.11","Peter McKinnon|Peter McKinnon photography|Peter McKinnon Tutorials|Photography|Cinematography|Learn Cameras|Learn Photography|Learn Video|Video tutorials|Camera basics|Mavic Mini|Mavic Drone|Lightweight Drone|MAVIC MINI|NEW DJI DRONE|DJI Mavic Mini|Mavic Mini Review|Mavic MIni First Look|Legal Drone Flying|Drone Weight Limit|Legal Drone Weight Limit|Small Dronea|Best Small Drones","357813","15392","214","1402","https://i.ytimg.com/vi/luNn6ovoKVw/default.jpg","False","False","Mavic Mini : https://click.dji.com/AAoEWQel7JG3OcejzNpt9w?as=11628&ch=mavicmini5&pm=customNEW 2019 Lightroom PRESET PACK: https://bit.ly/363HiilThe Music I use: https://bit.ly/2KJwcVG - AMAZING for YouTubers10% OFF YE OLD SQUARESPACE! https://www.squarespace.com/mckinnonColour Graded with my PM LUTS Pack : https://goo.gl/JmUrM7PM MERCH & COFFEE! : https://goo.gl/TkzM6SMy 2019 KIT for Filmmaking, Photography & Vlogs:MY ND FILTERS (A MUST!) https://bit.ly/2VmXXZdGoPro Hero 7 : https://amzn.to/2M7WSzVMy Drone : https://amzn.to/2spuHDxMy Smaller Drone : https://amzn.to/2MdxOHFND's For my Drone: https://amzn.to/2VSwkHlMain Vlog Camera: https://amzn.to/2RMov6DPhoto / Timelapse Camera 2: https://amzn.to/2M8W0uSVLOG LENS! : https://amzn.to/2FsiuqiMagic ZOOM LENS OF LIFE: https://amzn.to/2ChiDZiGnarly 28-70 Lens: https://amzn.to/2ChiJA8DOPE B Roll Lens: https://amzn.to/2VUQVebSmall Roll of Gaff Tape: https://amzn.to/2RPUJy6Aputure AL-MX Light: https://amzn.to/2VSj9pJ3 Legged Thing Tripod: https://amzn.to/2D9dd4vCheap alternative to expensive Time-lapse remote: https://amzn.to/2Dava2zExpensive Time-lapse Remote: https://amzn.to/2VUq6GIRode Video Mic Pro Plus: https://amzn.to/2RMROWFThink Tank Memory Card Organizers: https://amzn.to/2st9bO2Think Tank SD Organizers: https://amzn.to/2MgvlwlSamsung T5 SSD Drive: https://amzn.to/2MbSqQpFOLLOW ME: Instagram: https://www.instagram.com/petermckinnon/Twitter: https://twitter.com/petermckinnonFacebook: https://www.facebook.com/petermckinnonphotoWebsite: http://www.petermckinnon.com"
"XmI7WKrAtqs","The Mandalorian – Official Trailer 2 | Disney+ | Streaming Nov. 12","2019-10-29T01:10:04.000Z","UCZGYJFUizSax-yElQaFDp5Q","Star Wars","24","19.03.11","The Mandalorian|Lucasfilm|Pedro Pascal|Gina Carano|Carl Weathers|Jon Favreau|Dave Filoni|Disney Plus|Disney+","7804288","230551","6083","18367","https://i.ytimg.com/vi/XmI7WKrAtqs/default.jpg","False","False","“Mandalorian, look outside. They’re waiting for you.” Watch the brand new trailer for #TheMandalorian, an original Star Wars series. Start streaming Nov. 12, only on #DisneyPlus."
"yM8SM66G7g0","Doing A Couples Quiz With My Girlfriend","2019-10-29T19:01:08.000Z","UCYzPXprvl5Y-Sf0g4vX-m6g","jacksepticeye","24","19.03.11","jacksepticeye|newlyweds game|jacksepticeye girlfriend|girlfriend|girlfriend quiz|gab|gab smolders|girlgamergab|gg gab|boyfriend|girlfriend boyfriend quiz|funny quiz|couples quiz|dating|quiz|funny moments|funny|relationships|relationship|couple|how well do we know each other","1986792","139965","1444","18300","https://i.ytimg.com/vi/yM8SM66G7g0/default.jpg","False","False","My girlfriend, Evelien , and I played the newlyweds game quiz ..... even though we're not marriedEvelien's Channel: https://www.youtube.com/user/GirlGamerGaBSUB TO BE EPIC - https://www.youtube.com/user/jacksepticeye?sub_confirmation=1Become a Sponsor: https://youtube.com/jacksepticeye/join►Twitter : https://twitter.com/Jack_Septic_Eye►Instagram: http://instagram.com/jacksepticeyeOutro animation created by Pixlpit:https://www.youtube.com/user/pixlpitOutro Song created by Teknoaxe. It's called I'm everywhere and you can listen to it herehttp://www.youtube.com/watch?v=JPtNBwMIQ9Q"
"O5Sduwj9G98","We Broke The Budget | Overtime 12 | Dude Perfect","2019-10-28T22:00:12.000Z","UCRijo3ddMTht_IHyNSNXpNQ","Dude Perfect","17","19.03.11","dude perfect|dude perfect stereotypes|dude perfect water bottle flip|bottle flip|water bottle flip|dude perfect bottle flip|dude perfect basketball|dp|dude perfect world record|edition|nerf|trick shots|trick shot|family|ping pong|bowling|clean|family friendly|bubble wrap|soccer|football|spinner|spinners|fidget spinners|dude|overtime|12|wheel|unfortunate|gas|running out of gas|coby|chef|mcclaren|rolls royce|bently","13587555","736796","23572","84799","https://i.ytimg.com/vi/O5Sduwj9G98/default.jpg","False","False","Exotic cars, absurd recurds, Ned's back, and a heated brand new segment!Special thanks to VUDU for sponsoring our new segment Top 10! Click HERE to see the other Dudes top 10 lists and a chance to win a signed basketball! http://watchvudu.com/dudeperfectThanks to Michael Empric, the world best adjudicator, and Guinness World Records!Check out more officially amazing world records HERE: https://www.youtube.com/user/GuinnessWorldRecordsChef Air, you are the man! - https://kingdomkitchen.coBlake Wynn, thanks for the sneaker hookup!! - https://instagram.com/just_wynn► Want an EXTRA Dude Perfect Video every week? Join the DP SQUAD! https://www.youtube.com/user/corycotton/join► Thanks for subscribing! - http://bit.ly/SubDudePerfectNEXT LEVEL STUFF -------------------------------------------🎒 NEW Merch - http://bit.ly/DPStore🎮 Play our FREE iPhone game! - http://smarturl.it/DudePerfect2📱 JOIN our VIP TEXT LIST - http://bit.ly/DPTextVIP🔔 Hit the bell next to Subscribe so you don't miss a video!👨🏻‍💻 Watch our newest vids! - http://bit.ly/NewDPVids📕 Read our Book - Go Big - http://amzn.to/OYdZ2sFollow our Instagrams so we can be best friends -------------------------------------------🏆 http://Instagram.com/DudePerfect🧔🏻 http://Instagram.com/TylerNToney👱🏻‍♂️ http://Instagram.com/Cody_Jones_🙋🏻‍♂️ http://Instagram.com/CobyCotton👨‍🦰 http://Instagram.com/GarrettHilbert⛹🏻‍♂️ http://Instagram.com/CoryCottonBonus points if you're still reading this! Comment: poor Coby, that was brutal Click here to learn more about Dude Perfect:http://bit.ly/AboutDudePerfectAs always...Go Big and God Bless!- Your friends at Dude PerfectBusiness or Media, please contact us at: Dude@DudePerfect.com5 Msgs/Month. Reply STOP to cancel, HELP for help. Msg&data rates may apply. Terms: slkt.io/DLd------------5 Best Friends and a Panda.If you like Sports + Comedy, come join the Dude Perfect team!Best known for trick shots, stereotypes, battles, bottle flips, ping pong shots and all-around competitive fun, Dude Perfect prides ourselves in making the absolute best family-friendly entertainment possible! Welcome to the crew! Pound it 👊🏻 Noggin 🙇🏻‍♂️ - Dude Perfect"
"QDp_yHNoWhk","PUMPKIN CARVING! 🎃🔪- (SATISFYING)","2019-10-30T17:30:05.000Z","UCBlbxksRa-KRSEKLi6foxjQ","MARKO","24","19.03.11","MARKO|Custom|Shoes|Sneakers|Vans|Air Force 1's|pumpkin carving|satifying|custom halloween|custom shoes|custom clothes|carving|wood carving|zhc|vexx|pumpkin|satisfying videos|marko|marko terzo|painting|custom iphone|custom vans|halloween|diy pumpkin|diy halloween costumes|diy costumes|diy halloween|trick or treat","1932049","112387","1250","4383","https://i.ytimg.com/vi/QDp_yHNoWhk/default.jpg","False","False","Join this duckling army and SuBsCRiBe :)Song made by: @cherrigangstaFollow My Socials!Instagram : @ markoterzoSnapchat: @ markoterzic0018Twitter: @ MARKOTERZO_"
"zbKtIBGuZ90","[Show Champion] 웨이션브이(威神V) - 天选之城 (Moonwalk) (WayV - Moonwalk) l EP.338","2019-10-30T10:01:33.000Z","UCPde4guD9yFBRzkxk2PatoA","ALL THE K-POP","24","19.03.11","웨이션브이|WayV|쿤|텐|윈윈|루카스|샤오쥔|헨드리|양양|showchampion|쇼챔|케이팝|kpop|가수|음악|쇼챔피언|show champion|all the kpop|올더케이팝|idol|威神V|天选之城|威神V天选之城|WayV Moonwalk|Moonwalk|쇼챔 웨이션브이|쇼챔피언 웨이션브이","864970","105610","375","6742","https://i.ytimg.com/vi/zbKtIBGuZ90/default.jpg","False","False","웨이션브이(威神V) - 天选之城 (Moonwalk) (WayV - Moonwalk)#쇼챔피언 #웨이션브이 #天选之城[Show Champion]★All about KPOP! Subscribe now★https://bit.ly/2XR37jVGlobal No.1 KPOP IDOL CHANNEL, ALL THE K-POP! Copyrightⓒ MBC PLUS, All Rights Reserved. ---------------------------------------------------------------------------------------------Buy All The K-POP Goods * OKVIT : http://bit.ly/OKVIT_KPOP* facebook : http://facebook.com/allthekpop.idol* twitter : https://twitter.com/ALLTHEKPOP* instagram : https://www.instagram.com/allthekpop.official* idolchamp : http://www.idolchamp.co.kr/* mbcplus  : http://www.mbcplus.com/* allthekshop : http://www.allthekshop.com"
"wH49n-4zuIc","2020 Ford Mustang Shelby GT500 - Jay Leno’s Garage","2019-10-29T10:00:11.000Z","UCQMELFlXQL38KPm8kM-4Adg","Jay Leno's Garage","2","19.03.11","Shelby|GT500|Ford Performance|V8|supercharged|Dave Pericak|Ford GT|pony car|Mustang|5.2L|dual clutch|Jay Leno|Jay Leno's Garage|car reviews|compares cars|classic cars|vintage cars|sports cars|super cars|cars|car gear|McLaren P1|Porsche 918 Spyder|Camaro Z28|jay leno garage|jay lenos garage|car collection|cnbc|episode|motorcycle|ford|corvette|tour|dodge|lexus","1000160","22226","482","4147","https://i.ytimg.com/vi/wH49n-4zuIc/default.jpg","False","False","The wait is finally over and Jay gets to open up 760 HP of Ford's powerful new American V8 with Ford Director of Icons Dave Pericak.» Subscribe: http://bit.ly/JLGSubscribe» Visit the Official Site: http://bit.ly/JLGOfficialSiteTHE BEST OF JAY LENO'S GARAGE» Exclusive First Looks: http://bit.ly/JLGExclusives» Ultra Rare Supercars: http://bit.ly/JLGSupercars» Jay's Book Club: http://bit.ly/JLGBookClubJAY LENO'S GARAGE ON SOCIALFacebook: http://facebook.com/JayLenosGarageTwitter: http://twitter.com/LenosGarageInstagram: http://instagram.com/jaylenosgarage/ABOUT JAY LENO'S GARAGEA new video every Sunday! Visit Jay Leno's Garage, the Emmy-winning series where Jay Leno gives car reviews, motorcycle reviews, compares cars, and shares his passion and expertise on anything that rolls, explodes, and makes noise. Classic cars, restomods, super cars like the McLaren P1, sports cars like Porsche 918 Spyder and Camaro Z28, cafe racers, vintage cars, and much, much more.NBC ON SOCIAL:Full Episodes: http://NBC.com/video/library/full-episodes/NBC YouTube: http://www.youtube.com/nbcFollow NBC: http://Twitter.com/NBCLike NBC: http://Facebook.com/NBCNBC Tumblr: http://NBCtv.tumblr.com/NBC Pinterest: http://Pinterest.com/NBCtv/NBC Google+: https://plus.google.com/+NBCNBC Instagram: http://instagram.com/nbc2020 Ford Mustang Shelby GT500 - Jay Leno’s Garagehttps://youtu.be/wH49n-4zuIcJay Leno's Garagehttp://www.youtube.com/user/jaylenosgarage"
"k8fVQPrwgbo","Slumber Parties Are Witch Gatherings","2019-10-29T16:13:06.000Z","UCu6v4AdYxVH5fhfq9mi5llA","Let Me Explain Studios","1","19.03.11","slumber|parties|witch|gatherings|witches|witchcraft|sleepover|Let Me Explain Studios|Rebecca Parham|Halloween|dolls|Lizzie Borden|song|animated|animation|cartoon|funny|creepy|ghosts|paranormal|animator","1195804","73899","662","8971","https://i.ytimg.com/vi/k8fVQPrwgbo/default.jpg","False","False","There are just a few too many creepy, occult practices surrounding slumber parties for me to ignore. I'm pretty sure we were all raised as witches.Merch Store: http://bit.ly/2RwMjZBMegan Maher: https://meganamaher.com/NineDoodles: https://twitter.com/NineDoodles?s=09Additional Voices by Rebaka-Chan: https://www.youtube.com/channel/UCUp__NKbr1x8CY6EWjvB6UQREBECCA'S SOCIAL STUFF: TWITTER: https://twitter.com/_RebeccaParham INSTAGRAM: @RebeccaParham LME SOCIAL STUFF: Twitter: https://twitter.com/LME_Studios Instagram: @LetMeExplainStudios Facebook: https://www.facebook.com/LetMeExplain...#SlumberParty #Witch #Halloween #Animation #Animated #Cartoon #Witches # SlumberParties #Slumber #Party #Dolls #Creepy #LetMeExplainStudios #Sleepover #RebeccaParham #Ghosts #Paranormal #witchcraft #haunted #animator"
"mlLl8eFJgkU","Blue's New Superpower - #TeamTrees","2019-10-29T20:34:19.000Z","UCbKWv2x9t6u8yZoB3KcPtnw","Alan Becker","1","19.03.11","teamtrees|trees|arbor day foundation|mrbeast|mark rober|20000000|20M|20 million|environment|environmentalism|green|recycling","3089186","241685","1796","11817","https://i.ytimg.com/vi/mlLl8eFJgkU/default.jpg","False","False","Blue can turn dollars into trees. So can you! http://www.teamtrees.orgT-SHIRTS ► https://teespring.com/stores/alan-beckerGAMING CHANNEL ► https://goo.gl/Ugh7ExINSTAGRAM ► http://www.instagram.com/alanbeckerTWITTER ► http://twitter.com/alanthebeckerFACEBOOK ► http://facebook.com/alanthebeckerPATREON ► https://www.patreon.com/alanbeckerDISCORD SERVER ► https://discord.gg/Ksd7b86TUTORIALS ► http://youtube.com/alanbeckertutorialsMINECRAFT CHANNEL ► http://youtube.com/alanbeckerminecraftMINECRAFT SERVER ► play.ghiblicraft.comSOURCE FILES ► http://www.alanbecker.net/donate#teamtrees"
"IRbeAfc4GDc","If eye surgeons did you how barbers do.","2019-10-29T22:03:38.000Z","UCI1XS_GkLGDOgf8YLaaXNRA","CalebCity","23","19.03.11","calebcity|comedy|barber shop","1420642","139834","817","4867","https://i.ytimg.com/vi/IRbeAfc4GDc/default.jpg","False","False","I had a barber forget he was cutting my hair, that phone conversation musta be immaculate.MusicOddwin - 19"
"IMT36uvuUNw","Game Of Thrones Writers QUIT New Star Wars Trilogy!","2019-10-29T23:33:25.000Z","UCsgv2QHkT2ljEixyulzOnUQ","AngryJoeShow","20","19.03.11","angryjoe|angryjoeshow|game of thrones|writers|show runners|disney+|star wars|star wars trilogy|the old republic|David Benioff|D.B. Weiss|breaking news|disney|lucas film|george lucas","451287","19034","530","4674","https://i.ytimg.com/vi/IMT36uvuUNw/default.jpg","False","False","35% OFF TODAY 10/29 ONLY AJSA Posters ► http://bit.ly/2HHR9z1  [Code: PUMPKIN]Its OFFICIAL the Game of Thrones Show Runners, David Benioff and D.B. Weiss QUIT their Planned 2022 New Star Wars Trilogy! Our thoughts and what this means for The Old Rebublic, the Future of Star Wars and if we are better off for it!NEW Foil AJSA Shirt! ► http://bit.ly/2m2YJNqTwitch ► http://twitch.tv/angryjoeshowTwitter ► http://twitter.com/AJSADelrithTwitter ► http://twitter.com/Otherjoe_AJSAJSA Community ► http://ajsagaming.com"
"RQBSouPL2zo","Are These Shoes REALLY Indestructible?","2019-10-29T20:00:02.000Z","UC1zZE_kJ8rQHgLTVfobLi_g","The King of Random","27","19.03.11","Indestructible shoes|best work boots|strongest shoes|testing indestructible shoes|indestructible shoes review|unbreakable shoe challenge|cool shoes|indestructible shoes commercial|indestructible shoes comfortable|steel toe shoes|safety shoes|indestructible shoes test|indestructible shoes put to the test|cool shoes design|cool shoes under 200|cool shoes for back to school|safety shoes for men|random happens|thekingofrandom|grant thompson|nate|calli","901787","18070","627","1336","https://i.ytimg.com/vi/RQBSouPL2zo/default.jpg","False","False","Today we're taking the self claimed Indestructible Shoes and putting them to the test. How strong are they really, and can we break them down?Check out the TKOR Shop: http://bit.ly/2UCNpEbSee What Else We're Up To:TKOR Discord: http://bit.ly/2LTTRoyTKOR Reddit: http://bit.ly/2XOFn0mTKOR Instagram: http://bit.ly/2Ihef1jNate's Instagram: http://bit.ly/2CZx05FCalli's Instagram: http://bit.ly/2YWWryaTKOR Facebook: http://bit.ly/2Kl2zgrTKOR Pinterest: http://bit.ly/2InY0iTSend Us Some Mail:TKOR1881 W Traverse ParkwaySte. E #221Lehi, UT 84043Business Inquiries: For sponsorship requests or business opportunities please contact us directly: http://bit.ly/2VwFw3xMusic by: Martin Klem - Over the BridgeWellmess - Sundown (Tell me Everything Is Ok) (Instrumental Version)Victor Olsson - Redneck Rumble 4Rockin' For Decades - My Sober Face Royalty Free Music from Epidemic Sound: http://bit.ly/2YZS8SHWARNING:This video is only for entertainment purposes. If you rely on the information portrayed in this video, you assume the responsibility for the results. Have fun, but always think ahead, and remember that every project you try is at YOUR OWN RISK.✌️👑  RANDOM NATION: TRANSLATE this video and you'll GET CREDIT! Click Here: http://bit.ly/35CvfIn  Want credit TRANSLATING other videos? Click Here to see where else you can contribute: http://bit.ly/2UFOm1OThis video is dedicated to our friend and founder Grant Thompson- the one and only King of Random. Click here to to see our tribute to him: http://bit.ly/2MwG5bNTHANK YOU!! ✌️👑"
"Kt1yq2BhsDs","Reading Your Spooky Halloween Stories","2019-10-29T18:31:57.000Z","UC0GLNhtTu7yI8rl6ZZGeezw","TheOdd2sOut","24","19.03.11","Spooky|Halloween|scary|stories|hotdog|costume|theodd2sout","1112815","67714","514","12705","https://i.ytimg.com/vi/Kt1yq2BhsDs/default.jpg","False","False","The days are getting shorter, the weather is getting cooler (except in Australia) can you feel it? It's pumpkin time. Edited by➤ https://www.youtube.com/user/TheMadz2012Twitter ➤ https://twitter.com/theodd1soutWebsite ➤ https://theodd1sout.com/"
"_EPZHi38rZE","True Damage 2019: Breakout | Official Skins Trailer - League of Legends","2019-10-29T17:00:06.000Z","UC2t5bjwHdUX4vM2g8TRDq5g","League of Legends","20","19.03.11","Riot Games|Riot|League of Legends|League|LoL|MOBA|True damage skins|true damage ingame|true damage in game|giants skins|true damage skins lol|true damage ingame lol|true damage in game lol|giants skins lol|music video skins lol|lol skins ingame|true damage ekko|true damage qiyana|true damage senna|true damage yasuo|true damage ekko skin|true damage qiyana skin|true damage senna skin|true damage yasuo skin","2142009","92327","3394","6197","https://i.ytimg.com/vi/_EPZHi38rZE/default.jpg","False","False","Command the stage with True Damage Akali, Qiyana, Yasuo, and Senna for 1350 RP, or leave ‘em behind with Ekko’s Legendary True Damage skin for 1820 RP. Stay on the lookout for Qiyana’s True Damage Prestige skin.Virtual hip-hop group True Damage was born when K/DA’s lead rapper Akali sought to bring together the distinct talents of Ekko, Senna, Qiyana, and Yasuo in an ambitious, genre-defying collaboration.Play for free! Sign up and download League of Legends at https://riot.com/playfree.#TRUEDAMAGE #TRUEDAMAGESKINS #LEAGUEOFLEGENDS"
"WI0LYRZErjU","Our Fans Wrote Our Video *Things Got Weird* - Merrell Twins","2019-10-29T18:22:35.000Z","UCwtnkRZcvL4bfopzJ-Von8Q","merrelltwins","23","19.03.11","Merrell Twins|Twins|Merrell|Veronica Merrell|Vanessa Merrell|Twin|Comedy|Family Friendly|Kid Friendly|Fans|Subscribers|Wrote|Video|fans decide|fans|fans choose|choose|decide|decided|Weird|Things|Got|Funny|Sketch|Girls|Help|Make|Vanessa|Veronica|merrell twins dating|awesomenesstv|twin my heart|identical twins|the merrell twins","823527","44559","521","4614","https://i.ytimg.com/vi/WI0LYRZErjU/default.jpg","False","False","We asked YOU GUYS to help us write our new youtube skit... and things kinda got... weird 😳Thanks for all who participated! Should we do another one of these? Comment down below if we should! SUBSCRIBE TO OUR CHANNEL ▶ http://bit.ly/2dSP9Fg OUR NEW MERCH ▶ https://fanjoy.co/collections/merrell-twinsCheck Out Our Other Videos:SMOOTHING CHALLENGEhttps://youtu.be/Qr1we6I8m8YEAT IT OR WEAR IThttps://youtu.be/sWnF4R1FNHgThe Break Uphttps://youtu.be/MyS8AjVj9FQIF FOOD BABIES WERE REALhttps://youtu.be/joMRNv0SlYETHIS COULD BE YOUhttps://youtu.be/U9v_bUMqFHgFollow Us on Twitter & Instagram: TWITTER: https://twitter.com/MerrellTwinsINSTAGRAM: http://instagram.com/MerrellTwinsFACEBOOK: https://www.facebook.com/MerrellTwinsTWITTER: https://twitter.com/VanessaMerrellTWITTER: https://twitter.com/veronicamerrellINSTAGRAM: http://instagram.com/vanessamerrellINSTAGRAM:http://instagram.com/veronicamerrellwww.merrelltwins.com#merrelltwins#twins#decide"
"3qoV_Ee9pOM","Chance the Rapper ft. MadeinTYO & DaBaby - Hot Shower (Official Video)","2019-10-28T16:00:10.000Z","UCeXp3EC97_rUl_e2vgM3gLg","Chance The Rapper","10","19.03.11","chance the rapper|dababy|madeintyo|hot shower","3569968","150628","8214","6837","https://i.ytimg.com/vi/3qoV_Ee9pOM/default.jpg","False","False","TIX TO THE BIG TOUR AVAILABLE ATChanceraps.com/tourMy debut album The Big Day is streaming EVERYWHERE NOW"
"u53qrAOduMU","Highlights FC Barcelona vs Real Valladolid (5-1)","2019-10-29T23:01:17.000Z","UCTv-XvfzLX3i4IGWAm4sbmA","LaLiga Santander","17","19.03.11","española|oficial|soccer|football|spanish league|laliga|resumen|highlight|FC Barcelona vs Real Valladolid 5-1|sp:st=soccer|sp:vl=en|sp:dt=2019-10-29T20:15:00Z|sp:ti:home=fcb|sp:ti:away=vad|sp:ty=high|sp:or=2|sp:li=liga|fc barcelona|barça|real valladolid|golazo|great goal|amazing goal|lenglet|lionel messi|leo messi|messi|luis suarez|arturo vidal|luis suárez|kiko olivas|goat|nutmeg|rakitic|griezman|assist","2709780","18178","744","840","https://i.ytimg.com/vi/u53qrAOduMU/default.jpg","False","False","Barça win at Camp Nou. Lenglet is ahead in minute 2, but shortly after, Kiko Olivas draws. From that moment,  FC Barcelona heads the match with great goals from Arturo Vidal and Lionel Messi, with a final result of 5-1 thanks to Luis Suárez Matchday 11 #BarçaRealValladolidSubscribe to the Official Channel of LaLiga Santander in HD | 2019-10-29 00.00h | J11 | BAR | VLLLaLiga Santander on YouTube: http://goo.gl/Cp0tCLaCopa on YouTube: http://bit.ly/1P4ZriPLaLiga SmartBank on YouTube: http://bit.ly/1OvSXbiFacebook: https://www.facebook.com/LaLigaTwitter: https://twitter.com/LaLigaInstagram: https://instagram.com/laligaGoogle+: http://goo.gl/46Py9"
