video_id,title,publishedAt,channelId,channelTitle,categoryId,trending_date,tags,view_count,likes,dislikes,comment_count,thumbnail_link,comments_disabled,ratings_disabled,description
"KawrNNPdNsE","FILÉ MIGNON SUÍNO: GOSTOSO E BARATO! | ERICK JACQUIN","2019-11-25T15:00:07.000Z","UCcHuI3TBzZfcYuLRxQwjY6w","Erick Jacquin","22","19.01.12","JACQUIN|ERICK JACQUIN|CHEF JACQUIN|JACQUIN MASTERCHEF|MASTERCHEF|MASTERCHEF BRASIL|CULINÁRIA|GASTRONOMIA|COZINHA FRANCESA|RECEITA|JACQUIN TOMPERO|jacquin falando tompero|canal do jacquin|jaquim|PESADELO NA COZINHA|JACQUIN FILHOS|FREEZER JACQUIN|MEME JACQUIN|FREEZER DESLIGADO|COMO PREPARAR FILÉ MIGNON|FILE MIGNON SUÍNO|CARNE DE PORCO|PORCO JACQUIN|RECEITA DE CARNE DE PORCO","689075","88231","338","3341","https://i.ytimg.com/vi/KawrNNPdNsE/default.jpg","False","False","O chef Erick Jacquin ensina a preparar um corte de carne muito saboroso e barato: o filé mignon suíno. Aprenda essa receita com carne de porco e tente fazer em casa. Inscreva-se no canal do Chef Erick Jacquin: https:///www.youtube.com/channel/UCcHuI3TBzZfcYuLRxQwjY6w?sub_confirmation=1Mais Chef Erick Jacquin:- Site oficial: https://erickjacquin.com.br/- Instagram: https://www.instagram.com/erickjacquin/- Facebook: https://www.facebook.com/erickjacquin/- Twitter: https://twitter.com/erickjacquin/FILET MIGNON SUINOIngredientes:- 1 filet mignon suíno- 1 tomate- 3 champignons de paris- manteiga- meia cebola- 1 dentes de alho- 1 taça de vinho- 3 aspargos- pedaço de queijo parmesão- salsinha- sal à gosto- pimenta à gosto- 2 ramos de tomilho- 3 folhas de louro- manjericãoModo de Preparo:  1 - Deixe a frigideira pré-aquecendo 2 - Tire a casca do aspargo3 - Fure o filet e coloque o aspargo dentro do filet4 -  Pique o queijo parmesão em tiras e coloque dentro do filet5 - Corte o filet em escalopes6 - Coloque a manteiga na frigideira 7 - Pique o tomate, a cebola, o alho e os champignons e tempere com sal. 8 - Coloque todos os ingredientes picados na frigideira e acrescente a salsinha, o manjericão e o vinho.9 - Coloque os escalopes."
"FVXEqxjLv-Q","EMPANADO COM APENAS 1 INGREDIENTE, JÁ COMEU ESSA RECEITA ASSIM??","2019-11-26T14:00:04.000Z","UCKprb2rS223xM5uNsbrSVAg","Tata Pereira","22","19.01.12","tata pereira|comida|food|receita facil|receita rapida|receita economica|receitas|file de tilapia empanado|tilapia","61423","8841","208","392","https://i.ytimg.com/vi/FVXEqxjLv-Q/default.jpg","False","False","Uma receita fácil e rápida e super fácil de fazer, anote os ingredientes e bora começar!!!VÍDEOS NOVOS TODOS OS DIAS ÀS 11:00🌻🌻🌻🌻Os ingredientes são:600g de file de tilapia1 dente de alho2 limões espremidoPimenta do reino (a gosto)Sal (a gosto)Farinha de trigo para empanar🌻🌻🌻♡Para envios de correspondências e entregas:Tata Pereira Caixa Postal:1707Sorocaba SPCEP:18015-970🌻🌻🌻🌻🌻🌻🌻♡ Me siga também:Face:https://goo.gl/bcz89qSite para imprimir: http://tatapereira.com.br/Twitter: http://twixar.me/YJ9KPinterest:http://twixar.me/NJ9K🌻🌻🌻🌻♡ ♡  Muito obrigada meus amores pelo carinho e por assistir. Deixe seu comentário e o joinha pois é muito importante para mim. E não se esqueçam de se INSCREVER no canal e ativar o SININHO DE NOTIFICAÇÕES! ♡♡🌻🌻🌻🌻#maridonacozinha #receitafacil"
"BCN4ESvkoKU","Dua Lipa - Don't Start Now - live performance at the AMAs [2019]","2019-11-25T21:20:22.000Z","UC-J-KZfRV8c13fOCkhXdLiQ","Dua Lipa","10","19.01.12","dua lipa|don't start now|live amas","4760457","169375","2852","5222","https://i.ytimg.com/vi/BCN4ESvkoKU/default.jpg","False","False","Don't Start Now is out everywhere! http://dualipa.co/dontstartnowFollow me online:Instagram:  https://dualipa.co/instagramFacebook: http://dualipa.co/facebookTwitter: http://dualipa.co/twitterYouTube: https://dualipa.co/youtubeSpotify: http://dualipa.co/spotifyApple Music: https://dualipa.co/apple-musicDeezer URL: http://dualipa.co/deezerAmazon Music: https://dualipa.co/amazonmusic"
"98g6eci-3NI","BBB 20 vai ser com Youtubers, que loucura","2019-11-25T23:45:00.000Z","UCJAbkIY17zAmCTNQHH0bQoQ","Gameplayrj","24","19.01.12","gameplayrj|davyjones|davy jones|video com davy jones|jogando com davy jones|gameplayrj jogando|jogando jogos|dava jonas|gprj|video do gameplayrj|lançamentos de games|Youtubers|BBB 20|gamervlog|vlog|noticias de games|castanhari|bbb|big brother brasil|noticias|noticia|noticia bbb 20|youtube|gta v|online|dlc|gta v dlc|gta 5|update|internet|famosos da internet|influenciadores|sony|inteligencia artificial|inteligencia|robo|robos davy jones|vlog de noticias|games","301106","42748","397","1909","https://i.ytimg.com/vi/98g6eci-3NI/default.jpg","False","False","Kabum: https://www.kabum.com.br/gameplayrjCONHEÇA 2D PODCASThttp://2dpodcast.gameplayrj.com.brBORA PRO DISCORD OFICIAL DOS PIRATAShttp://discord.gg/gameplayrjAqui no GameplayRJ você encontra notícias, curiosidades, gameplay de jogos malucos e muito mais. Fazemos gameplays de jogos divertidos, lançamentos e dos jogos mais pedidos por vocês. Mas aqui no GameplayRJ vamos muito além do gameplay, também falamos sobre filmes, seriados, animes e notícias bem interessantes!Aqui também temos o Gamervlog, todos os dias, noticias do mundo dos games, analises, criticas, opiniões e muito mais."
"YbV7I0bDaOk","Aphelios: a Arma dos Devotos | Trailer de Campeão - League of Legends","2019-11-25T15:30:01.000Z","UC6Xqz2pm50gDCORYztqhDpg","League of Legends BR","20","19.01.12","Riot|Riot Games|League of Legends|lol|Aphelios|new champion|novo campeão|league champion|campeão do lol|new champ|campeão novo lol|league champ|aphelios champ|aphelios campeão|champion trailer|trailer de campeão|champ teaser|teaser de campeão|champ trailer|trailer de campeão lol|champion teaser|teaser de campeão lol|cinematic|animação|gameplay|mecânica de jogo","406717","29380","241","2202","https://i.ytimg.com/vi/YbV7I0bDaOk/default.jpg","False","False","Todo verdadeiro poder tem seu preço. Ao tomar o veneno, Aphelios canaliza a voz de sua irmã, Alune. Em troca, ela concede suas habilidades a Aphelios: cinco armas de pedra da lua para ele dominar."
"xH5GzyEHhjg","8 ARTISTAS que ODEIAM a PRÓPRIA MÚSICA! 🎶🚫","2019-11-25T22:10:16.000Z","UCnC9rXILh2O6KOaCKnCoqEQ","Pipocando Música","24","19.01.12","pipocando música|canal de listas|melhores músicas|piores hits|videoclips fodas|junior lima|bruno bock|música|escândalos na música|ARTISTAS que ODEIAM a PRÓPRIA MÚSICA|artistas que odeiam|artista que odeia|odeiam a própria música|odeia a própria música|músicos|cantores que odeiam a própria música|oasis|lady gaga|artistas que negam a própria música|artistas que detestam a própria música|odeiam a música","198265","25635","156","1006","https://i.ytimg.com/vi/xH5GzyEHhjg/default.jpg","False","False","Enquanto alguns astros amam suas canções, outros preferem tapar os ouvidos do que escutar alguns sucessos. De Oasis a Lady Gaga, conheça os Artistas que Odeiam Suas Próprias Músicas.Visite nossos canais e conheça mais sobre a gente:Canal do Junior - http://youtube.com/OficialJrLimaCanal do Bock - http://youtube.com/VidaDeBrunoOuça as músicas desse vídeo no Spotify - https://open.spotify.com/user/pipocandomusica/playlist/600QQNG95GgbN8IXcgnwnq?si=iTIpJK5WT-GnmKMkGNEXpg----------- ENCONTRE A GENTE POR AÍ ----------//BRUNO BOCKhttp://twitter.com/brunobockhttp://instagram.com/brunobock//JUNIOR LIMAhttp://twitter.com/junior_limahttp://instagram.com/junior_lima"
"hufAEsfx6kY","NEYMAR POR EMPRÉSTIMO? GABIGOL FICA? JESUS SAI DO FLAMENGO? E+","2019-11-25T22:04:20.000Z","UCdYsXD2Z2oNxgHnMf1U_X7g","Mengão O MELHOR","17","19.01.12","flamengo|noticias do flamengo|noticias do flamengo ao vivo|flamengo ao vivo|Mengão O MELHOR","105011","17166","236","897","https://i.ytimg.com/vi/hufAEsfx6kY/default.jpg","False","False","Veja todas as notícias do Flamengo aqui no canal Mengão O MELHOR!"
"RnVhTaSm7VE","Viúva de Gugu conta a Bacci detalhes da queda do apresentador","2019-11-24T18:13:16.000Z","UCzANEY54dzal6jaCgKp4e2g","Domingo Show","22","19.01.12","record tv|rede record|record|domingo show|geraldo luís|geraldo|record geraldo|homenagem gugu|viúva de gugu|família de gugu|gugu morreu|morte gugu|gugu|gugu liberato|esposa do gugu","3355159","70977","3721","5566","https://i.ytimg.com/vi/RnVhTaSm7VE/default.jpg","False","False","A viúva de Gugu conversou com Luiz Bacci pelo telefone e contou detalhes do momento do acidente que tirou a vida do apresentador. Na hora da queda, estavam na casa Gugu, a esposa e os três filhos, e ela, que é médica, prestou os primeiros atendimentos. Para assistir ao conteúdo na íntegra, acesse PlayPlus.comNosso Whatsapp: https://domingoshow.r7.com/whatsappInscreva-se no canal Domingo Show:   http://r7.com/ghqwAssista às íntegras no PlayPlus:   https://www.playplus.comFacebook:  https://www.facebook.com/domingoshow/Instagram:   https://www.instagram.com/domingoshow/Twitter:   https://twitter.com/PgmDomingoShowSite oficial:  https://recordtv.r7.com/domingo-show#DomingoShow #HomenagemGugu"
"nnWK4XlRAVA","Conquista dupla do Flamengo é o maior feito do futebol brasileiro? | Linha de Passe","2019-11-26T00:04:42.000Z","UCQET9CZdh03jWnpY7WY25EA","Mundo ESPN","17","19.01.12","Flamengo|Libertadores|semifinal da libertadores|gols flamengo|flamengo na final|Linha de Passe|Mauro Cezar|Mauro Cezar Pereira|Mauro Flamengo|Fla|Maracanã|Goleada Flamengo|Gabigol|Arrascaeta|Bruno Henrique|Pablo Marí|Filipe Luís|Diego Alves|Renato Gaúcho|Rubronegro|River Plate|Flamengo Bahia|Campeão Brasileiro|brasileirão|Flamengo campeão|Flamengo Libertadores|Flamengo Brasileirão|River|Flamengo River|Lima Peru|Final em Lima","251221","10787","329","1012","https://i.ytimg.com/vi/nnWK4XlRAVA/default.jpg","False","False","Em dois dias, o Flamengo conquistou a Libertadores e o Campeonato Brasileiro. Seria este o maior feito do futebol brasileiro? Veja a análise do Linha de Passe.Acompanhe nossas redes sociais:Facebook: https://es.pn/2lZaxOx Twitter: https://es.pn/2lNgU6f Instagram: https://es.pn/2HZYE5c Veja tudo sobre o campeão da América em ESPN.com.br e no ESPN App! #LinhaDePasse #AVidaPrecisaDeEsporte"
"dQwM_e3yA1g","Imagens históricas contam a trajetória de sucesso de Gugu na TV","2019-11-25T04:54:53.000Z","UCp6tx5isUZCgQnvEwbOVC-Q","Câmera Record","22","19.01.12","record|record tv|rede record|câmera record|jornalismo record tv|jornalismo record|marcos hummel","319406","5409","216","299","https://i.ytimg.com/vi/dQwM_e3yA1g/default.jpg","False","False","Quando visitou a casa de Gugu em São Paulo para um documentário sobre o apresentador, Adriana Araújo selecionou imagens históricas que ela mostrou para o próprio Gugu. São cenas que contam uma história gloriosa na televisão brasileira. Nosso Whatsapp: https://camerarecord.r7.com/whatsappInscreva-se no canal Câmera Record:  http://r7.com/hYPI Assista às íntegras no PlayPlus:   https://www.playplus.comFacebook:   https://www.facebook.com/CameraRecord/ Instagram:   https://www.instagram.com/camerarecord/  Twitter:  https://twitter.com/recordtvoficial   Site oficial:   https://recordtv.r7.com/camera-record  #CâmeraRecord #HomenagemGugu"
"tqOTZ4DZHZ8","DIEGO NA LIBERTADORES x EU EM CASA","2019-11-25T12:00:10.000Z","UCZfId64U0uXqaSsAQCsp7Qg","Evelyn Regly","26","19.01.12","Evelyn Regly|Babados da Vida|É do Babado|Humor|LUNA|LUNA 3|LUNA 3 da FOREO|FOREO LUNA 3|resenha|resenha FOREO LUNA 3|FOREO LUNA 3 opinião|FOREO LUNA 3 review|massagem facial|como usar escova de limpeza facial|rotina de skincare pele mista|anti idade|rotina anti idade|como fazer massagem no rosto","363694","43262","362","1247","https://i.ytimg.com/vi/tqOTZ4DZHZ8/default.jpg","False","False","Foreo: https://foreo.se/xwpdSE INSCREVA NO CANAL http://goo.gl/1XffBSME ACHE NAS REDES SOCIAIS!!!Instagram @evelynreglyMeu Facebook EVELYN REGLYMeu Twitter @evelynreglyMeu Blog edobabado.com.br* Este vídeo contém publicidade de Foreo;"
"8Q275rlYuGI","BOLINHO DE MANDIOCA RECHEADO I DELICIOSO SALGADO FRITO","2019-11-25T17:00:02.000Z","UCF5WzS-iBJRfp_EcFI-GT1w","Receitas de Pai","24","19.01.12","BOLINHO DE QUEIJO|bolinho de mandioca|bolinho de mandioca recheado|bolinho de mandioca com queijo|bolinho de mandioca facil|bolinho frito|coxinha|massa de salgado|coxinha de mandioca|bolinho","150395","26220","143","1249","https://i.ytimg.com/vi/8Q275rlYuGI/default.jpg","False","False","Adquira as canecas Receitas de Pai:https://produto.mercadolivre.com.br/MLB-1371038161-kit-3-canecas-cermica-receitas-de-pai-_JM?quantity=1Hoje a receita é um delicioso bolinho de mandioca recheado com muito queijo kkk Bora conferir?Ingredientes:1 kg de mandioca cozida3/4 de xícara de farinha de trigo1/2 xícara de manteiga ou margarina1/2 cebola picada2 dentes de alho2 colheres de chá de sal250ml de águaqueijo mussarelasalsinha e cebolinha a gostoCaixa postal21016CEP - 81720-000Curitiba - ParanáDiego Cesar AssalveContato para parcerias:receitasdepai@hotmail.comInstagram:https://www.instagram.com/receitasdepai/Página Facebook:https://www.facebook.com/receitasdepaioficial/#bolinhodemandioca #receitasdepai"
"CVkqyOFHaww","Celso Portiolli presta homenagem emocionante a Gugu | Domingo Legal (24/11/19)","2019-11-24T18:48:54.000Z","UCZjZZc4lE_pPEKvAjKQhQbg","Domingo Legal","24","19.01.12","Domingo Legal|Gugu|Gugu Liberato|homenagem","1882018","89220","919","5294","https://i.ytimg.com/vi/CVkqyOFHaww/default.jpg","False","False","O Domingo Legal já faz parte da vida dos brasileiros há mais de vinte anos. A atração leva até a casa do telespectador um programa especial, com música, reportagens, celebridades, notícias, quadros que são campeões de audiência e agora ele está no Youtube. Inscreva-se e não perca nenhum programa.Classificação indicativa: recomendado para todas as idades._______________________________________________________________________________________________Assine o canal do Domingo Legal: https://www.youtube.com/user/SBTDomin...Curta a página oficial no Facebook: https://www.facebook.com/DomingoLegalSiga o programa no instagram: https://instagram.com/domingo_legalSiga o programa no Twitter: https://www.twitter.com/domingo_legalSaiba mais em: http://www.sbt.com.br/domingolegal"
"9zuW2P7skhk","GABIGOL recebe uma ligação de WITZEL!","2019-11-25T13:00:04.000Z","UCwS-7_1aHcx4KrqOPhTU-IA","André Guedes","24","19.01.12","[none]","341873","52075","522","1658","https://i.ytimg.com/vi/9zuW2P7skhk/default.jpg","False","False","Depois de ser deixado no vácuo pelo atacante do Flamengo na comemoração do título da Libertadores, o governador do Rio resolve bater um fio pro Gabigol."
"JH4a9mh4oHI","AFINEI MEU NARIZ?? 😳 PRODUTOS BIZARROS!","2019-11-25T14:30:00.000Z","UCO-9Uf_aIFZ2mJF4ws8wOgQ","Jana Taffarel","26","19.01.12","jana taffarel|sempre glamour|como se maquiar|como fazer|como fazer maquiagem|base|como passar base|maquiagem|produtos esquisitos|kbeauty|beleza","113158","20391","140","766","https://i.ytimg.com/vi/JH4a9mh4oHI/default.jpg","False","False","Gente, que vídeo foi esse? Achei que ia ficar sem orelha! E você, usaria algum desses produtos? Gostou da participação do Thiago? Me conta aqui embaixo!📝 LISTA DE PRODUTOS:Perfect V Lifting Premium Mask - AvajarLip Plump Capsule Mask -  KOCOSTAR USAModelador de Nariz Nose UpEscova de Base Silicone MultifuncionalInscreva-se no canal - https://goo.gl/qWRSDN Não esqueça de ativar o 'sininho' 🔔 assim você recebe todas as atualizações em primeira mão 😉🦄 VEM FICAR MAIS PERTINHO DE MIM 🦄Blog - http://www.sempreglamour.com.brInstagram: https://www.instagram.com/janataffarel/Facebook - https://www.facebook.com/JanaTaffarel/Twitter - https://twitter.com/JanaTaffarel✉️  NOVA CAIXA POSTAL: 😍Janaina TaffarelCaixa Postal 61051São Paulo - SPCEP: 05424-970"
"AklGB32e8zg","O que destrói seu pulmão e a via respiratória a noite?","2019-11-25T12:25:36.000Z","UC6ZrZAZgQxsq7OUNgKSlJ-Q","Peter Liu","22","19.01.12","dr. peter liu|peter liu|piter liu|medicina chinesa|medicina oriental|bem estar|10 anos mais jovem|Dr. peter liu ácido fólico|Dr. peter liu you tube|acupuntura|dr. piter liu|saúde perfeita|sono bom|saúde do pulmão|como melhorar sono|via respiratória|sinusite cronica|rinite alergica|o que piorar via respiratória no sono|apneia do sono|ventilador ligado faz mal|não usa ar-condicionado no sono|vento faz mal a via respiratória|#semprejovem|a noite","229893","26630","195","1057","https://i.ytimg.com/vi/AklGB32e8zg/default.jpg","False","False","#Pulmão #Viarespiratória #Semprejovem  #DrPeterLiu  #Drpiterliu  ▶️Link do Vídeo: https://youtu.be/AklGB32e8zg ▶️Titulo do Vídeo: O que destrói seu pulmão e a via respiratória a noite?▶️ Hashtags:  #Pulmão #Viarespiratória #Semprejovem  #DrPeterLiu  #Drpiterliu Eu sou Peter Liu, sou médico de medicina Chinesa, tenho uma clínica de acupuntura em Campinas, Medicina Oriental. Esse canal eu tenho mais 1200 vídeos para você compartilhar com seus amigos, tenha saúde perfeita e o mundo melhora! Eu tenho um curso de leitura facial On-Line está no site do Dr. Peter Liu oficial:  https://www.peterliu.com.br,  Para quem quiser fazer esse curso só acessar o site ou usar whatsApp 019 984106241. Praticar o Bem salva vidas das pessoas, é a graça,  é de graça! A maior recompensa do bem é o reconhecimento de que você é do bem. Os seus amigos vão agradecer você eternamente por ter salvado a vida deles! Dr. Peter Liu é um especialista de acupuntura e medicina Chinesa. Trata as dores musculares, neuropatias, articulações, fibromialgia, dor de coluna. Doenças como diabetes, pressão alto, tireoides. intestinais. Doenças como fobias, traumas, depressão. Doenças graves como câncer, tem acompanhamento. Dr.  Peter Liu criou 4  modalidades  de acupuntura diferenciado: 1. Neuroplatia que trata paralisias trofias neurológicos ou de sequelas AVC ou acidentes, paralisia de Bell, paralisia facial, paralisia facial causado por herpes Zoster, paraplégico.  2. Varizes. Usa agulha de acupuntura para curar as varizes sem cirurgia! Pioneiro do mundo.  3. Dores miofacial. Dores musculares com fibrose muscular. 4. Acupuntura na língua. Essa modalidade trata fibromialgia com muita facilidade. Você pode sentir alívio imediato apenas uma sessão mesmo com  5 anos de fibromialgia! Dr. Peter Liu trata seu corpo, mente e alma.Contatos: Telefone: (019) 3305-6000WhatsApp (019)984106241Agende sua consulta com Dr. Peter LiuMedicina Oriental Rua Ferreira de Almeida 92Jd Guanabara, Campinas, SP Redes sociais: Instagram:  https://www.instagram.com/drpeterliuSite oficial:  https://www.peterliu.com.brFacebook da Medicina Oriental :  https://www.facebook.com/saudezenFacebook pessoal: https://www.facebook.com/peterliu518https://www.facebook.com/peter.liuiiMeu canal em Chinês: https://www.youtube.com/channel/UC9bzjhxCEFdwc7WtL5_j5TAMeu canal em Inglês: https://www.youtube.com/channel/UCdQV0G4FyAieDYpUzpDr2nw?view_as=subscriber"
"p7_BjFXaSAU","Adoção - DESCONFINADOS (Erros no final)","2019-11-25T13:00:12.000Z","UCOOkCYthHdrpCZdytAT63GQ","Canal Desconfinados","23","19.01.12","desconfinados|canal|humor|brasil|brazil|comedy|comedia|gospel|jonathan|nemer|porta|dos|fundos|parafernalha|novo|lançamento|thiago|baldo|trb|produtora|turruy|gamer|adoção|cachorro|criança","253499","35708","767","1576","https://i.ytimg.com/vi/p7_BjFXaSAU/default.jpg","False","False","Nem sempre as pessoas gostam de viver só... tem pessoas que desejam a companhia de um outro ser: cachorro, gato, passaro, peixe... afinal, qual espécie as pessoas mais tem adotado e quais as espécies mais esquecidas? kkkkkkkkkk ASSISTA ATE O FINAL. Deixem o like no vídeo, isso ajuda d+ nosso canal. Compartilhem com os amigos, envie nos grupos do Face, Whats, etc. Se ainda não é inscrito, se inscreva já em nosso canal. Toda segunda tem um vídeo novo pra vocês. Instagram: @desconfinados Curta: Facebook.com/DesconfinadosCriadores: Jonathan Nemer (instagram: @jonathannemer) e                    Thiago Baldo (instagram: @thiago.baldo)"
"gYOyeOP4u-8","E agora, anti? OLHA o que Vampeta falou do Flamengo campeão brasileiro e da Libertadores!","2019-11-25T00:05:05.000Z","UCv-Nx8pSfG_LxbViMz14RWQ","Jovem Pan Esportes","17","19.01.12","Flamengo|flamengo campeão|flamengo campeão brasileiro|flamengo x river|flamengo campeão da libertadores|vampeta|flamengo x river plate|flamengo e river plate|esporte em discussão|jovem pan esportes|vampeta flamengo|vampeta fala do flamengo|flamengo campeão brasileiro e da libertadores|rf|mengão|em dezembro de 81|pilulaesporteemdiscussão","338401","10724","830","1424","https://i.ytimg.com/vi/gYOyeOP4u-8/default.jpg","False","False","Flamengo campeão brasileiro e da Libertadores: veja o que Vampeta falou após os títulos do Mengão de Jorge Jesus em 2019!  Link do vídeo: https://youtu.be/gYOyeOP4u-8#JovemPan #EsporteEmDiscussãoInscreva-se no nosso canal: https://tinyurl.com/ycu65we8 Entre no nosso site:http://jovempan.uol.com.br/esportesFacebook:https://www.facebook.com/jovempansportsSiga no Twitter:https://twitter.com/JovemPansportsInstagram:https://www.instagram.com/jovempansportsoficial/"
"4IAyZOhhACM","O que mede o Teste de QI | Nerdologia Ensina 03","2019-11-25T14:00:00.000Z","UClu474HMt895mVxZdlIHXEA","Nerdologia","28","19.01.12","ciência|explicação|curiosidade|nerdologia|nerdologia ensina|teste de qi|teste de inteligência|qi","154055","24331","111","849","https://i.ytimg.com/vi/4IAyZOhhACM/default.jpg","False","False","ESTÁCIOEstácio Carreiras: http://www.estaciocarreiras.com.br/Vestibular: https://estac.io/PCV3No No Nerdologia Ensina (Habilidades Comportamentais) de hoje, vamos ver de onde vem o teste de QI e o que ele mede ou não mede nas pessoas!Apresentação:Átila Iamarino:- http://www.twitter.com/oatila- http://instagram.com/oatilaRoteiro:Átila Iamarino: http://www.twitter.com/oatilaEdição e Arte:Estúdio 42 – http://www.estudio42.com.brFONTESGardner, H., Chen, J. Q., & Moran, S. (2009). Inteligências múltiplas. Penso Editora.Hauser, R. M. (2002). Meritocracy, cognitive ability, and the sources of occupational success. Madison, Wis, USA: Center for Demography and Ecology, University of Wisconsin.McGreal, S. (2013). The illusory theory of multiple intelligences. Psychology Today.American Psychological Association. (2017). Believing you can get smarter makes you smarter.Nicolas, S., Andrieu, B., Croizet, J. C., Sanitioso, R. B., & Burman, J. T. (2013). Sick? Or slow? On the origins of intelligence as a psychological object. Intelligence, 41(5), 699-711.Duckworth, A. L., Quinn, P. D., Lynam, D. R., Loeber, R., & Stouthamer-Loeber, M. (2011). Role of test motivation in intelligence testing. Proceedings of the National Academy of Sciences, 108(19), 7716-7720.Hampshire, A., Highfield, R. R., Parkin, B. L., & Owen, A. M. (2012). Fractionating human intelligence. Neuron, 76(6), 1225-1237.Richardson, K., & Norgate, S. H. (2015). Does IQ really predict job performance?. Applied Developmental Science, 19(3), 153-169.Owen, A. M., Hampshire, A., Grahn, J. A., Stenton, R., Dajani, S., Burns, A. S., ... & Ballard, C. G. (2010). Putting brain training to the test. Nature, 465(7299), 775.SAIBA MAISComo ouvir audiolivros: https://bit.ly/2ejtJEmBibliografia do Nerdologia: https://bit.ly/1SUWXRPMATERIAL USADOVÍDEO abstrato tela 1: https://bit.ly/2OhtMk1VÍDEO cérebro tela 8: https://bit.ly/33ftcHNVÍDEO estudante tela 13: https://bit.ly/2QM3Gr4VÍDEO estudante tela 13: https://bit.ly/2qKjUX5IMAGEM lâmpada por Burak K: https://bit.ly/2Dbg5NsIMAGEM fundo por rodrigo souza: https://bit.ly/33khtYuIMAGEM dados por adriano 7492: https://bit.ly/34kRguhIMAGEM alfred binet: https://bit.ly/2DgNPsNIMAGEM david wechsler: https://bit.ly/2QZrvMvIMAGEM caderno por hermaion: https://bit.ly/2DgWxayIMAGEM lâmpada por pixabay: https://bit.ly/2KOc31CIMAGEM - Imagem de Steve Buissinne por Pixabay: https://bit.ly/2XIO7lqIMAGEM - Photo by Pixabay from Pexels: https://bit.ly/2QP7w2FIMAGEM - Photo by George Becker from Pexels: https://bit.ly/37DjrqfIMAGEM - Gardner in 2010: https://bit.ly/2XUbuc9IMAGEM - Coin: https://bit.ly/2rkk0VBSIGA-NOS NAS REDES SOCIAIS:Facebook http://www.fb.com/CanalNerdologiaG+: http://bit.ly/1hNOvpDTwitter: http://twitter.com/CanalNerdologiaInstagram: http://instagram.com/nerdologia"
"Wby4YjWstTo","Pão de Alho com Coraçãozinho e Queijo I Churrasqueadas","2019-11-25T14:30:00.000Z","UC9zqyKHeUbNls9XTuAhPwKg","Churrasqueadas","24","19.01.12","pão de alho|receita de pão de alho|pasta de alho|creme de alho|pão de alho com coração|coração de frango|receita de coraçãozinho|como fazer pão de alho|sanduiche de coração|sanduiche de creme de alho|churrasco|pão de alho do gordo","155999","20096","181","322","https://i.ytimg.com/vi/Wby4YjWstTo/default.jpg","False","False","Já pensou juntar os sabores do pão de alho com recheio de coração de frango e transformar esses dois fenômenos do churrasco brasileiro em um mega sanduíche servido com muito queijo derretido? Pois foi justamente essa a ideia de um restaurante localizado na Tijuca, Zona Norte do Rio, o “Pão de Alho do Gordo“.INGREDIENTES- 2 baguetes- 500g de coração de frango temperado- 100g de manteiga- 1/2 xícara de azeite- 3 dentes de alho- Salsinha picada- 500g de queijo pratoO prato está fazendo enorme sucesso no estabelecimento, que foi inaugurado no último dia 9/11, ou seja, ha apenas quatro dias. Na internet, o sanduíche de pão de alho com coração é um dos assuntos mais comentados pelos cariocas"
