video_id,title,publishedAt,channelId,channelTitle,categoryId,trending_date,tags,view_count,likes,dislikes,comment_count,thumbnail_link,comments_disabled,ratings_disabled,description
"5omc2txnOUs","新居がバレたからフィリピンに海外逃亡【YouTube引退】","2019-10-25T10:57:44.000Z","UCSmIO01FO8IxQo-6yL63BzA","チャンネルがーどまん","24","19.03.11","チャンネルがーどまん|チャンネルガードマン|がーどまんチャンネル|ガードマンチャンネル|がーどまん|ガードマン|ラップ|ドッキリ","1101305","17963","2519","5361","https://i.ytimg.com/vi/5omc2txnOUs/default.jpg","False","False","チャンネルがーどまんhttps://www.youtube.com/channel/UCSmIO01FO8IxQo-6yL63BzA夜のがーどまんhttps://www.youtube.com/channel/UCIhzVbsULDkuJ0VvAeMpP-Q/feed?view_as=subscriberニートがーどまんゲーム実況https://www.youtube.com/channel/UCEkrUzgbElR_WtFR5TwxJEQ?view_as=subscriberがーどまんのTwitterhttps://twitter.com/mcgardmanがーどまんのインスタhttps://www.instagram.com/gardman556/がーどまんテックトックhttp://vt.tiktok.com/JUG1yV/■ファンレター・プレゼントの宛先はこちら〒153-0042東京都目黒区青葉台3-6-28 住友不動産青葉台タワー2F株式会社Kiii がーどまん宛※冷蔵・冷凍が必要な、なま物の受付はできません。■お仕事のご依頼等channelgardman@kiii.co.jp■Kiii HPhttps://kiii.co.jp"
"u1JVN-CRD0g","バトルスピリッツ サーガブレイヴ 第2話","2019-10-25T12:00:30.000Z","UCwWsJ1jH1fRUm55-jY0XS2w","BattleSpirits","20","19.03.11","BattleSpirits|バトスピ|サーガブレイヴ|第2話|約束のバトル|馬神弾|ズングリー|BS50|超煌臨編第3章","458322","9456","106","0","https://i.ytimg.com/vi/u1JVN-CRD0g/default.jpg","True","False","『バトルスピリッツ 少年激覇ダン』『バトルスピリッツ ブレイヴ』続編アニメーション『バトルスピリッツ サーガブレイヴ』を全3話で配信！■バトルスピリッツ サーガブレイヴ 第1話https://youtu.be/ucPu6qMW4es■バトルスピリッツ サーガブレイヴ 公式ホームページ http://www.bn-pictures.co.jp/battlespirits/■バトルスピリッツ 少年激覇ダン  無料配信特設ページ  https://www.battlespirits.com/movie/bsgekiha/■バトルスピリッツ 公式ホームページ https://www.battlespirits.com/"
"TGxl2d3jNww","【祝】まりちゃん結婚おめでとう💍WEDDING👼VLOG","2019-10-25T12:45:01.000Z","UCOjmYCnYlTcdoD2DKHvrV5g","HARUNA KOJIMA's cat nap","22","19.03.11","#wedding|#AKB48|#結婚式|#congratulations|#こじはる|#小嶋陽菜|#VLOG","2326931","40806","863","1859","https://i.ytimg.com/vi/TGxl2d3jNww/default.jpg","False","False","こんにちは小嶋陽菜です❤️今回は篠田麻里子ちゃんのウェディングパーティーのVLOG🎈パーティーでは、AKB48時代の懐かしいメンバーにも会えた👏相変わらずでみんななにも変わってなくて安心した😂10代20代一緒に頑張ってきたメンバーのこんな日が来るなんて不思議な気持ちと、まりちゃんの笑顔で幸せな気持ちをたくさんいただきました🥺ウェディングドレス姿本当に美しかった💗素敵な会に招待してくれてありがとう。まりちゃん、旦那さん、末長くお幸せに..❤️みぃちゃんは、まだまだ頑張るそうです😂妹の応援よろしくお願いします🤲💋snsInstagram👩🏻・https://www.instagram.com/nyanchan22 👶🏻・https://www.instagram.com/kemushichan22Twitter・https://twitter.com/kojiharunyanTikTok・http://vt.tiktok.com/dfD16Q/💄Herliptohttp://www.herlipto.jp#wedding #AKB48 #結婚式 #congratulations #こじはる #小嶋陽菜 #VLOG"
"kaX_t4fnrxU","【アニメ】ヤバイアイス屋さんに来たｗｗｗｗｗ","2019-10-25T09:00:09.000Z","UCLqCmbd6bgcLaBVz3aA-68A","P丸様。","23","19.03.11","P丸様。|ななもり|すとぷり|かわいい|アイス|お笑い|コント|爆笑|楽しい|アイス屋さん|コールドストーン|歌","663281","33411","376","1447","https://i.ytimg.com/vi/kaX_t4fnrxU/default.jpg","False","False","最近ほうじ茶にはまってしまってとってもほうじ茶がスコティッシュホールドにゃ～～～店員さん▽ななもり。https://twitter.com/love_nkun?lang=jahttps://www.youtube.com/channel/UClqEh59SFJVyKU0RIhFBJ3Aすとぷり▽https://www.youtube.com/channel/UCdB5vhQORw9HeiF82IYLnjwTwitter　https://twitter.com/p_ma_ru面白い動画　https://www.youtube.com/channel/UCLqCmbd6bgcLaBVz3aA-68Aフリー音楽素材/魔王魂https://maoudamashii.jokersounds.com/"
"nwqItkDhCrI","女1人と猫2匹のナイトルーティーン！！Night Routine♡","2019-10-25T10:00:21.000Z","UC69xoWl5-Y3m-oRFTORIbKw","さぁや saaya","26","19.03.11","さぁや|saaya|メイク|コスメ","437814","9129","336","678","https://i.ytimg.com/vi/nwqItkDhCrI/default.jpg","False","False","提供：ドクターシーラボ ラボラボスーパーKeana Lotionを今すぐ購入したい方は下記のリンクから！　http://www.labo2.jpラボラボ スーパーKEANAローションを1本買うと送料無料期間：2019年10月25日～11月07日まで[商品特徴]４つのケアが素肌を引き締め。小鼻、つるん！　皮脂の除去：植物由来の成分が余分な皮脂の分泌を抑え、素肌を引き締めます。　角質の除去：乳酸、リンゴ酸、ローヤルゼリー酸など、天然由来の酸が古い角質や頑固な角栓にアプローチ。　洗浄：やさしくふき取ることで、毛穴の奥に入り込んだ汚れや詰まりを取り除きます。　保湿：ヒアルロン酸、水溶性コラーゲンがしっかりうるおいを与え、キメの整ったみずみずしい肌へ。♡さぁやフォトブック♡https://www.amazon.co.jp/dp/4065150892/ref=sr_1_1?s=books&ie=UTF8&qid=1545375759&sr=1-1&keywords=saaya%27s+Pink+BOxサブチャンネル（さやぴんく(さぁや2nd)）https://m.youtube.com/channel/UCCCKcdrIq6GXF2-IRJh3kNg(Twitter)https://twitter.com/saaya3831(Instagram)https://instagram.com/saaya831/"
"VOEeuw7w6_8","3ヶ月前のパワハラ炎上商法について、","2019-10-24T09:00:05.000Z","UC3eTZ5Yld6qufD6rtEiERdw","【レペゼン地球】公式","10","19.03.11","レペゼン地球|パワハラ|ジャスミン|DJ社長|しゃざい|謝罪|ホルモン|マキシマムザホルモン|炎上|炎上商法","1722532","79687","15804","12155","https://i.ytimg.com/vi/VOEeuw7w6_8/default.jpg","False","False",""
"7wgRSpVj6sU","【新発見】チェヨンちゃんの行ってるタトゥースタジオとは？！TWICE『Feel Special』サイン会レポ【チェヨン・ジョンヨン】","2019-10-25T11:00:12.000Z","UC31k7KPtTEsgty9lg5rxO1A","マーキュリー商事","24","19.03.11","マーキュリー|mercury|マーキュリー商事|韓国|Feel Special|サイン会|TWICE|チェヨン|ジョンヨン","219883","4826","152","469","https://i.ytimg.com/vi/7wgRSpVj6sU/default.jpg","False","False","サイン会レポ再生リスト！https://www.youtube.com/playlist?list=PLWHYkcNh0dxk_RqYbO3Yi83dyDp8fPIB5サナ・ダヒョン編https://www.youtube.com/watch?v=MPpbqb5kd2Qツウィ・ナヨン編https://www.youtube.com/watch?v=EZbeYnwNyR0モモりんの動画！https://www.youtube.com/watch?v=7TumCEy7Rfg&feature=youtu.beいつも動画見てくれて有り難うございます！毎日韓国での様子を紹介！サブチャンネル！→https://www.youtube.com/channel/UCteyxLmgu9a6rVkfPUDp4eA動画の字幕作成にご協力ください！日本語はもちろん、英語・韓国語・中国語など翻訳字幕へ協力いただけると非常に助かります！方法についてはこちら: https://support.google.com/youtube/answer/6054623?hl=ja【オススメの再生リスト】TWICE『FANCY』サイン会https://www.youtube.com/playlist?list=PLWHYkcNh0dxlW_E-mXBZWLFED2ZQlNCY2【TWICE関係のオススメ動画】モモちゃんに撮ってもらった動画https://www.youtube.com/watch?v=iU6FXng1cdgミナちゃんに撮ってもらった動画https://www.youtube.com/watch?v=7cCFZM11poo2回目のサイン会ジヒョ・ツウィ・ミナの回https://www.youtube.com/watch?v=4Q5EpsGXd1Iナヨン・チェヨン・サナの回https://www.youtube.com/watch?v=4qKWslnvrkEダヒョン・ジョンヨン・モモの回https://www.youtube.com/watch?v=0Gucp-MNxv4ツウィちゃんとツーショット撮った動画https://www.youtube.com/edit?o=U&video_id=gCbysbjFgnMミサモに空港で話した動画https://www.youtube.com/watch?v=gNPjDeX-htg初めて認知されたハイタッチ会の動画https://www.youtube.com/watch?v=6pCshGwt9RE韓国でグッズを爆買いした動画https://www.youtube.com/watch?v=OWoPBneulq4チャンネル登録はこちら！→https://www.youtube.com/channel/UC31k7KPtTEsgty9lg5rxO1A評価・コメント&SNS等でのシェアよろしくお願いします！Twitter・Instagramもフォローしてね！最新情報とか見れるよ！マーキュリーTwitter➤https://twitter.com/masakiti0704マーキュリーInstagram➤https://www.instagram.com/mercury0704お便りや案件のお話はこちらにお願いします！（株）UUUM東京都港区六本木6-10-1 六本木ヒルズ森タワー37Fマーキュリー宛"
"BDE33UPCL9I","「うんこポーカー」","2019-10-25T14:26:42.000Z","UCynIYcsBwTrwBIecconPN2A","東海オンエアの控え室","23","19.03.11","[none]","411833","7390","159","822","https://i.ytimg.com/vi/BDE33UPCL9I/default.jpg","False","False","それではお休みします。皆さんも良き休日を。東海オンエアの控え室へようこそ。ぜひチャンネル登録お願いします！https://www.youtube.com/channel/UCynIYcsBwTrwBIecconPN2Aメインチャンネルはこちらの【東海オンエア】です！https://www.youtube.com/channel/UCutJqz56653xV2wwSvut_hQグッズ購入はこちらから！！https://goo.gl/YtauZWお仕事の依頼はこちらからhttps://www.uuum.co.jp/inquiry_promotionファンレターはこちらへ〒106-6137 東京都港区六本木 6-10-1 六本木ヒルズ森タワー 37階UUUM株式会社　東海オンエア宛【Twitterアカウント】てつや→https://twitter.com/TO_TETSUYAとしみつ→https://twitter.com/TO_TOSHIMITSUしばゆー→https://twitter.com/TOKAI_ONAIRりょう→https://twitter.com/TO_RYOOゆめまる→https://twitter.com/TO_yumemarucas虫眼鏡→https://twitter.com/TO_ZAWAKUN"
"6F8IJrjhx44","月曜夜に無敵になっちゃったOLのナイトルーティーン","2019-10-25T09:03:51.000Z","UCw6gNpp35E4QJChCxHR4RWw","稀に暇なOL_なっちゃん","2","19.03.11","ディズニー|ディズニーシー|ディズニーランド|TDS|TDL|TDR|OL|バイク|バイク女子|女性ライダー|女子ライダー","378692","4484","226","631","https://i.ytimg.com/vi/6F8IJrjhx44/default.jpg","False","False","【SNSはこちら】▼Twitter（ディズニー本垢）＠natchan_nelhttps://twitter.com/natchan_nel▼ツイッター（バイク垢）＠bored_motorhttps://twitter.com/bored_motor▼インスタ＠bored_motorhttps://www.instagram.com/bored_motor/------------------------------------------------------------------------------ 楽曲提供：Production Music by http://www.epidemicsound.com ------------------------------------------------------------------------------"
"1e3L4QCP5Ag","笑顔で終われてよかった、、","2019-10-25T10:00:00.000Z","UCEEEOlXG09lb4pSr03QVhwQ","せりしゅん","24","19.03.11","せりしゅん|ジュキヤ|しゅんしゅん|じゅきぱっぱ|ゆなたこ|ゆな|VAZ|卒業","743461","19095","348","939","https://i.ytimg.com/vi/1e3L4QCP5Ag/default.jpg","False","False","ジュキヤhttps://www.youtube.com/channel/UCyFs_R4WYYUGYVzcnJyMHqgゆなたこhttps://www.youtube.com/channel/UCsTM1roCxoot1-03EO5zQxgせりしゅんです！チャンネル登録お願いします！TikTok：http://vt.tiktok.com/SQBbv/Twitter：https://twitter.com/0208_31instagram：https://www.instagram.com/shun.28/"
"KzCitSrxjv0","要望があったのでチュートリアル徳井さんの申告漏れについて解説しました","2019-10-24T14:06:02.000Z","UCXjTiSGclQLVVU83GVrRM4w","堀江貴文 ホリエモン","25","19.03.11","堀江貴文|ホリエモン|堀江|貴文|寺田有希|Takafumi|Horie|チュートリアル|徳井","1526535","17113","1551","2515","https://i.ytimg.com/vi/KzCitSrxjv0/default.jpg","False","False","要望があったので作りました。YouTubeにはない情報も！ホリエモン公式メルマガ配信中登録はこちら→ http://horiemon.com/magazine/堀江によるオンラインサロン、通称HIU（堀江貴文イノベーション大学校）のメンバーも募集中です！詳細はこちら→https://lounge.dmm.com/detail/87/ホリエモンチャンネルのノーカット版は月額840円のFRESH会員限定でご覧いただけます詳細はこちら→https://freshlive.tv/horiemon----------おすすめ書籍-------------【NEW】時間革命 １秒もムダに生きるな（朝日新聞出版）▶https://amzn.to/2n7VqVzゼロ―――なにもない自分に小さなイチを足していく（ダイヤモンド社）▶ https://amzn.to/2VHSx9J多動力 (NewsPicks Book) (幻冬舎文庫)▶ https://amzn.to/2HNvlSv堀江貴文Twitter : @takapon_jp 寺田有希Twitter : @terada_yukiオフィシャルHP：http://yukiterada.com/制作：エイジメディア株式会社http://www.agemedia.jp/"
"6ccyWSU3lbA","【空白の1日】巨人「認められないなら新リーグを作る！」ファン「巨人と裏取引しやがって！」昭和の怪物を巡る争い！「空白の1日」を漫画にしてみた(マンガで分かる)","2019-10-24T06:00:00.000Z","UC-kF1uMFhIfvw6seHqDGwkg","アシタノワダイ","24","19.03.11","アシタノワダイ|漫画|マンガ","634338","4713","417","1212","https://i.ytimg.com/vi/6ccyWSU3lbA/default.jpg","False","False","引用：https://gendai.ismedia.jp/articles/-/160Twitter・インスタみーたんhttps://twitter.com/hattaemilyhttps://www.instagram.com/hattaemily/アシタノワダイhttps://twitter.com/ashiwadaiちなっちゃんhttps://www.instagram.com/chinatchan/18号https://twitter.com/_18goまいhttps://twitter.com/sugar_ashiwada引用：https://www.pakutaso.comhttps://www.irasutoya.com音楽引用（フリー音源）：魔王魂 http://maoudamashii.jokersounds.com/DOVA-SYNDROME　　https://dova-s.jpアシタノワダイjustoyakudachi@gmail.com"
"3dFVEu1Al3Y","【実録】エンリケ密着24時!!  気になる自宅も大公開!! ｜エンリケ空間CHANNEL Vol.007","2019-10-24T03:00:51.000Z","UCD0Kba00rO0XaRKJ-qyrszw","エンリケ空間チャンネル","22","19.03.11","エンリケ|小川えり|キャバクラ|キャバ嬢|名古屋No1キャバ嬢|エンリケ シャンパン一気|エンリケ 直瓶|エンリケ 一気|名古屋 アールズカフェ|小悪魔ageha|愛沢えみり|桜井野の花|椿そら|進撃のノア|ラファエル|密着24時|内見","981192","12302","926","860","https://i.ytimg.com/vi/3dFVEu1Al3Y/default.jpg","False","False","エンリケ密着24時!! すっぴんで歯医者から愛沢えみりちゃんのポップアップショップでお買い物 からの東京へ行き 超高級ブティックDiorでオートクチュール ♪からの高層タワマンを内見して 気になる焼肉屋でキムチとにんにくを食べて出勤!!ww【チャンネル登録】https://www.youtube.com/channel/UCD0Kba00rO0XaRKJ-qyrszw/?sub_confirmation=1【Instagram】https://www.instagram.com/eri.ogawa1102【Twitter】https://twitter.com/rie0985【OFFICIAL WEBSITE】https://enrikekukan.com/【ナイブロ】https://www.nights.fun/aichi/A2301/A230101/arts_cafe/girlid-402259/diary/#menus【エンリケの著書】＜日本一売り上げるキャバ嬢の 指名され続ける力＞https://www.amazon.co.jp/%E6%97%A5%E6%9C%AC%E4%B8%80%E5%A3%B2%E3%82%8A%E4%B8%8A%E3%81%92%E3%82%8B%E3%82%AD%E3%83%A3%E3%83%90%E5%AC%A2%E3%81%AE-%E6%8C%87%E5%90%8D%E3%81%95%E3%82%8C%E7%B6%9A%E3%81%91%E3%82%8B%E5%8A%9B-%E5%B0%8F%E5%B7%9D-%E3%81%88%E3%82%8A/dp/4046024194＜日本一売り上げるキャバ嬢の 億稼ぐ技術＞https://www.amazon.co.jp/%E6%97%A5%E6%9C%AC%E4%B8%80%E5%A3%B2%E3%82%8A%E4%B8%8A%E3%81%92%E3%82%8B%E3%82%AD%E3%83%A3%E3%83%90%E5%AC%A2%E3%81%AE-%E5%84%84%E7%A8%BC%E3%81%90%E6%8A%80%E8%A1%93-%E5%B0%8F%E5%B7%9D-%E3%81%88%E3%82%8A/dp/4046041641/ref=pd_lpo_sbs_14_img_0?_encoding=UTF8&psc=1&refRID=ZJ9B63WG6SRN07APJ2SJ【エンリケ出演のおすすめ動画はこちら】https://www.youtube.com/watch?v=wl7vKo6PDkwhttps://www.youtube.com/watch?v=zuvfwdb6YCwhttps://www.youtube.com/watch?v=AnX7ZhtTdzohttps://www.youtube.com/watch?v=d23xXxQjirohttps://www.youtube.com/watch?v=1BzEhKyy81w#エンリケ#キャバ嬢#キャバクラ"
"y8h55zOf9m0","最強スマホ「Google Pixel4」はiPhoneを超えたのか？","2019-10-24T10:00:15.000Z","UC9WJo5ZJVXMZiA5XV2jLx5Q","吉田製作所","26","19.03.11","ジャンク|スマホ|スマートフォン|携帯|携帯電話|Pixel|純正|ガジェット|レビュー|商品紹介","664890","10126","1181","2099","https://i.ytimg.com/vi/y8h55zOf9m0/default.jpg","False","False","破産寸前詐欺師ヨシダヨシオさんは9万円でグーグル純正スマートフォンPixel4（ピクセルヨン）を買ってしまったので自慢しますiPhone11Proと比較してるかもしれません。◇Pixel4関連商品リンクhttps://amzn.to/33YTq29＝＝ヨシダグッズ＝＝グッズ販売https://yoshida-ss.booth.pm/LINEスタンプhttps://store.line.me/stickershop/product/7048464LINE着せ替えhttps://store.line.me/themeshop/product/1701a36f-fad9-4a0f-8aa6-ab31bc7699cc無料壁紙（PC・スマホ）https://netank.net/kabegami＝＝素材＝＝イラストは「あかね大佐」さんが生み出してます！https://twitter.com/Colonel_Akane＜＜幻のゲームチャンネル＞＞https://www.youtube.com/channel/UCEf87FzaACLkyaMSd3moQRw?view_as=subscriber＜＜伝説のサブチャンネル＞＞https://www.youtube.com/channel/UCLE2PTNDt--NLGLVbfOfHkQ?view_as=subscriber＜＜お問い合わせ＞＞企業案件、商品レビューのご依頼は全てお断りしてますメールフォーム（苦情専用）：https://netank.net/youtube-mツイッター：https://twitter.com/netatankアマゾンのリンクはアマゾンアソシエイトリンク、アフィリエイトリンクを使用しています"
"8u-_64S7plI","Selena Gomez - Look At Her Now (Official Music Video)","2019-10-24T04:00:01.000Z","UCjK8ORC71kwyj1DWFwril_A","SelenaGomezVEVO","10","19.03.11","selena Gomez|look at her now selena Gomez|look at her now|lose you to love me|selena|look at me now|selena Gomez lose you to love me|селена гомес|selena gómez|selena Gomez look at her now español|selena Gomez new song|look at her","63285135","2902445","100010","108459","https://i.ytimg.com/vi/8u-_64S7plI/default.jpg","False","False","Get ‘Look At Her Now,' out now: http://smarturl.it/LookAtHerNowGet ‘Lose You To Love Me’: http://smarturl.it/LoseYouToLoveMeListen On @applemusic #shotoniphoneDirected by Sophie MullerFollow Selena:Instagram: https://www.instagram.com/selenagomez/Twitter: https://twitter.com/selenagomezFacebook: https://www.facebook.com/SelenaYouTube: https://smarturl.it/SelenaYT Listen on Spotify: https://smarturl.it/SelenaGomezTheHitsSpListen on Apple Music: https://smarturl.it/SGEssentialsGet exclusive Selena Gomez merch, available at: http://smarturl.it/SelenaStoreSign-up to be the first to hear news from Selena: http://smarturl.it/SelenaGomez.NewsBest of Selena Gomez https://goo.gl/mgJg2sSelena Gomez Audio https://goo.gl/dmJYbdLYRICSThey fell in love one summerA little too wild for each othershiny till it wasn’tFeels good till it doesn’tIt was her first real loverHis too till he had anotherOh god when she found outTrust levels went way downOf course she was sadBut now she’s glad she dodged a bulletTook a few yearsto soak up the tearsBut look at her nowWatch her goMmm mmm mmmLook at her nowWatch her goMmm mmm mmmWowLook at her nowMmm mmm mmmLook at her nowWatch her goMmm mmm mmmWowLook at her nowFast nights that got himThat new life was his problemNot saying she was perfectStill regrets that momentLike that nightWasn’t wrong, wasn’t rightWhat a thing to be humanMade her more of womanOf course she was sadBut now she’s glad she dodged a bulletTook a few yearsto soak up the tearsBut look at her nowWatch her goMmm mmm mmmLook at her nowWatch her goMmm mmm mmmWowLook at her nowMmm mmm mmmLook at her nowWatch her goMmm mmm mmmWowLook at her nowShe knows she’ll find loveonly if she wants itShe knows she’ll find loveUhhShe knows she’ll find loveOnly if she wants itShe knows she’ll find loveOn the up from the way downLook at her nowWatch her goMmm mmmLook at her nowOhhhhhShe knows she’ll find loveOnly if she wants itShe knows she’ll find loveLook at her now yeahShe knows she’ll find love(She knows she will)Only if she wants itShe knows she’ll find loveWowLook at her now.Music video by Selena Gomez performing Look At Her Now. © 2019 Interscope Records"
"FQCBuPmkN8Y","【恥ずかしさ全開】負けたらヘリウムガスを吸って全力告白www","2019-10-24T10:10:48.000Z","UCjNrxV6lbQZHK8E5LfNHmUg","48-フォーエイト","24","19.03.11","フォーエイト|Tiktoker|告白|ヘリウム|恥ずかしい|全力告白","476874","12978","200","973","https://i.ytimg.com/vi/FQCBuPmkN8Y/default.jpg","False","False","【投稿日時: 毎日投稿 19:00チャンネル更新！！】チャンネル登録はこちら/Please Subscribe!!https://www.youtube.com/channel/UCjNrxV6lbQZHK8E5LfNHmUg Song: 007 James Bond - Eleven Music No CopyrightMusic provided by Eleven Music.Video Link: https://youtu.be/Zv-hLHFQSCU-SNS-【こたつ】■ Twitter ⇒ https://twitter.com/kotachumu ■ Instagram ⇒ http://Instagram.com/kotachumu ■ TikTok ⇒ http://vt.tiktok.com/JfekKn/ 【あみか】■ Twitter ⇒ https://twitter.com/amika429 ■ Instagram ⇒ http://Instagram.com/amika_tanaka0429■ TikTok ⇒ http://vt.tiktok.com/Jf19Q6【タロー社長】■ Twitter ⇒ https://twitter.com/torasann1998 ■ Instagram ⇒ http://Instagram.com/taroshechang ■ TikTok ⇒ http://vt.tiktok.com/Jf82em【永ennのアリス】■ Twitter ⇒ https://twitter.com/ennnnn_em ■ Instagram ⇒ http://Instagram.com/ennnnn_em ■ TikTok ⇒ http://vt.tiktok.com/Jfj2vL/ 【音羽】■ Twitter ⇒ https://twitter.com/otoha_danso ■ Instagram ⇒ http://Instagram.com/_.otoha._■ TikTok ⇒ http://vt.tiktok.com/t8Ltq/ 【ゑむ氏。】■ Twitter ⇒ https://twitter.com/Mk0104Sig ■ Instagram ⇒ http://Instagram.com/mk0607mg ■ TikTok ⇒ http://vt.tiktok.com/JfdgAY/ 【わかゔぁ】■ Twitter ⇒ https://twitter.com/wakavaa3150 ■ Instagram ⇒ http://Instagram.com/wakavaaa3150 ■ TikTok ⇒ http://vt.tiktok.com/Jfed2d/【アマリザ】■ Twitter ⇒ https://twitter.com/kotachum■ Instagram ⇒ http://Instagram.com/amariza4 ■ TikTok ⇒ http://vt.tiktok.com/JfAPWe/お問い合わせのメールアドレスinfo@48studio.jp#フォーエイト #ヘリウム #告白"
