video_id,title,publishedAt,channelId,channelTitle,categoryId,trending_date,tags,view_count,likes,dislikes,comment_count,thumbnail_link,comments_disabled,ratings_disabled,description
"Tjj5599Dl4E","Corrida das Blogueiras 2ª Temporada: QUARTO DE BLOGUEIRA - Episódio #07","2019-11-26T23:00:12.000Z","UCMpWpGXG8tlWA6Xban2m6oA","Diva Depressão","24","19.01.12","corrida das blogueiras|diva depressão|estreia corrida das blogueiras|andressah catty|vini freire|Ego Oliver|Juliana Haendchen|Kenya Borges|Lea Muller|Palloma Tamirys|Tabatha Cuzziol|lorelay fox|maira medeiros|corrida das blogueiras segunda temporada|quarto de blogueira|hugo gloss|blogueira de baixa renda|leroy merlin|Matheus Ilt|decoração|final da corrida das blogueiras|votação corrida das blogueiras|finalistas corrida das blogueiras|EXTREME MAKEOVER","445369","60444","619","12772","https://i.ytimg.com/vi/Tjj5599Dl4E/default.jpg","False","False","A Corrida das Blogueiras chegou à reta final! Estamos no sétimo episódio, o último antes da final ao vivo, que vai ser exibida na próxima terça-feira, 3 de dezembro, aqui no canal Diva Depressão!VOTAÇÃO FINAL: https://www.corridadasblogueiras.com/ No episódio de hoje vamos saber quem são as duas finalistas! Depois, as nossas blogueiras vão ter que, literalmente, correr para mostrar que são mestres em decoração na prova EXTREME MAKEOVER QUARTO DE BLOGUEIRA TUTUPOM, da Dona Leroy Merlin.SIGAM AS PARTICIPANTES:- Kenya Borges – @kenyaborgess – https://www.youtube.com/channel/UCqfBRC1XCGIsrpt5WvusagA- Palloma Tamirys – @pallomatamirys – https://www.youtube.com/user/Pallomasousa94- Tabatha Cuzziol – @tabathacuzziol –  https://www.youtube.com/user/TheTabathacuzziol - Andressah Catty - @andressahcatty – https://www.youtube.com/channel/UCf1Oha4gDumlb8-ysYJy4MA- Lea Muller – @leamulleer – https://www.youtube.com/channel/UCoPUq-yo4Cful6oHH9T6_4g- Juliana Haendchen – @juhaendchen –https://www.youtube.com/channel/UCxdSgo0TDYsVRc1KWRnQU2A- Vini Freire – @vinifreire – https://www.youtube.com/user/vinciusfreire- Ego Oliver – @egooliver – https://www.youtube.com/user/eltongabriel081089INSCREVA-SE em nosso canal: https://goo.gl/I2K4U6SIGAM A CONTA OFICIAL DO CORRIDA DAS BLOGUEIRAS, NO INSTAGRAM:https://www.instagram.com/corridadasblogueiras.oficial/NOS SIGA NAS OUTRAS REDES:- https://www.instagram.com/DivaDepressao/- https://twitter.com/DivaDepressao- https://www.facebook.com/DivaDepressao/?ref=br_rs#CorridaDasBlogueiras #FinalistasCorridadasBlogueiras"
"hujPJDPz4LQ","Vitão - 7 Chamadas (Live) | Vevo DSCVR Artists to Watch 2020 ft. Feid","2019-11-26T17:00:11.000Z","UC-7BJPPk_oQGTED1XQA_DTw","Vevo DSCVR","10","19.01.12","Vitão|Feid|Chamadas|Universal|Music|International|Ltda.|Urban|Brazil|Brazilian Music|Brazilian Rap|Vitão Live|Latin Music|Latin Music Live|Come To Brazil|DSCVR|DSCVR Artists To Watch|Que-quero namorar Quero namorar|yeah Oh Já|passaram|vários|dias Nem|sabia|se|tu|vinha Sete|chamadas|perdidas Mil|mensagens|com meu nome Longe|do|que eu|esperava Longe|que|eu|pretendia Com o|tempo|me|lembrava E|você","354808","27135","212","701","https://i.ytimg.com/vi/hujPJDPz4LQ/default.jpg","False","False","Vitão, Feid - 7 Chamadas - an exclusive live performance for Vevo DSCVR ARTISTS TO WATCH 2020, an annual series highlighting those that are shaping the future of music.Scroll through Vitão’s Instagram account and you’ll see a rising star having the time of his life. With his long brown hair, leopard print jackets and bare chest, he’s a sexy stage performer, gleeful traveler, and proud collaborator, touting individual collabs with fellow Brazilian talents Luccas, Rael, and Aniita. He shares a packed November tour schedule, dances alone in Times Square during a late-night tourist lull, and stands tall in a collage of our DSCVR Artists To Watch 2020 squad. It’s a busy life on the way up. The 20-year-old singer initially tested his skills like many pop aspirants do: using cover tunes on YouTube as a way of getting a foothold in the business. It worked, and it wasn’t long before he offered fans his own personal music. Summer 2018 saw the arrival of  Tá Foda,” his first track of his own music. A string of singles followed, and Vitão’s name recognition bolstered with each new wave: media buzz, a new EP featuring the song Café,” and the “Complicado” collab with Aniita. When superstar Brazilian footballer Neymar shared a clip of himself singing a Vitão song on social media, the Sao Paulo native leveled-up yet again. He says hearing classical music in utero while his mom was pregnant somehow informed the way he hears music, and professes a mix of everyone from Marvin Gaye to Caetano Veloso as influences. Hip-hop definitely guides his approach, but in conversation Vitão makes it clear that he’s not a rapper. That said, you’ll see plenty of other skills and experience when you roll through his Artists To Watch performances of “7 Chamadas” (accompanied by Colombian reggaetonero Feid) and Café.” And we bet you’ll be following him on the ‘Gram from now on, too. Watch more live performances from DSCVR ATW 2020: https://bit.ly/34mNoJ0 Watch music videos from Vitão: https://bit.ly/36bi6qh Follow Vitão:Facebook: https://www.facebook.com/vitaomusic/Instagram: https://www.instagram.com/vitao/Twitter: https://twitter.com/vitao Follow Vevo:Find us on Facebook: http://www.facebook.com/VEVOFollow us on Twitter: http://www.twitter.com/VEVOFollow us on Instagram: http://instagram.com/vevoExecutive Producer: Micah BickhamDirector: Priya MinhasProducer: Sacha NoelleProducer: Madeline SchmidtDirector of Photography: Janssen PowersEditor: Kevin RoseMusic & Talent: Parul Chokshi & Pattricia Britto#DSCVRATW2020 #Vitão #VitãoLive #7Chamadas #CaféMusic video by Vitão, Feid performing 7 Chamadas. © 2019 Head Media / Universal Music Internationalhttp://vevo.ly/H0I1nJ"
"kZ5P3fMysQ8","QUE TORCIDA É ESSA 50 MIL SÓCIOS | ALAN KARDEC NO VASCO | CIRURGIA DE LUXA UM SUCESSO | CASTAN FORA","2019-11-27T13:07:59.000Z","UCZ90RqFLhuwCtxKnTZbuNJg","FUTBOLAÇO_VASCO","17","19.01.12","vasco|vasco da gama|vascao|#vasco|vasco tv|mario coelho|mario coelho vasco|atencao vascainos|noticias do vasco|dieguinho|machao da gama|sobre vasco|mineiro vascaino|vasco hoje|ultimas novidades do vasco|noticias do vasco hoje","52657","10032","126","1665","https://i.ytimg.com/vi/kZ5P3fMysQ8/default.jpg","False","False","QUE TORCIDA É ESSA 50 MIL SÓCIOS | ALAN KARDEC NO VASCO | CIRURGIA DE LUXA UM SUCESSO | CASTAN FORA#VASCO #NOTICIASDOVASCO #ASSOCIAVASCOURGENTE |ESTAMOS LUTANDO PRA FAZER HISTÓRIA !DAQUI A 20 ANOS VÃO TER QUE FALAR DA GENTE #MUDAVASCO#VASCO #NOTICIASDOVASCO #ASSOCIAVASCO● Últimas Notícias, Informações e Novidades Sobre o Vasco da Gama é aqui no Futbolaço Vasco. Cola aqui com o Dieguinho que a resenha é a certa. 1,2,3 Futbolaço—Redes socias● INSTAGRAM DO CANAL:https://www.instagram.com/futbolaco_vasco/● INSTAGRAM DIEGUINHO:https://www.instagram.com/diegolopes10/●AJUDE NO CT DO VASCO:https://www.kickante.com.br/Vasco● VAQUINHA ONLINE PRO VASCO DIVIDA ZERO: https://www.vakinha.com.br/vaquinha/v... ● SE TORNE SOCIO TORCEDOR https://prod.sociogigante.com/planos●  VIRE SÓCIO TORCEDOR DO VASCO:https://sociogigante.com/Email Comercial do Canal : futebolaco2019@gmail.com"
"rLMaxkdwpzA","FIZEMOS SORVETE PELA PRIMEIRA VEZ NA NOVA MAQUINA ‹ PORTUGAPC ›","2019-11-26T15:00:26.000Z","UCHj8toxy4Ka53hjcRUs6caw","PortugaPC","20","19.01.12","Portugapc|Minecraft|Portuga|Luiz|Fernando|minecraft|mods|portugapc|juaum|sorvete|fizemos|maquina|Neox|Eagle|Jaum|Joao|Jao|Joaum|JuaumL|irmão do ppc|NeoxGamer_|Igou e Neox|Neox e Eagle|Igor''|desafio|Eagle_Gamer|Nigol Games|Canal em Dupla|Nigou Games|Igou","766685","66541","1325","1277","https://i.ytimg.com/vi/rLMaxkdwpzA/default.jpg","False","False","Gostou do video?? Então já sabe, se inscreva!LOJA DO CANAL : https://www.pcclothing.com.br/LOJA NO MERCADO LIVRE: https://lista.mercadolivre.com.br/_CustId_449554724CANAL DE GAMES: https://goo.gl/MPcdNVMEU COMPUTADOR CHIPART: https://goo.gl/OwoH1UCANAL DA CHIPART: https://goo.gl/TI90djQuer me mandar algum presentinho ( Desenho, Cartinha, Comida kk ) Eu tenho uma caixa Postal !CAIXA POSTAL: 8503CEP: 86015-981Londrina - PR►BATALHA DE BOSS : https://goo.gl/bgHvH1►Redes Sociais:►Instagram : http://instagram.com/portugapc/►Twitter : https://twitter.com/PortugaPC►Facebook : https://www.facebook.com/Portugapc►Página Oficial : http://goo.gl/4ioQdK►Contato Profissional : portuga.contato@hotmail.comTa em Shock, Parça ???Music by Epidemic Sound (http://www.epidemicsound.com)"
"O-LOG-Dznws","FALANDO O QUE PENSA - PARAFUSO SOLTO","2019-11-26T13:00:03.000Z","UC5DZBjR6W561Txc_vrRWTow","Familia Parafuso Solto","24","19.01.12","marquinho|parafuso|solto|humor|comedia|comedy|piada|entretenimento|engraçado|casamento|relacionamento|casal","522083","29593","1935","0","https://i.ytimg.com/vi/O-LOG-Dznws/default.jpg","True","False","Imagina se você realmente falasse tudo o que pensa para o seu marido/esposa. Acho que o relacionamento não ia muito longe. rss.. Confira o vídeo e veja se concorda.Elenco: Marquinho e AlineNão esqueça de inscrever, ativar o sininho e deixar o like.Postamos vídeos toda Terça feira as 10h da manhã."
"B9sd9LgkskM","6 FILMES QUE A HUMANIDADE É A VILÃ!","2019-11-26T21:27:07.000Z","UCBFLqK7PAP9DQ3JpIrWFI7w","Pipocando","24","19.01.12","pipocando|rolandinho|bruno bock|cinema|séries|filmes|melhores filmes|piores filmes|cenas|listas|curiosidades|humor|FILMES QUE A HUMANIDADE É A VILÃ|humanidade vilã|vilã|vilania|humanidade|filmes que a humanidade|humanidade nos filmes|filmes de vilã|distrito 9|avatar|é a vilã","279063","38005","301","891","https://i.ytimg.com/vi/B9sd9LgkskM/default.jpg","False","False","A Black Friday da Fini chegou com tudo! Os descontos são válidos para uma única compra de produtos FINI, por CPF, exclusivamente no site http://www.finistore.com.brNem sempre os humanos fazem papel de bonzinhos nas histórias. Vem conferir o que a gente tem a dizer sobre Distrito 9, Avatar e outros FILMES EM QUE A HUMANIDADE É A VILÃ!------------------------------------------------------------------------------------Inscreva-se no canal: http://bit.ly/1T6Yve4Assista outras curiosidades: http://bit.ly/1e3e5r5Fanpage: https://www.facebook.com/pipocandooficial----------- ENCONTRE A GENTE POR AÍ ----------//ROLANDINHOhttp://twitter.com/rolandinhohttp://instagram.com/rolandinhobr//BRUNO BOCKhttp://twitter.com/delongashttp://instagram.com/brunobock"
"bcfSDdMoMgA","A COBERTURA DO AMAs 2019 TÁ DIFERENTE | #ParódiasTNT","2019-11-26T19:17:39.000Z","UC5sIFumaA1rM1FdTvxURb4g","TNT Brasil","24","19.01.12","tnt brasil|canal tnt|rede tnt|american music awards|paródia|selena gomez|shawmila|taylor swift|senorita|living proof|taylor decade|post malone|billie|billie eilish|no|american|music|awards|performance|camila cabello|shawn mendes|ozzy|kesha|ciara|amas|amas 2019|lil nas x|old town road|clipe do ano|parodias tnt|tretas tnt","127893","23460","91","1208","https://i.ytimg.com/vi/bcfSDdMoMgA/default.jpg","False","False","Emocionante. A cobertura do American Music Awards de um jeito que você nunca viu._Inscreva-se no canal: http://bit.ly/canaltntbrasilSEGUNDAS (QUINZENAL): ORIGINAL VS. REMAKE TERÇAS (QUINZENAL): QUIRK TNT TERÇAS (QUINZENAL): POP BOX TNT QUARTAS (SEMANAL) TÁ PAGO TNT QUINTAS (QUINZENAL): TRETAS TNT QUINTAS (QUINZENAL): PARÓDIAS TNT COM DIOGO PARÓDIASAcompanhe a TNT nas redes:Facebook: https://www.facebook.com/tntbrTwitter: https://twitter.com/tntbrInstagram: https://www.instagram.com/tntbr"
"nvQvVd-bQPI","Clash on Ice (Clash of Clans Official)","2019-11-26T09:11:23.000Z","UCD1Em4q90ZUK2R5HKesszJg","Clash of Clans","20","19.01.12","clash of clans|COC|Clash of Clans Gameplay|Clash of Clans Strategy|Clash of Clans Animation|Clash of Clans Commercial|Clash of Clans Attacks|Clash of Clans Town Hall|Hog Rider|PEKKA|Clan Wars|clash on ice|town hall 13|clash of clans new update|clash of clans december update|winter jam","16785314","243718","10101","7381","https://i.ytimg.com/vi/nvQvVd-bQPI/default.jpg","False","False","It's Winter Jam Season! Enjoy 50% upgrade cost reduction for all Home Village buildings (includes Gear Ups), Traps and Walls - for a limited time only! Go all out in this Season of Upgrades! Follow us on our Socials!Twitter ► https://twitter.com/ClashofClans/Instagram ►https://www.instagram.com/clashofclans Facebook ►https://www.facebook.com/ClashofClans Attack. Defend. Strategize. Download for free for mobile devices. http://supr.cl/ThisArmyFrom rage-­filled Barbarians with glorious mustaches to pyromaniac wizards, raise your own army and lead your clan to victory! Build your village to fend off raiders, battle against millions of players worldwide, and forge a powerful clan with others to destroy enemy clans.PLEASE NOTE! Clash of Clans is free to download and play, however some game items can also be purchased for real money Also, under our Terms of Service and Privacy Policy, you must be at least 13 years of age to play or download Clash of Clans.A network connection is also required.FEATURES- Build your village into an unbeatable fortress - Raise your own army of Barbarians, Archers, Hog Riders, Wizards, Dragons and other mighty fighters- Battle with players worldwide and take their Trophies- Join together with other players to form the ultimate Clan- Fight against rival Clans in epic Clan Wars - Build 18 unique units with multiple levels of upgrades- Discover your favorite attacking army from countless combinations of troops, spells, Heroes and Clan reinforcements - Defend your village with a multitude of Cannons, Towers, Mortars, Bombs, Traps and Walls- Fight against the Goblin King in a campaign through the realmChief, are you having problems? Visit http://supercell.helpshift.com/a/clas...Privacy Policy:http://www.supercell.net/privacy-policy/Terms of Service:http://www.supercell.net/terms-of-ser...Parent’s Guide:http://www.supercell.net/parents#clashofclans #winterjam"
"Z5ilhjM8mis","JayA Luuck - Glances [ Rap Box Ep. 157 ]","2019-11-26T15:57:47.000Z","UCS7mVK5en3RJ0PTbJiKXmzQ","Rap Box","10","19.01.12","jaya luuck|canal do dimas|batalha de rap krawk|canal do dimas jaya|batalha da aldeia|batalha de rap|batalha de rima|duelo de mcs|trap|rap brasil|rap brasileiro|dudu|noventa|noventa vs jaya|noventa vs dudu|jayA|kevin o chris|JayA Luuck - Glances [ Rap Box Ep. 157 ]|batalha de rap bmo|duelo de mcs nacional|rap brasil 2019|jhony mc|yunk vino|bc raff|filipe ret|pineapple perfil|jaya perfil|xama|haikaiss|costa gold|rap box|rap box jaya","235041","37999","973","1671","https://i.ytimg.com/vi/Z5ilhjM8mis/default.jpg","False","False","Representante do rap Bahia, JayA Luuck se destacou pelo flow diferenciado nas batalhas de improviso.INSCREVA- SE: https://goo.gl/aTaaDPProd. Leo Ost @leonardoostJayA Luuck - Glances [ Rap Box Ep. 157 ]Direção: Léo Casa1 - @leocasa1 Imagens: Diego EugênioPós-produção: Diego EugênioCONTATO: rapbox@casa1.com.br LOJA: http://www.rapbox.com.brNossas redes: http://www.facebook.com/rapboxoficialhttp://www.instagram.com/rapboxoficialhttp://www.instagram.com/leocasa1http://www.facebook.com/leocasa1oficialGravação, Mixagem e Masterização CASA1 ESTÚDIOS. Fonograma exclusivo ®RAPBOX.Conteúdo exclusivo RAPBOX / CASA1 RECORDS.Realização e produção: CASA1 /2019 ®Todos direitos reservados#jayaluuck #rapbox"
"YCLB1bSe_Sk","PÃO DOCE DE JURUPINGA - UMA DELÍCIA SEM IGUAL","2019-11-27T10:00:11.000Z","UCfrpgW6wypbf7O0Mk8Idq6A","Culinária em Casa","26","19.01.12","receitas rapidas|fácil|como fazer|culinária|simples|receita caseira|pao caseiro doce|pao caseiro recheado|pão caseiro fofinho|pao caseiro facil|pão caseiro simples|pão caseiro bem fofinho|Pão Caseiro da Lu|Luluca|Resendiível|Winderson Nunes|Lucas Neto|Felipe Neto|Invento na Hora|INCRÍVEL|Você Sábia? Ei Nerd|Coisa de Nerd","51835","7726","97","241","https://i.ytimg.com/vi/YCLB1bSe_Sk/default.jpg","False","False","jurupinga 👇https://www.jurupinga.com.br/home/PÃO DOCE DE JURUPINGA - UMA DELÍCIA SEM IGUAL INGREDIENTES:MASSA:650g de farinha de trigo20g de fermento biológico2 ovos4 col. (sopa) de açúcar2 col. (sopa) de manteiga½ col. (chá) de sal100ml de Jurupinga250ml de leiteRECHEIO:½ litro de leite2 gemas4 col. (sopa) de amido de milho1 col. (sob) de essência de baunilha200ml de leite condensado1 xícara de açúcar de confeitero200ml de leite de cocoCereja a gosto1 FORMA GRANDE UNTADA COM MANTEIGA E É FARINHA DE TRIGO NOSSA LOJA :http://bit.ly/Loja-Culinária-em-CasaClique aqui e adquira o porta temperoshttp://bit.ly/O-porta-temperos(11) 97427-8536Link do CANAL da minha filha DIÁRIO DA KIARA AQUI 👉http://bit.ly/Canal-da-KiaraMeu novo canal com receitas em 1 minuto!! Venha se inscrever e conhecer meu novo trabalho AQUI 👇http://bit.ly/novo-canal-da-luContato Profissional: culinariaemcasaoficial@gmail.comINSCREVA-SE  Culinária em CasaRedes SociaisFacebook: https://goo.gl/6K8jnSInstagram: https://goo.gl/mVRv4vhttps://lucianamirihad.blogspot.com#CulináriaemCasa"
"SQpbk14iDWg","7 Chamadas","2019-11-26T03:00:46.000Z","UCxni8nNBem83pC-jX6xgd0g","Vitão - Topic","10","19.01.12","Vitão|Feid|7 Chamadas","370530","27825","177","792","https://i.ytimg.com/vi/SQpbk14iDWg/default.jpg","False","False","Provided to YouTube by Universal Music Group7 Chamadas · Vitão · Feid7 Chamadas℗ 2019 Head Media / Universal Music InternationalReleased on: 2019-11-26Producer: Los BrasilerosAssociated  Performer, Vocalist: VitãoAssociated  Performer, Vocalist: FeidComposer  Lyricist: FeidComposer  Lyricist: Los BrasilerosComposer  Lyricist: VitãoComposer  Lyricist: MostyComposer  Lyricist: RoloAuto-generated by YouTube."
"sHXmzkr0FaU","NÃO VÃO NOS CALAR...","2019-11-26T23:23:10.000Z","UC0GUaQ6lVzvu0FWklbsKFhg","BAROLO VÍDEOS","17","19.01.12","#spfc|#tricolor|#foraleco|#saopaulo|#morumbi|#blogdobarolo|#barolo|#futebol|#tricolordomorumbi","129344","19993","160","2253","https://i.ytimg.com/vi/sHXmzkr0FaU/default.jpg","False","False","RESENHA TRICOLOR:https://www.youtube.com/watch?v=HLrn-d3SeKUCANAL BOTEKO DO BAROLO - CONFIRA!https://www.youtube.com/channel/UCukVuQspRmzLqHk-7lxltUQCAMISAS DO TRICOLOR NA FUTFANATICS: http://bit.ly/2JT8O8ECONTATO: rbarolo@hotmail.comSiga nas redes sociais:Insta: barolovideosFace: blogobarolo e barolovideosQESTILOSFacebook:CellosOficialQestilosInstagram:QestilosOficialCellosOficialSites:www.usecellos.com.brwww.qestilos.com.br"
"m-YQdgQO4kQ","Thayse e Phavanello discutem: 'Você é falsa' | A Fazenda","2019-11-26T13:09:05.000Z","UCw4YGFtvDgOL09KrFpqj6kg","A Fazenda","22","19.01.12","acelere|aclr|a fazenda|vem aí a fazenda|fazenda talks|marcos mion|rodrigo carelli|lucas salles|multiplataforma|reality show|record tv|peões|roça|prova do fazendeiro|poder da chama|prova de fogo|Andréa Nóbrega|Aricia Silva|Bifão|Diego Grossi|Drika Marinho|Guilherme Leão|Hari Almeida|Lucas Viana|Netto|Phellipe Haagensen|Rodrigo Phavanello|Sabrina Paiva|Tati Dias|Thayse Teixeira|Túlio Maravilha","458061","15865","652","7410","https://i.ytimg.com/vi/m-YQdgQO4kQ/default.jpg","False","False","Após gerar nova punição, Thayse e Phavanello discutiram. O peão comentou que a hora se perde, mas a educação não. Ele ainda reforçou que Thayse se acha dona da razão e não dá o braço a torcer. Você é falsa, resumiu o ator.Inscreva-se no canal A Fazenda: http://r7.com/8IZb Site oficial: https://afazenda.r7.com/a-fazenda-11Assista às íntegras no PlayPlus: https://www.playplus.comFacebook: https://www.facebook.com/AFazendaRecordInstagram: https://www.instagram.com/afazendarecordTwitter: https://twitter.com/afazendarecord#AFazenda #MarcosMion"
"6JDaygqls3k","Simone & Simaria - Amor que Dói #vctemvoz","2019-11-25T19:00:00.000Z","UCSriAVggapS9Fb43fRB2vyQ","Simone e Simaria","10","19.01.12","simone|simaria|simone e simaria|amor que doi|minha voz|Amor|Paixão|Simone|Simaria|Relacionamento|Coleguinhas|Miguiles|Lançamento|Música|Clipe|Videoclipe|Sertanejo|Dupla Sertaneja|Violência|Abuso|Agressão|#vctemvoz|Maria da Penha|Mulher|Denúncia|Simone & Simaria|Simone e Simária|clipe oficial","1710568","171249","2271","6686","https://i.ytimg.com/vi/6JDaygqls3k/default.jpg","False","False","http://www.simoneesimaria.com.brhttp://www.facebook.com/simoneesimariahttp://www.instagram.com/simoneesimariahttp://www.twitter.com/simoneesimariaEste clipe faz parte de uma campanha do Governo Federal com a participação da dupla Simone & Simaria, para conscientizar as mulheres sobre a importância de usar a voz como forma de protesto para denunciar atos de violência e também divulgar o canal de denúncia, o Ligue 180.Depois de lançarem um videoclipe em que não era possível escutar a dupla cantando, as artistas aparecem agora na versão completa, usando suas vozes para falar ao Brasil todo sobre como é importante denunciar a violência contra a mulher. Seja ela física, psicológica, moral, sexual, patrimonial ou econômica, toda e qualquer violência contra a mulher deve ser repudiada. Para denunciar relacionamentos abusivos, use o canal de denúncias: o Ligue 180. As denúncias são anônimas e o canal funciona 24 horas – incluindo fins de semana e feriados. O atendimento é sempre feito por mulheres. Sigilo garantido.Faça parte desse movimento. Use a #vctemvozEm caso de abuso, denuncie. Ligue 180."
"a2fdBBrh1-s","TEM A VER COM O VÍDEO ISSO?","2019-11-26T13:00:00.000Z","UCbE7YGLZ-VY0oCgIsCSJ5Sg","JoutJout Prazer","22","19.01.12","jout|prazer|vlogger|brasil|instagram|facebook|responsabilidade virtual|saúde virtual","167423","22157","224","927","https://i.ytimg.com/vi/a2fdBBrh1-s/default.jpg","False","False","sobre responsabilidade dentro das redesvamos nos amar virtualmente:https://www.facebook.com/prazerjoutjouthttp://instagram.com/joutjouthttp://twitter.com/joutfuckinjoutpra me mandar um emailzim:joutjoutprazer@gmail.comTrilha Original por Rodrigo Martins."
