video_id,title,publishedAt,channelId,channelTitle,categoryId,trending_date,tags,view_count,likes,dislikes,comment_count,thumbnail_link,comments_disabled,ratings_disabled,description
"L2FzD6E91XM","So we have an airbag lander. Now what?!","2019-11-01T14:00:08.000Z","UCu8YylsPiu9XfaQC74Hr_Gw","Seth's Bike Hacks","22","19.03.11","mtb|mountain bike|bike repair|biking|bike riding|bike tricks|bike trials","537832","24397","223","1282","https://i.ytimg.com/vi/L2FzD6E91XM/default.jpg","False","False","In the last video I mentioned that this airbag is a tool for learning tricks, and that's exactly what we're going to do.  Today, we introduce my new dirt-jump bike, and Eric Porter attempts to teach me no-handers. Enjoy!The last video https://youtu.be/71x-LmfWtaAEric's behind the scenes video https://youtu.be/5nYuXxSoMFwMy airbag is the Nextstep Lander by DD Airbags. I haven't used it long enough to say whether it's durable, reliable, etc. yet. Once I've used it for a little bit I'll review it. So far, so good! https://www.ddairbags.com/nextsteplanderBerm Peak Playlist https://bit.ly/2jXkMEqBerm Creek Playlist https://bit.ly/2lzA56OAll music in this video is from http://share.epidemicsound.com/trQSg#DIY #mountainbikingI'm also working on a long-term moonshot project: Building a free public bike park in the Asheville metro area. Join my Patreon and 100% of the proceeds go towards funding this. https://www.patreon.com/sethsbikehacksAdvertising disclosure: All of these videos contain products, logos, or mentions associated with Diamondback Bicycles, Box Components, and Slime Sealant. Whether or not the video itself was sponsored by any of these companies, they do support this channel, and by extension, every video on it."
"YbZmhgtZkdg","Nick Offerman Gets the Job Done While Eating Spicy Wings | Hot Ones","2019-10-31T15:00:05.000Z","UCPD_bxCRGpmmeQcbe2kpPaA","First We Feast","26","19.03.11","First we feast|fwf|firstwefeast|food|food porn|cook|cooking|chef|kitchen|recipe|cocktail|bartender|craft beer|complex|complex media|Cook (Profession)sean evans|hot ones|hot ones nick offerman|nick offerman spicy wings|nick offerman hot sauce|sean evans|nick offerman sean evans|hot ones hot sauce|the last dab|hot wing challenge|food challenge|spicy wings|ron swanson","2480125","82924","1046","7897","https://i.ytimg.com/vi/YbZmhgtZkdg/default.jpg","False","False","Nick Offerman is an actor and comedian best known his role as the revered Ron Swanson on Parks & Recreation. He's also a New York Times best-selling author, and you can catch him live on the All Rise Tour—visit https://www.OffermanWoodShop.com for more information. But how is he with spicy food? Find out as Offerman puts his silver tongue to the test against the wings of death, battling the sauces while he breaks down his love affair with white oak, explores modern masculinity, and responds to some of the internet's favorite Ron Swanson-isms.BUY THE CLASSIC HOT ONES HOT SAUCE NOW: https://bit.ly/2Q1VfIhBUY LOS CALIENTES HOT SAUCE NOW: https://bit.ly/2LMDxqSNEW HOT ONES MERCH AVAILABLE NOW: https://bit.ly/2AIS271SIGN UP for the Hot Ones Monthly Hot Sauce Subscription box: https://bit.ly/2veY50PBUY THE LAST DAB XXX NOW: https://heatonist.com/products/hot-ones-the-last-dab?variant=378416136201Subscribe to First We Feast on YouTube: http://goo.gl/UxFzhKCheck out more of First We Feast here:http://firstwefeast.com/https://twitter.com/firstwefeasthttps://www.facebook.com/FirstWeFeasthttp://instagram.com/firstwefeastFirst We Feast videos offer an iconoclastic view into the culinary world, taking you behind-the-scenes with some of the country's best chefs and finding the unexpected places where food and pop culture intersect."
"uBNFgU4sfP4","i'm going back to NYC.","2019-10-31T22:03:50.000Z","UCtinbF-Q-fVthA0qrFQTgXQ","CaseyNeistat","22","19.03.11","neistat|nyc|la|los angeles|studio|hotel|vpn|consumer vpn|connection|vpn for travel|vpn client","1553231","72830","3279","5315","https://i.ytimg.com/vi/uBNFgU4sfP4/default.jpg","False","False","Go to https://NordVPN.com/casey to get 70% off a 3 year plan and use code CASEY for an additional month free.  thank you NOrd for sponsoring my channel.check out  DYALLA (she's a music genius, pls show her some love) https://www.youtube.com/channel/UCs5ib8kDfUmFBrL1BiEivEA"
"ISKlbc9fhTs","FINDING A HALLOWEEN COSTUME IN 24 HOURS","2019-10-31T20:00:13.000Z","UC78cxCAcp7JfQPgKxYdyGrg","emma chamberlain","24","19.03.11","emma chamberlain|emma chambie|vlog|halloween|costume|costume ideas|finding a halloween costume","2628336","137565","2247","4918","https://i.ytimg.com/vi/ISKlbc9fhTs/default.jpg","False","False","i tried lol✩ MY PODCAST ✩✭ listen on SPOTIFY: https://bit.ly/StupidGeniusShow✭ listen on APPLE PODCASTS: https://bit.ly/StupidGeniusPod✭ or just search Stupid Genius on spotify, apple podcasts, or wherever else you get your podcasts...✭ podcast merch NOW AVAILABLE: https://shopemmachamberlain.com/products/stupid_genius_podcast_hoodie✩ MERCH ✩✭  https://shopemmachamberlain.com✩ MY SOCIAL MEDIA ✩✭ instagram: https://www.instagram.com/emmachamberlain✭ twitter: https://twitter.com/emmachamberlain✭ snapchat: https://www.snapchat.com/emmachambie✭ spotify: http://open.spotify.com/user/emmachambie ✭ tik tok (lol): emmachambieI LUV U,-emma chamberlain"
"I6B0NzrSDs8","Top GOP lawmakers speak after House passes impeachment inquiry resolution","2019-10-31T16:51:41.000Z","UCXIJgqnII2ZOINSWNOGFThA","Fox News","25","19.03.11","Fox News Channel|FNC|Fox News|News|Top stories|Kevin McCarthy|Rep McCarthy|Rep Kevin McCarthy|GOP leaders|Republican leaders|GOP presser live|Kevin McCarthy live|house minority leader|house republicans|live press conference|congress live|congress|impeachment|whistleblower|ukraine|zelensky|trump zelensky|biden|joe biden|biden ukraine|impeachment inquiry|trump|trump news|trump impeachment|pelosi|nancy pelosi|house democrats|house dems|democrats","1247193","27028","5118","14496","https://i.ytimg.com/vi/I6B0NzrSDs8/default.jpg","False","False","Leader Kevin McCarthy and top House Republicans hold a press conference following the House vote on the impeachment inquiry. #FoxNewsFOX News operates the FOX News Channel (FNC), FOX Business Network (FBN), FOX News Radio, FOX News Headlines 24/7, FOXNews.com and the direct-to-consumer streaming service, FOX Nation. FOX News also produces FOX News Sunday on FOX Broadcasting Company and FOX News Edge. A top five-cable network, FNC has been the most watched news channel in the country for 17 consecutive years. According to a 2018 Research Intelligencer study by Brand Keys, FOX News ranks as the second most trusted television brand in the country. Additionally, a Suffolk University/USA Today survey states Fox News is the most trusted source for television news or commentary in the country, while a 2017 Gallup/Knight Foundation survey found that among Americans who could name an objective news source, FOX News is the top-cited outlet. FNC is available in nearly 90 million homes and dominates the cable news landscape while routinely notching the top ten programs in the genre. Subscribe to Fox News!  https://bit.ly/2vBUvASWatch more Fox News Video: http://video.foxnews.comWatch Fox News Channel Live: http://www.foxnewsgo.com/Watch full episodes of your favorite showsThe Five: http://video.foxnews.com/playlist/longform-the-five/Special Report with Bret Baier: http://video.foxnews.com/playlist/longform-special-report/The Story with Martha Maccallum: http://video.foxnews.com/playlist/longform-the-story-with-martha-maccallum/Tucker Carlson Tonight: http://video.foxnews.com/playlist/longform-tucker-carlson-tonight/Hannity:  http://video.foxnews.com/playlist/longform-hannity/The Ingraham Angle: http://video.foxnews.com/playlist/longform-the-ingraham-angle/Fox News @ Night: http://video.foxnews.com/playlist/longform-fox-news-night/ Follow Fox News on Facebook: https://www.facebook.com/FoxNews/Follow Fox News on Twitter: https://twitter.com/FoxNews/Follow Fox News on Instagram: https://www.instagram.com/foxnews/om/"
"hnwwvNrhHlU","Making My Eyes Into Mouths So You Don't Have To...","2019-10-31T22:04:15.000Z","UCfBpv6ahDMg7kEClQuMpzzw","Gabbie Hanna","26","19.03.11","gabbie hanna|fx|makeup|effects|sfx|mykie|boyfriend|glam|tati|jeffree|star|shane|docuseries|documentary|tutorial|halloween|eyes|mouth|teeth|spirit gum|how-to|hair|james charles|patrick star","582753","31532","1208","3007","https://i.ytimg.com/vi/hnwwvNrhHlU/default.jpg","False","False","You're welcome for this EYE-conic video.GET 2WAYMIRROR!! https://ffm.to/2WAYMIRROR🔔SUBSCRIBE & TURN ON MY NOTIFICATIONS🔔I MANAGED TO FIND THE OP! https://www.instagram.com/roligore/?hl=enCLEANING MY CARPET LOL https://www.youtube.com/watch?v=D-n1xKIFAks&t=915sCANDY CORN ON THE COB! https://www.youtube.com/watch?v=8EgNNNRHKv0OLD MYSPACE PICS! https://www.youtube.com/watch?v=WMosPBa7iA4&t=1s👕 SHOP MY MERCH! https://www.amazon.com/gabbiehanna 👕🎵 STREAM & DOWNLOAD MY MUSIC! https://ffm.to/gabbiehanna 🎵 📖 BUY MY BOOK! http://gabbiehannabook.com/ 📖USE MY LYFT CODE! GABBIE38▶SUBSCRIBE! https://www.youtube.com/subscription_center?add_user=TheGabbieShow▶MY VLOG CHANNEL! https://www.youtube.com/channel/UCPVc4QnmAK13FdJydoQiljg▶FOLLOW ME ON INSTAGRAM: @gabbiehannahttp://instagram.com/gabbiehanna▶FOLLOW ME ON TWITTER: @gabbiehannahttps://twitter.com/gabbiehanna▶SNAP ME! I SNAP BACK: TheGabbieShowhttp://www.snapchat.com/add/thegabbieshow▶FACEBOOK.com/thegabbieshow https://facebook.com/thegabbieshowtrying to pull my life together! https://www.youtube.com/watch?v=KDF_MJXNoU8&list=PLV4HyEXIJkIeSkmqac9Qs9NSzk9UmIBZBJOIN MY PATREON! https://www.patreon.com/gabbiehanna"
"iObg33h-hEI","40 Days: Logan Paul's Countdown to Fight Night","2019-10-30T15:00:37.000Z","UCG8rbF3g2AMX70yOd8vqIZg","Logan Paul Vlogs","24","19.03.11","logan paul vlog|logan paul|logan|paul|olympics|logan paul youtube|vlog|daily|comedy|hollywood|parrot|maverick|bird|maverick clothes|40 days|dazn|logan paul boxing|logan paul training|training camp|boxing training|logan paul sparring|ksi|logan paul vs ksi|ksi vs logan paul","4375890","185783","41428","21004","https://i.ytimg.com/vi/iObg33h-hEI/default.jpg","False","False","November 9 will be biblical. Get your tickets to the fight ► https://www.axs.com/events/381960/ksi-vs-logan-paul-ii-the-rematch-tickets?skin=staplesSUBSCRIBE FOR DAILY VLOGS! ► http://bit.ly/Subscribe2LoganDownload the DAZN app and watch my fight against KSI: http://bit.ly/KSILoganPaul2 THE MAVERICK | Official Documentary Trailer ► https://youtu.be/T33lstVGtYEADD ME ON:INSTAGRAM: https://www.instagram.com/LoganPaul/TWITTER: https://twitter.com/LoganPaulI’m a 24 year old manchild living in Los Angeles. This is my life.https://www.youtube.com/LoganPaulVlogs"
"cFBMKk_tnp0","The BAC Mono Is a Crazy $250,000 Street-Legal Race Car","2019-10-31T15:57:16.000Z","UCsqjHFMB_JYTaEnf_vmTNqg","Doug DeMuro","2","19.03.11","bac mono|mono|bac mono review|bac review|bac mono one|bac mono car|doug demuro|demuro|doug de muro","1103334","29595","743","5440","https://i.ytimg.com/vi/cFBMKk_tnp0/default.jpg","False","False","GO READ MY COLUMN! http://autotradr.co/OversteerCHECK OUT TOM’S GARAGE!!https://www.youtube.com/channel/UClqlaw57fZ4xm9qp8k0MLzwThe BAC Mono is an insane $250,000 street-legal race car. Today I'm reviewing the BAC Mono to show you around this crazy race car for the road, and I'm going to show you all the quirks and features of the BAC Mono.WEBSITE & MERCH!http://www.dougdemuro.comFOLLOW ME!Twitter - http://www.twitter.com/dougdemuroInstagram - http://www.instagram.com/dougdemuroFacebook - http://www.facebook.com/ddemuroDOUGSCORE CHART: https://www.dougdemuro.com/dougscore"
"jroVHwMgX4Q","Painting the Huracan Frame and Building Carbon Fiber Doors","2019-10-31T21:00:11.000Z","UCl4-WBRqWA2MlxmZorKOV7w","B is for Build","2","19.03.11","acura|aston martin|audi|bentley|bmw|Buick|cadillac|chevrolet|dodge|ferrari|fiat|ford|gm|gmc|honda|hyundai|infinity|jaguar|jeep|kia|lamborghini|land rover|lexus|maserati|mazda|mclaren|mercedes|mini|mitsubishi|nissan|porsche|ram|rolls royce|subaru|tesla|toyota|volkswagen|volvo|b is for build|fibreglast|carbon fiber|door panels|carbon fiber body kit|diy|frame paint|engine bay paint","484535","18306","396","1036","https://i.ytimg.com/vi/jroVHwMgX4Q/default.jpg","False","False","In today's episode we repaint the huracan engine bay/frame and then jump into building carbon fiber door skins. Huge thanks to our sponsor https://fibreglast.com for supporting us on our carbon fiber journeys. And thanks to Wrapco PDX http://wrapcopdx.com follow them on insta/FB @wrapcoPDX , if you're in the portland area hit them up for all your wrapping/signage needs.And if you're looking for my awesome turbine spraying system, head over to https://hvlp.com/ and look at their lines of turbine spraying systems.❱ Shop - http://bisforbuild.com/❱ Patreon - http://www.patreon.com/user?u=3364742❱ Facebook - http://facebook.com/bisforbuild❱ Instagram - http://instagram.com/bisforbuild❱ Twitch - https://www.twitch.tv/bisforbuildMusic:Fareoh - Cloud Ten"
"eWI8Fk2ZERs","Skip Bayless makes a BIG announcement: Kawhi Leonard has won him back | NBA | UNDISPUTED","2019-10-31T17:00:57.000Z","UCLXzq85ijg2LwJWFrz4pkmw","Skip and Shannon: UNDISPUTED","17","19.03.11","NBA|basketball|Los Angeles Clippers|Los Angeles|Clippers|Kawhi Leonard|Kawhi|Leonard|NBA MVP|MVP|fox|fox sports|fs1|fox sports 1|undisputed|skip bayless|shannon sharpe|skip and shannon|fs1 undisputed|skip|bayless|shannon|sharpe|sports|news|BIG announcement|Clippers NBA|los angeles clippers nba|national basketball association|kawhi leonard clippers|kawhi clippers|leonard clippers","903443","21013","1191","6315","https://i.ytimg.com/vi/eWI8Fk2ZERs/default.jpg","False","False","Skip Bayless has a big announcement to make regarding Kawhi Leonard on Halloween. Hear why Skip has forgiven Kawhi and claims he's the best player on the planet right now.#Undisputed #NBA #KawhiLeonard #ClippersSUBSCRIBE to get the latest UNDISPUTED content: http://foxs.pt/SubscribeUNDISPUTED▶Watch our latest NFL content: http://foxs.pt/NFLonUNDISPUTED▶Watch our latest NBA content: http://foxs.pt/NBAonUNDISPUTED▶Watch our latest MLB content: http://foxs.pt/MLBonUNDISPUTED▶First Things First: Cris Carter and Nick Wright's YouTube channel: http://foxs.pt/SubscribeFIRSTTHINGSFIRST▶The Herd with Colin Cowherd’s YouTube channel: http://foxs.pt/SubscribeTHEHERD▶Speak for Yourself’s YouTube channel: http://foxs.pt/SubscribeSPEAKFORYOURSELF▶Fair Game with Kristine Leahy’s YouTube channel: http://foxs.pt/SubscribeFAIRGAMESee more from UNDISPUTED: http://foxs.pt/UNDISPUTEDFoxSportsLike UNDISPUTED on Facebook: http://foxs.pt/UNDISPUTEDFacebookFollow UNDISPUTED on Twitter: http://foxs.pt/UNDISPUTEDTwitterFollow UNDISPUTED on Instagram: http://foxs.pt/UNDISPUTEDInstagramFollow Skip Bayless on Twitter: http://foxs.pt/SkipBaylessTwitterFollow Shannon Sharpe on Twitter: http://foxs.pt/ShannonSharpeTwitterAbout Skip and Shannon: UNDISPUTED:UNDISPUTED is a daily two-and-a-half hour sports debate show starring Skip Bayless and Shannon Sharpe. Every day, Skip and Shannon will give their unfiltered, incisive, passionate opinions on the biggest sports topics of the day.Skip Bayless makes a BIG announcement regarding Kawhi Leonard | NBA | UNDISPUTEDhttps://youtu.be/eWI8Fk2ZERsSkip and Shannon: UNDISPUTEDhttps://www.youtube.com/c/UndisputedOnFS1"
"2KtFPjSp3og","[ENG sub] [최종회] ♬ LION - (여자)아이들 @ FINAL 경연 컴백전쟁 : 퀸덤 10화","2019-10-31T14:25:30.000Z","UCbD8EppRX3ZwJSou-TVo90A","Mnet K-POP","24","19.03.11","퀸덤|Queendom|이다희|AOA|(여자)아이들|러블리즈|마마무|오마이걸|박봄|장성규|컴백전쟁|에이오에이|여자아이들|(G)I-DLE|Lovelyz|MAMAMOO","3806395","184358","2658","24441","https://i.ytimg.com/vi/2KtFPjSp3og/default.jpg","False","False","[최종회] ♬ LION - (여자)아이들 @ FINAL 경연K-POP 여왕의 자리를 두고 펼쳐지는걸그룹 컴백 전쟁! Mnet ‘퀸덤(Queendom)’--------------------------------Mnet ‘퀸덤(Queendom)’지금까지 시청해주신 여러분 감사합니다♥-------------------------------------------------------------------------------------------------- ▶[Mnet] 구독 http://www.youtube.com/channel/UCepUWUpH45hRTi-QePdq1Bg?sub_confirmation=1 ▶[컴백전쟁 : 퀸덤] 지금 뜨는 동영상 : http://www.tving.com/smr/vod/player/P/C01_B120192549?from=youtube ▶[Mnet] 라이브 : http://www.tving.com/live/player/C00579------------------------------------------------------------------ #퀸덤#Queendom#이다희#AOA#(여자)아이들#러블리즈#마마무#오마이걸#박봄#장성규#컴백전쟁#에이오에이#여자아이들#(G)I-DLE#Lovelyz#MAMAMOO"
"qAkM3Vyt8WY","49ers vs. Cardinals Week 9 Highlights | NFL 2019","2019-11-01T03:43:31.000Z","UCDVYQ4Zhbm3S2dlz7P1GBDg","NFL","17","19.03.11","NFL|Football|offense|defense|American Football|highlight|highlights|game|sport|play|plays|season|2019|touchdown|td|game highlights|week 9|best plays|top plays|49ers|san francisco|sf|cardinals|arizona|ari|49ers cardinals game highlights|49ers highlights|cardinals highlights|sp:ty=high|sp:dt=2019-11-01T00:20:00Z|sp:st=football|sp:li=nfl|sp:ti:home=Ari|sp:ti:away=SF","2008600","18573","813","5010","https://i.ytimg.com/vi/qAkM3Vyt8WY/default.jpg","False","False","The San Francisco 49ers take on the Arizona Cardinals during Week 9 of the 2019 NFL season.Subscribe to NFL: http://j.mp/1L0bVBuCheck out our other channels:NFL Vault http://www.youtube.com/nflvaultNFL Network http://www.youtube.com/nflnetworkNFL Films http://www.youtube.com/nflfilmsNFL Rush http://www.youtube.com/nflrushNFL Play Football https://www.youtube.com/playfootballNFL Podcasts https://www.youtube.com/nflpodcasts#NFL #49ers #Cardinals"
"OTEaEukyc9A","Fortnite Shorts - Peely Bone Rises","2019-10-31T14:01:25.000Z","UClG8odDC8TS6Zpqk9CGVQiQ","Fortnite","20","19.03.11","Fortnite|Epic Games|PC|PS4|Xbox One|Battle Royale|Unreal Tournament|Unreal Engine|Fortnite Battle Royale|Fortnite Creative","1922230","76160","3311","5079","https://i.ytimg.com/vi/OTEaEukyc9A/default.jpg","False","False","Peely returns from beyond and he's bringing some friends with him.  Play Fortnite Battle Royale, the completely free 100-player PvP mode. One giant map, A Battle Bus, Last one standing wins. ESRB Rating: Teen with Violence.Instagram: https://www.instagram.com/fortnite/Twitter: https://twitter.com/FortniteGameFacebook: https://www.facebook.com/FortniteGame/Learn More: https://www.epicgames.com/fortnite/en-US/"
"CwVwLmbZ7dQ","JOKER REVEALS FATMAN'S IDENTITY | Jeff's Barbershop","2019-10-31T16:31:48.000Z","UCmraHp1nkUsFWLqR7SWToIg","Jeff Wittek","23","19.03.11","jeff wittek|jonah|david dobrik|vlog squad|joker|batman|haircut|barber|dark night|jeffs barbershop|vlog|interview|podcast|nick antonyan|transformation|heath ledger|hairstyle|how to","863419","51296","671","3529","https://i.ytimg.com/vi/CwVwLmbZ7dQ/default.jpg","False","False","thnx 4 washn hope u enjoyed this 2nd annual Halloween episode. Thank you to RAID  for sponsoring it. Install Raid for Free ✅ IOS: http://bit.ly/JeffWittek_Ios  ✅ANDROID: http://bit.ly/JeffWittek_android and get a special starter pack 💥Available only in the next 30 daysJeff's Barbershop collection is available now at 👇https://www.fanjoy.co/jeff Follow my Instagramhttps://www.instagram.com/jeffTwitter https://www.twitter.com/jeffwittek Check out Jonah's  channel:https://www.youtube.com/channel/UCTTS1yS_b6xak0vEh7LYx8ABurning Man Outro Song by Simon Rex: https://www.instagram.com/simonrex415...camera/editing by Oscar: https://www.instagram.com/oscaralvaEditor Joe Vulpis: https://www.instagram.com/ughitsjoe/?...Nathan Speicer: https://www.instagram.com/nathanspeis..."
"BRB-OlGJK1w","Why I'm Beating Logan Paul - 40 Days: KSI","2019-10-30T14:59:48.000Z","UCVtFOytbRpEvzLjvqGG5gxQ","KSI","24","19.03.11","WHY|IM|BEATING|LOGAN PAUL|40 Days|KSI","5822978","322259","28310","26616","https://i.ytimg.com/vi/BRB-OlGJK1w/default.jpg","False","False","To watch in the United States, Canada, Germany, Austria, Switzerland, Italy, Spain and Brazil go to DAZN http://bit.ly/KSILoganPaul2To watch in the United Kingdom and Ireland go to SKY SPORTS https://sky.com/boxoffice/ksi-loganpaulTo watch in Scandinavia, Australia, Japan, France, Netherlands, the Baltics and more go to http://Fite.tv Footasylum: https://footasylum.com Scuf Gaming: http://scuf.co/KSI"
"jJXy3Aya8H4","I'm Dog Stairs For Halloween","2019-10-31T04:45:55.000Z","UC9gFih9rw0zNCK3ZtoKQQyA","JennaMarbles","23","19.03.11","jenna|marbles|mourey|im|dog|stairs|for|halloween|kermit|peach|italian|greyhounds|greyhound|dogs|chihuahua|costume|diy|at|home|board|foam|fleece|batting|last|minute|funny|funniest|julien|solomita|boyfriend|gaming|game|computer|desk|chair|ladder|vlog|made","2346958","165706","1546","10786","https://i.ytimg.com/vi/jJXy3Aya8H4/default.jpg","False","False","Please subscribe to my channel and my vlog channel!  I make new videos here every Wednesday and make vlogs during my majestical daily life. http://www.youtube.com/JennaMarbleshttp://www.youtube.com/JennaMarblesVlogAlso our weekly podcast https://www.youtube.com/user/JennaJulienPodcastTwitchhttps://www.twitch.tv/jennajulienAnd past gaming from Twitch to Jenna Julien Gameshttps://www.youtube.com/channel/UC_Z0x662N1VUN9J7FYwCwkgSnapchat:JennaKermarblesFacebook: http://www.facebook.com/pages/Jenna-Mourey/311917224927Twitter:https://twitter.com/Jenna_Marbles@Jenna_Marbleshttps://twitter.com/jennajulien@jennajulienMerchandise:http://jennamarblesblog.com/shop Tumblr: http://jennamarbles.tumblr.com/Instagramhttp://instagram.com/JennaMarbles"
"3kUElZGMXm8","Halloween Special: Doctor Jekyll and Mister Hyde","2019-10-31T15:00:00.000Z","UCodbH5mUeF-m_BsNueRDjcw","Overly Sarcastic Productions","27","19.03.11","Funny|Summary|OSP|Overly Sarcastic Productions|Analysis|Literary Analysis|Myths|Legends|Classics|Literature|Stories|Storytelling|History|jekyll and hyde|doctor jekyll|mister hyde|utterson|horror|halloween","404449","38696","148","3652","https://i.ytimg.com/vi/3kUElZGMXm8/default.jpg","False","False","Some monsters are undead creatures of the night. Some monsters are cosmic horror nightmare gods. Some monsters are existential personifications of dread and decay. But perhaps the greatest monster of all… is man.Have a very spooky halloween! And don't forget the explicit moral of Jekyll and Hyde - that the greatest danger you'll ever face comes from wealthy middle-aged white men who get away with their crimes because society refuses to believe they would ever do such horrible things.…Hm. Are we SURE this was written in 1886…?(Topic originally requested by patron Kyakan!)PATREON: https://www.Patreon.com/OSPMERCH LINKS: https://www.redbubble.com/people/OSPYouTubeOUR WEBSITE: https://www.OverlySarcasticProductions.com/Find us on Twitter https://www.Twitter.com/OSPYouTubeFind us on Reddit https://www.Reddit.com/r/OSP/"
"6u44q0cslfE","Young Dolph - Tric Or Treat (Official Video)","2019-10-31T04:00:00.000Z","UCgcRU8TrT4cQpA6m5c6w_CQ","YoungDolphVEVO","10","19.03.11","Young Dolph|Tric Or Treat|Paper Route|EMPIRE|Paper Route Empire|Rap|Hip-Hop","2693437","86936","2335","4260","https://i.ytimg.com/vi/6u44q0cslfE/default.jpg","False","False","Listen to the single Tric Or Treat. Out now!Stream: https://empire.lnk.to/tricortreat#YoungDolph #TricOrTreat #PaperRouteEMPIREOfficial Music Video by Young Dolph performing Tric Or Treat (Official Video) © 2019 Paper Route EMPIREhttp://vevo.ly/y9fTLu"
"KAGEp62R3GY","We Share Our Crazy Halloween Stories!","2019-10-31T23:12:08.000Z","UCdM8C3ufiI-i-I1XSugKVvg","The Real Daytime","24","19.03.11","the real|daytime|talk show|women|tamera mowry|adrienne bailon|loni love|jeannie mai","296792","5244","91","469","https://i.ytimg.com/vi/KAGEp62R3GY/default.jpg","False","False","Real fam, what’s your craziest Halloween story?"
"i7648rZpdck","Pies | Basics with Babish","2019-10-31T13:00:14.000Z","UCJHA_jMfCvEnv-3kRjTCQXw","Binging with Babish","24","19.03.11","pies|basics with babish|cooking with babish|babbish|binging with babish|blueberry pie recipe|how to make blueberry pie|apple pie recipe|how to make apple pie|pumpkin pie recipe|how to make pumpkin pie|target|meal prep|grocery list|pear qwerty horse|target grocery|grocery haul|meal hacks|meal tips|good and gather|target good and gather|good and gather brand|good & gather|good and gather products","1042623","43808","349","2469","https://i.ytimg.com/vi/i7648rZpdck/default.jpg","False","False","Thank you to Target for sponsoring this video. Shop Good & Gather at your local Target or online here: https://tgt.biz/wkjk2 Watch more from @Target #goodandgather here: https://www.youtube.com/user/TargetI've made pies on the show before, but it's about time that I talk about the basics of making a really good pie - whether it's blueberry, apple, or pumpkin.Music: Apple Pies & Butterflies by Blue Wednesdayhttps://soundcloud.com/bluewednesday"
