video_id,title,publishedAt,channelId,channelTitle,categoryId,trending_date,tags,view_count,likes,dislikes,comment_count,thumbnail_link,comments_disabled,ratings_disabled,description
"u2voTz16Rng","The Best FIVE GUYS Burger at Home | SAM THE COOKING GUY 4K","2019-10-28T19:14:27.000Z","UCbRj3Tcy1Zoz3rcf83nW5kw","SAM THE COOKING GUY","24","19.03.11","five guys|five guys burgers|five guys burgers and fries|best burgers|best five guys|five guys homemade|sam the cooking guy|burger|sam the cooking guy burgers|cooking burgers|burger recipe|how to make burger|best burger recipe|best burger|five guys burger recipe|easy burger recipe|easy burger|easy recipe|sam the cooking guy burger","371042","8373","327","2152","https://i.ytimg.com/vi/u2voTz16Rng/default.jpg","False","False","Today I'll show you how to make the best Five Guys inspired burger at home with this easy recipe!SUBSCRIBE: http://bit.ly/stcgsub | MERCH: http://bit.ly/M_A_C_A WATCH NEXT ► Popular Videos:  http://bit.ly/stcg-popular-vids **Sorry the audio is a bit low in this vid! SHOP:     ►CHOSEN FOODS AVOCADO OIL | THE OFFICIAL OIL OF STCG - http://bit.ly/stcg-oil    ►MY KITCHEN MUST-HAVES - http://bit.ly/stcg-kitchen-musthaves       ►FAT MEANS FLAVOR TEES (& MORE) - http://bit.ly/stcg-merch    ►MAKE AMERICA COOK AGAIN MERCH - http://bit.ly/M_A_C_A    ►MY COOKBOOKS - http://bit.ly/stcg-cookbooks INGREDIENTS:     ►ground beef (80/20)     ►salt & pepper     ►avocado oil     ►lettuce     ►tomato     ►hamburger buns    ►ketchup     ►mustard     ►frank's red hot sauce    ►american cheeseJOIN THE COMMUNITY:    ►REDDIT: http://bit.ly/stcg-redditFOLLOW ME:    ►FACEBOOK: http://bit.ly/stcg-fbook     ►TWITTER: http://bit.ly/stcg-twitter     ►INSTAGRAM: http://bit.ly/stcg-insta     ►PINTEREST: http://bit.ly/stcg-pinterestWATCH MORE SAM THE COOKING GUY:    ►POPULAR VIDEOS: http://bit.ly/stcg-popular-vids     ►LATEST UPLOADS: http://bit.ly/stcg-latest-uploads     ►EPIC BURGERS & SANDWICHES: http://bit.ly/stcg-epic-burgers-etc     ►STCG'S FAVORITE RECIPES: http://bit.ly/stcg-fave-recipes CONNECT:    ►MY WEBSITE: http://thecookingguy.com    ►ALL MY RECIPES: http://thecookingguy.com/recipes/     ►MY SAN DIEGO TACO RESTAURANT: https://www.notnottacos.com/     ►BUSINESS EMAIL: info@thecookingguy.comABOUT SAM THE COOKING GUY:I'm Sam, and this is my Youtube channel - welcome to my world of cooking! If you love food that’s big in taste, small in effort, and served with a healthy dose of irreverence… well, you’ve definitely come to the right place. Watch my videos for easy to make recipes…kitchen basics…and live Q&A episodes where I answer all of your cooking questions. My goal is to show you that cooking doesn’t have to be hard, it just has to be delicious.--Please SUBSCRIBE and enable notifications to see NEW EPISODES shot in 4K uploaded every MONDAY + WEDNESDAY + FRIDAY For instant updates check out the links below and FOLLOW me on social media where you can stay up to date on new episodes and what's going on in my life. THANK YOU!"
"0UOJD_cadlI","Hairdresser Reacts To Girls Going Blonde To Black With Box Dye","2019-10-27T20:59:21.000Z","UCoc_XJPj6YLMQDWtPDQcDtA","Brad Mondo","24","19.03.11","bradmondo|bradmondonyc|hairdresser|reacts|brad&eric|Hairdresser Reacts To Girls Going Blonde To Black With Box Dye|blonde to black hair|dye your hair black|blue black|blonde hair dye|dye your hair at home|color hair at home|box dye for black hair|how to go blond to brown|diy hair|hair fail|fall off|hair dresser|box dye|hair dye|transformation|dye|hair color|hair transformation|beauty|blonde|funny|dying my hair black|guy tang|black hair","2044108","61927","1648","5890","https://i.ytimg.com/vi/0UOJD_cadlI/default.jpg","False","False","Hi Beautiful! My worst nightmare! Girls going from blonde to black :( lol just kidding! Some of these girls looked sooo much more fabulous with darker hair! Woah what a transformation! SHOP XMONDO HAIRCARE ▷ https://www.xmondohair.com/SUBSCRIBE TO BRAD & ERIC ▷ https://bit.ly/2XVO8ptSHOP MY MERCH ▷ https://goo.gl/VN6tVD SARA KINGHAM VIDEO ▷ https://www.youtube.com/watch?v=IPqr_D_IllcOHHAIJENNI VIDEO ▷ https://www.youtube.com/watch?v=aNjC_ahTxwcMADELINE POMPEII VIDEO ▷ https://www.youtube.com/watch?v=AO23IzRAelESOCIALS: INSTAGRAM ▷ https://www.instagram.com/bradmondonyc/TWITTER ▷ https://twitter.com/bradmondonycXMONDO INSTA ▷ https://www.instagram.com/xmondohair/DON'T FORGET TO LIVE YOUR EXTRA LIFE!"
"JCHttVEG_Lk","$3 Chicken Vs. $62 Chicken • Taiwan","2019-10-27T15:00:04.000Z","UCpko_-a4wgz2u_DgDgd9fqA","BuzzFeedVideo","22","19.03.11","buzzfeed|buzzfeedvideo|worth it|worth it chicken|worth it taiwan|taiwan chicken|worth it taiwan chicken|worth it andrew|buzzfeed inga|worth it steven|worth it adam|buzzfeed worth it|andrew ilnyckyi|cameraguy|steven lim|adam bianchi|food|travel|cheap|expensive|lifestyle|cheap vs. expensive|PL-WorthIt|PL-WorthItFood|PL-WorthItTaiwan|cheap vs. expensive food","2636297","62575","1151","3221","https://i.ytimg.com/vi/JCHttVEG_Lk/default.jpg","False","False","The finale of our three-episode special in Taiwan!Credits: https://www.buzzfeed.com/bfmp/videos/87994Check out more awesome videos at BuzzFeedVideo!https://bit.ly/YTbuzzfeedvideoGET MORE BUZZFEED:https://www.buzzfeed.comhttps://www.buzzfeed.com/videoshttps://www.youtube.com/buzzfeedvideohttps://www.youtube.com/asishttps://www.youtube.com/buzzfeedmultiplayerhttps://www.youtube.com/buzzfeedviolethttps://www.youtube.com/perolikehttps://www.youtube.com/ladylikeSUBSCRIBE TO BUZZFEED NEWSLETTERS:https://www.buzzfeed.com/newslettersBuzzFeedVideoBuzzFeed’s flagship channel. Sometimes funny, sometimes serious, always shareable. New videos posted daily!To see behind-the-scenes & more, follow us on Instagram @buzzfeedvideo http://bit.ly/2JRRkKULove BuzzFeed? Get the merch! BUY NOW: https://goo.gl/gQKF8mMUSICChi-Ki Cha_FullMixLicensed via Warner Chappell Production Music Inc.Genesis_MainLicensed via Warner Chappell Production Music Inc.MystereLicensed via Warner Chappell Production Music Inc.Super Charged_AltMixv1InstLicensed via Warner Chappell Production Music Inc.Season Opener_FullLicensed via Warner Chappell Production Music Inc.Lumiere D'or_30secLicensed via Warner Chappell Production Music Inc.Paris In Bloom_FullLicensed via Warner Chappell Production Music Inc.Diamond Noir_FullLicensed via Warner Chappell Production Music Inc.Spensive_FullLicensed via Warner Chappell Production Music Inc.Bright Little Dancer_FullLicensed via Warner Chappell Production Music Inc.Bon Voyage_FullLicensed via Warner Chappell Production Music Inc.Genova_InstrumentalLicensed via Warner Chappell Production Music Inc.Swing That ThingLicensed via Warner Chappell Production Music Inc.Go Time_InstrumentalLicensed via Warner Chappell Production Music Inc.About It_InstrumentalLicensed via Warner Chappell Production Music Inc.Bourbon Street Battery_MainLicensed via Warner Chappell Production Music Inc.Chicken Jive_undrscrLicensed via Warner Chappell Production Music Inc.Chicken Jive_fullmixLicensed via Warner Chappell Production Music Inc.Youth ClubLicensed via Warner Chappell Production Music Inc.Off To The SunLicensed via Warner Chappell Production Music Inc.HotspotsLicensed via Warner Chappell Production Music Inc."
"FWy-3H05A9o","Eoghan threatens to leave the Villa after dramatic Recoupling | Love Island Australia 2019","2019-10-28T11:20:27.000Z","UCaH2fA_zKsVlC2Y4uuRA-yA","Love Island Australia","24","19.03.11","Love Island|Love Island UK|Love Island AU|Love Island Australia|Love Island Couples|Sophie Monk|Sophie Monk Love Island|Love Island 2019|Adam Farrugia|Gerard Majda|Matthew Zukowski|Sam Withers|Maurice Salib|Luke and Josh|Luke Packham|Josh Packham|Eoghan Murphy|Cartier Rose Surjan|Cynthia Taylu|Jessie Winter|Vanessa Joli|Anna McEvoy|Phoebe Thompson|Love Island Season 2|9Now|Reality TV|fiji|narrator|watch love island|australia love island","246741","2200","64","0","https://i.ytimg.com/vi/FWy-3H05A9o/default.jpg","True","False","Eoghan threatens to leave the Love Island Australia 2019 Villa after a dramatic Recoupling.Subscribe here: https://bit.ly/2lvqvSL Full episodes here: https://bit.ly/2VLZF6HFollow Love Island Australia on Instagram: http://instagram.com/LoveIslandAULike Love Island Australia on Facebook: http://facebook.com/LoveIslandAUFollow Love Island Australia on Twitter: http://twitter.com/LoveIslandAUAbout Love Island Australia:Sophie Monk returns to host the ultimate game of love and romance in Love Island Australia, premiering on Monday, October 7 at 8.45pm on Nine. Sophie will play Cupid as she takes a group of beautiful young Aussie singles to find love in the sun.Love Island Australia – which was one of the most-talked about shows last year – sees a group of sexy singles coupling up in a luxury villa in search of the ultimate holiday of lust, romance and love. Not only must the Love Island couples stay together, they must also survive the temptations as beautiful new singles enter the island. The winning couple is handed a pot of money to start their new lives together, but there's a catch: one is given the chance to share the money or walk away with it all for them self. Were they after love or money all along?Love Island Australia is produced by ITV Studios Australia for Nine.#LoveIslandAU#SophieMonk#LoveIsland#LoveIslandAustralia"
"nUlK4L37DUE","AMAZING Cakes That Look Like Everyday Objects","2019-10-28T20:15:01.000Z","UCpB959t8iPrxQWj7G6n0ctQ","SSSniperWolf","24","19.03.11","sssniperwolf|sniper wolf|reaction|funny|cakes|amazing|amazing cakes|ordinary|objects|birthday|birthday cake|cake decorating|icing","692865","39872","809","2731","https://i.ytimg.com/vi/nUlK4L37DUE/default.jpg","False","False","Amazing Cakes That Look Like Everyday Objects! Watch more amazing cakes that look like everyday objects https://youtu.be/0Rrk7MdKibk  Leave a Like if you enjoyed! Subscribe to join the Wolf Pack and enable notifications!Instagram: http://instagram.com/sssniperwolfTwitter: http://www.twitter.com/sssniperwolfFacebook: https://www.facebook.com/sssniperwolfOfficial Merch: https://ogwolfpack.com/"
"1hq9aTFU-n8","6 Rappers vs 1 Fake Rapper","2019-10-27T14:00:01.000Z","UCJjSDX-jUChzOEyok9XYRJQ","Jubilee","24","19.03.11","jubilee|jubilee media|jubilee project|live deeper|blind devotion|love language|middle ground|spectrum|odd man out|odd man out rappers|6 rappers vs 1 fake rapper|who is the fake rapper|odd man out live audience|tenn buick|blimes brixton|kito fortune|colette carr|kingston the barber|deazy treez|milania monroe|rap|rappers|freestyle|hip hop","3934459","137874","3886","12615","https://i.ytimg.com/vi/1hq9aTFU-n8/default.jpg","False","False","Get your first audiobook and two Audible originals FREE when you try Audible for 30 days! Visit https://audible.com/jubilee or text jubilee to 500 500.SUBSCRIBE for more! 👉http://bit.ly/SUBSCRIBEjubilee 👈Be in a Jubilee video: http://bit.ly/JubileeCastingFollow us on INSTAGRAM: https://www.instagram.com/jubileemedia/Are you a loyal Jubilee fan? Join our Facebook group: https://www.facebook.com/groups/407942859721012/| ABOUT |Jubilee exists to bridge people together and inspire love through compelling stories. We create shareable human-centric videos that create connection, challenge assumptions, and touch the soul.Ultimately, we aim to inspire people to LIVE DEEPER.| SOCIAL |Jubilee Facebook: https://www.facebook.com/jubileemediaJubilee Instagram: https://www.instagram.com/jubileemedia/Jubilee Twitter: https://www.twitter.com/jubileemediaJubilee Website: https://www.jubileemedia.comFEATURING:Blimes Brixton - https://instagram.com/blimesbrixtonColette Carr - https://instagram.com/colettecarrDeazy Treez - https://instagram.com/deazytreezKingston The Barber - https://instagram.com/kingstonthebarberKito Fortune - https://instagram.com/kitofortuneMilania Monroe - https://instagram.com/milaniaamonroeTenn Buick - https://instagram.com/tennbuickBeats by Skinny Chase: https://www.youtube.com/officialjollyrecordsHelp us caption & translate this video!https://amara.org/v/f5rE/For brands interested in partnering with Jubilee, email us:hello@jubileemedia.comHelp us caption & translate this video!https://amara.org/v/BnNCQ/"
"esbpv23C-XU","Our Life Changing Experience In The Graveyard.","2019-10-27T20:14:09.000Z","UCg3gzldyhCHJjY7AWWTNPPA","Sam and Colby","24","19.03.11","sam golbach|colby brock|exploring|abandoned|sam and colby hotel|sam and colby haunted|most haunted places|sam and colby scary|overnight at haunted hotel|sam and colby overnight|sam and colby queen mary|exploring haunted|top 10 haunted|the langham hotel|the graveyard sam and colby|sam colby jake corey|haunted london|the graveyard|24 hour overnight|st andrews church|abandoned church|haunted church|exploring sam and colby|overnight sam and colby","2159830","128453","3787","21997","https://i.ytimg.com/vi/esbpv23C-XU/default.jpg","False","False","NEW INTERNATIONAL MERCH: https://shopxplr.comSam and Colby experience a life changing overnight at St Andrews abandoned church and explore London's scariest graveyard at 3am... Jake and Corey experience real paranormal curses from the haunted churchPART 1: https://youtu.be/4d05PGcquGcPART 2: https://youtu.be/wU7N01Fa5goPART 3: https://youtu.be/P2TiRJXWvHMNEW XPLR APP! Download for free: https://apps.apple.com/us/app/xplr/id1474820819Android: https://play.google.com/store/apps/details?id=co.tapcart.app.id_lMlmFXdnGD&hl=en_USFollow Jake and Corey!https://www.youtube.com/user/ItsCoreySchererhttps://www.youtube.com/user/Jakewebber9Get Extra Content here: https://www.youtube.com/channel/UCg3gzldyhCHJjY7AWWTNPPA/joinMake sure to Subscribe! https://www.youtube.com/channel/UCg3gzldyhCHJjY7AWWTNPPA?sub_confirmation=1Check out our personal channels!COLBY: https://www.youtube.com/c/ColbyBrockSAM: https://www.youtube.com/c/SamGolbachStock Footage used: https://www.videvo.net/Credit: Videvo & BeachFrontScary Music (CO AG): https://www.facebook.com/COAG-Music-146339785905623/Music Used: http://link.epidemicsound.com/Sound Effects: sounds provided by MrSnooze https://youtu.be/1RavoGSfE3UOur other social media!Instagram: @SamandColbyTwitter: @SamandColbySnapchat: @samgolbach & @colbybrock"
"9O5JGhzdnbo","Joe Giudice on Teresa Giudice Holding Another Man’s Hand | #WWHL","2019-10-28T02:20:09.000Z","UCy6D16zE_mMEm1HVD20WFxA","Watch What Happens Live with Andy Cohen","24","19.03.11","What What Happens live|reality|interview|fun|celebrity|Andy Cohen|talk|show|program","414834","2371","248","1322","https://i.ytimg.com/vi/9O5JGhzdnbo/default.jpg","False","False","Joe Giudice is asked what he thought of #RHONJ’s Teresa Giudice holding another man’s hand while he was in prison and Teresa says if she think Joe was faithful.►► Subscribe To WWHL: http://bravo.ly/WWHLSubWatch WWHL Sun-Thu 11/10c:WWHL Website: https://www.bravotv.com/watch-what-happens-liveFollow WWHL: https://twitter.com/BravoWWHLLike WWHL: https://www.facebook.com/WatchWhatHappensLive/WWHL Tumblr: http://bravowwhl.tumblr.com/'Watch What Happens: Live' is Bravo's late-night, interactive talk show that features guests from the world of entertainment, politics, and pop culture. Hosted by Andy Cohen, the series includes lively debates on everything from fashion, the latest on everyone's favorite Bravolebrities, and what celebrity is making headlines that week. Past guests who have joined Cohen in the Bravo Clubhouse include Sarah Jessica Parker, Tina Fey, Khloe Kardashian, Jennifer Lopez, Liam Neeson, Kelly Ripa, Jimmy Fallon, Anderson Cooper, Jennifer Lawrence, and Lance Bass.Watch More Bravo:Bravo Website: http://www.bravotv.com/Bravo Youtube: http://www.youtube.com/videobybravoFollow Bravo: http://www.twitter.com/bravotvLike Bravo: https://www.facebook.com/BRAVOPin Bravo: http://www.pinterest.com/bravobybravoBravo Instagram: http://www.instagram.com/bravotvBravo Tumblr: http://bravotv.tumblr.com/"
"aa7hl8A0tAY","MONSTA X 몬스타엑스 'FOLLOW' MV","2019-10-28T09:00:01.000Z","UCYDmx2Sfpnaxg488yBpZIGg","starshipTV","10","19.03.11","Kpop|1theK|Starshiptv|starship|loen|로엔|뮤비|티저|MV|Teaser|Dance practice|신곡|new|song|한류|idol|hallyu|ロエン|ミュージック|ミュージックビデオ|アイドル|韓流|韓国|아이돌|reality|몬채널|MONCHANNEL|MON-CHANNEL|making film|behind|MONSTA X|MONSTA-X|몬스타엑스|몬엑|MX|DRAMARAMA|THE CODE|더코드|드라마라마|몬스타엑스 드라마라마|걸어|THE CLAN|THE CONNECT|셔누|형원|기현|민혁|원호|주헌|아이엠|SHOWNU|HYUNGWON|KIHYUN|MINHYUK|WONHO|JOOHEON|IM|JOOHONEY|FINDYOU|FIND_YOU|FOLLOW|팔로우|파인드유","7765559","431639","2881","47468","https://i.ytimg.com/vi/aa7hl8A0tAY/default.jpg","False","False","MONSTA X's Mini Album 'FOLLOW : FIND YOU’ is out! ▶Ituneshttps://t.co/cbgn4lBSeI▶Apple Music : https://music.apple.com/us/album/follow-find-you/1484313886▶SPOTIFYhttps://t.co/Dn4nFvuj43[TRACK LIST]1. Find you2. Follow3. Monsta Truck4. U R5. Disaster6. Burn it up7. Mirror8. See You Again▶More informationMONSTA X Official Fan cafe : http://cafe.daum.net/monsta-xMONSTA X Official Twitter : http://www.twitter.com/OfficialMonstaXMONSTA X Official Facebook : http://www.facebook.com/OfficialMonstaXMONSTA X Official Weibo : http://www.weibo.com/monstax#MONSTAX #몬스타엑스 #MONBEBE #FOLLOW #FIND_YOU"
"c8nXfXkdO-4","Tiger Woods finishes 19 under to win 82nd PGA TOUR title | Round 4 | ZOZO 2019","2019-10-28T02:28:04.000Z","UCKwGZZMrhNYKzucCtTPY2Nw","PGA TOUR","17","19.03.11","highlights|shot|championship|usa|club|swing|golf course|pga tour|pga|tour|round recap|drive|golf|2019|zozo championship|accordia|golf narashino|tiger woods|tiger|woods|round|zozo","483636","3160","129","429","https://i.ytimg.com/vi/c8nXfXkdO-4/default.jpg","False","False","Every shot from Tiger Woods' 5 birdies and 2 bogeys in the final round of the 2019 ZOZO CHAMPIONSHIP. Woods tied Sam Snead for most victories all time with his 82nd PGA TOUR win, a 3-shot triumph over Hideki Matsuyama.SUBSCRIBE to PGA TOUR now: http://pgat.us/vBxcZShTiger Woods makes his season debut as the PGA TOUR plays its first official event in Japan at the inaugural ZOZO CHAMPIONSHIP. Woods is back in action after a knee operation, just weeks before he leads the U.S. Team at the Presidents Cup in Australia. Reigning FedExCup champion Rory McIlroy, along with former FedExCup champions Justin Thomas and Jordan Spieth and local star Hideki Matsuyama join the field at the Accordia Golf Narashino Country Club. This is McIlroy's first PGA TOUR start since his victory at the TOUR Championship in August where he won the FedExCup and was named Player of the Year. Can he get off to a winning start in Japan?Welcome to the official YouTube channel of the PGA TOUR.Here you can find everything you need to stay up to date with the world’s foremost golf tour. Check in for highlights from every tournament plus player interviews, player profiles, tournament previews, swing analysis and all the greatest shots and amazing moments. Teryn Schaefer presents the best social media posts from around the world of golf in ‘Good, Bad & Unusual' and after each day's play brings you the biggest talking points in 'The Takeaway'.Check out https://www.pgatour.com for complete coverage along with all the latest news, scoring, and stats!Follow PGA TOUR online:Instagram: https://instagram.com/pgatour/  Facebook: https://www.facebook.com/PGATour  Twitter: https://twitter.com/PGATOURSoundCloud: https://soundcloud.com/pgatourSign up for exclusive coverage - http://www.pgatourlive.comPGA TOUR Superstore - http://www.pgatoursuperstore.com/"
"Y9U_uN8L-v0","TRYING 23 EASY AND COOL DIY HALLOWEEN DECOR IDEAS by 5 Minute Crafts","2019-10-27T18:30:03.000Z","UCy47Au63gFpnzb_959sCcyg","Robby","22","19.03.11","Robby|5 minute craft|5-minute crafts|5 minutes craft|diy projects|robby trying life hacks|crafts|lifehacks|trying life hacks by 5 minute crafts|robby trying 5 minute crafts|robby life hacks|trying hacks|easy diy life hack|diy life hacks|trying 5 minute crafts|trying life hacks|hacks|life hack|lifehack|robby 5 minute crafts|testing life hacks|diy|viral hacks|makeup lifehack|DIY HALLOWEEN|23 EASY AND COOL DIY HALLOWEEN DECOR IDEAS|life hacks","1677581","29336","1952","15434","https://i.ytimg.com/vi/Y9U_uN8L-v0/default.jpg","False","False","Thank you for watching me try 23 easy and cool diy halloween decor ideas by 5 minute crafts!WATCH MORE: https://www.youtube.com/watch?v=WwTEpNTeuXU&list=PLd91ozZ_SW7c1A0N8gJnLongxjAQ7qg5x&index=2&t=0sThank you Hair Jordan for doing my voiceover subscrie o his channel here: https://www.youtube.com/channel/UCb2A2q0YQ4V69WNH9DSBzRwSubscribe to my channel! https://www.youtube.com/Robby?sub_confirmation=1Tori: https://www.youtube.com/yepitsstilltori?sub_confirmation=1BUY MY MERCH!!!! https://robby.bigcartel.comBusiness Email (promotional and collab) : RobbyEpicsauce@yahoo.comInstagram: https://www.instagram.com/robbyepicsauceTwitter: https://twitter.com/#!/RobbyEpicsauceMore funny videos!_Trying 20 FANTASTIC EGG COOKING TIPS by 5-Minute Craftshttps://www.youtube.com/watch?v=cqdXnKwgerc&list=PLd91ozZ_SW7c1A0N8gJnLongxjAQ7qg5x&index=2&t=2sTrying 30 GENIUS HOT GLUE HACKS by 5-Minute Craftshttps://www.youtube.com/watch?v=1wVK3k8JBqs&index=2&list=PLd91ozZ_SW7c1A0N8gJnLongxjAQ7qg5xtrying 42 HOLY GRAIL HACKS THAT WILL SAVE YOU A FORTUNE by 5-Minute Craftshttps://www.youtube.com/watch?v=Yd_vc91JvSA&index=4&list=PLd91ozZ_SW7c1A0N8gJnLongxjAQ7qg5xTrying 13 Funny Pranks! Prank Wars! By Troom Troomhttps://www.youtube.com/watch?v=rTE6fFGADOY&list=PLd91ozZ_SW7c1A0N8gJnLongxjAQ7qg5x&index=8Trying 30 SIMPLE KITCHEN HACKS YOU'D WISH YOU'D KNOWN SOONER by 5-Minute Craftshttps://www.youtube.com/watch?v=aMceQqnQkIQ&list=PLd91ozZ_SW7c1A0N8gJnLongxjAQ7qg5x&index=5-----------------------------------------------------------------------------------------------------------Background music: https://www.youtube.com/user/HeatleyBrosEnding music: https://www.youtube.com/watch?v=Xj7cbEOUu4g"
"-Q1ACcCTmNM","LET'S ARGUE: The Most Overrated Albums of All Time Pt. 1","2019-10-27T20:51:10.000Z","UCnxQ8o9RpqxGF2oLHcCn9VQ","fantano","10","19.03.11","lets argue|overrated|classic|music|albums|mbdtf|my beautiful dark twisted fantasy|kanye west|frank ocean|blonde|captain beefheart|trout mask replica|playboi carti|die lit|pink floyd|dark side of the moon|tool|smashing pumpkins|mellon collie|arcade fire|funeral|death grips|the money store|metallica|black album|lupe fiasco|the cool|rock|rap|hip hop|metal|indie|anthony fantano|needle drop","661730","24827","808","2909","https://i.ytimg.com/vi/-Q1ACcCTmNM/default.jpg","False","False","This batch of albums includes My Beautiful Dark Twisted Fantasy, Die Lit, Funeral, The Money Store, Mellon Collie and the Infinite Sadness, The Cool, Metallica's black album, Tool's entire discography, Blonde, Trout Mask Replica, and Dark Side of the Moon.===================================Patreon: https://www.patreon.com/theneedledropFollow your melon:Twitter: https://twitter.com/theneedledropInstagram: @afantanoFB: https://www.facebook.com/theneedledrop"
"j3Xj6SNIY94","Doctor Reacts to HILARIOUS Medical Memes #9","2019-10-27T14:59:15.000Z","UC0QHWhjbe5fGJEPz3sVb6nw","Doctor Mike","27","19.03.11","medical memes|doctor mike|meme review|funny medical memes|funniest medical memes|dr mike|doctor reacts|dr. mike|medical satire|doctor jokes|doctor memes|medical humor|medical comedy|hospital humor|doctor mike meme|mike varshavski|doctor meme review|doctor humor|nursing humor|medical meme compilation|meme review dr mike|dr reacts|medical school humor|health memes|real doctor reacts|medical meme review|real doctor reaction|satire|memes","1460628","79537","677","5902","https://i.ytimg.com/vi/j3Xj6SNIY94/default.jpg","False","False","If you want more MEME REVIEW click HERE: https://bit.ly/2NhCoWfMedical memes or Doctor Memes are a great way to get a laugh whether or not you are part of the medical community. I think that they are incredibly relatable as you can catch the humor even as a patient. I will say that some of the memes can be mean and if taken out of context can even seem rude BUT we need to understand that this is medical satire. Being able to laugh at ourselves and our troubles is a healthy habit to practice. I really enjoy reacting to these memes and I know that there are millions more out there that are as funny. Please if you enjoy this series let me know by liking, commenting, and sharing this video with your friends/family. If I see that you enjoyed it I will put out another post on my IG to send me the best doctor memes and nursing memes so that we can all share a laugh. #DoctorMikeMedicalMemeReviewAs they say, laughter is the best medicine, so let's laugh away together! If you have an idea of something you want me to cover in-depth, please let me know because I take your requests seriously. We will be back with more Medical Drama Review/Responding to comments Series in a couple of weeks so please submit more names of shows/questions you'd like for me to watch/answer. Love you all! - Doctor Mike VarshavskiPlease SUBSCRIBE for new videos every Sunday 11am EST ▶  https://goo.gl/87kYq6 Let's connect:IG https://goo.gl/41ZS7w - Doctor MikeReddit https://www.reddit.com/r/DoctorMike/Twitter https://goo.gl/kzmGs5 - Real Doctor MikeFacebook https://goo.gl/QH4nJS - Real Doctor MikeContact Email: DoctorMikeMedia@Gmail.comP.O. Box (send me stuffs):340 W 42nd St # 2695NY, NY 10108http://teamtrees.org/** The information in this video is not intended nor implied to be a substitute for professional medical advice, diagnosis or treatment. All content, including text, graphics, images, and information, contained in this video is for general information purposes only and does not replace a consultation with your own doctor/health professional **#teamtrees"
