video_id,title,publishedAt,channelId,channelTitle,categoryId,trending_date,tags,view_count,likes,dislikes,comment_count,thumbnail_link,comments_disabled,ratings_disabled,description
"GKXS_YA9s7E","Overwatch 2 Announce Cinematic | “Zero Hour”","2019-11-01T19:14:18.000Z","UClOf1XXinvZsy4wKPAkro2A","PlayOverwatch","20","19.03.11","Overwatch 2|“Zero Hour”|Winston|Tracer|Mei|Genji|Null Sector|Blizzard Entertainment|Blizzard|FPS|First-Person Shooter|Team-Based Shooter|Objective-Based Shooter|Shooter|Action Game|Team Game|Objective-Based Game|Multiplayer Game|Hero Shooter|Hero|Heroes|Hero Abilities|Future|Near-Future|Sci-Fi","4709143","220740","22785","26540","https://i.ytimg.com/vi/GKXS_YA9s7E/default.jpg","False","False","Stand together.When Null Sector attacks, Winston assembles a small strike team to fend off the invasion. But as hope begins to fade, the team must stand together to overcome the odds.Learn more: http://www.playoverwatch.comLike us on Facebook: http://www.facebook.com/playoverwatchFollow us on Twitter: http://www.twitter.com/playoverwatchJoin us on Instagram: https://www.instagram.com/playoverwatch"
"wjaIRPAxGgA","COOL GIRLY AND BEAUTY HACKS || Smart DIY Beauty Hacks For Girls","2019-11-02T14:00:08.000Z","UCBXNpF6k2n8dsI6nBH8q4sQ","123 GO!","22","19.03.11","DIY|craft|crafts|prank|pranks|challenge|challenges|fun|funny|123GO!|123 go|123go|friends|friendly|tutorial|howto|how to","1246337","18335","1634","1096","https://i.ytimg.com/vi/wjaIRPAxGgA/default.jpg","False","False","There are all kinds of life hacks. But for us ladies? There are a whole mess of girly hacks out there that serve us way better.Whether it’s makeup tricks, fashion short-cuts or DIY hair-care, us girls can use all the help possible!Be sure to share these hacks with your friends and subscribe to 123GO’s YouTube page for more helpful videos like this one! Catch ya later!#girly #DIY #makeupMusic by Epidemic Sound: https://www.epidemicsound.com/Stock materials: https://www.depositphotos.com https://www.shutterstock.com"
"7RdDpqCmjb4","Diablo IV Official Gameplay Trailer","2019-11-01T18:18:21.000Z","UCxn8csYeZg6awRnZS-aqg0g","Diablo","20","19.03.11","Diablo|Blizzard|Blizzard Entertainment|Diablo 4|ARPG|blizzcon|2019|gameplay|official|official gameplay","2828766","59687","6410","7004","https://i.ytimg.com/vi/7RdDpqCmjb4/default.jpg","False","False","Diablo IV is the newest incarnation of the genre defining ARPG players have come to know and love. Hellish new features, brutal challenges, and an indisputable return to darkness lie at the core of our hard work. Take a glimpse into the terror that awaits.Follow us: http://www.twitter.com/DiabloLike us: http://www.facebook.com/Diablo Visit our site: http://www.diablo.com/"
"leJNDpm_G10","Young Thug - Hot ft. Gunna & Travis Scott [Official Video]","2019-11-01T20:00:02.000Z","UCuwdplPbuTFZj_64d03tSBA","Young Thug","10","19.03.11","YoungThug|Anybody|Slime Season 3|Gunna|Trap|Slatt|Thugger|Up|Hear No Evil|Lil Baby|YSL|Young Thug|Best Friend|Super Slimy Future|Hip Hop & Rap|WSHH|Jeffrey|Relationship|Super Slimey|Lil Uzi Vert|Rap|Wrold star|Patek Water|Slime Season 2|Nicki Minaj|Country|World Star Hip Hop|EBBTG|WorldStar|BTG|Atlanta|Easy Breezy Beautiful Thugger Girl|Rich The Kid|ATL|Beautiful Thugger Girl|Slime Season|Jeffery|Barter 6","2636301","229638","3278","11430","https://i.ytimg.com/vi/leJNDpm_G10/default.jpg","False","False","Young Thug - Hot ft. Gunna & Travis Scott [Official Video]Stream So Much Fun on all platforms:https://youngthug.ffm.to/somuchfunConcept by Young Thug A Psycho Films Production @PsychoFilmsDirected by Christian Sutton @ShowMeSuttonExec. Producer: Sam CanterProducer: Tyler Sobel-MasonDP: Doug PorterProd. Designer: Miranda LorenzEditor/VFX: Tyler Sobel-MasonVideo Commissioner: Lucas PrevostFollow Young Thug:https://www.youngthugmusic.com/http://www.twitter.com/youngthughttp://instagram.com/thuggerthugger1http://www.facebook.com/youngthugmusic--#YoungThug℗ 2019 300 Entertainment / Atlantic Recording Corporation"
"s4gBChg6AII","World of Warcraft: Shadowlands Cinematic Trailer","2019-11-01T18:42:14.000Z","UCbLj9QP9FAaHs_647QckGtg","World of Warcraft","20","19.03.11","World of Warcraft|WoW|Warcraft|Blizzard|Blizzard Entertainment|Battle for Azeroth","2980729","81573","28478","18199","https://i.ytimg.com/vi/s4gBChg6AII/default.jpg","False","False","The veil between life and death is no more. Discover what lies beyond the world you know in the next chapter of the World of Warcraft saga--Shadowlands: Coming 2020. Learn more at http://worldofwarcraft.com"
"qBLKoo6oWEc","CAN YOU PASS THIS NHL ARENAS QUIZ?","2019-11-02T14:52:39.000Z","UC--i2rV5NCxiEIPefr3l-zQ","TSN","17","19.03.11","nhl|hockey|quiz|bardown|jesse|corwin|luca|marissa|DZ|eric|seals|leafs|canadiens|tom hanks|oracle arena","85698","9412","75","906","https://i.ytimg.com/vi/qBLKoo6oWEc/default.jpg","False","False","The BD squad is back, but most importantly...the Jofa bucket is back. Can Jesse end his drought with a little bit of helmet help? Corwin, Luca, Marissa and Eric are also vying for their claim to the BD belt in this ever-requested quiz."
"rsNskDfd5CM","Greta Thunberg on Whether She’d Meet with the President","2019-11-02T13:00:10.000Z","UCp0hYYBW6IMayGgR-WeoCvQ","TheEllenShow","24","19.03.11","ellen|ellen degeneres|the ellen show|ellen fans|ellen tickets|ellentube|ellen audience|ellen season 17|greta thunberg|greta thunberg ellen|greta thunberg interview|greta thunberg donlad trump|greta thunberg trump|greta thunberg president|climate change|climate change movement|greta thunberg speech|great thunberg death metal|greta thunberg meme|greta thunberg daily show|greta thunberg stare","1604036","74369","9024","7336","https://i.ytimg.com/vi/rsNskDfd5CM/default.jpg","False","False","Climate change activist Greta Thunberg was publicly mocked by President Trump on Twitter, and Ellen asked the 16-year-old whether she would ever meet with him to try to change his opinion on the topic. The teen also discussed inspiring millions of students around the world to organize and attend climate strikes, and how her Asperger’s has been a gift while being an outspoken activist. Plus, Ellen surprised the remarkable teen by revealing a section on ellentube dedicated to Greta and her climate change movement.#GretaThunberg#TheEllenShow#Ellen"
"lD-mqVq4Kmc","Rugby World Cup Final Highlights: England v South Africa","2019-11-02T12:21:37.000Z","UCE28rwYoaV7jvU6GVzdu_GQ","World Rugby","17","19.03.11","rugby|rugby world cup|rugby world cup 2019|rwc 2019|england|south africa|england v south africa|england 12-32 south africa|match highlights|highlights|siya kolisi|rassie erasmus","921082","13962","525","3948","https://i.ytimg.com/vi/lD-mqVq4Kmc/default.jpg","False","False","Short form highlights of England v South Africa in the Rugby World Cup 2019 final. Extended highlights will be published at 8pm (JPN Local time) on Sunday."
"qRd5SlRw48o","WEARING LONG ACRYLIC NAILS FOR 24 HOURS || Longest Nails Ever!! Funny Pranks by 123 GO! CHALLENGE","2019-11-02T13:00:10.000Z","UC_O-vmjpkom1m5shISID94g","123 GO! CHALLENGE","22","19.03.11","challenge|challenges|prank|pranks|fun|funny|123 go|123go|DIY|123 go challenge|123go challenge|24hours|long nails|comedy|funny pranks","673157","10093","812","464","https://i.ytimg.com/vi/qRd5SlRw48o/default.jpg","False","False","Thinking about getting a mani-makeover?Before you run to the nail salon, you may want to think about what life would really be like with long nails like these.While they may look cute, they’re anything but convenient and Kevin here is about to learn that the hard way.That’s because he’s going 24 hours with a full set of long, acrylic nails.Could you get through 24 hours with long nails? Share this hilarious video with your manicure-loving friends! And don’t forget to subscribe to 123GO Challenge’s youtube page for more great videos! See you next time!#123GO  #LongNails #24Hours #FunnyPrankMusic by Epidemic Sound: https://www.epidemicsound.com/Stock materials:https://www.depositphotos.comhttps://www.shutterstock.comhttps://elements.envato.com"
"2LoLE7iTCDM","I make PewDiePie's replacement 100 MIL subscriber award  (and mail it to him)","2019-11-02T13:38:14.000Z","UCSC1HqVmTaE4Shn32ihbC7w","Bobby Duke Arts","26","19.03.11","[none]","988664","140191","1238","5683","https://i.ytimg.com/vi/2LoLE7iTCDM/default.jpg","False","False","Start listening with a 30-day Audible trial.Choose 1 audiobook and 2 Audible Originals absolutely free. Visit http://audible.com/bobbyduke or text bobbyduke to 500-500.Thank you Audible for sponsoring this video!  Holy crap my little Dukeys, this piece was sooo challenging but I still feel that it was all worth it in the end :)  Just so you know, PewDiePie knows that I made this and that I'm mailing it to him, so try not to spam him about it. I hope you all like it! YAAAAAY!!I'm giving away my PewDiePie chair!! go follow me on Twitter to find out how you could win it  https://twitter.com/bobbydukearts?lang=enThank you Will (aka Ol' weird thumbs) for your help. Go subscribe to his channel! https://www.youtube.com/williamosmanGO DONATE TO TEAMTREES!! https://teamtrees.orgIf you want more Dukey in your life, go followMy Instagram https://www.instagram.com/bobbydukearts/and Twitter https://twitter.com/bobbydukearts?lang=enand Patreon  https://www.patreon.com/bobbydukeartsand P.O. Box  Bobby Duke9463 Benbrook Blvd. #1135Benbrook, TX 76126"
"oygrmJFKYZY","Dua Lipa - Don't Start Now (Official Music Video)","2019-11-01T13:00:11.000Z","UC-J-KZfRV8c13fOCkhXdLiQ","Dua Lipa","10","19.03.11","dua lipa|dua|new rules|dua leepa|idgaf|scared to be lonely|be the one|dua lipa dont start now|dua lipa dont start now video|dua new video|dua dont start now official video|dua lipa dont start now official video|dua dsn|dua lipa dont strat now|dua new song|dua new song 2019|if you don't wanna see me dancing with somebody|dont show up|dont come out|dont start caring about me now|nabil|nabil elderkin|nabil dua lipa|dua lipa nabil video|new dua","8941053","636264","14375","20916","https://i.ytimg.com/vi/oygrmJFKYZY/default.jpg","False","False","Don't Start Now is out everywhere! http://dualipa.co/dontstartnowFollow me online:Instagram:  https://dualipa.co/instagramFacebook: http://dualipa.co/facebookTwitter: http://dualipa.co/twitterYouTube: https://dualipa.co/youtubeSpotify: http://dualipa.co/spotifyApple Music: https://dualipa.co/apple-musicDeezer URL: http://dualipa.co/deezerAmazon Music: https://dualipa.co/amazonmusic"
"H6Vs1pbNos4","Eating Nail Polish That Tastes Like Ribs (two-course meal)","2019-11-02T15:30:00.000Z","UCGCVyTWogzQ4D170BLy2Arw","Simply Nailogical","24","19.03.11","nails|nail art|nail tutorial|beauty tutorial|nail art tutorial|diy nails|diy nail art|simply nailogical|cristine|edible|edible nail polish|eat nail polish|kfc nail polish|deliveroo|polished man|men wearing nail polish|painting my boyfriend's nails|nail polish tastes like ribs|scented nail polish|eating nail polish|bbq ribs nail polish|manly nail polish","564924","46427","275","4213","https://i.ytimg.com/vi/H6Vs1pbNos4/default.jpg","False","False","Are things really better if they're edible?🤔Got boring nails? Just add a Holo Taco 💿🌮 Sign up for email updates to be notified about new releases👀 ➡️ http://holota.co/holothere1 ♡ Subscribe to never miss n̶e̶w̶ ̶n̶a̶i̶l̶ ̶a̶r̶t̶ ̶t̶u̶t̶o̶r̶i̶a̶l̶s̶! http://bit.ly/subsimply♡ Subscribe to my SECOND CHANNEL for no reason: http://bit.ly/SubSimplyNotWatch me dress up my cats in costumes: https://www.youtube.com/watch?v=qpsbwkPO1hE_ _ _ _ _ _ _ _ _ _ _ _ _ _ _ _ _ _ _ _ _ _ _ _ _ _ _ _ _ _ _ _ _ _Sources:Daily Mail top tier journalism: https://www.dailymail.co.uk/femail/food/article-7548543/Food-scientists-create-new-edible-nail-polish-tastes-like-ribs-onions-rings-blueberry-pie.htmlhttps://deliveroo.com.auhttps://polishedman.comSimply trying edible nail polish #1: http://bit.ly/NailPolishCakeSimply trying edible nail polish #2: http://bit.ly/NailPolishCake2Other edible nail polish: https://www.adweek.com/creativity/kfc-just-made-edible-finger-lickin-good-nail-polish-yeah-tastes-chicken-171245/ON MY MAIN HAND: I had to hold out for this wear demo https://www.holotaco.com/products/long-lasting-base (coming soon 😏)_ _ _ _ _ _ _ _ _ _ _ _ _ _ _ _ _ _ _ _ _ _ _ _ _ _ _ _ _ _ _ _ _ _Stalk me on all the social medias!http://www.simplynailogical.comhttp://instagram.com/simplynailogicalhttps://www.snapchat.com/add/simplynailogicahttps://twitter.com/nailogicalhttps://www.facebook.com/simplynailogicalhttps://youtube.com/user/simplynailogicalhttps://www.youtube.com/c/simplynotlogicalhttp://simplynailogical.tumblr.com/Also follow Ben, but he probably won't follow you back because he's busy doing taxes:https://www.instagram.com/simplybenlogical/https://twitter.com/simplybenlogica_ _ _ _ _ _ _ _ _ _ _ _ _ _ _ _ _ _ _ _ _ _ _ _ _ _ _ _ _ _ _ _ _ _I film my nail videos with this camera: http://amzn.to/1MgznhtThis 105mm macro lens: http://amzn.to/1Pi8PM3I film my face videos with this camera: http://amzn.to/2kgHIgUThis 24-70mm lens: http://amzn.to/2gXJpxQI edit my videos with: http://bit.ly/videoeditor1I get some cool editing filters from: https://motionvfx.sjv.io/Ze3bRVoiceover mic: http://amzn.to/1MefGpGOn-camera shotgun mic: http://amzn.to/1HA9nz2External mic: http://amzn.to/2cU7t3jRing light for face-cams: http://amzn.to/2cU7cNOCheck out my personalized Amazon page with stuff I like! https://www.amazon.com/shop/simplynailogicalSee how to make your own amazing nail videos here: http://youtu.be/6k_GW0aso_kMusic: http://share.epidemicsound.com/SIMPLY_ _ _ _ _ _ _ _ _ _ _ _ _ _ _ _ _ _ _ _ _ _ _ _ _ _ _ _ _ _ _ _ _ _Disclaimer cause I love you guys: This video was not sponsored by any of the brands mentioned. All opinions are my own. Some links above are affiliate links."
"4b2Jm2WWUl4","VFX Artists React to Bad & Great CGi 12","2019-11-02T16:00:01.000Z","UCSpFnDQr88xCZ80N-X7t0nQ","Corridor Crew","24","19.03.11","VFX Artists|React|cgi|Hollywood|shot breakdown|visual effects|movies|Spiderman|far from home|Titanic|Supergirl|Tom Holland","695007","49552","312","5921","https://i.ytimg.com/vi/4b2Jm2WWUl4/default.jpg","False","False","ExpressVPN ► https://expressvpn.com/corridorcrew Take back your Internet privacy TODAY and find out how you can get 3 months free.New Robot Makes Soldiers Obsolete ► https://www.youtube.com/watch?v=y3RIHnK0_NECONSIDER SUBSCRIBING ► http://bit.ly/Subscribe_Corridor_CrewWatch This Show From The Beginning ► http://bit.ly/Watch_Season1This Episode ►The Crew sits down once again to react to some of Hollywood's zestiest CGi moments: What makes a visual effect bad? What makes one great?THE GEAR WE USE ►Most Used Equipment: http://bit.ly/Corridor_Crew_GearPerfect Camera: https://bhpho.to/2FJpQmRPuget Systems Computers: http://bit.ly/PC_Puget_WorkstationsSUPPORT US ► Translate & Subtitle: http://bit.ly/Make_SUBTITLESPatreon Donation: http://bit.ly/_Corridor_Patreon_SupportBuy Merch: http://bit.ly/Corridor_StoreFOLLOW US ►Instagram: http://bit.ly/_Corridor_InstagramSub-Reddit: http://bit.ly/_Corridor_Sub-RedditSubscribe to our Gaming Channel, NODE: http://bit.ly/Subscribe_to_NODEEPISODE MUSIC ►Epidemic Music ► http://bit.ly/Corridor_Music click this link for a free month!"
"Chk0ry3zVEs","GIANT ICE BLOCK Vs. BULLETPROOF GLASS from 45m Tower!","2019-11-01T22:00:00.000Z","UC5f5IV0Bf79YLp_p9nfInRA","How Ridiculous","17","19.03.11","how ridiculous|magnus effect|oobleck|rc cars|how ridiculous rc car|bowling ball vs trampoline|bowling ball|giant dart|trampoline|bowling ball vs oobleck|anvil vs car|how ridiculous giant dart|basketball|how ridiculous darts|basketball connect 4|bowling|anvil vs fridge|44 club|anvil|anvil vs","911126","41371","804","4593","https://i.ytimg.com/vi/Chk0ry3zVEs/default.jpg","False","False","Can Big Icey get through?BUY NEW REXY / CHRISTMAS MERCH ➤ http://tidd.ly/8b33c00bSUBSCRIBE ➤ http://bit.ly/SubHowRidiculousBECOME A MEMBER ➤ http://bit.ly/HRmembershipsSOCIALSInstagram ➤ @HowRidiculousFacebook ➤ How Ridiculous / http://bit.ly/HRFaceyTwitter     ➤ @howridiculousTikTok     ➤ @howridiculousWhat's the 44 Club? Well it all started in the outro of this video https://www.youtube.com/watch?v=AyLPMhp7qbs where we wondered if anyone was still watching the video at that point, and to comment 44 (Scott's fave number) if they were. Brett then said 44 Club get on board and the rest is history. The 44Club is the official How Ridiculous fan club made up of people who love our videos and watch them right to the very end. We've even got 44 Club merch now! So yeh, that's the story. Pretty random but good fun at the same time.We are passionate about seeing children released from poverty and we would love you to consider sponsoring a child with Compassion. We visited our sponsor children in the Philippines and were blown away by the difference that child sponsorship can make. To find out more about sponsoring a child right now, check out: http://cmpsn.co/howridiculousWhat Slow Mo Camera Do We Use? The Chronos 1.4 https://www.krontech.ca/camera-and-products/A big thanks to the awesome crew at the Gravity Discovery Centre in Gingin for letting us use their 45m leaning tower for our own experiments. If you wanna head out there and check it out, it's not far from Perth. Western Australia: https://gravitycentre.com.au/leaning-tower/For 44 Club fan mail or other items please send to: How Ridiculous PO Box 7045 Karawara WA 6152 AustraliaEMAIL US:All 44CLUB/fan email ➤ 44club@howridiculous.orgWe'll Pin Ya Submissions ➤ pinya@howridiculous.orgMerchandise Questions ➤ merch@howridiculous.orgLicensing/Media Inquiries ➤ licenses@howridiculous.orgBusiness Inquiries ONLY ➤ management@howridiculous.org"
"ndl1W4ltcmg","THE WITCHER | MAIN TRAILER | NETFLIX","2019-10-31T16:00:01.000Z","UCWOA1ZGywLbqmigxE4Qlvuw","Netflix","24","19.03.11","WITs3rMT!|The Witcher|Witcher|Geralt of Rivia|Gerald|Ciri|Jaskier|Dandelion|Bard|Tissaia|Filavandrel|Yennefer|Mousesack|Calanthe|Stregobor|MyAnna Buring|Anna Shaffer|Lars Mikkelsen|Fringilla|Henry Cavill|Freya Allan|Anya Chalotra|Joey Batey|Adam Levy|Andrzej Sapkowski|Rivia|The Last Wish|Blaviken|Nilfgaard|Roach|Witcher 3|Adventure|Series|Netflix|Superman|Game of Thrones|LOTR|Xbox|Playstation|PS4|SDCC","8922676","339219","11808","28232","https://i.ytimg.com/vi/ndl1W4ltcmg/default.jpg","False","False","You can't outrun destiny just because you're terrified of it. Henry Cavill is Geralt of Rivia. The Witcher arrives December 20.Watch The Witcher, Only on Netflix: https://www.netflix.com/title/80189685SUBSCRIBE: https://bit.ly/29qBUt7About Netflix:Netflix is the world's leading internet entertainment service with over 158 million paid memberships in over 190 countries enjoying TV series, documentaries and feature films across a wide variety of genres and languages. Members can watch as much as they want, anytime, anywhere, on any internet-connected screen. Members can play, pause and resume watching, all without commercials or commitments.THE WITCHER | MAIN TRAILER | NETFLIXhttps://youtube.com/netflixThe witcher Geralt, a mutated monster hunter, struggles to find his place in a world where people often prove more wicked than beasts."
"aM1oKTw83ao","Overwatch 2 - FULL Reveal Presentation | BlizzCon 2019","2019-11-01T19:39:38.000Z","UCbu2SsF-Or3Rsn3NxqODImw","GameSpot","20","19.03.11","overwatch 2|overwatch|o2|overwatch blizzcon|overwatch blizzcon 2019|blizzcon 2019|overwatch trailer|overwatch 2 trailer|overwatch story so far|jeff kaplan|jeff kaplan blizzcon|jeff kaplan edgey|blizzcon","347096","8482","933","1586","https://i.ytimg.com/vi/aM1oKTw83ao/default.jpg","False","False","Jeff Kaplan presents Overwatch 2 at BlizzCon 2019. Watch 'The Story So Far', the Overwatch 2 announcement trailer, and the gameplay trailer."
"nelZWV6Z27o","Carmelle Collado & Coach Bamboo - Let It Go | The Voice Kids Philippines Season 4","2019-11-02T12:30:27.000Z","UCjz5Ai3RBvw-vdhii-AE45g","Kapamilya Trending","24","19.03.11","ABS-CBN|The Voice|The Voice Kids|The Voice Kids Philippines|TVK|TVK 2019|The Voice Kids Season 4|TVK Season 4|Lea Salonga|Sarah Geronimo|Bamboo Manalac|singing contest|kids singing contest|November 2 2019|YT0psBea|TVK performances|the voice kids performances|Coach Lea|Coach Sarah|Coach Bamboo|Kamp Kawayan|carmelle collado|tvk carmelle|let it go|frozen let it go|20191102online|tvk grand finals|the voice kids grand finals|coach bamboo and carmelle","329150","15607","330","2959","https://i.ytimg.com/vi/nelZWV6Z27o/default.jpg","False","False","Carmelle Collado and Coach Bamboo Manalac perform Frozen's Let It Go.Subscribe now: https://www.youtube.com/channel/UCjz5Ai3RBvw-vdhii-AE45g#KapamilyaTrending#TVK2019#KampKawayan"
"c_gD8huo-PM","Testing Leroy's New SLIPPER Clutch... THIS THING FREAKIN RIPS!!!","2019-11-02T14:53:25.000Z","UCh8f8vssLddD2PbnU3Ag_Bw","Cleetus McFarland","1","19.03.11","leroy|1320video|drag racing|boosted|cleetus McFarland|cleetus|McFarland|Leroy|bald eagles|bald eagle machine|procharger|1320|modified|boost|turbo|twin turbo|precision turbo|precision turbo and engine|Texas speed|resleeved 427|Texas speed and performance|Fasterproms|tuning|tuned|burnout|stick shift|six speed|corvette|Leroy Vette|c5 corvette|Chevrolet|unicorn|c5|supercharging Leroy|turbocharging Leroy|black magic clutches|slipper clutch","354486","22034","159","2226","https://i.ytimg.com/vi/c_gD8huo-PM/default.jpg","False","False","CLEETER Merch!  - https://www.cleetusmcfarland.comFINALLY looks like we're onto something!!! Check out Leroy's first rips on his new Black Magic clutch right before the boys leave for World Cup!Here's the new Cleetus2 Channel - https://goo.gl/Ph2wyoHere's our Full Schedule for 2019! https://cleetusmcfarland.com/our-2019-calendar/Holley's new channel - https://www.youtube.com/channel/UCeQfJXzg0gnfuM4tgmagCCw-Leroy's Injectors! - http://fuelinjectorclinic.com-Leroy's BILLET Intake! - https://frankensteined.net (10% off one if you use coupon code GODBLESSAMERICA)-Leroy's Clutch (LT1-RR Triple Disc) - monsterclutches.com-Leroy's ECU (Holley Dominator) - https://goo.gl/JjvakM-Precision Turbo (turbos, BOV, waste gates) - http://www.precisionturbo.net -Jeremy's Shop, Fasterproms (tuning) - (813) 476-7364-Texas Speed & Performance - (512) 863-0900-Motion Raceworks - https://www.motionraceworks.com-ProFab Performance Plus - (727) 849-9300-RPM Transmissions - www.rpmtransmissions.com-Billet T4 Flanges - www.streetcarrfabrication.com**Social Media:Instagram - https://goo.gl/LZvy5eFacebook - https://goo.gl/gdwhh1**SEND ME FAN MAIL... (bald eagles welcome) Cleetus McFarland12961 44th St N. Ste BClearwater, FL 33762United States of America"
"vwg6O7ojAtc","You Decide How We Destroy Our Favorite Products • Product Deathmatch #1","2019-11-02T12:17:15.000Z","UCDRbNGFusqlXX4a5vwi9ouQ","Vat19","24","19.03.11","vat19|gummy heart|vat 19|vat-19|gummy|heart|goo jit zu|stress ball|nightball|hershey's kiss|unicorn lamp|hydraulic press|magnetic hourglass|super mario block light|avocado stuffed animal|hot sauce","601531","15280","426","1177","https://i.ytimg.com/vi/vwg6O7ojAtc/default.jpg","False","False","We picked out our favorite items and you guys told us how we should destroy them. It. Was. Awesome!Buy here: https://www.vat19.comMore Destruction: https://www.youtube.com/watch?v=o7cVnSA734M&list=PLSqiExuEA-REAvNt3afooT0yYEnWaPH6aSubscribe to Vat19: http://www.youtube.com/subscription_center?add_user=vat19comVisit the Vat19 Headquarters: https://www.vat19.com/tour****************** Follow Vat19:Facebook: https://facebook.com/vat19Instagram: https://instagram.com/vat19/Shop hundreds more curiously awesome products:https://www.vat19.com/?adid=youtubeWatch More Vat19:The White Elephant Gift Show: https://www.youtube.com/watch?v=rppcXroNgKI&list=PLSqiExuEA-RFpqW0Y3vn0pn8wDW_3LXAOLatest Uploads: https://www.youtube.com/user/vat19com/videos?shelf_id=1&view=0&sort=ddPopular Videos: https://www.youtube.com/user/vat19com/videos?shelf_id=7&view=0&sort=pFun Stuff to Eat: https://www.youtube.com/watch?v=7RXmNRr8x7I&list=PLSqiExuEA-REt5gzR0A9ernZNHlZ2glIlAbout Vat19:Vat19 is dedicated to curiously awesome gifts, candy, toys, gummy, putty, puzzles, games, and more! In addition to making funny commercials you'll actually want to watch, we produce amazing challenge videos, document our outrageous contraptions, and invite you to a front row seat for our silly stunts. Sometimes we blow things up, fill up a bathtub or pool with crazy stuff, dare each other to eat super spicy foods, and answer “burning questions” from our viewers."
"Y0LiRzhKLmQ","NHL Highlights | Canadiens @ Golden Knights 10/31/19","2019-11-01T05:08:12.000Z","UCqFMzb-4AUf6WAIbl132QKA","NHL","17","19.03.11","Vegas Golden Knights|Montreal Canadiens|Vegas Golden Knights vs. Montreal Canadiens|sp:st=icehockey|sp:li=NHL|sp:vl=en-US|sp:ty=high|sp:dt=2019-11-01T00:30:00z|sp:ti:away=MTL|sp:ti:home=VGK|habs","157692","1292","57","272","https://i.ytimg.com/vi/Y0LiRzhKLmQ/default.jpg","False","False","Extended highlights of the Montreal Canadiens at the Vegas Golden Knights"
