video_id,title,publishedAt,channelId,channelTitle,categoryId,trending_date,tags,view_count,likes,dislikes,comment_count,thumbnail_link,comments_disabled,ratings_disabled,description
"NKC0hpnh5XY","Como é feita a caneta esferográfica (a caneta azul) #Boravê","2019-11-02T14:30:00.000Z","UCKHhA5hN2UohhFDfNXB_cvQ","Manual do Mundo","28","19.03.11","como funciona|plástico|polietileno|poliestileno|fábrica|produção|máquina injetora|polipropileno|montagem|extrusora|carboneto de tungstênio|carga|bic|caneta bic|fábrica bic|fábrica de canetas|fábrica em manaus|polo industrial de manaus|fábrica de plástico|montagem canetas|caneta azul","718956","93541","835","4703","https://i.ytimg.com/vi/NKC0hpnh5XY/default.jpg","False","False","Fomos ao Polo Industrial de Manaus para mostrar para vocês como é fabricada a caneta esferográfica! Você vai ver o funcionamento de máquinas injetoras, formas para plástico, mistura de tintas, a formação do tubo da carga, carregamento de tinta na caneta e a montagem final!CRÉDITOSDireção e apresentação: Iberê Thenório Produção executiva e apresentação: Mari FulfaroImagens: Natã RomualdoProdução: Rubens IsharaEdição e finalização de imagens: Kiwi produçõesAgradecimento: BIC 🔵Este é o canal do Manual do Mundo. Vídeos novos todas as terças, quintas e sábados. 📩Manual do Mundo Comunicação LTDA Caixa Postal 77795 CEP 05593-000 SP - SP"
"x_1GdmgzkFM","Millena & Manu Maia - Apaixonadinho Em Mim (Clipe Oficial)","2019-11-02T13:00:17.000Z","UCf7NHjrBm0FIBm8SOet1q4Q","Millena e Manu Maia","22","19.03.11","Millena & Manu Maia - Apaixonadinho Em Mim (Clipe Oficial)|Millena e Manu Maia - Apaixonadinho Em Mim (Clipe Oficial)|videoclipe|clipe|video clipe|funk|musica|clipes|funks|milena e manu cantando|milena e manu maia cantando|clipe millena e manu|millena e manu clipe|milena e manu maia clipe oficial|millena e manu videoclipe|clipe oficial|musicas|clipe de funk|millena e manu cantando|minha gemea|millena e manu maia|millenaemanumaia1230|funkeirinhos|apaixonadinho em mim","207022","13029","1281","0","https://i.ytimg.com/vi/x_1GdmgzkFM/default.jpg","True","False","Millena & Manu Maia - Apaixonadinho Em Mim (Clipe Oficial)Millena e Manu Maia - Apaixonadinho Em Mim (Vídeo Clipe)#millenaemanumaia #clipeoficial #clipe #videoclipe #musica #funkAPAIXONADINHO EM MIM Compositor: Mih MaiaMe olha e joga o cabelim, tipo formal Me ver e manda um sorrisim, sensacional Ta paixonadim em mim, te dou moral Ta paixonadim em mim, te dou moral Eu também estou afim Mas não sou facim assim Mamãe me fez assim Papai caprichou direitim Chega de mancim, Profissional Fala bem devagarim, é cordial Me chama de amorzim, tão literal Ta paixonadim em mim, te dou moral Vou te mandar a real Não quero ser sua atual Muito menos a oficial Se quiser, vai ter que se esforçar Sou garota pra casar Seus papos são engaçadim, é natural É todo charmosim, não tem igual Ta paixonadim em mim, te dou moral Ta paixonadim em mim, te dou moralSHOWSmillenaemanumaiaoficial@gmail.comFICHA TÉCNICADireção Geral: Mih Maia Roteiro: Mih Maia - @michellemaiaoficialDireção de Produção: Nauta Inc. Produção Áudio Visual: Nauta Inc. - @vibenautaProdução Musical: DJ Kik Prod. & TS - @djkikproddj BAILARINOSCoreografia: Yan Junior de CastroBailarinos: Igor Luís Xisto, Luan Saraiva, Luid Saraiva, João victor de Freitas - @osatuaisoficialATORES CONVIDADOSMoisés Oliveira, Gabriel Resende"
"ClQY6J2cjE0","Entrevista com Now United | The Noite (01/11/19)","2019-11-02T13:29:55.000Z","UCEWOoncsrmirqnFqxer9lmA","The Noite com Danilo Gentili","24","19.03.11","sbt|The Noite|The Noite com Danilo Gentili|Entrevista|Danilo Gentili|Murilo Couto|Léo Lins|Juliana|Diguinho|Diguinho Coruja|Ultraje a Rigor|Roger|Marcos Kleine|Bacalhau|Mingau|The Noite de sexta|The Noite 01 de novembro|The Noite 01/11|now united|now united no the noite|fdp the noite","187314","23990","227","1651","https://i.ytimg.com/vi/ClQY6J2cjE0/default.jpg","False","False","O The Noite dessa sexta-feira recebe o grupo Now United, e conversam sobre as diferenças de idiomas entre os integrantes, informações sobre a turnê no Brasil e muitos outro detalhes. _________________________________________________________________O The Noite é um talk show apresentado por Danilo Gentili e vai ao ar de segunda a sexta nas madrugadas do SBT. Personalidades de todas as áreas são entrevistadas no programa, que também conta com Léo Lins, Murilo Couto, a assistente de palco Juliana e o locutor Diguinho Coruja. A trilha sonora fica por conta da banda Ultraje a Rigor e os comentários são cortesia do vocalista Roger Moreira. Completam o grupo o baixista Mingau, o guitarrista Marcos Kleine e o baterista Bacalhau.Além das entrevistas diárias, a atração conta com diversos quadros irreverentes. No Contrarium e Favorarium, por exemplo, comediantes debatem assuntos de extrema importância no palco do programa. Já no Fight de Piadas, que teve início na temporada 2018, humoristas de todo o Brasil disputam para saber quem ofende melhor o outro.Outro diferencial do programa são as reportagens exclusivas produzidas por Murilo Couto e Léo Lins. A dupla vai aos mais variados lugares, desde feiras eróticas até cruzeiros, e aborda todos os temas possíveis. Tudo feito com muito humor e com aquele jeito The Noite de ser.Veja mais em http://www.sbt.com.br/thenoite/Inscreva-se no canal do The Noite: http://www.youtube.com/sbtthenoiteCurta a página do programa no Facebook:  https://www.facebook.com/SBTTheNoiteSiga o perfil oficial do programa no Twitter:https://twitter.com/SBTTheNoiteE no Instagram:https://www.instagram.com/sbtthenoite"
"d9bFDcf7QcM","FELIPE ERROU TUDO E FICOU NERVOSO??? FEAT FRANCINY EHLKE","2019-11-02T12:00:05.000Z","UCIR9VKPE70KJ4DX2zCjHObw","Canal IN","24","19.03.11","irmãos neto|familia neto|neto|Felipe|Luccas|Felipe Neto|Luccas Neto|Casa|felipe e lucas|bruno|familia|engraçado|humor|amizade|Franciny Ehlke|Franciny|Desafio|dezafio|Canal IN|Bruna Gomes|Bruno Correa|brincadeira","313863","50583","490","653","https://i.ytimg.com/vi/d9bFDcf7QcM/default.jpg","False","False","REALIZAÇÃO: PLAY9Canal da Franciny - https://www.youtube.com/channel/UCoTM-vvs2hnv2mCvzNJ5uXACanal do Felipe - https://www.youtube.com/user/felipenetoCanal do Luccas - https://www.youtube.com/user/luccasnetoCanal do Bruno - https://www.youtube.com/user/PlatinaKHCanal da Bruna - https://www.youtube.com/channel/UCu3PnW9yUmniJj5-QZ44jOQ"
"ZNo1G978TCU","COSPLAY vs. COSPOBRE! Quem ganha?","2019-11-02T13:00:06.000Z","UCV306eHqgo0LvBf3Mh36AHg","Felipe Neto","24","19.03.11","felipe neto|irmãos neto|bruno correa|bruno corrêa|cosplay|cosplayer|cospobre|fantasia|games|videogames|jogo|maquiagem|piores cosplay|melhores cosplay","890985","157889","1698","3010","https://i.ytimg.com/vi/ZNo1G978TCU/default.jpg","False","False","Neste vídeo, vemos cosplayers que zoam com as próprias fantasias de propósito e criam obras-primas da comédia.COMPRE MEU LIVRO NOVO! - https://www.felipenetolivros.com.br/VÍDEO MOSTRANDO O LIVRO NOVO - https://youtu.be/4EpdYWYSRXoSEJA MEMBRO! - https://www.youtube.com/felipeneto/join"
"CkKY-xhLt44","'Caneta azul': Entenda o novo meme da internet","2019-11-01T22:55:29.000Z","UC-6xqzMBF2CXTImn_a4aCVg","Jornal O Globo","25","19.03.11","O Globo|Rio de Janeiro|Notícias|Jornalismo|Imprensa|Globo|Jornal O GLOBO|Brasil|Rio|caneta azul|manoel gomes|meme|wesley safadão|neymar|simone|simaria|guitarra humana|para nossa alegria|jeremias|jeremias muito louco|maranhão|engraçado","437020","11342","856","496","https://i.ytimg.com/vi/CkKY-xhLt44/default.jpg","False","False","Postada no Youtube no dia 18 de outubro, 'Caneta azul', música composta e interpretada pelo maranhense Manoel Gomes, viralizou. O hit foi cantado por Wesley Safadão e tocado pelo DJ Alok durante uma apresentação nos EUA. Simone e Simaria,  Eduardo Costa e o apresentador Rodrigo Faro  postaram versões para a letra. O jogador Neymar postou nos stories um vídeo ouvindo uma versão eletrônica da música em sua Ferrari. ASSINE O GLOBO: http://assineoglobo.globo.com/INSCREVA-SE NO CANAL: http://bit.ly/2BQvqB4 O SITE: https://www.oglobo.globo.comOS PODCASTS: https://oglobo.globo.com/podcast/O FACEBOOK: https://www.facebook.com/jornalogloboO TWITTER: https://twitter.com/jornalogloboAS NEWSLETTERS: https://oglobo.globo.com/newsletter/cardapio/"
"8BWRD1ya1SE","TIPOS DE FANTASMAS | PARAFERNALHA","2019-11-02T13:00:04.000Z","UCddYq41_tZ1FnLlguLT6-Ow","Parafernalha","24","19.03.11","parafernalha|parafernalia|humor|comedia|esquete|canal parafernalha|canal parafernalia|jhonny drumond|cezar maracuja|victor lamoglia|renata canossa|mariana rebelo|daniel curi|terror|fantasma|dia do irmão|lista|assustador|susto|medo|tipos de|hallooween|dia das bruxas","266973","34658","404","314","https://i.ytimg.com/vi/8BWRD1ya1SE/default.jpg","False","False","No vídeo de hoje, vemos uma lista com diversos tipos de fantasmas. Não que eles existam, mas vai que, né. Forte abraço!INSCREVA-SE: http://tinyurl.com/c6fm4okFacebook: http://www.facebook.com/parafernalhaTwitter: http://www.twitter.com/parafernalhaInstagram: https://www.instagram.com/parafernalhareal---FICHA TÉCNICA:Produtora: MassivHead de Projetos Especiais: Rafael NascimentoAssistente de Projetos Especiais: Guilherme ResendeDireção de Conteúdo: Rafael CastroRoteiro: Paulo SuarezDiretor: Gustavo ChagasAssistente de Direção: Alexander CaioDiretora de Produção: Alessandra BezerraProdução: Natã Lamego e Gabrielle MisaelAnalista de Planejamento Audiovisual: Vitor Hugo FariaArte: Vic EstevesMaquiagem: Brayon MattosPós Produção: MassivMontagem: Natalia CardozoColorista: Natalia CardozoSom direto: Richard Gonçalves - Oveloud StudiosElenco: Renata Canossa e Jhonny Drumond Participação: Thais Belchior e Jorge Hissa"
"_Gh47Fxhuk0","♫ GOLS QUE MERECIAM TER GANHADO O PUSKÁS | Paródia Gaiola é o Troco - MC Du Black","2019-11-01T15:21:50.000Z","UCGFNp4Pialo9wjT9Bo8wECA","FutParódias","17","19.03.11","Futebol|FutParodias|Paródia|futparodia|futeparodia|parodia|fut parodia|fut parodias|Paródia com Jogadores|Gaiola é o Troco|MC Du Black|Paródia Gaiola é o Troco|Paródia MC Du Black|Cristiano Ronaldo|Paródia Cristiano Ronaldo|Messi|Paródia Messi|Paródia Gaiola|Neymar|Paródia Neymar|Cristiano Ronaldo Puskas|Prêmio Puskas|Puskas|Mereciam ter ganhado o Puskás|Futparódias Gols|Melhores Gols","1674637","155953","2141","4404","https://i.ytimg.com/vi/_Gh47Fxhuk0/default.jpg","False","False","Uma paródia de futebol da música Gaiola é o Troco de MC Du Black, só com golaços épicos, que não ganharam ou nem foram indicados para o prêmio Puskás... Quem não lembra daquela bike do Cristiano Ronaldo, ou quando o Messi saiu driblando todo mundo? Mesmo assim não levaram o prêmio, uma injustiça. Mas o importante mesmo é ver essa paródia cheia de golaço!👕 NOSSA LOJA: https://bit.ly/futloljaBora seguir nossas redes? =)👍 INSTAGRAM:https://instagram.com/dezaodrumondhttps://instagram.com/leonwhosoeverhttps://instagram.com/FutParodias👍 TWITTER:https://twitter.com/dezaodrumondhttps://twitter.com/leonwhosoeverhttps://twitter.com/FutParodias👍 FACEBOOK:https://facebook.com/dezaodrumondhttps://facebook.com/leonwhosoeverhttps://facebook.com/FutParodias-----------------------------------------------------------------------------------------------💻 Edição: Juan Carlos Borgonovohttps://www.youtube.com/futebolnacional-----------------------------------------------------------------------------------------------LETRA:Injusto é poucoDá o Puskás pra nós, pra nós, pra nós, pra nósLembra do gol do Cris de Bikera?Não dar Puskás pra isso aí foi brincadeiraMe explica, Deus, o porquê dissoTanto gol tão lindo passando batidoTem golão que tinha que ganhar um caminhãoDe homenagem, placa, taça e premiaçãoQue merecia Puskás e muito bem maisMas eis que o prêmio vai pra mão de outro rapazMermão, isso é maldade, coisa de loucoMas segue o baile, engole o choroPra que ficar vidrado tanto nesse prêmio?Não é um Puskás que define um gol de gênioEntão vaiDesce, desce, desce, desce, desce o canhãoSenta, senta, senta, senta a bike de platinaMete o gol mais lindo da sua vidaCom ou sem um Puskás, faz tua arte e assinaEntão vaiDesce, desce, desce, desce, desce o canhãoSenta, senta, senta, senta a bike de platinaMete o gol mais lindo da sua vidaCom ou sem um Puskás, faz tua arte e assinaEntão vaiLembra do gol do Cris de Bikera?Não dar Puskás pra isso aí foi brincadeiraMe explica, Deus, o porquê dissoTanto gol tão lindo passando batidoTem golão que tinha que ganhar um caminhãoDe homenagem, placa, taça e premiaçãoQue merecia Puskás e muito bem maisMas eis que o prêmio vai pra mão de outro rapazMermão, isso é maldade, coisa de loucoMas segue o baile, engole o choroPra que ficar vidrado tanto nesse prêmio?Não é um Puskás que define um gol de gênioEntão vaiDesce, desce, desce, desce, desce o canhãoSenta, senta, senta, senta a bike de platinaMete o gol mais lindo da sua vidaCom ou sem um Puskás, faz tua arte e assinaDesce, desce, desce, desce, desce o canhãoSenta, senta, senta, senta a bike de platinaMete o gol mais lindo da sua vidaCom ou sem um Puskás, faz tua arte e assinaInjusto é pouco"
"GubjHz5--6M","Overwatch 2 Cinemática de Anúncio| “Zero Hour”","2019-11-01T20:35:30.000Z","UCcOlGZMY19XQupKH4aigvkw","Overwatch Brasil","20","19.03.11","Overwatch 2|“Zero Hour”|Winston|Tracer|Mei|Genji|Null Sector|Blizzard Entertainment|Blizzard|FPS|First-Person Shooter|Team-Based Shooter|Objective-Based Shooter|Shooter|Action Game|Team Game|Objective-Based Game|Multiplayer Game|Hero Shooter|Hero|Heroes|Hero Abilities|Future|Near-Future|Sci-Fi","289845","40193","550","2918","https://i.ytimg.com/vi/GubjHz5--6M/default.jpg","False","False","Permaneçam juntos.Quando o Setor Nulo ataca, Winston reúne um pequeno time de ataque para conter a invasão. Mas quando a esperança começa a esvanecer, o time precisa permanecer junto para superar as probabilidades.Saiba mais: http://www.playoverwatch.comSiga-nos no Facebook: http://www.facebook.com/overwatchbrasilSiga-nos no Twitter: http://www.twitter.com/OverwatchBrasil Siga-nos no Instagram: https://www.instagram.com/playoverwatchbrasil"
"31LTnAMKT2k","“Inverdade”, afirma Pai de Gérson sobre saída! Tudo sobre R. Caio e Pitty! Milton ataca FLA de novo!","2019-11-02T12:41:06.000Z","UCvft5hNFTEUsRPmMN2rWYRA","Paparazzo Rubro-Negro","17","19.03.11","Flamengo|Fla|Mengo|Mengão|Mercado|Mercado da Bola|Vai e Vem|Gol|Gols|Jorge Jesus|Contratação|Gérson|Santos|Corinthians|FLAxCOR|Gabigol|Hernane Brocador|Rodrigo Caio|Zagueiro|Pitty Martinez|River Plate|Buser|Buser Brasil","85998","14152","138","985","https://i.ytimg.com/vi/31LTnAMKT2k/default.jpg","False","False","#MercadodaBola #Flamengo #BuserBrasil Seja Membro do Clube do Canal e concorra a Mantos e Agasalhos do Flamengo: https://www.youtube.com/channel/UCvft5hNFTEUsRPmMN2rWYRA/joinSiga a gente no Twitter: @paparazzornE Instagram: @paparazzorubronegroSiga os nossos Parceiros:@businesspromotora1 (sorteios de ingressos)@buser no Instagram e @buserbrasil no Twitter.@espacorubronegro (Cupom PAPA = 5% de desconto na loja)@lojasoficiaisdoflamengo (Cupom PAPA = 5% de desconto na loja)"
"aWiyQCsXG3Y","CORINGA NA VIDA REAL #DESAFIOS","2019-11-01T17:53:48.000Z","UChPa3fnlI3RKuzEbeEPKRFw","Everson Zoio","22","19.03.11","Everson Zóio|Zoio|DJ Zoio|Caraio|Vai pa puta que pariu|Para com isso que ta feio pa caraio|Minas Gerais|desafio do zoio|se é loco|Oazidéia|coringa|joker|2019|lançamento|filme|dublado|completo|legendado|musica|moradores de rua|mendigo|desafios|pegadinhas|humor|sociedade|publico|sao paulo|parodia coringa|risada coringa|dublador|imitador|cosplay coringa|alerquina|policia|spoliers|cinema|filme do ano|joaquin phoenix","413999","92729","796","5929","https://i.ytimg.com/vi/aWiyQCsXG3Y/default.jpg","False","False","Pensei em algo relacionado com o filme do CORINGANo filme, quiseram dar um recado de como a sociedade esta,No meu vídeo também quis mostrar a realidade da vida, onde somos tratado indiferentes e tambémpassar um recado pra quem vive reclamando da vidae ao mesmo tempo trazer um humor assim como sempre fuiespero que tenham gostado, eu gostei muito de gravar esse vídeodeixe seu like é muito importante pra eu saber se gostaram e se posso estar trazendo mais conteudos assim ASSISTA AO VÍDEO ANTERIORPASSANDO UM ANZOL NA BOCAhttps://youtu.be/kk9thi7Z7mwMANDEM DESAFIOS NO MEU INSTAGRAM, SIGAM LÁ https://goo.gl/xZcnWXCONTATO PROFISSIONAL contato@oficialzoio.com.brINSCREVAM MEU CANAL SECUNDÁRIOhttps://www.youtube.com/channel/UCi0aSU3x06FHJ2hUHgc0_XwINSTA KAIQUE https://goo.gl/npmUuPINSTA DO ALÉK https://goo.gl/gQh2ujINSTA DO ANTHONY (Sobrinho)https://goo.gl/wmTbLs??OUÇA NO SOUNDCLOUD ALGUMAS MUSICAS TOCADAS EM MEUS VÍDEOS https://goo.gl/xaiN6GFACEBOOK DO ZOIO .??http://goo.gl/d8xQUd??MEU GRUPO DE ZUEIRA NO FACE https://goo.gl/dpZrj1??TWITER https://goo.gl/2oE7xACODIGO PARA DESCONTO NO UBER ?7xo6z"
"oygrmJFKYZY","Dua Lipa - Don't Start Now (Official Music Video)","2019-11-01T13:00:11.000Z","UC-J-KZfRV8c13fOCkhXdLiQ","Dua Lipa","10","19.03.11","dua lipa|dua|new rules|dua leepa|idgaf|scared to be lonely|be the one|dua lipa dont start now|dua lipa dont start now video|dua new video|dua dont start now official video|dua lipa dont start now official video|dua dsn|dua lipa dont strat now|dua new song|dua new song 2019|if you don't wanna see me dancing with somebody|dont show up|dont come out|dont start caring about me now|nabil|nabil elderkin|nabil dua lipa|dua lipa nabil video|new dua","8941053","636265","14375","20916","https://i.ytimg.com/vi/oygrmJFKYZY/default.jpg","False","False","Don't Start Now is out everywhere! http://dualipa.co/dontstartnowFollow me online:Instagram:  https://dualipa.co/instagramFacebook: http://dualipa.co/facebookTwitter: http://dualipa.co/twitterYouTube: https://dualipa.co/youtubeSpotify: http://dualipa.co/spotifyApple Music: https://dualipa.co/apple-musicDeezer URL: http://dualipa.co/deezerAmazon Music: https://dualipa.co/amazonmusic"
"2kO9pNZFq_s","Gusttavo Lima - Carreira Solo - DVD O Embaixador In Cariri (Ao Vivo)","2019-11-01T14:02:47.000Z","UCXooz9whNJZBRTHi9AqdjPw","Gusttavo Lima Oficial","10","19.03.11","Slap Música|Arrocha|Música Sertaneja (Musical Genre)|Pop|Gustavo Lima|Gusttavo Lima|Gatinha Assanhada|Tchererê Tche Tche|Sony|Sony Music|Buteco|Buteco do Gusttavo Lima|Buteco do Gusttavo Lima 2|O Embaixador|Homem de Família|Abre o Portão Que Eu Cheguei|Que Pena Que Acabou|Apelido Carinhoso|Na Hora de Amar|Mil Vezes Cantarei|Cem Mil|Eu Não Iria|Sujeito|Carrinho na Areia|Milu|O Embaixador In Cariri|Cariri|Quem Traiu Levou|Perrengue|Carreira Solo|Caquinho","2393119","87499","1164","3346","https://i.ytimg.com/vi/2kO9pNZFq_s/default.jpg","False","False","#GusttavoLima #CarreiraSolo #OEmbaixadorEssa música faz parte do novo álbum do Gusttavo Lima, O Embaixador In Cariri, gravado em Crato/CE.INSCREVA-SE NO CANAL: http://tinyurl.com/youtubeGLCOMPRE E OUÇA: https://SMB.lnk.to/EmbaixadorInCaririVol2Produção: Gusttavo Lima e Newton FonsecaMixagem e Masterização: Rafael VargasDireção: Anselmo TroncosoCompositores: Zé André / Amanda Borges / Mateus CandottiGravadora: Sony MusicCARREIRA SOLO Meu coraçãoTá cansado de apanharBatendo errado por quem não quis me amarTá compensando mesmo é beber sozinhoSó um copo na mesaTo mais feliz com a minha cervejaE sem ter hora pra voltar do barEu vou seguir carreira solo, uô uôE to trocando o repertório, uô uôE pra quem acha que eu to sofrendoQue eu to malOuve o finalEu vou seguir carreira solo, uô uôE to trocando o repertório, uô uôE na minha cama o meu show segue normalCom participação especialSiga Gusttavo Lima nas redes sociais!Facebook: https://www.facebook.com/gusttavolimaoficial/Youtube: https://www.youtube.com/gusttavolimaoficialInstagram: https://www.instagram.com/gusttavolima/Twitter: https://twitter.com/gusttavo_limaSite: http://gusttavolima.com.br/"
"MZpbV15daX4","REUNIÃO COM QATAR AIRWAYS CONFIRMADA POR CANDIDATO A PRÊSIDENCIA | ÚLTIMAS NOTÍCIAS DO VASCO DA GAMA","2019-11-02T08:30:09.000Z","UCUzrTcQHWjvIF_XYTstdlbw","Mario Coelho Vasco","17","19.03.11","canal do vasco|globo esporte vasco|informacoes do vasco|mario coelho|mario coelho vasco|noticias do vascao|noticias do vasco|noticias do vasco com mario coelho|notícias do vasco da gama|noticias do vasco globo esporte|noticias do vasco hoje|novidades do vascao|novidades do vasco|ultimas noticias do vasco|vasco|vasco da gama hoje|vasco da gama noticias|vasco hoje|vasco noticias hoje|vasco reforços|investimento milionario no vasco|qatar airways no vasco|bb","54713","12516","124","508","https://i.ytimg.com/vi/MZpbV15daX4/default.jpg","False","False","✅GRUPO DE ZAP e SORTEIO DE 2 CAMISAS OFICIAIS DO VASCO POR SEMANA- VIRE MEMBRO E PARTICIPE ✅  https://www.youtube.com/channel/UCUzrTcQHWjvIF_XYTstdlbw/join● INSTAGRAM  https://www.instagram.com/mariocoelhovasco/✅GRUPO TELEGRAM: https://t.me/mariocoelhovascocanal● REUNIÃO COM QATAR AIRWAYS MARCADA, CONFIRMA CANDIDATO A PRÊSIDENCIA | ÚLTIMAS NOTÍCIAS, NOVIDADES E INFORMAÇÕES DO VASCO DA GAMA● CONTRATAÇÕES, REFORÇOS, DISPENSA DE JOGADORES E PATROCÍNIO PRO VASCO EM 2019● Últimas Notícias, Informações e Novidades Sobre o Vasco da Gama é aqui no Canal Mario Coelho Vasco● VIRE MEMBRO DO CANAL https://www.youtube.com/channel/UCUzrTcQHWjvIF_XYTstdlbw/join●  LOJA COM PRODUTOS OFICIAIS DO CANAL:https://www.colab55.com/@mariocoelhovascAAAAAEzZHW94uirGhamjLA-—Redes Sociais—● INSTAGRAM  https://www.instagram.com/mariocoelhovasco/● TWITTER https://twitter.com/mariocoelhovasc● FACEBOOK PAGINA https://www.facebook.com/mariocoelhovasco/● FACEBOOK GRUPO https://www.facebook.com/groups/1871209516241158/● VAQUINHA ONLINE PRO VASCO DIVIDA ZERO: https://www.vakinha.com.br/vaquinha/vamos-patrocinar-o-vasco-atraves-do-canal-mario-coelho-vasco ● SE TORNE SOCIO TORCEDOR https://prod.sociogigante.com/planos●  INSCREVA-SE NO MEU NOVO CANAL NO LINK ABAIXO:https://www.youtube.com/channel/UCd1NcNvfCl-nEp18ks5B5HQ●  VIRE SÓCIO TORCEDOR DO VASCO:https://sociogigante.com/Email De Contato do Canal : canalmariocoelhovasco@gmail.com✅ *INSCREVA-SE NO CANAL* Futebol & Papo Furado: https://www.youtube.com/c/PapoFuradocanal✅ *NAVEGADOR BRAVE* INSTALE NO LINK: https://brave.com/ict266✅ *R$179 DE PRESENTE DO CANAL* - https://www.airbnb.com.au/c/marioc5938?currency=BRL"
"gNBvgWAIM4I","Gaab e Chris - O que você pensa de mim (Prod. Malak)","2019-11-01T14:00:13.000Z","UCqrFwa5vueOTzGZ7NSlnvlQ","PineappleStormTV","10","19.03.11","rap|nacional|pineapple|brainstorm|costa|gold|poetas|no|topo|perfil|acustico|ducon|contra|corrente|menestrel|sagaz|cone|crew|diretoria|cacife|clandestino|filipe|ret|marcelo|d2|sain|bloco|djonga|baco|froid|choice|oriente|3030|haikaiss|quinto|andar|sintese|neto|modestia|parte|diomedes|chinaski|shawlin|morcego|caixa|baixa|coringa|um44k|luccas|carlos|cartel|king|mac|delarima|piramide|perdida|don|cesao|racionais|rzo|negra|li|flora|chris|gaab|o que você pensa de mim","614471","75855","965","1368","https://i.ytimg.com/vi/gNBvgWAIM4I/default.jpg","False","False","Uma Realização Pineapple Storm Records.Música- O que você pensa de mimVoz - Gaab e Chris | @gaab @chrismcoficialComposição: Gaab, Rafa Chagas e ChrisProdução: Musical - Lucas Malak | @salvemalakPiano: Fabricio TenórioProdução Executiva - Paulo Alvarez | @pauloalvarezzProdução Audiovisual : TNV’MOB | @tunaoviumob Direção: Gabriel Solano I @solanoav Assist. Direção: Luiz Ferreira | @pxrrxluizDireção de Fotografia: Brandon Barcellos | @brandonbarcellos Operador de Câmera: Gabriel Solano e Brandon BarcellosRoteiro: TNV’MOB | @tunaoviumob Produção: Stéfani Pettená | @stefanipettena Assist. de Produção: Paulo Grow | @paulogrow2º Assist. de Produção: Thafarel Sobral | @thafarelsobralFigurinista: Ana Luísa Dantas | @analuzdantasMake: Danilo Sallens | @danilosallenssallensFotografia Still: Cadu Andrade | @caduandradeeMaking of : Lener Medina | @lener_medinaEdição/Finalização : Jorge Gabriel | @jgborges94Cattering: Silvia BarandaModelos: Brenda Black | @brendablackdiasGabi Pereira | @pereiragabis_NOVA LOJA ONLINE PINEAPPLE:https://www.pineapplesupply.com.br/loja/"
"XrsHU9qvxpk","Maiara e Maraisa - Minha Pessoa Errada - EP Aqui Em Casa","2019-11-01T14:00:05.000Z","UCULzCZWkkOb9dW8rr6dguQQ","Maiara e Maraisa","10","19.03.11","maiara e maraisa|sentimento seu nenhum|nem tchum letra|te amo e vc nem tchum|nem tchum|maiara e maraisa 2019|medo bobo|marilia mendonça|trai sim maiara e maraisa|mayara e maraysa|quer ficar com ela fica|oi tchau|sertanejo 2019|separada maiara e maraisa|se olha no espelho|cristiano araujo|sertanejo|aí eu bebo|ai eu bebo|marilia mendonça 2019|nao abro mao|no dia do seu casamento|naiara azevedo|workshow|feminejo","493041","30912","339","2806","https://i.ytimg.com/vi/XrsHU9qvxpk/default.jpg","False","False","INSCREVA-SE NO NOSSO CANAL: https://goo.gl/8rlBhZ Para shows: (62) 3241-7163 / (62) (62) 9 9944-3121comercial@maiaraemaraisa.com.br#MaiaraeMaraisa👉 Ouça ou baixe Minha Pessoa Errada: https://SomLivre.lnk.to/Minha_Pessoa_Errada-Um_Pelo_Outro_Ao_Vivo👉 Ouça ou baixe o álbum REFLEXO: https://SomLivre.lnk.to/Reflexo_Ao_VivoMinha Pessoa Errada  [ Letra ]Composição: Anajuh/ Elcio di Carvalho/ Gustavo Martins/ Chirsthyan RibeiroNão precisa A gente terminar com briga Você já me fez tão bem merece ser feliz e eu também Só vai mudar o beijo Da boca vai pro rosto Não vai mudar o respeito Que a gente tem um pelo outro Não apaga meu  telefone Só muda de amor pra meu nome Não é porque você não ama Não é porque você não beija bem Não é minha pessoa errada Só é a pessoa certa de outro alguém"
