video_id,title,publishedAt,channelId,channelTitle,categoryId,trending_date,tags,view_count,likes,dislikes,comment_count,thumbnail_link,comments_disabled,ratings_disabled,description
"PrwgJTZvkZA","Cash| Ali,Posani Krishna Murali,Vidyullekha,Kalpika | 30th November 2019  | Full Episode | ETV","2019-11-30T18:47:10.000Z","UCSs9H1cyB3OHdy8wkit8ZKg","etvteluguindia","24","19.01.12","cash|anchor suma|etv telugu|etv comedy show|jabardasth|extra jabardasth|suma dance|funny game show|reality show|naga babu|roja|anchor anasuya|dhana dhan dhanraj|comedy spoofs|chamak chandra|chalaki chanti|rocket raghava|roller raghu|venu wonders|getup sreenu|comedy show|comedy|anchor reshmi|comedy skits in telugu|roja dance|telugu comedy tracks|allari harish|yedukondalu|racha ravi|adhire abhi|fata fat fun|super sreenu|sudigaali sudheer","394888","3491","446","124","https://i.ytimg.com/vi/PrwgJTZvkZA/default.jpg","False","False","Cash    #Cash #TeluguShow #ETVWinTo watch your ETV all channel’s programmes any where any time Download ETV Win App for both Android & IOS: https://f66tr.app.goo.gl/appsETV Telugu(Youtube) - http://bit.ly/2QR0yu9  Facebook - http://bit.ly/2L2GYYhETV Jabardasth(Youtube) - http://bit.ly/35xdqtuETV Dhee(Youtube) - http://bit.ly/2Ok8zWFETV Plus India(Youtube) - http://bit.ly/2OlEAOgFacebook - http://bit.ly/2DudC0tETV Abhiruchi(Youtube) - http://bit.ly/2OkEtTbFacebook - http://bit.ly/2OSrIhvETV Life(Youtube) - http://bit.ly/2OiKAY6Facebook - http://bit.ly/34tiqzkETV Telangana(Youtube) - http://bit.ly/33nRaAKFacebook - http://bit.ly/37GkVQFETV Andhra Pradesh(Youtube) - http://bit.ly/2OKARZzFacebook - http://bit.ly/2R0vs3k► Like us on Facebook : https://www.facebook.com/etvwin► Follow us on Instagram : https://www.instagram.com/etv_win/► Follow us on Twitter : https://twitter.com/ETV__Win► Visit Website : https://www.etvwin.com/► Pin us on Pinterest: https://in.pinterest.com/etv_win/"
"6mHRlA0B-Rk","Chhudake Daman || Satyajeet Jena || Official Video || New Hindi Sad Songs 2019","2019-11-27T00:30:12.000Z","UCP_b12xavk-H9EXp5JXLOEA","Satyajeet Jena Official","10","19.01.12","chhudake daman satyajeet jena|chhudake daman|#ChhudakeDaman|satyajeet jena song|satyajeet jena songs new 2019|satyajeet jena new song|satyajeet jena songs new|satyajeet jena songs|satyajeet jsatyajeet jena songs|satyajeet jena new song 2019|satyajeet jena official new song|satyajeet jena official|new song|Chhudake Daman Tera|hindi song|satyajit jena|satyajeet jena|Satyajeet Jena|satyajeet all song 2019|satyajeet all song|#satyajeetnewdjsong","1014770","45225","1571","2839","https://i.ytimg.com/vi/6mHRlA0B-Rk/default.jpg","False","False","A Heart Touching Soulful Sad Song By Satyajeet Jena.Keep Watching.....!!!Credits''''''''''''''''''''''''''♪ Song - Chhudake Daman♪ Singer - Satyajeet Jena♪ Music - Satyajeet Jena♪ Produce, Mix & Master - Satyajeet Jena♪ Lyrics - Guman Charan Jena♪ Director & Editor - Rajat Parida♪ Assistant - Lohit Bagh♪ Cameras - Raja Kishore & BabulAlso Listen On -JioSaavn - https://www.jiosaavn.com/song/chhudake-daman/Al8sSCBoaFIiTunes - https://geo.itunes.apple.com/at/album/id1489167605?at=1l3v9Tx&app=itunesGoogle Play - https://play.google.com/store/search?q=Chhudake%20Daman&c=musicSpotify - http://open.spotify.com/album/25bJDvADu8oYwI9V1JkBjMAmazon Music - https://www.amazon.com/Chhudake-Daman-Satyajeet-Jena/dp/B081Z66MX2/ref=sr_1_1?keywords=Satyajeet+Jena&qid=1574828643&s=dmusic&search-type=ss&sr=1-1Back Stage - https://backl.ink/98866526YouTube Music - https://music.youtube.com/watch?v=JIXPxgogyDg&feature=share-------------------------------------------------------------------------------------© All Copyrights Reserved To Believe Music.-------------------------------------------------------------------------------------Plz... Share & Subscribe for MoreIf you really like this video.... Please Share & Subscribe my dear Viewers...Thanks for watching me- Plz Share/ Subscribe/ Like/ Comment.Follow Me on Twitter-https://twitter.com/music_satyajeetFollow Me on:  Instagram-https://www.instagram.com/satyajeetjena_official/Follow Me on:  Facebook-https://www.facebook.com/satyajeetjenaztvYou can see & subscribe my sister's Channel- SUBHASHREE JENAClick here to visit her channel- https://www.youtube.com/subhashreejenaFollow Subhashree Jena on:  Instagram-https://www.instagram.com/subhashree....Follow Subhashree Jena on:  Facebook-https://www.facebook.com/subhashree.j...#ChhudakeDaman  #SatyajeetJena_Official  #HeartTouchingSadSong"
"1rP8o0YLjAE","বিধানসভা উপনির্বাচনের ফলাফল : Kaliaganj-এ ২৩০৪ ভোটে জয়ী TMC প্রার্থী","2019-11-28T06:28:34.000Z","UCbf0XHULBkTfv2hBjaaDw9Q","News18 Bangla","25","19.01.12","West Bengal by election result live updates|By-election Results 2019 LIVE|West Bengal By Election Result 2019 Live Updates|West Bengal Election Results Live Update 2019|By-election Results 2019 Live|by-elections Results Karimpur|by-elections Results Kharagpur Sadar|by-elections Results Kaliaganj|trinnamool|bharatiya janata party|congress cpim alliance|election latest news|news on by poll election|bangla news today|news 18|latest news|news18 live|banglar khobor","350100","1736","268","191","https://i.ytimg.com/vi/1rP8o0YLjAE/default.jpg","False","False","বিধানসভা কেন্দ্র - Karimpur, Kharagpur Sadar ও Kaliaganj-এ  উপনির্বাচনের ফলাফল : Kaliaganj-এ ২৩০৪ ভোটে জয়ী TMC প্রার্থী তপনদেব সিনহা News 18 Bangla is an exclusive news channel on YouTube which streams news related to West Bengal, Nation and the World. The channel also has contemporary topic based debate and subject special series which are interesting & informative. Our channel aims to update the viewers with the current news.নিউজ 18 বাংলা একটি আঞ্চলিক নিউজ চ্যানেল যেখানে আপনি পশ্চিমবঙ্গের, দেশের এবং বিশ্বের নানা খবর জানতে পারবেন। খবরের সঙ্গে আপনি এই চ্যানেলে সমসাময়িক বিতর্ক ও তথ্যপূর্ণ স্পেশাল সিরিজ দেখতে পারবেন।Follow Us On:YouTube : Subscribe to our channel for latest news updates: https://tinyurl.com/y2lvqmxjTwitter :  https://twitter.com/News18BengaliFacebook : https://www.facebook.com/News18Bangla/Our Official Website : https://bengali.news18.com/"
"BSioUvySgJQ","Full Talk #3 By Sandeep Maheshwari - What do we really want?","2019-11-27T12:30:11.000Z","UCBqFKDipsnzvJdt6UT0lMIg","Sandeep Maheshwari","22","19.01.12","Positive|Thinking|thoughts|best|intelligence|stress|manage|how to|feelings|latest|fear|attitude|fearless|latest 2019|2019|motivational video|spirituality|students|for students|study|studies|practical|tips|motivation|communication|love|comedy|confidence|time|loneliness|depression|anxiety|akele|rehna|seekho|video|videos|motivational speech|speech|overcome","663910","40915","791","3540","https://i.ytimg.com/vi/BSioUvySgJQ/default.jpg","False","False","Sandeep Maheshwari is a name among millions who struggled, failed and surged ahead in search of success, happiness and contentment. Just like any middle class guy, he too had a bunch of unclear dreams and a blurred vision of his goals in life. All he had was an undying learning attitude to hold on to. Rowing through ups and downs, it was time that taught him the true meaning of his life.To know more, log on to www.sandeepmaheshwari.comFacebook: https://www.facebook.com/sandeepmaheshwaripageInstagram: https://www.instagram.com/sandeep__maheshwariTwitter: https://twitter.com/sandeepseminarsMusic: Youtube Music Library"
"Y0gUFmOgQBc","Bigg Boss 13 Review: बिग बॉस ने दी Paras को सजा Asim की गरीबी पे मजाक उड़ाने पर","2019-11-29T06:31:51.000Z","UC2tRhjkebu5aSo0IYcTtX2Q","pressnews tv","24","19.01.12","bb13|shehnaz fight|shehnaz himanshi rivalry|captain|bb13 captian|himanshi khurrana|shefali zariwali|aarti singh|wild card contestants|bb13 latest episode|bb13 shefali zariwala|siddharth shukla fight|paras chabbra|paras chabbra mahira sharma|weekend ka vaar|bb13 today episode|rashami siddharth fight|devoleena angry|asim riaz|rashami desai|mahira sharma|bigg boss 13 full episode|hindustani bhau|siddharth aarti fight","234361","1575","99","317","https://i.ytimg.com/vi/Y0gUFmOgQBc/default.jpg","False","False","Bigg Boss 13 Review: बिग बॉस ने दी Paras को सजा Asim की गरीबी पे मजाक उड़ाने पर #BiggBoss13 #SiddharthShukla #ShehnazGill #pressnewstv - first hand account of news videos in Hindi, Telly Updates, Bollywood News 2019, Celebrity News, Trending Stories, Social Media Buzz, Exclusive Interviews etc. Follow #PNTV & Stay Updated!  ►Subscribe us on YouTube @ http://bit.do/pressnewstv►Follow on Facebook @ https://www.facebook.com/pressnewstv►Follow on Instagram @ https://www.instagram.com/pressnewstv►Follow On Twitter  @ https://twitter.com/pressnewstv"
"FsD2BHAPWK0","Bigg Boss 13 Returns | SAMREEN ALI","2019-11-30T09:00:24.000Z","UC0cHVZAeY_qxI7Z-7nJFXkg","Samreen Ali","23","19.01.12","samreen ali|samreen ali funny videos|samreen ali videos|samreen ali bigg boss|samreen new videos|funny vines|samreen ali vlogs|bigg boss 13|bigg boss review|bigg boss 13 sneak peak|samreen tahura|bigg boss|bigg boss 13 update|bigg boss 13 contestants|bigg boss 13 house|big boss funny video|bigg boss funny videos|best big brother moments|bigg boss spoof|types of people|bigg boss season 13|bigg boss best scenes|samreen and tahura|hindi funny video","164253","8594","665","1189","https://i.ytimg.com/vi/FsD2BHAPWK0/default.jpg","False","False","Bigg Boss 13 Returns | SAMREEN ALIInstagram - https://www.instagram.com/samreenali142/Subscribe its free: http://bit.ly/samreenaliHi! My name is Samreen and I make funny videos.! Most importantly, I smile a lot and want to make you feel happy. Subscribe! Subscribe to my Sister's Channel: https://goo.gl/Y33HGT----------------------------------------------THIS WAS JUST FOR FUN!----------------------------------------------Actress   :Samreen Ali & TahuraScript      :Mahjabeen AliEdited By:Mahjabeen AliInstagram - https://www.instagram.com/samreenali142/Facebook https://www.facebook.com/alisamreen42Thank You For Watching...... |Samreen Ali|#BIGGBOSS13 #samreenali #comedy"
"N9VRGVsxXcA","Kundali Bhagya | कुंडली भाग्य | Mon-Sun | 8:30 PM | Promo | #ZeeAnmol","2019-11-30T11:57:03.000Z","UCqjizN9AS-Bub9bx-9vT4PA","Zee Anmol","24","19.01.12","Kundali Bhagya|Kundali bhagya full epsiode today|kundali bhagya today epsiode|kundali bhagya today|kundali bhagya epsiode terakhir|kundali bhagya natak|kundali bhagya serial|kundali bhagya today promo|kundali bhagya today preview|kundali bhagya aaj ka episode|preeta and karan romance|preeta and karan dance|zee tv|zee5|kundali bhagya epsiode|kundali bhagya zee anmol|zee anmol kumkum bhagya|zee anmol serial|कुंडली भाग्य|कुंडली भाग्य आज का एपिसोड|drama|serials","103762","668","26","7","https://i.ytimg.com/vi/N9VRGVsxXcA/default.jpg","False","False","ZEE5 Now available in 190+ countries. Click Here ►http://bit.ly/WatchNowOnZEE5To watch Full Episode of Kundali Bhagya, CLICK here - https://www.zee5.com/tvshows/details/kundali-bhagya/0-6-366'Kundali Bhagya' is a Hindi drama television series starring Shraddha Arya, Dheeraj Dhoopar and Manjit Joura. The story revolves around the two sisters of Pragya, from Kumkum Bhagya. Her sisters are Preeta and Shristhi who discover the existence of their mother Sarla and sister Pragya, after their father’s death. The sisters try to unite with their mother and sister.The feel of your language is in your entertainment too! Watch your favourite TV shows, movies, original shows, in 12 languages, because every language has a super feel! To Feel ZEE5 in Your Language, DOWNLOAD the app now ZEE5 Now available in 190+ countries. Click Here http://bit.ly/WatchNowOnZEE5 - Playstore: https://play.google.com/store/apps/de...- iTunes: https://itunes.apple.com/in/app/ozee-...Visit our website - https://www.zee5.com Connect with us on Social Media: - Facebook - https://www.facebook.com/ZEE5/ - Instagram - https://www.instagram.com/zee5 - Twitter - https://twitter.com/ZEE5India"
"8ElAqhzz1UI","Draw It or Eat It Food Challenge!","2019-11-28T20:00:02.000Z","UCWwqHwqLSrdWMgp5DZG5Dzg","Troom Troom","26","19.01.12","Challenge|Food Challenge|Draw It|Draw It or Eat|Draw It or Eat It|Food|Draw It or Eat It Food Challenge!","724351","13938","1116","442","https://i.ytimg.com/vi/8ElAqhzz1UI/default.jpg","False","False","Subscribe Here: https://www.youtube.com/channel/UCWwqHwqLSrdWMgp5DZG5Dzg?sub_confirmation=115 Types of Students in Class: https://youtu.be/E-ZBz4ToXTk?list=PLy0LaulZe0vSzNLVwlQZVJszbLCsIwl_CWe came up with another fun challenge with food! If you do not want to eat pizza with condensed milk, lemon or raw chicken, you will have to work hard to beautifully draw this food. Otherwise, you lose!Watch More Troom Troom: Popular Videos:14 Weird Ways To Sneak Food Into Class / Back To School Pranks:  https://youtu.be/W5p2ndS34vA18 Funny Pranks! Prank Wars! https://youtu.be/yWazGzCNtJ411 DIY Edible Makeup Ideas/11 Funny Pranks:  https://youtu.be/kewz3hF63Xo17 Weird Ways To Sneak Makeup Into Class:  https://youtu.be/bvhBIsmzhwEGummy Food vs Real Food Challenge!  https://youtu.be/jBIG6GsQcq8Popular Playlists:Funny Pranks: https://www.youtube.com/playlist?list=PLy0LaulZe0vRyRDcwVaqbvnbSqhSQNtS-Back to School: https://www.youtube.com/playlist?list=PLy0LaulZe0vSzNLVwlQZVJszbLCsIwl_CLife Hacks: https://www.youtube.com/playlist?list=PLy0LaulZe0vSljAapkasaxsIKJp7I-7j0Beauty And Makeup Hacks: https://www.youtube.com/playlist?list=PLy0LaulZe0vSUQifjokDaw5m9aIgOQKt-Home Décor: https://www.youtube.com/playlist?list=PLy0LaulZe0vRWdxuF7xEwK_eJV2cZ8dt0Follow Troom Troom:Subscribe: https://www.youtube.com/channel/UCWwqHwqLSrdWMgp5DZG5Dzg?sub_confirmation=1Instagram: https://www.instagram.com/troomtroom/Facebook: https://www.facebook.com/troomhandsPinterest: https://pinterest.com/troomtroom/Troom Troom Español: Subscribe: https://www.youtube.com/channel/UCu6oyJJ6PlkeNNv6n26ZNyA?sub_confirmation=1Troom Troom Française:Subscribe: https://www.youtube.com/channel/UCyNeKmBHI10u4bwYEKimlZA?sub_confirmation=1Troom Troom Russian: Subscribe: https://www.youtube.com/channel/UCq1JpGFxcZTbbOAz010U-og?sub_confirmation=1Troom Troom Deutsch:Subscribe:  https://www.youtube.com/channel/UCzgmxZIlgfH1fgch7OpigIA?sub_confirmation=1Troom Troom Chinese:Subscribe:  https://www.youtube.com/channel/UCV3NWBs2K7pOEGmI4w_2dhg?sub_confirmation=1Troom Troom Português:Subscribe: https://www.youtube.com/channel/UCgCQlMYN2XypwYC2wcR32bA?sub_confirmation=1Troom Troom Japanese:Subscribe: https://www.youtube.com/channel/UCPCwT9JMWPjg6xAWrQxhQaw?sub_confirmation=1About Troom Troom: Easy DIY how to video tutorials. DIY Accessories, Scrapbooking Cards, Home Décor, Make Up Tutorials, Life Hacks, and MUCH more! Make it easy! For any business enquires please contact me at: troomtroomdiy@gmail.comQuestion of the Day: did you like our artistic food challenge? Comment Below!Don’t forget to turn on notifications, like, & subscribe!"
"FtHnGvFoOQo","Maharashtra में BJP की 6 ग़लतियां जिनके कारण पीछे हटना पड़ा (BBC Hindi)","2019-11-27T07:29:52.000Z","UCN7B-QD0Qgn2boVH5Q0pOWg","BBC News Hindi","25","19.01.12","BBC Hindi|hindi news|news in hindi|महाराष्ट्र|भाजपा|शिवसेना|महाराष्ट्र राजनीति|शिवसेना एनसीपी कांग्रेस|महाराष्ट्र बीजेपी|उद्धव ठाकरे|आदित्य ठाकरे|देवेंद्र फडनवीस|शरद पवार|बीबीसी हिन्दी|maharashtra|BJP|shivsena|congress|ncp|uddhav thackeray|devendra fadnavis|sharad pawar|maharashtra bjp|ncp shivsena alliance|aditya thackeray|bbc hindi|amit shah|narendra modi|raj thackeray|bala saheb tackeray|ajit pawar|ncp bjp maharashtra","1179104","0","0","1396","https://i.ytimg.com/vi/FtHnGvFoOQo/default.jpg","False","True","महाराष्ट्र की राजनीति के पल-पल बदलते घटनाक्रम ने कम से कम ये तो साबित कर ही दिया था कि राजनीति में कभी भी कुछ भी हो सकता है. लेकिन सवाल ये उठता है कि गोवा, मणिपुर और हरियाणा में सरकार बना लेने वाली बीजेपी से आख़िर चूक कहां हुई.सुनिए वरिष्ठ पत्रकार प्रदीप सिंह का नज़रिया.आवाज़: पंकज प्रियदर्शीऐसे ही और दिलचस्प वीडियो देखने के लिए चैनल सब्सक्राइब ज़रूर करें-https://www.youtube.com/channel/UCN7B-QD0Qgn2boVH5Q0pOWg?disable_polymer=trueबीबीसी हिंदी से आप इन सोशल मीडिया चैनल्स पर भी जुड़ सकते हैं-फ़ेसबुक- https://www.facebook.com/BBCnewsHindiट्विटर- https://twitter.com/BBCHindiइंस्टाग्राम- https://www.instagram.com/bbchindi/बीबीसी हिंदी का एंड्रॉयड ऐप डाउनलोड करने के लिए क्लिक करें- https://play.google.com/store/apps/details?id=uk.co.bbc.hindi"
"30Fc9Q00iws","Akshay Kumar Blockbuster Comedy Scenes | Rajpal Yadav | Paresh Rawal | Bhagam Bhag | Comedy Movie","2019-11-25T12:30:01.000Z","UCF1JIbMUs6uqoZEY1Haw0GQ","Shemaroo","24","19.01.12","Shemaroo|Shemaroo Entertainment|ShemarooMovies|Shemaroovideos|Bhagam Bhag|Akshay Kumar|Best Comedy|Best Hilarious Scenes|Bollywood Movie Scenes|Hindi Movie Scenes|Scenes Compilation|Part 2|full movie|funny scenes|paresh rawal|hindi movies new|hindi movies|new hindi movie|hindi comedy|akshay kumar movies 2019|hindi comedy video|comedy scenes|paresh rawal comedy|akshay kumar comedy scenes|akshay kumar movies|lara dutta|best comedy scenes","6782483","47743","4650","1460","https://i.ytimg.com/vi/30Fc9Q00iws/default.jpg","False","False","Subscribe to Shemaroo - http://bit.ly/2DNFnzFDownload the app now and share it with all the asli fanshttp://twd.bz/shemaroome Give a missed call on 18002665151 www.shemaroome.comClick the CC icon and watch with English/Arabic SubtitlesChampak Chaturvedi, the creator of a theatre group, is offered a chance perform a show in London. Bunty and Babla are two wannabes and skirtchasers in his group, always at loggerheads with each other to covet the role of the hero. Their behaviour causes the heroine to run away. This really upsets the organizer, who got offered with the chance just because of the heroine. Champak tells the duo that whoever gets a new actress will get a chance to become hero. Bunty and Babla now take this as a challenge and set out to find a heroine for the show. But this leads them into a situation full of mess and hilarious situation.SUBSCRIBE for the best Bollywood videos, movies and scenes, all in ONE channel http://www.YouTube.com/ShemarooEnt.Like, Comment and Share with your friends and family. Watch more Bollywood videos and movies starring your favourite celebrities like Amitabh Bachchan, Raj Kapoor, Dharmendra, Zeenat Aman, Vidya Balan, Govinda, Salman Khan and many more, only on http://www.YouTube.com/ShemarooEnt Connect with us on :- Facebook -http://www.Facebook.com/Shemaroo.Ente... Twitter http://Twitter.com/BollyFilmVideosSign up for Free and get daily updates on New Videos, exclusive Web Shows, contests & much morehttp://youtube.shemaroo.com/default.aspxSend us your feedback and suggestions at : connect@shemaroo.comSUBSCRIBE for the best Bollywood videos, movies and scenes, all in ONE channel http://www.YouTube.com/ShemarooEnt. Like, Comment and Share with your friends and family. Watch more Bollywood videos and movies starring your favourite celebrities like Amitabh Bachchan, Raj Kapoor, Dharmendra, Zeenat Aman, Vidya Balan, Govinda, Salman Khan and many more, only on http://www.YouTube.com/ShemarooEnt Facebook - https://www.facebook.com/ShemarooEnt Twitter - https://twitter.com/ShemarooEnt Google+ -https://plus.google.com/+shemaroo Pinterest - http://pinterest.com/shemarooSUBSCRIBE for the best Bollywood videos, movies and scenes, all in ONE channel http://www.YouTube.com/ShemarooEnt.Sign up for Free and get daily updates on New Videos, exclusive Web Shows, contests & much morehttp://youtube.shemaroo.com/default.aspxSend us your feedback and suggestions at : connect@shemaroo.com"
"I1LjVSG6B38","Daku Faulad Se Takkar - Arjun Prince of Bali","2019-11-28T12:31:02.000Z","UCiBigY9XM-HaOxUc269ympg","Green Gold","24","19.01.12","[none]","358241","2259","571","0","https://i.ytimg.com/vi/I1LjVSG6B38/default.jpg","False","False","Arjun - The Prince of Bali & the King of Bali are listening to the crimes committed by Daku Faulad. King passed a judgment stating that Daku Faulad has to spend the rest of his life in jail. Arjun’s sister dancer Tanya impresses everyone in Rajmahal with her dance. But Arjun points out that there might be some best dancers outside other than Tanya. Now Tanya is on way to Nagada Kabila to compete with the dancer Shakthi. Suddenly, Daku Faulad & other prisoners escape from the prison and the Kingdom of Bali is in danger! Will Arjun be able to protect the Kingdom of Bali from Daku Faulad & Tanya from upcoming troubles? Watch more video of Arjun, Chhota Bheem and other Characters on our YouTube Channel @GreenGoldTVSubscribe for more videos: http://bit.ly/greengoldtvArjun Playlist: https://bit.ly/2mmdRWdFollow us Facebook : https://www.facebook.com/welovechhotabheemInstagram: https://www.instagram.com/chhotabheemTwitter  : https://www.twitter.com/iamchhotabheem"
"SE7Yx_b0bE8","NOT A DARING SHOW FT. WAKAR ZAQA  | CARRYMINATI","2019-11-24T12:54:57.000Z","UCj22tfcQrWG7EMEKS0qLeEg","CarryMinati","23","19.01.12","CarryMinati|Carry|Indian|youtuber|#CarryMinati|roast|CARRYMINATI WAKAR ZAQA|WAKAR ZAQA|CHAMPIONS|CARRYMINATI ROAST CHAMPIONS","9532924","1409617","27815","63023","https://i.ytimg.com/vi/SE7Yx_b0bE8/default.jpg","False","False","CarryisLive :  https://www.youtube.com/channel/UC0IWRLai-BAwci_e9MylNGwSnapchat► heyAjeyInstagram► https://www.instagram.com/carryminati/Facebook ► https://www.facebook.com/CarryDeol/Twitter ► https://twitter.com/CarryMinati About CarryMinati : Youthoob certified memberˍˍˍˍˍˍˍˍˍˍˍˍˍˍˍˍˍˍˍˍˍˍˍˍˍˍˍˍˍˍˍˍˍˍˍˍˍˍˍˍˍˍˍˍˍˍˍˍˍˍˍˍˍˍˍˍˍˍˍˍˍˍˍˍˍˍˍˍˍˍˍˍˍˍˍˍˍˍˍˍˍˍˍˍˍˍˍˍˍˍˍˍˍˍˍˍOutro: Zindagi(unreleased) SOURCE► Bol Network Disclaimer : DISCLAIMER: Please don't go out of your way to  or hate on anyone I talk about in my videos, this channel is to entertain people and I usually focus on joking about what the people are doing not the individual themselves, please don't go spreading hate it's all for laughs Copyright Disclaimer Under Section 107 of the Copyright Act 1976, allowance is made for fair use for purposes such as criticism, comment, news reporting, teaching, scholarship, and research. Fair use is a use permitted by copyright statute that might otherwise be infringing. Non-profit, educational or personal use tips the balance in favor of fair use.ˍˍˍˍˍˍˍˍˍˍˍˍˍˍˍˍˍˍˍˍˍˍˍˍˍˍˍˍˍˍˍˍˍˍˍˍˍˍˍˍˍˍˍˍˍˍˍˍˍˍˍˍˍˍˍˍˍˍˍˍˍˍˍˍˍˍˍˍˍˍˍˍˍˍˍˍˍˍˍˍˍˍˍˍˍˍˍˍˍˍˍˍˍˍˍˍˍ"
"NDkCEFmYfE4","Coke Studio Season 12 | Aaye Kuch Abr | Atif Aslam","2019-11-29T12:00:11.000Z","UCM1VesJtJ9vTXcMLLr_FfdQ","Coke Studio","10","19.01.12","coke studio|coke studio season 9|cocacola pakistan|coke studio pakistan|strings|season 7|fusion music|coke studio 12|rohail hyatt","3156297","56723","3675","3429","https://i.ytimg.com/vi/NDkCEFmYfE4/default.jpg","False","False","#CokeStudio12 presents an incarnation of Faiz Ahmed Faiz’s poetry in the voice of Atif Aslam with Aaye Kuch Abr. Speaking of solitude and finding personal solace in life’s little pleasures, the ghazal provides a space for one to find the common humanity in one's own experiences.  Produced by: Rohail HyattOriginal Artist: Mehdi HassanPoetry by: Faiz Ahmed FaizComposed by: Mehdi HassanCopyright in the original works for the original song owned or otherwise controlled by -“EMI (Pakistan) Ltd”Coke Studio Season 12, Episode 6"
