video_id,title,publishedAt,channelId,channelTitle,categoryId,trending_date,tags,view_count,likes,dislikes,comment_count,thumbnail_link,comments_disabled,ratings_disabled,description
"W6lr2Rpht9w","買って良かったモノ！10月版","2019-11-01T10:00:07.000Z","UCVPz_nauEJpqPxxvYiOpCHQ","カズチャンネル/Kazu Channel","26","19.03.11","Kazu|カズ|商品レビュー","171254","1739","161","181","https://i.ytimg.com/vi/W6lr2Rpht9w/default.jpg","False","False","第1位 https://youtu.be/RdrE5KWi92o第2位 https://youtu.be/AzqCw4jJvhg第3位 https://youtu.be/f5AM6ZOBAzE第4位 https://youtu.be/STGqGa4I9sw第5位 https://www.amazon.co.jp/o/ASIN/B07TQS4FTX/kazuch09240a-22第6位 https://youtu.be/IK3-YlIKEGsBOSE FRAMES ALTO専用 オプション偏光レンズ ミラードシルバーhttps://www.amazon.co.jp/o/ASIN/B07X32G8KW/kazuch09240a-22【カズさん出演イベント情報】CYCLE MODE international 2019会場：幕張メッセ 国際展示場 9～11ホール日時：11月2日（土）～ 11月4日（月・祝）※カズさんが出演するのは11/3のみです。http://www.cyclemode.net/2019/＜編集者コメント＞ノブです。今月の買って良かったは実用的なモノばかりでしたね。皆様も買って損はないと思いますよ。でも、散財のし過ぎで後々困らないようによくお財布と相談して下さいね。なんて言ってる私も今月は久々の自作PCで散財させて頂きました…ちょ、待てよ！？結構お財布ピンチかも！↓使用機材GH5s http://amzn.to/2BJzI07GH5 http://amzn.to/2qUiFDhレンズズーム http://amzn.to/2pWbd6zレンズ単焦点 http://amzn.to/2qvsw1sマイク大 http://amzn.to/2qyT53Qマイク小 http://amzn.to/2rhB10LGoPro7 https://amzn.to/2KDaP89クイックシュー http://amzn.to/2qyRyL6GC550 http://amzn.to/2qyRRFE三脚旅用 http://amzn.to/2qUmW9U三脚部屋用 http://amzn.to/2rtDe6sDRONE http://amzn.to/2pYQNsN◆カズさんのTwitterhttps://twitter.com/kazuch0924◆カズさんのインスタhttps://www.instagram.com/kazuch0924/◆カズ嫁のTwitterhttps://twitter.com/8jizeninsyugo------------------------------------------------------------------------------ 楽曲提供：Production Music by http://www.epidemicsound.com ------------------------------------------------------------------------------どれもボチボチ動画更新中！◆カズチャンネル登録↓http://bit.ly/kazuch-T◆カズ飯チャンネル登録↓http://bit.ly/kazumeshi-T◆カズゲームズチャンネル登録↓http://bit.ly/kazugames-T【プロフィール】福井在住のカズです。小学校時代は遊ぶ友達があまりいなかったので練り消し作り・一人学校探検で休み時間を過ごしてました。えぇ、ごくごく普通の人です。とりあえず一度きりの人生、後悔しないよういろんな事やってみてる所なう。↓ファンレターの宛先はコチラ〒106-6137 東京都港区六本木 6-10-1六本木ヒルズ森タワー 37階カズさん宛↓お仕事のご依頼はこちらからhttp://www.uuum.co.jp/inquiry_promotion"
"5LN2mrF1C4I","女子高生がタイムスリップして江戸時代の職業・運送事情を学んでみた【マンガで分かる】","2019-11-01T10:00:02.000Z","UCd1SHHpqbGKhk0vpTj_ZUfg","これホントかも","25","19.03.11","これホントかも","175562","2633","50","403","https://i.ytimg.com/vi/5LN2mrF1C4I/default.jpg","False","False","女子高生がタイムスリップして江戸時代の職業・運送事情を学んでみた【マンガで分かる】過去の女子高生と源ちゃんシリーズhttps://www.youtube.com/playlist?list=PLtzG8M5g8RV_fPlsP3aXaHdVz0D0DD0mN姉妹チャンネル開設しました：クロネコの部屋 http://www.youtube.com/channel/UC3bBCyGyGfI9elWm6cEAcGA?sub_confirmation=1これホントかものチャンネル登録 http://www.youtube.com/channel/UCd1SHHpqbGKhk0vpTj_ZUfg?sub_confirmation=1この動画は、誹謗中傷を目的としておりません。また、著作権を侵害する目的で制作もしておりません。動画に問題ありましたらコメントでお知らせ下さい。～音楽～エンディング：Memory of love　https://www.youtube.com/watch?v=1TzNQM46zRY～フリー素材～魔王魂 / DOVA-SYNDROME / 甘茶の音楽工房　YouTubeオーディオライブラリ / 効果音ラボフリー素材ぱくたそサムネイル・イラスト：当チャンネル用にイラストレーター様に描いて頂いたオリジナルを使用しております。#これホントかも"
"6V42iXTFocU","【2泊3日】渋谷のハロウィンで拾ったゴミ1g×1円で生活できるのか！？1/2","2019-11-01T10:14:24.000Z","UCFKSFhVMtIu7akVuxPtXtQw","きょんくま","24","19.03.11","きょんくま|2泊3日|渋谷|ハロウィン|過酷|面白い|ダンス|dance|動画|ビデオ|さのす|無料|チンチラ|ハムスター|YouTube|ユーチューブ|お隣のきょんくま|ハリネズミ|タヌちゃん|２４時間生活|踊ってみた|ダンサーが踊る|YouTuber|２倍速|１万円企画|バク転","233279","4027","144","652","https://i.ytimg.com/vi/6V42iXTFocU/default.jpg","False","False","後編https://youtu.be/ZAeOl9kJ810きょんのTwitter個人垢↓↓↓↓https://mobile.twitter.com/kyonchandayo_くまのTwitter個人垢↓↓↓↓https://mobile.twitter.com/kuma_chandesuえいじhttps://twitter.com/eiji_egachanちぇぬhttps://twitter.com/yutori_yutaka後ろの人の動画は探してみてね。⭐twitter （きょんくま）  ↓↓↓↓https://twitter.com/kyonkuma_mainサブチャンネルhttps://www.youtube.com/channel/UCVKQO4lPAI6QV5iAukIRKXwきょんくま メインチャンネルhttps://www.youtube.com/channel/UCFKSFhVMtIu7akVuxPtXtQwペットチャンネルhttps://www.youtube.com/channel/UCNmjwhgOA8QM9-gqypc1S_w⭐お仕事の依頼はUUUMにお問い合わせください⭐ファンレター宛先  ↓↓↓↓↓106-6134東京都港区六本木6-10-1六本木ヒルズ森タワー37階UUUM株式会社 きょんくま宛"
"oRvzYMmLPQg","超巨大納豆巻きを食べ切るぞー！！！","2019-11-01T10:00:11.000Z","UCMOWCrRrcdSRT7dCR_dB7qA","さんこいち","24","19.03.11","ほりえりく|古川優香|やっぴ|さんこいち|読モ|モデル","256512","4593","142","441","https://i.ytimg.com/vi/oRvzYMmLPQg/default.jpg","False","False","１.２.３さんこいちです！！月・水・金・日の週419:00投稿です！＊さんこいち ブランドhttp://rybc.jp✳︎サブチャンネルhttps://www.youtube.com/channel/UC9RbsxutGLpLLkYrI6irkYQチャンネル登録もお願いします！＊さんこいちTwitterアカウント＊◎Twitter→https://twitter.com/sankoiti_offici＊ほりえりく＊◎Twitter→https://twitter.com/horienorikudesu◎YouTube→https://www.youtube.com/channel/UCaZptJUdR8t0gPIu0kZJL0w?view_as=subscriber◎Instagram→https://www.instagram.com/rikunohonmono/＊やっぴ＊◎Twitter→https://twitter.com/1016Kn◎Instagram→https://www.instagram.com/1016kn/◎YouTube→https://www.youtube.com/channel/UCG937GJ3sH_WLE06qGqwulg＊古川優香＊◎Twitter→https://twitter.com/FURUKAWAYUKA_◎Instagram→https://www.instagram.com/iamyukaf/◎YouTube→https://www.youtube.com/channel/UCm-m76oSXXj41CUxDwUeF4Q・お仕事依頼rybc20190101＠gmail.com"
"sj3I972BYd0","グループYouTuberやリーダーって実際どうなんですか？ソロとの違いは？","2019-11-01T12:50:40.000Z","UCibEhpu5HP45-w7Bq1ZIulw","Fischer's-フィッシャーズ-","24","19.03.11","Fischer's|フィッシャーズ|野生児|MASAI.|無謀|自然|チャレンジ|シルクロード|マッチョ|マサイ|ぺけたん|ザカオ|ンダホ|ダーマ|モトキ|おもしろ|挑戦|SilkRoad|Dama|Peketan|Ndaho|Zakao|Motoki|Masai|シルクの部屋|毎日|動画|投稿|面白|面白動画|やってみた|ウケる|爆笑|大爆笑|コント|一発芸|ギャグ|ネタ|楽しい|お笑い|笑える|オススメ|商品紹介|YouTube|youtuber|Japan|japanese|Blog|Vlog|腹筋崩壊|抱腹絶倒|都市伝説|身体張る|スポーツ|講座|ビログ|ビデオブロガー|大学生|軍団|イケメン|ウオタミ|UUUM|ウーム|グループ|Youtuber|リーダー|違い|悩み相談|グループについて|組織|メリット|デメリット","445538","15416","527","1494","https://i.ytimg.com/vi/sj3I972BYd0/default.jpg","False","False","二代目のチャンネルもよろしく！☆Fischer's-セカンダリ-■https://goo.gl/QgBhjD☆チャンネル登録よろしくね！■https://goo.gl/lSy9St☆専用の絵文字や色々！チャンネルメンバーシップはこちら！■https://goo.gl/uJomwo☆Ｔシャツ、パーカーなどのフィッシャーズグッズ！■http://bit.ly/2pdgURz☆リーダー、シルクロードのツイッター■https://twitter.com/RytoSle2↓フィッシャーズ公式アカウントは下へ↓①最強の水上アスレチックhttps://www.youtube.com/watch?v=eF7By5Ii6KQ②ンダホ救急搬送されるhttps://www.youtube.com/watch?v=pWf0B4FiHSA&t=518s【Fischer's-フィッシャーズ-】出来そうで出来なさそう、くだらない事、好きなことをする…。中学三年の頃、「楽しい」を動画にすることから始まった古くて幼稚園、同い年の同級生７人からなるネットパフォーマー集団です。メンバーは7人[シルクロード] [ンダホ] [ダーマ] [ザカオ] [ぺけたん] [モトキ] [マサイ] ―ウェブサイト・メンバー紹介■http://fischers.web.fc2.com/【Twitter】■https://twitter.com/FischersHome【Facebook】■https://www.facebook.com/FischersHome【Instagram】■https://www.instagram.com/fischershome【再生リスト】―すべて表示(西暦別もあります)■https://goo.gl/fB9HYY―アップロード順■https://goo.gl/TuFZ4W―再生数順■https://goo.gl/pw3hyy【音源・効果音使用元】様―DOVA-SYNDROME■http://dova-s.jp/―効果音ラボ■http://soundeffect-lab.info/―甘茶の音楽工房■http://amachamusic.chagasi.com/―魔王魂■http://maoudamashii.jokersounds.com/―Epidemic Sound■ http://www.epidemicsound.com【一部の動画・静止画素材提供元】 PIXTA※動画によって使用していない場合がございます。【お問い合わせ先について】※1 業界の皆様・ご依頼の方々・その他ご相談がある方は、UUUMウェブサイトにある「サービス」からお願い致します。※2 YouTubeメッセージ機能は、フィッシャーズでは利用していません。ご理解いただけると幸いです。【サービスに関するお問い合わせ（UUUM）】http://www.uuum.co.jp/#Fischers #フィッシャーズ #グループYouTuber"
"DqtgAoCLVaA","「それいけ！美奈子ファミリー」第１弾！家族の自己紹介動画を配信！撮影・編集は全て美奈子さん！それぞれのやりたい事や好きなYouTuberなどを発表！これを見れば佐々木家の新たな魅力が発見できます！","2019-11-01T11:00:04.000Z","UC4y3TWIq94xMa81o7NdF_5g","美奈子ファミリーTV","24","19.03.11","#大家族|＃美奈子ファミリー|＃佐々木家|＃ザ・ノンフィクション|＃新・漂流家族|＃重大発表|＃衝撃の事実|＃密着取材|＃ドキュメンタリー|＃痛快ビッグダディ|#それいけ！美奈子ファミリー|＃自己紹介|＃美奈子ファミリーTV","154442","2334","600","634","https://i.ytimg.com/vi/DqtgAoCLVaA/default.jpg","False","False","先週、遂に念願のYouTuberデビューを果たした美奈子ファミリー！緊急生ライブ配信を開催し、３６００人を超える視聴者様のご声援のおかげで家族の団結力もグングンと高まっています！その際に視聴者様のご意見で多かった「家族それぞれの自己紹介を改めてしてほしい！」という要望にお応えして挑む第１弾は…「それいけ！美奈子ファミリー」〜家族の自己紹介編〜を公開します！大家族・佐々木家１０人の個性豊かな面々をご紹介いたします！ちなみに今回の動画は美奈子さんが自分一人で初めて撮影・編集の全てを手がけました！その辺りにご注目いただきご覧ください！始めたばかりでまだまだ未熟ですが…皆さん応援宜しくお願いいたします！＊家族が初めて巨大スライム作りに挑んだ「美奈子ファミリー劇場」第２回は　来週１１月８日（金）夜8時より公開予定です！　お待たせして申し訳有りません！そちらも是非ご覧ください！#それいけ美奈子ファミリー #自己紹介 #佐々木家「あの美奈子ファミリーが…まさかの重大発表！」https://youtu.be/YcGcosKb_6M使用音源「DOVA-SYNDROME」https://dova-s.jp家族イラスト「猫田まんじまる」　https://twitter.com/shizuharamaika「美奈子ファミリーTV」https://youtu.be/YcGcosKb_6Mお仕事のご依頼はminako.info@gmail.com美奈子　公式LINEブログhttps://linebrog.me/minako/.美奈子　公式インスタグラムhttps://www.instagram.com美奈子　公式ツイッターhttps://twitter.com/minako7love0223上記SNSで美奈子ファミリーの最新情報をお知らせします！チャンネル登録＆フォローお願いいたします！"
"S9MbURwpO2g","ハロウィンの怖い起源！？","2019-10-31T11:30:52.000Z","UC4lN5sizuJraSHqy99xTy6Q","Naokiman Show","1","19.03.11","ハロウィン|halloween|ナオキマン|naokiman|ミステリー|ハロウィンの起源","488978","11337","282","2000","https://i.ytimg.com/vi/S9MbURwpO2g/default.jpg","False","False","タイトル：ナオキマンのヤバい世界の秘密発売日：2019年9月19日価格：1,000円＋税アマゾン・ネット書店で予約受付中！！https://www.amazon.co.jp/ナオキマンのヤバい世界の秘密-Naokiman-Show/dp/4537217251/Twitter:https://twitter.com/naokimanshowInstagram:https://www.instagram.com/naokimanshow/?hl=jaID：NaokimanshowLINEスタンプを発売しました！Naokiman show検索で探せます！https://line.me/S/sticker/45583362ndチャンネル開設しました：Naokimanhttps://www.youtube.com/channel/UCT9cFrlnfy1-XLf0Vuy0ZzwNaokiman show 中国チャンネル！https://www.youtube.com/channel/UCW-C627r2o67vCueVFoaFGwFor Business Inquiries Contact: naokimanshow@gmail.com引用：BGM：V.I.P.N - EPIC CLOUD TRAP BEAT | No Copyright Traphttps://www.youtube.com/watch?v=x1zq_VlOeHAmusic provided by BNBV.I.P.Nhttps://www.youtube.com/channel/UC2KS...https://www.facebook.com/vipnbeatshttps://soundcloud.com/vipnhttps://www.youtube.com/watch?v=KMkkk7vN7V4https://www.youtube.com/watch?v=GWuw_07cPc0https://www.youtube.com/watch?v=wz5XQBQK9Gghttp://www.youtube.com/watch?v=7LJZJ-NxcdEhttps://www.youtube.com/watch?v=ChdY6a59wTkhttps://www.youtube.com/watch?v=Ys1w9A4DrO4"
"woz7Brvpiro","【漫画】整形した40代デブスの私はイケメン大学生と結婚→すると披露宴で酒に酔った元カノが彼氏の秘密を…【スカッとする話】","2019-10-31T10:26:06.000Z","UCIgIVRs-VrV-pkkenE5lRBQ","進撃のミカ","24","19.03.11","漫画|スカッとする話|整形|彼氏|元カノ|結婚|進撃のミカ|マンガ動画","317212","2801","273","522","https://i.ytimg.com/vi/woz7Brvpiro/default.jpg","False","False","スカッと！！整形した40歳の私、コンプレックスだらけのただのレジ打ちが、まさかイケメンと結婚出来るなんて…信じられなかった私は彼に当たってしまう。しかしこんな私の事が大好きな彼氏はプロポーズを。そして結婚式当日。呼んでもない元カノが登場しとんでもない事が起こったのである。毎日動画を上げられる様に頑張ります！皆さんの面白いエピソードもありましたら是非コメントお願いします★チャンネル登録→ http://bit.ly/2WmZIoY始めたばかりですので、これからどんどん改善していきます！！こうした方がいいよ等コメントもお願いします。★あらすじ★★BGM（フリー音源）YouTube オーディオ ライブラリhttps://www.youtube.com/audiolibrary/music甘茶音楽工房https://amachamusic.chagasi.com/※お願いイラスト・音声はクリエイター様に製作依頼をしており、当チャンネルのオリジナルとなっています。よって複製・転載等は御控えいただきますようお願い致します。#漫画　#スカッとする話　＃進撃のミカ"
"k4LWKpmYhFA","【美女に負けない】韓国コスメ初開封しながらメイクしたら人生で1番盛れた‼︎‼︎‼︎【ふくれな】","2019-10-31T10:00:07.000Z","UCCuizDTLsr-mNm_PEGdChVg","ふくれな/fukurena","24","19.03.11","ふくれな|えむれな|M君|メイク|美容|すっぴん|カラコン|コスメ|ブス|裸眼|三白眼|フルメイク|ファンデーション|眉マスカラ|詐欺メイク|リップ|アイシャドウ|チーク|可愛い","556883","15337","530","991","https://i.ytimg.com/vi/k4LWKpmYhFA/default.jpg","False","False","いつもご視聴ありがとうございます！提供：Qoo10動画で紹介した商品がセール中！ここから購入できるよ！https://bit.ly/2q5ppio【お仕事ご依頼】emurena.info@guild-inc.tokyo【お手紙などこちら】〒155-0032『ふくれな宛』『M君宛』 東京都世田谷区代沢4-16-6  2F【Twitter】https://twitter.com/fukurena0924【Instagram】https://www.instagram.com/fukurena/?h...#ふくれな#すっぴん#メイク"
"yE6mtDp4Kik","ヤスナーたちのハロウィンが本気すぎて焦るｗｗ【イラスト】","2019-10-31T10:09:26.000Z","UCNFhaCR_nid2XbqdFNgLoWA","スマイリー","24","19.03.11","スマイリー|なろ屋|ツッコミ","276551","11366","97","1777","https://i.ytimg.com/vi/yE6mtDp4Kik/default.jpg","False","False","ハッピィハロウィウィウィ👆👆【スマイリー×なろ屋】Happy Halloween歌ってみたhttps://youtu.be/j15K7a4GDXYスマイリーです。良ければチャンネル登録・高評価SNSフォローお願いします！ツイッターhttps://mobile.twitter.com/yasuner1103インスタグラムhttps://www.instagram.com/yasuner1103/サブチャンネルhttps://www.youtube.com/channel/UCz9GXhk9_Es12tEes77PSig【人気過去動画】575でオンラインバトルしたら神の一句ができました。https://youtu.be/-7z610Gz3xo質問コーナーでスマイリー大暴露。https://youtu.be/HZkWmRM4E6U写真でカロリーが分かるアプリにツッコミどころありすぎたhttps://youtu.be/PWfe6OTiWSM【BGM・SE素材】DOVA-SYNDROMEhttps://dova-s.jp/d-elf.comhttps://www.d-elf.com/Music　isVFRhttp://musicisvfr.com/free/license.htmlMusMushttp://musmus.main.jp/bgm.html音人https://on-jin.com/魔王魂https://maoudamashii.jokersounds.com/ポケットサウンド https://pocket-se.info/OtoLogichttps://otologic.jp/free/license.html【画像素材】イラストAC写真ACシルエットACいらすとやぱくたそhttps://www.pakutaso.com/イラストレイン【動画素材】無料映像素材 フリー素材館http://www.namaewallpaper.com/movie/index.htmlmotion elementshttps://www.motionelements.com/ja/free/stock-footage※動画によっては使用していない場合もあります。"
"5domOEkW054","第5話｜ガンダムビルドダイバーズRe:RISE【ガンチャン】","2019-10-31T11:00:12.000Z","UC7wu64jFsV02bbu6UHUd7JA","ガンダムチャンネル","1","19.03.11","ガンダム|ガンチャン|Re:RISE|リライズ|ビルドダイバーズ|アニメ","296288","3252","163","0","https://i.ytimg.com/vi/5domOEkW054/default.jpg","True","False","【サブタイトル】いま、翼ひろげて【あらすじ】作戦当日、遅刻して現れたパルヴィーズは、これまでの自身のふがいなさを嘆き、ビルドダイバーズを抜けたいという旨をメンバー全員に伝える。必死に引き留めようとするカザミ、冷静なメイ、そしてどこまでも現実的なヒロト。パルヴィーズの決意は固いが、その意思に反して強制的にミッションは開始される。#ガンチャン　#ガンダム　#リライズ ★★★ガンダムの最新情報は公式ポータルサイト「ガンダムインフォ」をチェック！★★★▼『ガンダムビルドダイバーズRe:RISE』公式サイトhttp://gundam-bd.net/▼『ガンダムビルドダイバーズRe:RISE』公式Twitterhttps://twitter.com/gundambd▼ガンダム公式ポータルサイト「ガンダムインフォ」http://www.gundam.info▼ガンダムインフォ公式Twitterhttp://twitter.com/gundam_info▼機動戦士ガンダム40周年プロジェクトhttp://gundam40th.net▼機動戦士ガンダム40周年プロジェクト公式Twitterhttps://twitter.com/gundam40th▼サンライズ公式サイトhttp://www.sunrise-inc.co.jp▼サンライズ公式Twitterhttps://twitter.com/SUNRISE_web(C)創通・サンライズ"
"08oDuWK5LGE","かねこからもらったカニが有毒ガニに似ているので恐る恐るドリアにしました！！！","2019-10-31T10:00:01.000Z","UCDJ_L7aJsijdUKXQgy7GXhA","へんな魚おじさんの寝言","24","19.03.11","へんな魚おじさん|きまぐれクック|kimagurecook|かねこ|kaneko|南知多|内海|河和|名古屋|魚市場|さかな広場|fish|japanese|ヒゲの兄貴|お魚クイズ|ヨーロッパイチョウガニ","219702","3979","74","391","https://i.ytimg.com/vi/08oDuWK5LGE/default.jpg","False","False","今回のカニは「ヨーロッパイチョウガニ」です！ヨーロッパイチョウガニは無毒でおいしいカニです！※スベスベマンジュウガニは有毒ガニなので食べないでください。動画をご覧いただきありがとうございます！ぜひチャンネル登録と高評価を宜しくお願いします！☆Twitter ➡︎ https://twitter.com/_Sakana_Ojisanお魚クイズや豊浜魚ひろばの情報を発信しています！☆Instagram ➡︎ https://www.instagram.com/_sakana_ojisan/?hl=ja魚ひろばにお越しいただいた方との写真を載せています！☆ヒゲの兄貴のTwitter ➡︎ https://twitter.com/marukan_aichi?s=17☆お便り・プレゼントはこちら〒153-0042東京都目黒区青葉台3-6-28住友不動産青葉台タワー2F 株式会社Kiii「へんな魚おじさん」宛もしくは「ヒゲの兄貴」宛(※生物、冷蔵便はお受取ができません)(※魚ひろば宛に宅配便で送ることはご遠慮ください。YouTube活動とは関係ないのでお店のご迷惑になってしまいます。)☆お仕事・取材等のご依頼はこちらまで！hensakaojisan@gmail.comそれじゃ！バイバイッ！！"
"4suACq2O7wU","火災が発生した首里城","2019-10-31T05:43:25.000Z","UCNLxBzguoGLqXWA8_BtHSHA","時事通信映像センター","25","19.03.11","沖縄|首里城|那覇|火災|正殿|全焼","391869","945","144","0","https://i.ytimg.com/vi/4suACq2O7wU/default.jpg","True","False","火災が発生した首里城。中央が焼け落ちた正殿＝３１日午前、那覇市（時事通信ヘリより）【時事通信映像センター】映像素材の購入については時事通信フォトへお問い合わせください　https://www.jijiphoto.jp"
"TxONRtJ7n6A","絶対に笑ってはいけない無一文からのドリーム【ラファエル著】","2019-10-31T14:14:45.000Z","UCaminwG9MTO4sLYeC3s6udA","ヒカル（Hikaru）","24","19.03.11","ヒカル|Hikaru|トーク|おもしろ|ラファエル|本|笑ってはいけない|無一文のドリーム|イーサン|エルくん|まえっさん","487278","9215","724","829","https://i.ytimg.com/vi/TxONRtJ7n6A/default.jpg","False","False","Q.なぜ今日の動画削除されたのですか？A.ちょっとした手違いで大人の事情ってやつです。お詫びとして速攻この動画完成させました。ラファエルさんのチャンネルはこちらhttps://www.youtube.com/channel/UCgQgMOBZOJ1ZDtCZ4hwP1uQ★チャンネル登録はこちらhttps://www.youtube.com/channel/UCaminwG9MTO4sLYeC3s6udA?sub_confirmation=1★本編の未公開シーン中心のチャンネルhttps://www.youtube.com/channel/UCzVaupa8VNfVXxkYJibizlw新曲はこちらです。https://www.youtube.com/watch?v=nRkmpaNQyZA&t=22sヒカルのZepp東京のライブ映像はこちらです。https://www.youtube.com/watch?v=Oocgc5EYqfg曲をまとめて聞きたい方はこちらから！https://www.youtube.com/watch?v=yrXuKm6JtYA&list=PLcxHm0kSGuEBGW8gmYNOM-2Ah1B9t6Gax★ヒカルのTwitterhttps://twitter.com/kinnpatuhikaru★ヒカルのサブ1のTwitterhttps://twitter.com/tadanokarisuma?lang=ja★ヒカルのサブ2のTwitterhttps://twitter.com/1chan_hikaru?lang=ja★ヒカルのゲーム実況チャンネルhttps://www.youtube.com/user/kinnpatuhikaru★ヒカルの公式Twitterはこちら（動画通知、お知らせ等）https://twitter.com/hikaru2nd1031★カルxピンの公式Twitterはこちら（ライブ、グッズのお知らせ等）https://twitter.com/karu_x_pin★ヒカルのインスタグラムhttps://www.instagram.com/tadanokarisuma/★ヒカルへの仕事のお問い合わせはこちらマネージャー高橋のDMまでお願いします。https://twitter.com/takahashisan69#ヒカル#ラファエル"
