video_id,title,publishedAt,channelId,channelTitle,categoryId,trending_date,tags,view_count,likes,dislikes,comment_count,thumbnail_link,comments_disabled,ratings_disabled,description
"qwovgPqca-w","SAMPAOLI TÁ DE SAÍDA DO SANTOS ? l BALE IGNORA TORCEDOR MIRIM l MESSI DÁ SHOW EM GOLEADA","2019-10-30T15:03:27.000Z","UCflhYB5hOiPxdjoG4EtSUKA","Tode","17","19.03.11","noticias de hoje|noticias futebol brasileiro hoje|noticias futebol europeu hoje|noticias futebol agora|noticias futebol ao vivo|noticias|futebol|mercado da bola tode|mercado da bola hoje|noticias flamengo|flamengo x river|final libertadores|chile|noticias fluminense|noticias cruzeiro|noticias futebol hoje|noticias futebol hj|noticias do futebol brasileiro|noticias do futebol europeu|brasil sub-17|mundial sub-17|reforços real madrid|bale|messi|barcelona","99390","16706","89","328","https://i.ytimg.com/vi/qwovgPqca-w/default.jpg","False","False","Bale tem uma proposta salarial de 20 milhões de euros anuais no Shangai, Brasil sub-17 vence mais uma no Mundial, João Pedro vai deixar o Fluminense em janeiro e se juntar ao Watford e muito mais !📷 MEU INSTAGRAM 📷https://www.instagram.com/felipe_todeSe Inscreva: www.youtube.com/canaldotode📧 Meu contato comercial 📧fetode85@gmail.com⚽ SANTOS REDUZ MULTA DE SAMPAOLI l BALE IGNORA TORCEDOR MIRIM l MESSI DÁ SHOW EM GOLEADA ⚽#Messi #NotíciasDeFutebol #Futebol"
"tCI396HyhbQ","Death Stranding - Launch Trailer | PS4","2019-10-30T14:00:08.000Z","UC-2Y8dQb0S6DtpxNgAKoJKA","PlayStation","20","19.03.11","Hideo Kojima|Death Stranding|Launch|Sam Porter|norman reedus|mads mikkelsen|lea seydoux|lindsay wagner","1497262","83047","1925","8483","https://i.ytimg.com/vi/tCI396HyhbQ/default.jpg","False","False","https://www.playstation.com/en-us/games/death-stranding-ps4/Reconnect a fractured society as Sam Bridges. Save us all. Tomorrow is in your hands.Pre-Order Death Stranding for PS4. Out November 8th, 2019.Rated Mature: Blood, Intense Violence, Partial Nudity, Strong Language"
"mc9r3oyz5ZY","Perdem-se até os que se esforçam! (Homilia Diária.1304: Quarta-feira da 30.ª Semana do Tempo Comum)","2019-10-30T08:00:06.000Z","UCP6L9TPS3pHccVRiDB_cvqQ","Padre Paulo Ricardo","27","19.03.11","Padre Paulo Ricardo|Homilia Diária","69168","12497","59","299","https://i.ytimg.com/vi/mc9r3oyz5ZY/default.jpg","False","False","É verdade que são poucos os que se salvam? A esta pergunta, que todos nós já nos devemos ter feito em algum momento, Jesus não responde diretamente, preferindo tomá-la como ocasião para nos recordar algo de gravíssima importância: o Inferno é para todos uma possibilidade real, e é por isso que devemos fazer todo esforço possível — nem muito nem suficiente, mas todo esforço possível — para atravessarmos a porta estreita que conduz à vida. Assista à homilia do Padre Paulo Ricardo para esta quarta-feira, dia 30 de outubro, e que Deus nos dê força e constância para, observando os Mandamentos e cooperando com a graça, pertencermos um dia ao número dos santos do céu."
"sRKUeM_GXtA","HORÓSCOPO DE NOVEMBRO DE 2019 PARA TODOS OS SIGNOS | MÁRCIA FERNANDES","2019-10-29T13:00:08.000Z","UCVFp8BjPn_pdf83s9UkezaQ","Universa","26","19.03.11","uol|universa|estilo|mulher|sensemarcia|marcia sensitiva|marcia fernandes|marcia fernandes universa|horoscopo marcia fernandes|horoscopo novembro|horoscopo novembro 2019|horoscopo novembro marcia fernandes|horoscopo novembro universa|horoscopo novembro 2019 universa|horoscopo novembro 2019 marcia fernandes|marcia fernandes horoscopo universa|horoscopo todos os signos|marcia fernandes signos|marcia fernandes todos os signos|todos os signos universa","208044","19906","259","324","https://i.ytimg.com/vi/sRKUeM_GXtA/default.jpg","False","False","#SenseMarcia #ParadeSerDoida #HoróscopoMárcia Fernandes, mais conhecida como Sense Márcia ou Márcia Sensitiva, te dá todas as dicas e previsões para você guiar sua vida conforme as posições dos astros no mês de NOVEMBRO. Acredite! Astrologia tem tudo a ver com cada momento seu e pode te ajudar a tomar decisões importantes. Acompanhe a Márcia aqui no Canal Universa toda terça-feira e em datas especiais.-----Bem-vindo ao UNIVERSA. INSCREVA-SE NO CANAL: http://bit.ly/2gLZcOr**UNIVERSA NO FACEBOOK ** http://bit.ly/2zhatNM** SIGA O UNIVERSA NO INSTAGRAM **@uoloficial: http://bit.ly/2HjMWPU** ACESSE NOSSA PÁGINA **https://universa.uol.com.br"
"hUKQRIatBvY","HORA DE DIZER  ADEUS !! * indo embora*","2019-10-29T15:13:40.000Z","UCCgZZd8zy-OyiVtQ5WeOV6w","Leo da Hornet","24","19.03.11","leo da hornet|leo ruiz|leonardo|leonardo hornet|hornet branca|hornet rosa|hornet só o cano|motovlog|motovlog de hornet|vlogs leo|em alta|leo seu zuado|video de casal|video|de|namorada|trolagem|trolei minha namorada|casa de yotubers|casa nova|*golf|gti|golf branco|xj6|camaro branco|youtuber londrina|londrina|fui embora de casa|sai da mansao|mudei para sp|sp|fui para sp com minha namorada","582461","81340","2495","4831","https://i.ytimg.com/vi/hUKQRIatBvY/default.jpg","False","False","Me segue lá no  Instagram!  Vou responder todos que comentar que veio pelo Youtube!! : https://www.instagram.com/leoruizyt► GOSTOU DESSE VÍDEO? ENTÃO SE INSCREVA NO CANAL, COMPARTILHE E DEIXE MUITO SEU LIKE, ENTÃO VALEU .. FALOU .. FUI.Redes Sociais:►Instagram : https://www.instagram.com/leoruizyt►Facebook: https://www.facebook.com/profile.php?id=100003734534077►Página Oficial:https://www.facebook.com/leodahornet►Email Comercial: leoruizyt.comercial@gmail.com● Compartilhe o Vídeo com seus Amigos e se Inscreva no canal!MOTO: HORNET BRANCA e XJ6 BRANCACARRO: GOLF GTI 2017🔰 PARCEIROS:🐦 PICHAU INFORMÁTICA: http://bit.ly/📷 INSTA: https://www.instagram.com/pichauoficial/📷 INSTA: https://www.instagram.com/pichaugaming/"
"k-KI30h5Pzc","True Damage 2019: Estreia | Trailer oficial de skins - League of Legends","2019-10-29T17:17:22.000Z","UC6Xqz2pm50gDCORYztqhDpg","League of Legends BR","20","19.03.11","Riot|Riot Games|League of Legends|lol|True Damage|Ekko|Akali|Senna|Yasuo","212567","14183","226","1321","https://i.ytimg.com/vi/k-KI30h5Pzc/default.jpg","False","False","Dê um show com Akali, Qiyana, Yasuo e Senna, os integrantes da True Damage, por 1350 RP ou mostre a eles como é que se faz com a skin Lendária True Damage do Ekko por 1820 RP. E fique de olho na skin de Prestígio True Damage da Qiyana que está por vir!O grupo virtual de hip-hop True Damage nasceu quando a rapper principal das K/DA, Akali, decidiu juntar os talentos distintos de Ekko, Senna, Qiyana e Yasuo em uma colaboração ambiciosa e arrasadora de paradigmas.Jogue de graça! Cadastre-se e baixe League of Legends em https://signup.br.leagueoflegends.com/pt/signup/index#/.#TRUEDAMAGE #SKINSTRUEDAMAGE #LEAGUEOFLEGENDS"
"bvuliojkwTA","MATEMÁTICA SIMPLES - FAMÍLIA PARAFUSO SOLTO","2019-10-29T13:00:10.000Z","UC5DZBjR6W561Txc_vrRWTow","Familia Parafuso Solto","23","19.03.11","marquinho|parafuso|solto|humor|comedia|comedy|piada|entretenimento|engraçado|matematica|simples|passeio|ferias|viagem","543811","45070","1159","0","https://i.ytimg.com/vi/bvuliojkwTA/default.jpg","True","False","Não esqueça de inscrever, ativar o sininho e deixar o like.Postamos vídeos toda Terça feira as 10h da manhã."
"_mBJuihHiX8","🔴AO VIVO: Natty Hills em uma noite no tapete vermelho do Prêmio Multishow 2019","2019-10-30T01:47:48.000Z","UC11JFCoslUUMTuAsUPH8RdQ","Humor Multishow","23","19.03.11","humor multishow|assistir multishow|assistir multishow online|programa multishow|vai que cola|comédia|piada|humor|vídeo engraçado|vídeos engraçados|multishow online|paulo gustavo|lady night|Tatá Werneck|a vila|tô de graça|graça|tapete vermelho|prêmio multishow|prêmio multishow 2019|natty","95122","3397","325","287","https://i.ytimg.com/vi/_mBJuihHiX8/default.jpg","False","False","Hi, people! Natty Hills faz sua estreia triunfal no Prêmio Multishow 2019. O que será que ela vai aprontar com os outros convidados? Vai ter ASMR no tapete? Ela vai se misturar com o público? Vem ver! ✅ NÃO ESQUECE DE SE INSCREVER: http://bit.ly/YouTubeHumorMultishow👍 Curtiu o vídeo? Deixa seu like e comenta o que mais gostou, bb 🔥 Assista mais vídeos na playlist:______________________________________🌟 Playlists Mais Assistidas 🌟► Lady Night: http://bit.ly/LadyNightHumorMultishow►Vai que Cola: http://bit.ly/VQCHumorMultishow►Tô de Graça: http://bit.ly/ToDeGraçaHumorMultishow►Difícil de Focar: http://bit.ly/DificilDeFocar______________________________________No canal Humor Multishow você encontra o melhor do humor e conteúdos exclusivos para o YouTube. Confira vídeos do Vai que Cola, Lady Night, Tô de Graça e MUUUITOS outros conteúdos originais. 😍______________________________________🎥 ASSISTA TAMBÉM 🎥Música Multishow: http://bit.ly/YouTubeMúsicaMultishowModo Viagem: https://bit.ly/ModoViagemCanal OFF:  http://bit.ly/YouTubeCanalOff"
"2fnXcT6YHs8","CHEIO DE ENERGIA ( Ft. BAMBAM)","2019-10-29T13:00:01.000Z","UCHutMB8u5KZzuHzeSJCob1g","Na CorreRia","24","19.03.11","video de humor|comedia no youtube|melhor da internet|esquetes de humor|treinando na academia|mulher bonita|tarefa de casa|cheguei em casa|bambam do bbb|kleber bambam|ganhador do bbb|mutante do brasil","443891","34568","1032","497","https://i.ytimg.com/vi/2fnXcT6YHs8/default.jpg","False","False","Hoje o vídeo com a participação especial do Bambam.Mesmo depois de muito treino na academia ele ainda tinha energia, só não imaginava que era pra isso.Conheça o Canal do BamBam, top demaisSe inscreva https://www.youtube.com/channel/UCswWbaIJUzld5BQxyM2IbsAVídeo novo toda terça e sexta sempre as 10h, se inscreva e não perca, valeu!"
"vBnGrvbXSJk","❤️CORAÇÃO ABERTO❤️ EU CREIO NA VIDA ETERNA⭐️SAUDADE SIM,Tristeza não⭐️🙏🙏🙏🙌🙌🙌30/10/19","2019-10-30T10:13:59.000Z","UCp4scJVG8IeQnPBrQrflaKg","Pe Marcelo Rossi","29","19.03.11","[none]","24815","11351","29","330","https://i.ytimg.com/vi/vBnGrvbXSJk/default.jpg","False","False",""
"NVUhjmVD7fI","COLHER, COLHERZINHA OU COLHERZONA - Desafio","2019-10-28T22:00:04.000Z","UC2bYhAHyaqfWlPXWBVk4BcA","Enaldinho","23","19.03.11","Enaldinho|Enaldo Lopes|pegadinha|trollagem|trollei|troll|trollando|desafio|desenho|COPO|COPINHO|COPÃO|colher|COLHERZINHA|COLHERZONA","2646863","229977","9326","7247","https://i.ytimg.com/vi/NVUhjmVD7fI/default.jpg","False","False","COMPRE SEU LIVRÃO DO ZAP NA PRE VENDA: http://bit.ly/2yEsTtvINSTA: @Enaldinho ou www.instagram.com/enaldinho/Meu segundo canal: https://goo.gl/oA3ErZ  ★ Siga nas redes sociais:Twitter: https://twitter.com/Enaldinho1Face: https://www.facebook.com/enaldo.lopes.1★ Canais Participantes:Brenner: https://encurtador.com.br/dexJYBiel: https://goo.gl/YVv4n5Painzeiro: https://goo.gl/nWpFc1Nicolas Gomes: https://goo.gl/saBq3d"
"2uBV3FWr0VU","DIANTE DO TRONO | DEFENSOR | CLIPE OFICIAL","2019-10-29T13:00:10.000Z","UCmofVw_WgKPDy3pEiXLskug","Diante do Trono Oficial","10","19.03.11","diantedotrono|dtoficial|ana paula valadão|congressodt|dt2019|deserto de revelação|gospel|louvor|Jesus|Deus|dt ao vivo|dt|gospel 2019|tu reinas|imersao 3|onimusic (record label)|levanto um aleluia|isaias saad|ousado amor|dt19|isaías|Diante do Trono|DT|Lagoinha|André Valadão|Gabriela Rocha|Música Gospel|Adorar|Cristo|ao vivo|fé|lugar secreto|a sua voz|voce sussurra|clipe oficial|fernandinho|deus|outra vez|jesus|worship|defensor|DTdefensor|musica gospel 19","110330","8852","117","814","https://i.ytimg.com/vi/2uBV3FWr0VU/default.jpg","False","False","Defensor | Ana Paula Valadão | Diante do Trono (Clipe Oficial)___Assistam nossa playlist: http://bit.ly/31QNOpeInscreva-se no canal: http://bit.ly/2IE1P1I ___Letra - DefensorBem antes de eu notarVocê já saiu pra guerrearE volta com a cabeça do inimigoE diz que sou eu quem tem vencidoBem antes de eu saberMinhas guerras foi por mim vencerNo Seu amor completa proteção Me tira do deserto e sequidão E eu só louveiEu só adoreiSó fiquei prostrado Só me aquieteiAleluia, me salvouDo Seu jeito é melhorAleluia, Grande defensorDo Seu jeito é melhorBem antes de eu achar Sabe onde a verdade encontrarDebaixo de Sua sombra eu vivoRestaura minha fé quando eu precisoQuando eu me perdiVocê me encontrouMe reapresentou ao Seu amorJuntou os meus pedaçosE me fez de novoDo meu coração é defensor___Ficha Técnica:Produção Musical: Gustavo SoaresInterprete: Ana Paula ValadãoViolão: Felipe BarrosBateria: Adauto Junio Guedes de OliveiraBaixo: Ricardo Chagas MonteiroGuitarra: Igor Nunes dos SantosTeclado: Gustavo SoaresTeclado: Raphael Guimaraes Frederico XavierBacking Vocals: Tiago Araújo Gusmão Sebastião Batista de Oliveira JúniorShaila Elizabeth KerrKeila Cristina Araujo DrumAline Aparecida CruzDireção Geral: Alex PassosDireção de Fotografia: Marko CostaCoord. Técnica: Felipe BarrosCoord. de Produção: Jenifer EmmelsEdição e finalização: Rafael CaminhaAss. De Produção: Carla Bastos e Thalita DaherCâmeras:Alencar RibeiroHenrique StenioJorge RabelloLucas Felipe (Pkta)Thiago de SouzaTúlio RoblesCammate: Lúcio FerreiraDrone: Wanderson de SouzaLight Designer: Daniel de PaulaLogger: Roger FernandesVideo Designer: Juliano MazzettoAss. Técnica: Rafael SouzaAss. Tecnologia: Murilo D’Jota___Diante do Trono é um dos nomes mais conhecidos da música cristã brasileira. Fundado em 1997, o ministério tem mais de 50 CDs lançados e mais de 15 milhões de discos vendidos. O grupo é liderado pela fundadora, a pastora Ana Paula Valadão Bessa - compositora da maioria das canções gravadas.Desde a criação, o Diante do Trono tem a missão de “vivenciar e incentivar a adoração a Deus nas nações do mundo, influenciando a sociedade e a nova geração de adoradores com excelência, santidade a amor”.O Diante do Trono tem uma série de 18 CDs e DVDs lançados, sendo eles: Diante do Trono; Exaltado; Águas Purificadoras; Preciso de Ti; Nos Braços do Pai; Quero me Apaixonar; Esperança; Ainda Existe uma Cruz; Por Amor de Ti, Oh Brasil; Príncipe da Paz; A Canção do Amor; Tua Visão; Aleluia; Sol da Justiça; Creio, Tu Reinas; Tetelestai; Deserto de Revelação. Há também a série Crianças Diante do Trono, com 11 CDs e 9 DVDs: Crianças DT; Amigo de Deus, Quem é Jesus?; Vamos Compartilhar; A Arca de Noé; Samuel, O Menino que Ouviu Deus; Para Adorar ao Senhor; Amigos do Perdão; Davi; Renovo Kids; DT Babies.A banda foi indicada ao “Grammy Latino” em 2012, pelo álbum “Sol da Justiça”. A indicação foi na categoria “Melhor Álbum Cristão de Língua Portuguesa”, gravado ao vivo em Natal/RN. Além disso, de acordo com ranking da Billboard Brasil Gospel, o Diante do Trono figurou com três canções entre as mais tocadas no Brasil em 2013: “Creio”, “Canta Minh’alma” e “Me Ama”. Várias canções do grupo marcaram a igreja brasileira e a história da música gospel, entre elas: “Canção do Apocalipse”, “Nos Braços do Pai”, ”Preciso de Ti”, “Águas Purificadoras”, “Te Agradeço” e outras.___Assista a outros vídeos do DT:- Outra Vez: https://youtu.be/xkqXGWkPCMw- Água Viva: https://youtu.be/Fihkl_E2Gsk- Não Quis Ficar: https://youtu.be/021YS87nOpc- Comigo: https://youtu.be/FHZLfaAuvYY- A Sua Voz: https://youtu.be/IaK6ysX7k_U- Levanto Um Aleluia: https://youtu.be/oNcQfgsa0Cs- Eu Já Sei o Fim da História: https://youtu.be/6grdC0CYfCo- Meu Ar: https://youtu.be/aLHXTuTJgcg- Águas Passadas: https://youtu.be/_qKfT_3sFk0- Cada Batida: https://youtu.be/YSm9dFnyecc- Tu És Digno: https://youtu.be/Q8S8xGTdh6g- Amor Maior: https://youtu.be/LdE35hEuRvY- Valorize-se: https://youtu.be/o53omHpiOvU___Conheça mais o Diante do Trono acessando as redes sociais do DTOficial:Facebook – https://www.facebook.com/DianteDoTron...Instagram – https://www.instagram.com/dtoficial/Twitter – https://twitter.com/diantedotronoSite –  http://diantedotrono.com/ ___#DiantedoTrono #AnaPaulaValadao#SomQueAlimenta#DT19"
"-J7JL_Rt6LM","CENAS IMPROVÁVEIS #180","2019-10-29T11:00:01.000Z","UCZbgt7KIEF_755Xm14JpkCQ","Barbixas","23","19.03.11","cia barbixas de humor|humor|comédia|barbixas|engraçado|funny|comedy|anderson bizzocchi|daniel nascimento|elidio sanna|standup|stand-up|jogador:Anderson_Bizzocchi|jogador:Daniel_Nascimento|jogador:Elidio_Sanna|jogador:Evandro_Rodrigues|mc:Allan_Benatti|músico:Andrés_Giraldo|jogo:Cenas_Improváveis|dia:20_06_19|upload:29_10_19|estacionar|papa|mamão papaya|Ka|estação|moeda|cara|coroa|push|fumaça|papamóvel|hinodê|sequestro","252886","31935","125","325","https://i.ytimg.com/vi/-J7JL_Rt6LM/default.jpg","False","False","O Papa é pop? Não sabemos. Mas ele garante as frutas do café da manhã.ASSISTA AO VIVO:Quintas-feiras - TUCA (SP): https://goo.gl/QUMCdP01 e 02/11 - São Carlos (SP): https://bit.ly/2OruZ9f08/11 - Jaguariúna (SP): https://bit.ly/337gkUL09 e 10/11 - Indaiatuba (SP): https://bit.ly/2MqYkOv15 a 17/11 - Porto Alegre (RS): https://bit.ly/2Mf7WM422 a 24/11 - Rio de Janeiro (RJ): https://bit.ly/2PfyVLY06 a 08/12 - Salvador (BA): https://bit.ly/31OlODlLoja online: http://www.barbixas.com.br/loja-online.htmlSite da Cia. Barbixas de Humor: http://www.barbixas.com.br--Convidados:MC: Allan BenattiJogador: Evandro RodriguesMúsico: Andrés GiraldoJogo: Cenas ImprováveisRegra: Antes de começar o espetáculo as pessoas da plateia colocam sugestões de cena numa caixa. As melhores são lidas na hora para os jogadores que terão que improvisar algo relacionado.Temas (sugestões propostas pela plateia): O que não fazer quando se está fazendo baliza, Produtos inusitados para vender no trem, Melhores coisas pra fazer com uma moeda de 1 real, Cenas não vistas do Papa, Como passar um golpe pelo telefone.Improvável é um espetáculo criado, encenado e produzido pela Cia. Barbixas de Humor.www.barbixas.com.brGravado no Teatro TucaDia 20/06/2019"
"Hx2e9tqg4eU","ELA APANHOU MUITO JOGANDO FUTEBOL... ( perdeu? )","2019-10-29T13:00:02.000Z","UCMPPsRQg12IYk2V7vOfx-9A","Vosso Canal","17","19.03.11","rezende|rezendeevil|vosso|canal|futebol|gol|golaço|defesas|dribles|mitagem|mitou|chute|goleiro|atacante|juninho|rossini|treta|vosso canal briga|leticia apanha|menina nova|;eticia apanha da menina nova|vosso canal menina|leticia vs menina nova","231912","21522","646","878","https://i.ytimg.com/vi/Hx2e9tqg4eU/default.jpg","False","False","Fizemos um desafio entre as meninas sem cortes e vocês não vão acreditar no que aconteceu...BAIXE ONEFOOTBALL - http://tinyurl.com/yxguj4xkExperimente 1 mês grátis do banco de trilhas Epidemic Sound:  http://share.epidemicsound.com/vossoc🔴 CANAL NOVO 🔴: https://www.youtube.com/channel/UC_spRk_FrMjMRddBt6FHgSg🔴 CANAL NOVO 🔴: https://www.youtube.com/channel/UCh4CpTrKqQH7QFdAQsb3XfQINSCREVA-SE: https://www.youtube.com/channel/UCMPPsRQg12IYk2V7vOfx-9A/videosemail para parcerias: vossocanal@adragencia.com.brSE QUISEREM MAIS ESSE TIPO DE VÍDEO ESTOUREM DE LIKE!!CURTA NOSSA NOVA PAGINA NO FACEBOOK: https://www.facebook.com/VossoCanal-1322530574487146/?ref=aymt_homepage_panelcanal do rezende: https://www.youtube.com/user/rezendeevilCOMPUTADOR DO VOSSO CANAL:https://www.youtube.com/watch?v=aT5GBmdPnCsSite: https://www.chipart.com.br instagram JUNINHO - https://www.instagram.com/juninhomanellaROSSINI - https://www.instagram.com/joaorossini7/twitter @vossocanal"
"oFzSdCqh47w","Flamengo já planeja melhorar elenco em 2020 e mira feras como Cavani","2019-10-29T16:17:05.000Z","UCRcRAyb5Y4x3HVNKBZ9SMLA","Mauro Cezar","17","19.03.11","flamengo|cavani|contratações|flamengo cavani|psg|futebol|jorge jesus|libertadores|campeonato brasileiro|mauro cezar pereira|mauro cezar|espn|espn brasil|uol|river plate|final libertadores|flamengo x river plate|sofascore","204500","25316","391","0","https://i.ytimg.com/vi/oFzSdCqh47w/default.jpg","True","False","Clube conseguiu Rafinha e Felipe Luís, dois jogadores experientes que ficaram livres, sem contrato, na metade de 2019, tentou, sem sucesso, Balotelli, e pretende fazer investidas em atletas desse nível que ficarão sem compromisso com algum clube na metade de 2020, caso do uruguaio do PSGLeia mais sobre o tema no Blog do Mauro Cezar, no UOL Esporte: https://blogdomaurocezar.blogosfera.uol.com.br/2019/10/29/fla-planeja-2020-procura-novos-mari-e-fica-atento-a-feras-como-cavani/"
"-OZ1mN4UtoY","BARCELONA PRECISA VENDER JOGADORES PARA NÃO FALIR? Entenda TODA A HISTÓRIA","2019-10-29T13:30:00.000Z","UCcXV2JeP2g9kmXP9-F1xjrg","Futirinhas","24","19.03.11","futirinhas|futebol|futebol ao vivo|melhores momentos|notícias futebol hoje|notícias futebol|Barcelona PRECISA VENDER JOGADORES|Barça PRECISA VENDER JOGADORES|Barcelona|FC Barcelona|Messi|Arturo Vidal|Ivan Rakitic|Rakitic|Nelson Semedo|Jordi Alba|Sergi Roberto|Luis Suarez|Griezmann|Frenkie De Jong|Arthur|jogadores que o barcelona precisa vender","103382","12426","133","551","https://i.ytimg.com/vi/-OZ1mN4UtoY/default.jpg","False","False","O melhor app de futebol do mundo. DE GRAÇA. ONE FOOTBALL:►►► http://tinyurl.com/y4mnopobO Barcelona PRECISA VENDER jogadores até o fim da temporada para fechar suas contas no azul, pois gastou mais do que arrecadou até o momento e de acordo com as regras do Fair Play Financeiro, da UEFA, o clube pode começar a sofrer sanções da entidade. Começando com multas, exclusão de competições da UEFA, proibição de contratar jogadores e até ser rebaixado, dependendo da situação. Entenda TODA A HISTÓRIA"
"3M7_nsXjYcY","É Sério Isso? EP #510","2019-10-29T15:00:00.000Z","UCLXl1V6n82Dyg1VhVgSL0nw","Aviões e Músicas","28","19.03.11","AVIAÇÃO|Lito|Lito do Aviões e Músicas|AVIÕES E MÚSICAS|Aerolito|electra|mecânico de avião|Congonhas|Passado|MMA|Mecânico de manutenção Aeronáutica","115081","25769","84","474","https://i.ytimg.com/vi/3M7_nsXjYcY/default.jpg","False","False","Comentando uma foto que gerou muitos comentários no Instagram - mecânicos do lado de uma hélice girando.✈ Seja Membro: http://bit.ly/ApoiarCanal✈ Loja do Canal: http://bit.ly/CamisetasDoCanal✈ Livro do lito: http://bit.ly/livrosDoLito ✈ Contato Comercial: comercial@avioesemusicas.com✈ Seu vídeo na abertura: http://bit.ly/EnviarSuaSaudacao✈ Escreva para o AeM: Caixa Postal 3008     CEP 07190-972 - Guarulhos/SP==// Mídia Social✈ Twitter: @avioesemusicas✈ Instagram: avioesemusicas✈ Facebook: http://facebook.com/avioesemusicas✈ Aviões e Músicas é um canal para descomplicar a aviação e complementar as informações do blog http://www.avioesemusicas.comVídeos novos toda Quinta e Domingo às 12h00. Ou um Extra a qualquer dia.✈ Vinheta de abertura: Ivo Duran (@ivoduran)Disclaimer: “The views expressed in this video are my own. They have not been reviewed or approved by United. I do not speak for United.”Os pontos de vistas aqui apresentados são apenas meus e não foram revistos ou aprovados pela United. Eu não falo em nome da United."
"DDWRfXOicyw","Fortnitemares 2019 Gameplay Video","2019-10-29T13:59:35.000Z","UClG8odDC8TS6Zpqk9CGVQiQ","Fortnite","20","19.03.11","Fortnite|Epic Games|PC|PS4|Xbox One|Battle Royale|Unreal Tournament|Unreal Engine|Fortnite Battle Royale|Fortnite Creative","1470720","63486","2720","4599","https://i.ytimg.com/vi/DDWRfXOicyw/default.jpg","False","False","Fortnitemares returns with a vengeance... An ancient evil has been awoken and ghoulish creatures have invaded the new island. Squad up and face the Storm King head-on!Secure the Cryptic Curse Bundle in the Item Shop and become the warden of the underworld. Earn free rewards by completing challenges.Play Fortnite Battle Royale, the completely free 100-player PvP mode. One giant map, A Battle Bus, Last one standing wins. ESRB Rating: Teen with Violence.Instagram: https://www.instagram.com/fortnite/Twitter: https://twitter.com/FortniteGameFacebook: https://www.facebook.com/FortniteGame/Learn More: https://www.epicgames.com/fortnite/en-US/"
