video_id,title,publishedAt,channelId,channelTitle,categoryId,trending_date,tags,view_count,likes,dislikes,comment_count,thumbnail_link,comments_disabled,ratings_disabled,description
"cOVTFuPXClA","NOVA CONTRATAÇÃO!! ELE CHEGOU NA LOUD PARA MUDAR TUDO!!","2019-11-30T23:02:03.000Z","UC7iwNp4GUynlGXvK-6KD0Rw","LOUD","20","19.01.12","free fire|mobile|playhard|crusher|loud","1541197","368824","2554","22996","https://i.ytimg.com/vi/cOVTFuPXClA/default.jpg","False","False","●Se inscreva no canal dele: https://www.youtube.com/channel/UCuzezNFePF6UzsORJSKbOJg?sub_confirmation=1●https://www.instagram.com/loud_bak/Jogue conosco: https://www.discord.gg/loudAcompanhe a LOUD na Nimo: https://linktr.ee/LOUDnimo● Faça barulho conosco:Assista a LOUD ao vivo na https://nimo.tvInstagram: https://www.instagram.com/loudgg/Twitter: https://twitter.com/loudggFacebook:  https://www.facebook.com/loud--------------------------------------------------------------------------Business email: contact@loud.gg"
"xM207mJY9ww","JOGANDO FUTEBOL DE SALTO ALTO!!!","2019-11-30T23:15:15.000Z","UCPHXtOVmjvbP9OJihsd7gCg","CanalCanalha","23","19.01.12","canal canalha|canalcanalha|canal|canalha|julio cocielo|júlio cocielo|julio|júlio|cocielo|@cocielo|crossbar challenge|desafio do travessão|desafio|soccer|futebol|salto alto|futebol de salto alto|fut salto|jogando futebol de salto alto|jogando futebol|challenge|futsal de salto alto|futsal","947082","173473","1048","1937","https://i.ytimg.com/vi/xM207mJY9ww/default.jpg","False","False","CLIQUE EM GOSTEI, FAVORITE, COMENTE E SE INSCREVA!INGRESSOS COPA YOUTUBERS: https://copayoutubers.com.br/LOUTH SHOES: https://www.louth.com.br/MEUS CANAIS: CANAL TACIELO: https://www.youtube.com/channel/UCS0HnVAJqgJ3VZkluCZEbIQCANAL COCIELO: https://www.youtube.com/CocieloCANAL REVERSÃO: https://www.youtube.com/channel/UCyEHckavb7hMh5f8j4WEiIgREDES SOCIAIS:MEU INSTAGRAM: https://www.instagram.com/cocielo/MEU TWITTER: https://twitter.com/cocieloMINHA PAGINA https://www.facebook.com/CanalCanalhaMEU FACEBOOK https://www.facebook.com/juliococielo#Cocielo #FutebolDeSalto #FutSalto"
"dY09peNVVLc","The Pussycat Dolls REUNITE and perform new song 'React'! | Final | X Factor: Celebrity","2019-11-30T20:21:25.000Z","UCEY1ejsweY4DgMwOVJeEaBA","The X Factor UK","24","19.01.12","the x factor|x factor|X factor UK|simon cowell|auditions judges season 15|series 15|Louis Walsh|Nicole Scherzinger|The X Factor Celebrity|X Factor Celebrity|X Factor Audition|X Factor 2019|The X Factor Audition|X Factor Celebrity Audition|X Factor Celebrity 2019|The X Factor Celebrity 2019|Pussy Cat Dolls|Pussycat Dolls","1832353","92376","2881","0","https://i.ytimg.com/vi/dY09peNVVLc/default.jpg","True","False","Visit the official site: http://itv.com/xfactorFor the first time in a decade, the Pussycat Dolls reunite on The X Factor: Celebrity Final performing a medley of their biggest hits and new song 'React'.SUBSCRIBE: http://bit.ly/TXFSubFacebook: http://bit.ly/TXFFBTwitter: http://bit.ly/TXFTwiDownload The X Factor mobile app: http://bit.ly/TXFappWatch full episodes on ITV Hub (UK ONLY): http://www.itv.com/hub/the-x-factor"
"FS0XdzxZ_vc","O MELHOR DESENHO GANHA 3! - Desafio","2019-11-30T22:00:05.000Z","UC2bYhAHyaqfWlPXWBVk4BcA","Enaldinho","23","19.01.12","[none]","950266","93732","2915","5078","https://i.ytimg.com/vi/FS0XdzxZ_vc/default.jpg","False","False","COMPRE SEU LIVRÃO DO ZAP NA PRE VENDA: http://bit.ly/2yEsTtvINSTA: @Enaldinho ou www.instagram.com/enaldinho/Meu segundo canal: https://goo.gl/oA3ErZ  ★ Siga nas redes sociais:Twitter: https://twitter.com/Enaldinho1Face: https://www.facebook.com/enaldo.lopes.1★ Canais Participantes:Brenner: https://encurtador.com.br/dexJYBiel: https://goo.gl/YVv4n5Painzeiro: https://goo.gl/nWpFc1Nicolas Gomes: https://goo.gl/saBq3d"
"r8A5F2rnJ34","CEARÁ 1 X 1 ATHLETICO-PR - Melhores Momentos - Brasileirão 2019 (30/11)","2019-12-01T00:26:26.000Z","UCs-6sCz2LJm1PrWQN4ErsPw","Esporte Interativo","17","19.01.12","esporte interativo|ceara|athletico|ceara x athletico|melhores momentos|brasileirao|campeonato brasileiro|mateus gonçalves|madson|briga pelo rebaixamento|vozao|ceara x athletico paranaense|sp:ty=high|sp:dt=2019-11-30:19:00-03:00|sp:st=soccer|sp:li=braz|sp:ti:home=CEAR|sp:ti:away=CAPA","337409","9535","339","1716","https://i.ytimg.com/vi/r8A5F2rnJ34/default.jpg","False","False","Ceará e Athletico-PR empataram em 1 a 1 com dois no final da partida. Com o resultado, o Vozão segue em situação delicada no Brasileirão! Confira os melhores momentos da partida, com gols de Mateus Gonçalves e Madson!Siga o Bradesco:https://www.facebook.com/bradesco/                                                             https://www.instagram.com/bradesco/Siga o Sporting Bet:https://www.facebook.com/sportingbet.tv/                                                                       https://www.instagram.com/sportingbet.tvSiga a Chevrolet:https://www.facebook.com/chevroletbrasilhttps://www.instagram.com/chevroletbr/https://www.youtube.com/user/chevrole...https://twitter.com/chevroletbrasilAssine o EI PLUS e assista todos os jogos da Champions League e tenha acesso a vários conteúdos exclusivos do Esporte Interativo: http://bit.ly/2UfmdtUCANAIS:DE PLACA - http://bit.ly/2HxPlHlMFM - http://bit.ly/2KnSU6PDESAFIEI - http://bit.ly/2EZIjL6DE SOLA - http://bit.ly/2k0Xg90EI GAMES - http://bit.ly/2ufcveAAcesse o portal do Esporte Interativo: http://www.esporteinterativo.com.br/"
"lYFNyj8tjDg","Ludmilla - Verdinha (Official Music Video)","2019-11-29T15:00:44.000Z","UCSCB1IQUmNa8Gn5VfSUAUpg","Ludmilla","10","19.01.12","Ludmilla|MC Beyonce|Funk|funk carioca|POP|Sem Querer|Hoje|Warner|MC Ludmilla","2697884","218903","32374","14343","https://i.ytimg.com/vi/lYFNyj8tjDg/default.jpg","False","False","#Ludmilla #VerdinhaVERDINHACompositora: LudmillaEditora: Warner ChappellProdutores: Walshy Fire e Topo La MarkaraEu fiz um pé lá no meu quintalTo vendendo a grama da verdinha a um realEu fiz um pé lá no meu quintalTo vendendo a grama da verdinha a um realMinha mãe já perguntouO meu pai já perguntouA minha vó já perguntouQue planta é essa meu amorMinha mãe já perguntouO meu pai já perguntouA minha vó já perguntouQue plantinha é essa meu amorSou porra loucaMas também sou dedicadaEm casa não falta nadaTrabalho pra estudarEu tenho alma de pipa avoadaMinha vizinha fala, fala, não consegue acompanharUm dia vou poder falar toda verdadeA máscara que vai cair diante da sociedadeBang, bangNão em perturbaVou tacar fogo em mais umSó pra não ficar malucaEu fiz um pé lá no meu quintalTo vendendo a grama da verdinha a um realEu fiz um pé lá no meu quintalTo vendendo a grama da verdinha a um realFiquei loconaChapadonaSó com a marola da Ruhama Ficha Técnica:Produtora: UMANA (@umanafilm)Direção e Montagem: João Monteiro (@jpmmonteiro)Produção Executiva: Toti Higashi (@totihigashi)Direção Criativa: João e Audrey1º Ass de Direção: Audrey Nobrega2º Ass de Direção: Tize Salati2º Ass de Direção: Hana BatistaCoordenação de Produção: Isabelle AcioliDireção de Produção: Thiago FreireProdutora: Michelle RodriguesAjudante de Produção: Caleb ApoliAjudante de Produção: Rodrigo PedreiraAjudante de Produção: Rafael MartinsDireção de Fotografia: Fabio Politi1º Ass de Câmera: Rafael Giacondino2º Ass de Câmera: Maria NavarroVideo Assist: Rebeca CapeceLogger: Carolina ColomboSteadicam: ZugaAss Steadicam: Mateus FelipeEletricista: Marcelo Marujo (Melão)1º Ass de Elétrica: Danilo Soncela2º Ass de Elétrica: Aleandro GoesMaquinista: Julio Garcia (Julinho)1º Ass de Maquinaria: Reinaldo Chijo2º Ass de Maquinaria: Aliandro ZotiDiretor de Arte: Lucas AndradeAss e Produção de Arte/Objetos: Diego HarleyContra Regra: Gabriel TaveiraContra Regra: Maick EduardoAss de Contra Regragem: Hallan FerronFotografia (BTS): Kendy HigashiFotografia (Still): Rodolfo MagalhãesColor: BleachStylist (Ludmilla): Rodrigo PolackAss de Stylist: Ana BallesterosAss de Stylist: Laurentina RamalhoAss de Stylist: Junior MendesStylist (Elenco): Joseph AckonAss de Stylist: David Michael dos SantosCamareira: Paula MontagnerCostureira: ItaemaBeauty (Ludmilla): Cristian de Oliveira GomesBeauty (Elenco): Jessica Andrade MongeAss de Beauty (elenco): Anna Carolina Sant’Anna de SouzaProdutora de Casting: Aisha MbikilaElenco: David Newton César, Luiza Alves de Alexandre, Charlesde Lima Silva, Anddy Williams, Anderson de Lima Santos, AlisonOliveira MeirelesBailarinas (convidadas): Bruna Goncalves Coelho, PatríciaCristino Barros da Silva, Laís de Melo Oliveira, Emily daSilva FerreiraFornecedores:Equipamento de Câmera: MR5Equipamento de Luz e Maquinaria: Cine e Video / Elite CamEstrutura de Produção: Águia Locações, BestCom, Puff CrewGerador: ZerleiGeradorista: Vanei de Jesus BritoCatering: Tia Nenna e JeffEquipe Catering: Jefferson Alencar / Rodrigo da Paixão /Jonathan JoabTransporte:Caminhões de Produção e Vans: TransKinderrVan de Camera: Ricardo de SouzaCarro de Produção: Rubens Leandro D'Avila PereiraMotorista (catering): Wilson Roberto SoaresAgradecimentos especiais ao Tadashi Miyayaciki por ter nosoferecido o seu espaço para podermos realizar o projeto."
"KNwDUT1qG5w","Sampaoli quer esperar Palmeiras e Flamengo para decidir futuro / Quanto Goiás cobra por Michael?","2019-12-01T11:00:04.000Z","UCx0RRbF4EJOUQ28SurIU7Eg","Canal do Nicola","17","19.01.12","sampaoli|sampaoli futuro|sampaoli racing|sampaoli santos|sampaoli palmeiras|sampaoli flamengo|sampaoli quer esperar|jorge nicola|canal do nicola|nicola|sampaoli 2020|michael|michael goias|michael flamengo|michael palmeiras|preço michael|multa michael|goias pedida michael|ofertas michael|ofertas michael goias|valores michael","153345","16042","232","1107","https://i.ytimg.com/vi/KNwDUT1qG5w/default.jpg","False","False","O Racing-ARG vai ter de esperar para ter uma resposta de Jorge Sampaoli. É que o argentino, de saída do Santos, decidiu aguardar movimentos do mercado de técnicos no Brasil antes de definir seu 2020. Ele imagina que Palmeiras e Flamengo podem ficar sem técnicos. Neste caso..Já Michael, sondado por vários clubes brasileiros, vai custar quanto? Conversei com o diretor de futebol do Goiás que revela a pedida do clube para liberar o atacante, de 23 anos.Link do vídeo:https://youtu.be/KNwDUT1qG5w"
"8-gMqrKMDMo","TOUR PELO MEU APARTAMENTO REFORMADO!","2019-11-30T21:00:01.000Z","UCnfUCP_4nSws4KUI4Nkdaig","Maria Venture","23","19.01.12","reforma|maria venture|apartamento|colorido|daily|vlog|venture|morando sozinha|ap|casa|casa nova","245818","50371","292","1174","https://i.ytimg.com/vi/8-gMqrKMDMo/default.jpg","False","False","CORRE PRO MEU FIREWORK! SOLTO CONTEÚDOS EXCLUSIVOS LÁ! 😍BAIXE O FIREWORK: https://fireworktv.onelink.me/iKBL/mariaventureMeu user no firework: @mariaventureE aí galera, tudo beleza? Neste vídeo eu mostro todos os detalhes do meu apartamento reformado! Amei demais e quero saber o que vocês acharam! Espero que tenham gostado! Deixem o like e se inscreva no canal. Beijoos e valeu! :DMinhas redes sociais:Instagram: @mariaventureSnapchat: maria_ventureTwitter: @maria_ventureFacebook: https://www.facebook.com/mariaventure..."
"2CdWrCQTxgM","MC Digo STC e MC Rodolfinho - Levada Mala (kondzilla.com)","2019-11-30T18:00:00.000Z","UCffDXn7ycAzwL2LDlbyWOTw","Canal KondZilla","10","19.01.12","kondzilla|videoclipe|lançamento|Funk|Música de Funk|Musica de Funk|Kond|Musica|Música|musicas|músicas|mc|mcs|funks|funk2019|funks2019|músicas de funk|musicas de funk|levada|mala|mc digo stc|mc rodolfinho","214270","23014","507","441","https://i.ytimg.com/vi/2CdWrCQTxgM/default.jpg","False","False","O Digo e o Rodolfinho emplaca! Confira Levada Mala do MC Digo STC e MC Rodolfinho no Canal KondZilla.Inscreva-se no NOVO CANAL da KondZillahttp://bit.ly/CanalPortalKondZillaLETRA:Sem capacete na minha quebradaDe Ducati multi-estrada as gata fica ouriçadaOs bico sujo não entende nadaFala que a nave é roubadaMas a nave tá quitadaHabilitado e não pega nadaSe trombar VT nóis para e joga o doc na caraOs cara de lei não fala nadaLigo a moto e taco marchaQue não tá constando nadaMandando marcha em cima de marchaDando grau raspando a placaCom a navera penduradaMestre do toque da madrugadaDe rolê pelas quebradaAtiçando a mulheradaSou inspiração pra molecadaSou porta voz da quebradaE os bico não entende nadaMais uma letra tapa na caraMais uma levada malaQue o Digo e o Rodolfinho emplacaSHOWS:(11) 2385-0126KondZilla11 94014-2769 Encontro de MCsPRODUÇÃO MUSICAL:DJ Biel BoladoDIREÇÃO:Tico FernandesREDES SOCIAIS: MC Digo STC Instagram: https://www.instagram.com/mcdigostc/MC RodolfinhoInstagram: https://www.instagram.com/mcrodolfinho/OUÇA NOSSOS HITS:http://bit.ly/LançamentosFunks2019http://bit.ly/MelhoresFunksKondZilla#Funk #KondZilla #MCDigoSTCeMCRodolfinho #PortalKondZilla  #FavelaVenceu #SomosPluralCopyright © 2019 KondZilla®. Todos os direitos reservados."
"WtPfJ0xo73w","A CADA GOL GANHA UM PRODUTO DA NIKE! *DESAFIO DA BLACK FRIDAY*","2019-11-30T21:58:30.000Z","UCriRvZSnEFPSMqSya2s2U6g","Banheiristas","17","19.01.12","caio|vitor|lo|banheiristas|banheristas|banheirista|criança|crianca|videos|futebol|esporte|desenhos|desafios|gol|gols|diversao|kids|teen","209196","24270","218","552","https://i.ytimg.com/vi/WtPfJ0xo73w/default.jpg","False","False","APROVEITA QUE É SÓ ATE AMANHA A BLACK FRIDAY NA NIKE.COM: https://www.nike.com.br/blackfriday[SEJA MEMBRO] e vire PARCEIRO DO BANHEIRISTAS!: https://www.youtube.com/channel/UCriRvZSnEFPSMqSya2s2U6g/join[O QUE VOCÊ VAI TER SE VIRAR MEMBRO]:-1 VIDEO EXCLUSIVO POR SEMANA!-1 LIVE MENSAL EXCLUSIVA!-POSTAGENS EXCLUSIVAS NA COMUNIDADE DO YOUTUBE!-SELOS EXCLUSIVOS QUE TE INDENTIFICA COMO MEMBRO NOS COMENTÁRIOS!-EMOJI EXCLUSIVO DO BANHEIRISTAS!IRMÃOS LO:https://www.youtube.com/channel/UCGmK5lxJny00jnQl03rvgEw/videos[INSCREVA-SE NO CANAL]INSTAGRAM@banheiristas@caiolo@vitorlo_@baheaoficial@owenesquilo@tarobinha@tulinhoAPENAS! CONTATO COMERCIAL: banheiristas@emailtb.com.brbanheiristas@gmail.comMusic from:A new persona for electro swing: Peggy Suave.https://soundcloud.com/simgretina/peg...http://simgretina.tumblr.com/post/133...https://simgretina.bandcamp.com/"
"oO697ufI1YI","PESSOAS QUE ESTÃO TENDO UM DIA BEM PIOR QUE O SEU","2019-11-30T21:00:04.000Z","UCV306eHqgo0LvBf3Mh36AHg","Felipe Neto","24","19.01.12","felipe neto|irmãos neto|bruno correa|bruno corrêa|dia pior que o seu|dia pior|dia ruim|azar|fail|praia|sol|ironia|dominó|monte rushmore|girafa","1207097","180964","1727","4715","https://i.ytimg.com/vi/oO697ufI1YI/default.jpg","False","False","Você acha que seu dia tá indo mal porque você não tá conseguindo encontrar a chave do seu carro ou algo assim? Assista este vídeo. Você vai se sentir bem melhor.INSTALE O VIGIA DE PREÇO! - https://vigiadepreco.com.br/APP STORE - https://apps.apple.com/br/app/vigia-de-pre%C3%A7o/id1467012135GOOGLE PLAY - https://play.google.com/store/apps/details?id=com.vigiadepreco.app&hl=enEXTENSÃO CHROME - https://chrome.google.com/webstore/detail/vigia-de-pre%C3%A7o/hilpchhlogijamlemmggobblmfcdkomgEXTENSÃO FIREFOX - https://addons.mozilla.org/en-US/android/addon/vigia-de-preco/COMPRE O LIVRO NOVO! - https://www.felipenetolivros.com.br/SEJA MEMBRO! - https://www.youtube.com/felipeneto/join"
"2HYqkb4g22M","9 Jogos que Quase Ninguém Viu o Fim","2019-11-30T18:06:28.000Z","UChYkldqKWymAKTsPku_tDfg","#Refúgio Mental","24","19.01.12","#Refúgio Mental|refúgio mental|10 mais|10 coisas|top 5|refúgiomental|mundo estranho|top 10|do mundo|canal|fatos curiosos|fatos desconhecidos|canal top10|fatos|curioso|9 Jogos|Jogos|que Quase|Ninguém|Viu o Fim|com jogos|jogar|aqueles jogos|Flappy Bird|Pac-Man|Battletoads|Contra|jogos|jogos de computador","197522","25933","332","505","https://i.ytimg.com/vi/2HYqkb4g22M/default.jpg","False","False","Para questões relacionadas a direitos autorais, entre em contato conosco: copymanager.mn@gmail.comTechZone ► https://goo.gl/5mT49hAlguma vez você já se deparou com jogos que são simplesmente impossíveis de jogar? Tentativa após tentativa, vida após vida... e nada funciona. O bom é que agora você pode simplesmente acessar a Internet, seguir as instruções de alguém sobre como passar de níveis e lidar facilmente com qualquer obstáculo... Ou talvez até pontuar o jogo todo e pular direto para a final! Mas antigamente, nem sequer podíamos sonhar com uma coisa dessas. Para descobrir como esse ou aquele jogo de videogame terminava, tinha que tentar até o fim. Infelizmente, isso nem sempre funcionava, e algumas finais permanecem até hoje uma incógnita para muitas pessoas. Mas hoje vamos desvendar esse mistério! Vamos descobrir como aqueles jogos que todos já conhecem terminaram."
"OXg0ysnV9o0","Clash Royale Season 6: CLASHMAS! ❄️ Free Tower Skin ☃️ New Card ❄️ TV Royale","2019-11-30T14:00:22.000Z","UC_F8DoJf9MZogEOU51TpTbQ","Clash Royale","20","19.01.12","Clash Royale|Clash Royale Game|Supercell|Supercell Game|Clash Royale Supercell|Mobile Game|season 6|clashmas|free tower skin|free reward|pass royale|emote","2298479","93652","2222","4639","https://i.ytimg.com/vi/OXg0ysnV9o0/default.jpg","False","False","Watch the CRL World Finals on December 7th: https://www.youtube.com/esportsroyaleNovember Release Notes: https://clashroyale.com/blog/release-notes/november-update.htmlSeason 6 starts on December 2nd! Get a FREE Tower Skin reward, play in the new Arena, unlock the new card and get it boosted to your King Level!Subscribe for more! ►► http://supr.cl/SubRoyaleEnter the Arena! From the creators of Clash of Clans comes a real-time multiplayer game starring the Royales, your favorite Clash characters and much, much more.Collect and upgrade dozens of cards featuring the Clash of Clans troops, spells and defenses you know and love, as well as the Royales: Princes, Knights, Baby Dragons and more. Knock the enemy King and Princesses from their towers to defeat your opponents and win Trophies, Crowns and glory in the Arena. Form a Clan to share cards and build your very own battle community.Lead the Clash Royale Family to victory!FEATURES• Duel players from around the world in real-time in both 1v1 and 2v2 Battles• Earn chests to unlock rewards, collect powerful new cards and upgrade existing ones• Destroy opponent's towers and win Crowns to earn epic Crown chests• Build and upgrade your card collection with the Clash Royale Family along with dozens of your favorite Clash troops, spells and defenses• Construct your ultimate Battle Deck to defeat your opponents• Progress through multiple Arenas all the way to the top• Form a Clan to share cards and build your very own battle community• Challenge your Clanmates and friends to a private duel, or play side-by-side in a 2v2 Battle• Work together with your Clan to unlock Clan Chests• Take on daily and weekly Quests for big rewards• Play new events every week• Learn different battle tactics by watching the best duels on TV RoyalePLEASE NOTE! Clash Royale is free to download and play, however, some game items can also be purchased for real money. If you don't want to use this feature, please disable in-app purchases in your device's settings. Also, under our Terms of Service and Privacy Policy, you must be at least 13 years of age to play or download Clash Royale. A network connection is also required.Support:Are you having problems? Visit http://supercell.helpshift.com/a/clash-royale/ or contact us in-game by going to Settings, Help and support.Privacy Policy:http://supercell.com/en/privacy-policy/Terms of Service:http://supercell.com/en/terms-of-service/Parent's Guide:http://supercell.com/en/parents/#ClashRoyale"
"jB6-3jjiOXk","Zé Neto e Cristiano - BEBI MINHA BICICLETA - DVD Por Mais Beijos Ao Vivo","2019-11-29T14:00:11.000Z","UCRRu9OXVYd5clj2Bs29gUVQ","Zé Neto e Cristiano","10","19.01.12","ze neto e cristiano|zé neto e cristiano|musica sertaneja|música sertaneja|nova música de|largado as traças|derreter a aliança|Morador de rua|Notificação preferida|Bebida na ferida|ontem era eu|#zenetoecristiano|ferida curada|amigo taxista|bateria acabou|ze neto e cristiano 2019|estado decadente|mulher maravilha|sertanejo|status que eu não queria|sertanejo 2018|sertanejo universitário|enchendo e derramado","2464601","75486","1686","2034","https://i.ytimg.com/vi/jB6-3jjiOXk/default.jpg","False","False","OUÇA O ÁUDIO NA SUA PLATAFORMA FAVORITA:SPOTIFY 👉 https://open.spotify.com/album/5Qn8laDtOhTweODnPud3KPDEEZER 👉 https://www.deezer.com/br/album/119073962?app_id=140685&utm_source=lf&utm_content=1f37c011d43ce7bdd3a02ff3bfb5061fAMAZON MUSIC 👉 https://music.amazon.com.br/albums/B081J4F5ZZAPPLE MUSIC 👉 https://music.apple.com/br/album/1488030710?app=music&lId=1792789&cId=none&src=Linkfire&sr=4&ign-itsct=catchall_p4&ign-itscg=30440&ign-mpt=uo%3D4TIDAL 👉 https://tidal.com/browse/track/122553497NAPSTER 👉 https://br.napster.com/artist/ze-neto-and-cristiano/album/bebi-minha-bicicleta-coracao-falido-ao-vivoGOOGLE PLAY 👉 https://play.google.com/store/music/album/Z%C3%A9_Neto_Cristiano_Bebi_Minha_Bicicleta_Cora%C3%A7%C3%A3o_Fal?id=Bmhyxlte4cscshangymmf6ewufe&PCamRefID=LFV_1f37c011d43ce7bdd3a02ff3bfb5061fYOUTUBE MUSIC 👉 https://music.youtube.com/watch?v=0iG714P6Bqk&list=PLaf863IOhXhyyXk4B67J7TnXEfDTtgwlkZé Neto e Cristiano - BEBI MINHA BICICLETA - DVD Por Mais Beijos Ao VivoBEBI MINHA BICICLETA ( Letra )Compositores: Rafael Quadros, Vinni Miranda, Waleria Leão, Denner Ferrari, Kid LimaCortaram minha luzPerdi o meu empregoMinha geladeiraEra só ovo e geloDepois da sacanagem que você fez comigoFiquei com coração e o bolso falidoCom o que aconteceuAté bala perdida tá tendo mais rumo que euBebi minha bicicletaBebi minha TVSó não bebo o meu celularPorque preciso ligar pra você#DVDPorMaisBeijosAoVivo #ZeNetoeCristiano #BebiMinhaBicicleta"
"0W_KzbPOw0E","Uma ótima opção para substituir o pão no café da manhã,  super fácil e rápido delicioso","2019-11-30T20:55:19.000Z","UCMsiBt3dWti3oJLJR_7ikjQ","Cleo Alves","22","19.01.12","Cleo Alves","100446","7800","164","196","https://i.ytimg.com/vi/0W_KzbPOw0E/default.jpg","False","False","Dessa vez fiz uma receitinha deliciosa, super fácil e rápido para substituir o pão no café da manhã, veja que delícia INGREDIENTES:2 colheres de sopa de flocão de arroz 4 colheres de sopa bem cheia de tapioca 2 ovos 1 colher de sopa de queijo parmesão 3Sal a gosto GENTE SIGA-ME  NO INSTAGRAMhttps://www.instagram.com/cleoalves_20/?hl=pt-brINSCREVA-SE NO CANAL E ATIVE O SININHO PARA RECEBER AS NOTIFICAÇÕES DE CADA VÍDEO QUE EU POSTAR COMPARTILHE COM SEUS AMIGOS DEUS ABENÇOE A TODOS. BJS 💋💋💋CANAL PARCEIRO: CULINÁRIA COM GILBERTO  https://www.youtube.com/channel/UCV6xz9uONeKU5I91FE15WRwCANAL PARCEIRO: JESUS CRISTO TE FALA https://www.youtube.com/c/JESUSCRISTOTEFALApalavrasdevidaeternaCANAL PARCEIRO: TIAGO SODRÉ https://www.youtube.com/channel/UCy78YRi3hQhXr0U2fyXFE1w"
"03LoM5mlj6o","GABIGOL RECUSA PROPOSTA DO FLAMENGO? MENGÃO PRÓXIMO DE VENDER JOGADOR PARA O JAPÃO? RELACIONADOS E+","2019-11-30T19:20:21.000Z","UCIpylxq_JDl2YpvTpN11p9Q","FLAZOEIRO","17","19.01.12","Flamengo|Fla|Mengo|Mengão|Fla Notícias|Notícias do Flamengo|Ultimas Notícias do Flamengo|Flamengo 24 Horas|Flamengo ao vivo|Fox Sports|Globo Esporte|Treino Do Flamengo|Gabigol|Gabriel Barbosa|Gabigol Flamengo|Gabigol recusa flamengo|Gabigol Resposta Flamengo|Flamengo renova com Gabigol|Gabigol renova com o Flamengo|Everton Ribeiro|Everton Ribeiro Lesionado|Palmeiras|Flamengo x Palmeiras|Matheus Savio|Jogador do Flamengo vendido","118561","15011","307","2732","https://i.ytimg.com/vi/03LoM5mlj6o/default.jpg","False","False",""
"mlBdEXwNLys","Horóscopo de DEZEMBRO 2019, por Márcia Fernandes","2019-11-30T18:00:27.000Z","UCFU3gn0coWqxh_1qzhv4AQg","Márcia Fernandes","22","19.01.12","márcia fernandes|sensitiva|astróloga|astrologia|numerologia|planetas|signos|horóscopo dezembro 2019|dezembro 2019","63219","9124","127","185","https://i.ytimg.com/vi/mlBdEXwNLys/default.jpg","False","False","Horóscopo de DEZEMBRO 2019, por Márcia FernandesPrevisões Astrológicas no mês de DEZEMBRO 2019. Confira neste vídeo tudo sobre seu Signo. O décimo segundo mês em nosso calendário atual foi nomeado de Dezembro em homenagem a Decem, uma das Senhoras do Destino, regente do presente e tecelã do fio da vida na cultura antiga romana.Neste mês, celebrações antigas como o solstício de inverno (no hemisfério norte) eram exaltadas refletindo em tradições que perpetuamos até hoje no nosso Natal, como o pinheiro e as guirlandas.Também dentro da cultura judaica temos o Hannukah ou festival das luzes, no qual se acende, diariamente, uma vela branca em agradecimento a reconquista do Templo de Jerusalém, há dois mil anos.Dezembro representa o fechamento de um ciclo, um período para refletir sobre o ano que passou, uma avaliação do que iremos querer para o próximo ano.Este ano, em especial, reveja todos os aspectos de sua vida: das realizações as frustrações. Balanceio o que quer. Delimite seus projetos mais importantes e priorize um deles.Deseja saber mais sobre as previsões de Dezembro? Tudo sobre seu Signo? Dicas para seu sucesso, sua prosperidade? Então, acesse o link com alegria e fique por dentro de tudo:  https://www.marciafernandes.com.br/site/horoscopo-dezembro-2019/Paz, luz Divina e um Dezembro muito próspero a todos!Feliz Natal e um Ano Novo repleto de paz, amor e infinita prosperidade! Feliz 2020 a todos!"
