video_id,title,publishedAt,channelId,channelTitle,categoryId,trending_date,tags,view_count,likes,dislikes,comment_count,thumbnail_link,comments_disabled,ratings_disabled,description
"k14i2gYlf8M","Buying Condom For The First Time | Harsh Beniwal","2019-11-30T13:00:03.000Z","UCVmEbEQUGXHVm-O9pqa3JWg","Harsh Beniwal","23","19.01.12","harsh beniwal|beniwal|Harshbeniwal|harsh|harsh beniwal new video|harsh beniwal latest video|harsh beniwal condom video|buying condom for the first time|condom|harsh beniwal popular video|harsh beniwal trending video|harsh beniwal comedy video|harsh beniwal funny video|bollywood|world aids day|precaution","3654105","400583","7109","26899","https://i.ytimg.com/vi/k14i2gYlf8M/default.jpg","False","False","Hey Guys We are back with new video, Tried something different this time I hope Guys will love it.In this video you will be seeing the struggle of a Young boy Anni who is going to buy condom for the first time As on 1 December its World aids Day so this video is to spread awareness To use protection and stay safe.BeJijhak mango :DDop - Nitin goyal camThumbnail - Vishal Rana (Phoenix)Subscribe: https://www.youtube.com/c/TheBrainHumourLike|Share|CommentShow us some love on these platform too.Facebook: https://www.facebook.com/harshbeniwalofficialInstagram: https://www.instagram.com/harshbeniwal/Snapchat: Harshbeniwal"
"FhjK08rnBEs","[Hindi] PMCO Global Finals Day 3 | Vivo | Fall Split | PUBG MOBILE CLUB OPEN 2019","2019-12-01T14:45:34.000Z","UCmeeY9kzNswUpbYyJntb3Aw","PUBG MOBILE Esports","20","19.01.12","Entity|PMCO|Esports|pmco fall split global finals|Pubgm hindi|PUBG mobile|PMCO LIVE|pmco finals|global finals|pmco global finals day 3|Soul|PMCO FINALS|esports|Grand Finale|PMCO HINDI|Gaming|pmco|global finals day 3|pubgm|pmco global finals|fall split global finals","1872342","41601","1122","360","https://i.ytimg.com/vi/FhjK08rnBEs/default.jpg","False","False","PMCO Fall Split Global Finals, sponsored by @vivo Day 3 is here! Top 16 teams from around the world will battle against each other to win #PMCO Fall Split Global Finals and #BETHEONEBuy Tickets: http://pmco2019.info/myticketPrize PoolWinner: $180,000Runner up: $90,0003rd Prize: $45,0004th Prize: $23,0005th Prize: $12,000Every Chicken Dinner: $5,000“Download PUBG MOBILE: https://bit.ly/2XTh5zq” Buy Tickets: http://pmco2019.info/myticketEvent Dates: Nov. 29-Dec. 1Time: Doors open at 1:30pm (GMT+8), broadcast starts at 2:30pm#pmco2019 #EsportsTeams: 1#RRQ (RRQ.ATHENA, SEA)2#ILMN (Illuminate The Murder, SEA)3#Entity (Entity Gaming, South Asia)4#SouL (SouL, South Asia)5#YOODO (YOODOO GANK, Malaysia) 6#Uniq (TeamUnique, Europe)7#C9 (Cloud9, North America)8#UNG (UNicornGaming, Wildcard)9#KS (Kurd Squad, MENA)10#TQ (Team Queso, South America)11#TES (TOPESPORTS, China)12#EGC (EGCKRBlack, Korea)13#ARW (AllRejectionGaming Wistaria, Japan)14#MEGA (MEGA Esports, SEA)15#BTR (Bigetron RA, SEA)16#ORANGE (ORANGE ESPORTS CG, SEA)"
"ldAgG1M4qZg","Dabangg 3: Munna Badnaam Hua Video | Salman Khan | Badshah,Kamaal K, Mamta S | Sajid Wajid","2019-11-30T16:00:14.000Z","UCq-Fj5jknLsUf-MWSy4_brA","T-Series","10","19.01.12","munna badnaam hua|munna badnaam hua song|munna badnaam hua full song|dabangg 3|dabangg|badnaam|salman khan|dabangg 3 song|salman khan dabangg 3|songs 2019|sonakshi sinha|tseries|munna badnaam hua new song|t-series songs|bollywood songs|new songs bollywood|prabhu deva|salman khan songs|new songs 2019|dabangg 3 new song|munna badnaam hua dance|munna badnaam hua video song|dabangg 3 music|hud hud","13852312","343834","36651","29485","https://i.ytimg.com/vi/ldAgG1M4qZg/default.jpg","False","False","Presenting the video song Munna Badnaam Hua from the most awaited movie Dabangg 3. The film features Salman Khan, Sonakshi Sinha in the leading roles along with Arbaaz Khan and Saiee Manjrekar. Dabangg 3 is directed by Prabhu Deva.India's most badass and lovable cop Chulbul Robinhood Pandey is back with 'Dabangg 3'. Salman Khan Films in Association With Saffron Broadcast & Media Limited Present Dabangg3 an Arbaaz Khan Production.Chulbul Pandey packs surprise with the new edition titled 'Munna Badnaam Hua'. Watch Chulbul Pandey in an all-new avatar with 'Munna Badnaam Hua'.#MunnaBadnaamHua #Dabangg3 #SalmanKhan----------------------------------------------------------------Make your TikTok Video Here: MUNNA BADNAAM HUA  https://www.tiktokv.com/i18n/share/music/6758324483565553666 MUNNA BADNAAM HUA 2 https://www.tiktokv.com/i18n/share/music/6758324942049134594----------------------------------------------------------------♪Full Song Available on♪ iTunes: http://bit.ly/Munna-Badnaam-Hua-From-Dabangg3-iTunesHungama: http://bit.ly/Munna-Badnaam-Hua-From-Dabangg3-HungamaWynk: http://bit.ly/Munna-Badnaam-Hua-From-Dabangg3-WynkGaana: http://bit.ly/Munna-Badnaam-Hua-From-Dabangg3-GaanaJioSaavn: http://bit.ly/Munna-Badnaam-Hua-From-Dabangg3-JioSaavnApple Music: http://bit.ly/Munna-Badnaam-Hua-From-Dabangg3-AppleMusicAmazon Prime Music: http://bit.ly/Munna-Badnaam-Hua-From-Dabangg3-AmazonPrimeMusicSpotify: http://bit.ly/Munna-Badnaam-Hua-From-Dabangg3-SpotifyGoogle Play: http://bit.ly/Munna-Badnaam-Hua-From-Dabangg3-GooglePlayFor Caller Tunes :Munna Badnaam Hua http://bit.ly/2rGenRzMunna Badnaam Hua - Pyaar Mein Aise Pagla http://bit.ly/2phC029Munna Badnaam Hua - Innocent Se Pehle http://bit.ly/2NL2lixMunna Badnaam Hua - Collar Pe Chasma Tikaake http://bit.ly/33I32yyMunna Badnaam Hua - Model Jaisi Body Hai http://bit.ly/2KiA5S6Set as Caller Tune:Set Munna Badnaam Hua  as your caller tune -sms DBANG11 To 54646Set Munna Badnaam Hua - Pyaar Mein Aise Pagla as your caller tune - sms DBANG12 To 54646Set Munna Badnaam Hua - Innocent Se Pehle as your caller tune -sms DBANG13 To 54646Set Munna Badnaam Hua - Collar Pe Chasma Tikaake as your caller tune - sms DBANG14 To 54646Set Munna Badnaam Hua - Model Jaisi Body Hai as your caller tune - sms DBANG15 To 54646________________________________________♫SONG CREDITS♫♫ Song- Munna Badnaam Hua♫ Music: SAJID WAJID ♫ Singers: Badshah, Kamaal Khan, Mamta Sharma ♫ Lyricists: Danish Sabri ♫ Rap Lyrics: Badshah ♫Music produced & conducted by Aditya Dev ♫ Backup Vocals:  Ashish Sehgal, Rahul Kothari,  Abhishek Jhanwar, Kaushtuk Gupta, Subodhh Sharma, Sameer Khan Royal, Sajid Masood ♫Rhythm arrangement & Percussions by Nitin Shankar ♫Mixed & Mastered by: Eric Pillai @ Future Sound of Bombay ♫Assisted by: Michael Edwin Pillai ♫Sajid Wajid’s Assistants: Ashish Sehgal, Uvie, Rahul Kothari, Sajid Masood, Abdullah Khan, Sameer Khan Royal ♫Recorded by: Abani Tanti & Pankaj Kaushik @ Taaleem Studio ♫Original soundtrack composed and designed by SAJID WAJID♫ Choreographer: Vaibhavi Merchant♫ Music Label: T-Series ________________________________________Enjoy & stay connected with us!👉 Subscribe to T-Series: http://bit.ly/TSeriesYouTube👉  Like us on Facebook: https://www.facebook.com/tseriesmusic👉Follow us on Twitter: https://twitter.com/tseries👉 Follow us on Instagram: http://bit.ly/InstagramTseries"
"Fy6HTNRLphQ","I Never Wear Helmet, I Won't Give Fine- A Defiant Woman Commuter In Cuttack","2019-12-01T08:44:25.000Z","UCCgLMMp4lv7fSD2sBz1Ai6Q","OTV","25","19.01.12","otv|otv news|odisha tv|odishatv|odisha news|latest odisha news|odisha current news|breaking news odisha|otv odisha|odisha tv latest|latest news otv|latest odia News|naveen patnaik|bhubaneswar|bhubaneswar news|ଓଟିଭି|ଓଡିଶା ଖବର|ଓଡ଼ିଆ news","105277","4655","232","777","https://i.ytimg.com/vi/Fy6HTNRLphQ/default.jpg","False","False","OdishaTV is Odisha's no 1 News Channel. OTV being the first private satellite TV channel in Odisha carries the onus of charting a course that behoves its pioneering efforts.Accordingly its charter objectives are FREE, FAIR and UNBIASED. OTV delivers reliable information across all platforms: TV, Internet and Mobile.Stay tuned for all the breaking news !Visit Our Website https://odishatv.in/Android App: bit.ly/OTVAndroidAppiOS App: http://bit.ly/OTViOSAppWatch Live: http://live.odishatv.in/YouTube: https://goo.gl/Ehz6OPFacebook: https://www.facebook.com/otvnewsCircle on G+: google.com/+otvodishaTwitter: https://twitter.com/otvnewsInstagram: https://www.instagram.com/otvnews/#OdishaTV #OTV"
"SpTkR3p2pZk","DR PRIYANKA REDDY के साथ हैदराबाद के उस HIGHWAY पर क्या हुआ था|CRIME TAK","2019-11-29T12:17:41.000Z","UCpDxPj3sm40ISX5hn-TlYcw","Crime Tak","25","19.01.12","crime tak|crimetak|priyanka reddy phone call|priyanka reddy last call|rangareddy priyanka|priyanka reddy mother|priynka reddy live|priyanka reddy parents|priyanka reddy sister|family|HINDI NEWS|BREAKING NEWS|AAJTAK NEWS|AAJTAK VIDEO|CRIME TAK LATEST|HYDERBAD|BIRYANI|HYDERABAD BIRYANI|BIRYANI DISH|FOOD|SCOOTY|ACTIVA|GIRL ON ACTIVA","2259168","34457","2297","4938","https://i.ytimg.com/vi/SpTkR3p2pZk/default.jpg","False","False","Mail us at crimetak@aajtak.comThe Cyberabad police have reportedly detained four persons including truck drivers and cleaners in connection with P.Priyanka Reddy’s death here on Friday.The prime suspect, identified as Mohd Pasha, along with others is suspected to have kidnapped, gang-raped and killed her. Pasha is a native of Mahbubnagar district---------About the Channel:आज वक़्त के जिस दौर में हम जी रहे हैं उसमें आने वाला पल किस शक्ल में हमारे सामने आएगा कोई नहीं जानता। हां....अगर हम कुछ कर सकते हैं तो सिर्फ़ इतना कि आने वाले पल के क़दमों की आहट को ज़रूर भांप सकते हैं। मगर आने वाले वक़्त की नीयत क्या है ये तभी जाना जा सकता है जब हम अपने आंख और कान खुले रखें। और इसमें CRIME TAK आपकी मदद करेगा। क्राइम की दुनिया की हर छोटी-बड़ी ख़बरों से आपको आगाह करके। ताकि आप सुरक्षित रहें।Nowadays we are living in such a age, where one knows that what will happen in next moment? In such scenario what we can do is to be stay aware each moment. We can prepare for future only if we keep our eyes and ears open. CRIME TAK is here to help and assist you in this regard, by making you aware of all crime related incidents/stories, so that you can be safe.Follow us on:FB: https://www.facebook.com/crimetakofficial/Twitter: https://twitter.com/CrimeTakBrand"
"ZVvFyOwNarU","Kunwari Bohu | Full Ep 356 | 29th Nov 2019 | Odia Serial – TarangTV","2019-11-30T14:00:06.000Z","UCnm5DH0oJndtA-6J10_jIEw","Tarang TV","24","19.01.12","tarang|tarang tv|tarang tv online|tarang tv serial|odia tarang tv serial|tarang tv show|taranga channel|tarang tv channel|odia tarang channel|odia serial|odia serial video|odia channel|odia tv channel|odia tv show|odia tv|tarangtv programe|tarang serial|tarang serial kuanri bohu|kuanri bahuserial|odia tv programe|kunwari bohu serial|odia popular tv shows|kuanri bahu full episode|kuanri bohu full episode","406363","2230","381","83","https://i.ytimg.com/vi/ZVvFyOwNarU/default.jpg","False","False","Shraddha is trying to say Sai about the truth for which she is behaving so rudely with Sai and on other hand Sai have already decided to stay away from Shraddha’s life. In between this Sai has suspected that Vivek is dead for which no one is able to see him and he has decided to find out the truth behind Vivek’s missing and what the entire family along with Shraddha is hiding everyone and Shraddha on warning of ammaji is taking care of Vivek’s body from rotting. Now it’s time to see will Shraddha be able to convey her truth to Sai? Will Sai again trust Shraddha? Will Shraddha and Sai again be together?Monday-Saturday at 7.30 p.m. only on Tarang TV.SUBSCRIBE to TarangTV channel for more Odia Serial and movie videoshttps://goo.gl/QgkQLbLike us on Facebookhttps://www.facebook.com/tarangtv Circle on G+  https://goo.gl/ArUUGwFollow us on Twitterhttps://twitter.com/tarangtvodishaFollow us on Instagramhttps://www.instagram.com/tarangtv/Visit our website for further details: www.tarangtv.in#KunwariBohu #TarangSerial #OdiaSerial"
"NV3Z9gkYwoM","Dr.Priyanka Reddy Rapist Kidnapper Arrested मोहम्मद पासा गैंग ने दिया हैदाराबाद रेप कांड को अंजाम","2019-11-29T11:54:27.000Z","UC1tnj_v8Sn-hWERFvqSjBWQ","inKhabar","25","19.01.12","हैदराबाद रेप कांड|हैदराबाद रेप कांड मोहम्मद पाशा गैंग|hyderabad rape case|Hyderabad veterinary doctor murder|hyderabad doctor murder|Hyderabad Doctor killed|Andhra Pradesh|Anantapur district|Hyderabad based Veterinarian|priyanka reddy|doctor priyanka reddy case|Shadnagar Murder Case|priyanka reddy news|priyanka reddy rape case|Shadnagar Murder Case victims|Shadnagar Murder Case accused mohammed pasha|hyderabad doctor murder accused mohammed pasha","2949299","41893","5793","10792","https://i.ytimg.com/vi/NV3Z9gkYwoM/default.jpg","False","False","Dr.Priyanka Reddy Rapist Kidnapper Arrested, हैदराबाद के बाहरी इलाके शमसाबाद में 26 वर्षीय महिला डॉक्टर की जली हुई लाश मिलने से पूरे इलाके में सनसनी फैल गई। आरोपी पकडे गया है और शुरुवाती जांच में पता चला है कि मोहम्मद पासा गैंग ने हैदाराबाद रेप कांड को अंजाम दिया है | #Hyderabad #RIPPriyankaReddy #IndiaNewsIndia News, the leading news channel for news in Hindi in India. India News in Hindi. For More Information visit us: http://www.inkhabar.com/Connect with us on Social platform at https://www.facebook.com/InkhabarConnect with us on Social platform athttps://twitter.com/InkhabarSubscribe to our YouTube channel: https://www.youtube.com/user/itvnewsindiaहैदराबाद रेप कांड,हैदराबाद रेप कांड मोहम्मद पाशा गैंग ,hyderabad rape case,Hyderabad veterinary doctor murder,hyderabad doctor murder,Hyderabad Doctor killed,Andhra Pradesh,Anantapur district,Hyderabad based Veterinarian,priyanka reddy,doctor priyanka reddy case,Shadnagar Murder Case,priyanka reddy news,priyanka reddy rape case,Shadnagar Murder Case victims,Shadnagar Murder Case accused mohammed pasha,hyderabad doctor murder accused mohammed pasha"
"CvrYHXV6o5Y","A Traffic Violator In Cuttack:  I Don't Like Wearing Helmet, Take My Vehicle,Look How She Reacts","2019-12-01T07:56:41.000Z","UC90RW5ZmBBqp4r2QIQxfACA","Kanak News","25","19.01.12","Odisha Latest News|Odisha Latest|Latest News|Odisha Poltics|Odia Famous People|Orissa News|Orissa Latest News|Odisha Orissa|Bhuabneswar|Cuttack|Kanak News|Puri|News Odisha|Oriya News|Odia News|Breaking News|News Headlines|Kanak News Odisha","88184","6250","422","918","https://i.ytimg.com/vi/CvrYHXV6o5Y/default.jpg","False","False","For latest Odisha News Follow us:Visit: http://kanaknews.com/YouTube: https://www.youtube.com/user/kanaktvonlineTwitter: https://twitter.com/kanak_newsFacebook: https://www.facebook.com/KanakNewsPlaylists-Big Debate- https://www.youtube.com/watch?v=FThjqCRJXQE&list=PLAfchLMlcCeXro0DaMSfVSS4Q-Q_jhTBbOne to One-https://www.youtube.com/watch?v=OvDWzu1jCco&list=PLAfchLMlcCeUPb0xj4SZtmDbVvP0iF-14Loka Nakali Katha Asali:https://www.youtube.com/watch?v=zuAo6OBmyfA&list=PLAfchLMlcCeXzGOLmXc4K87EMc3hiyiezManoranjan Mishra Live:https://www.youtube.com/watch?v=jofnsNMsPes&list=PLAfchLMlcCeWfFRDWkNmLVnc2LeGp3oQ8"
"vXuO3Yg6yKE","Harrdy Sandhu - Dance Like  | Lauren Gottlieb | Jaani | B Praak  | Latest Hit Song 2019","2019-11-30T06:30:13.000Z","UC56gTxNs4f9xZ7Pa2i5xNzg","Sony Music India","10","19.01.12","Sony Music India|Latest Hits|Sony Music|hardy sandhu new song|harrdy sandhu dance like|harrdy sandhu dance like song|dance like hardy sandhu|dance like|dance like song|hardy sandhu|hardy sandhu song|hardy sandhu new song 2019|hardy sandhu latest song|hardy sandhu latest new song 2019|harrdy sandhu lauren gottlieb|harrdy sandhu lauren gottlieb song|lauren gottlieb songs|hardy sandhu all song|lauren gottlieb|harrdy|dance like a pro|dance like hardy","13096136","292070","13414","20586","https://i.ytimg.com/vi/vXuO3Yg6yKE/default.jpg","False","False","After the massive success of Kya Baat Aye,  “Naah”  & Backbone, the dream team is back with the most sensational pop single of 2019 - “Dance Like”.The song has been Written & Composed by Jaani & Arranged by B Praak. Yet again Harrdy Sandhu with his mesmerising vocals creating the magic and has got the gorgeous and super talented Lauren Gottlieb grooving to it.    #DanceLike  #HarrdySandhu #Bpraak  #Jaani #LaurenGottlieb Listen To Dance Like on - Jio Saavn : https://www.jiosaavn.com/album/dance-like/3hvGyY6xK4A_Wynk  - https://wynk.in/u/iuTE8eo9uGaana - https://gaana.com/song/dance-like-2Amazon Prime - https://music.amazon.in/albums/B081Z44YKF/B081Z4MN6M?tab=CATALOGSpotify - https://open.spotify.com/track/36EPfDEkfLYQLt8Fvced8x?si=hFQKVg_SRoGRiE_KB4WUxwHungama - http://www.hungama.com/album/dance-like/50396161/Apple Music  - https://music.apple.com/in/album/dance-like-single/1489156675?app=music&ign-mpt=uo%3D4Song : Dance Like Artist : Harrdy SandhuStarring : Harrdy Sandhu,  Lauren GottliebLyrics & Composition : JaaniMusic : B Praak Mixing & Mastering : Eric Pillai (Future Sound Of Bombay)Song Recording  : Saffron Studio (Gurjinder Singh & Akash Bambar) Guitarist : Shomu SealVideo Director : Keoni MarceloEditor : Adele PereiraColorist : Nadeem AkhtarChoreographer : Sahaj Singh , Shreoshi KumarAssistant Choreographer : Priyanka MitraHair Styling (Harrdy Sandhu) : Ali KhanProduction : Uluc Yemen Aslan Hair Design : Darshan YawlekarCostume Assistant : Shyam Bhaskar DOP : Muko TimrikDOP 2 : R. DeePublicity Creatives / Designs : Aman Kalsi Location : Cesme , TurkeyLabel : Sony Music IndiaTo set Dance Like as your caller tune -    Airtel subscribers Dial 5432117303045   Vodafone subscribers Dial 53711754175   Idea subscribers Dial 53711754175   BSNL (South/East) subscribers sms BT 11754175 to 56700   BSNL (North/West) subscribers sms BT 7338065 to 56700Jio users, download the JioSavan Music App to set this song as your Jio Tune 👉 Subscribe To Sony Music India YouTube - http://bit.ly/SonyMusic_YouTube👉 Like us : Facebook - https://www.facebook.com/SonyMusicNorth👉 Follow us : Instagram - https://www.instagram.com/sonymusicnorth👉 Follow us : Twitter - https://twitter.com/sonymusicnorthAudio on Sony Music Entertainment India Pvt. Ltd(C) 2019"
"NFEQ3F-p3mo","#AskR2H | Episode 2 | Qna | Round2hell | R2h","2019-11-29T12:00:28.000Z","UCt4atlExw8aj3Bm79nv1fig","Round2hell","23","19.01.12","round2hell|r2h|round to hell|askr2h|askr2h2|qna|round2hell qna|the horror house|harsh beniwal|nazim|zayn|wasim|round2hell comedy|round2hell interview|round2hell new video|collab","4623746","442682","9444","34136","https://i.ytimg.com/vi/NFEQ3F-p3mo/default.jpg","False","False","Hello guys thank you so much to dropped your questions as much as we never expect but your love is so amazing so guys we received 36,000+ Questions.We have answered as much as we can but it was not possible to including all the questions which we got on the instagram post so please don’t be upset , you will get another chance in our next QnA video . So enjoy the videoFor Behind The Scenes & More..Follow us on Instagram : @round2hellhttp://instagram.com/round2hellFollow us on :-→ Facebook Page : http://www.facebook.com/round2hell→ instagram page : http://instagram.com/round2hell→ Twitter Page : https://twitter.com/round2hell Follow our artists :-→ nazim : http://www.facebook.com/nzm0211→ zayn : http://www.facebook.com/zayn.saifi.50 → wasim : http://www.facebook.com/wasimahmadr2hSubscribe Here ⇨ https://www.youtube.com/channel/UCt4a...Thumbnail & Editing: Ryan SaifiManaged by Brandzup( VCOI )Copyright Disclaimer Under Section 107 of the Copyright Act 1976, allowance is made for fair use for purposes such as criticism, comment, news reporting, teaching, scholarship, and research. Fair use is a use permitted by copyright statute that might otherwise be infringing. Non-profit, educational or personal use tips the balance in favor of fair use. No copyright infringement intended."
"Jslqn_dgD1g","MEME MINATI - THE ULTIMATE CARRYMINATI MEME COMPILATION","2019-11-30T06:23:31.000Z","UC0IWRLai-BAwci_e9MylNGw","CarryisLive","24","19.01.12","CarryMinati|Carryminati gaming|carrisLive|Gaming|Livestream|Indian gaming|carryminati meme|meme funny|meme compilation|fails|carryislive m|meme|carrymianti new video|new video","1148888","168638","3839","7606","https://i.ytimg.com/vi/Jslqn_dgD1g/default.jpg","False","False","Credits - https://www.youtube.com/channel/UCIHqYFVBeGdyXegEXhFZCmwDiscord▶ https://discord.gg/CarryisliveSupport the Stream▶ https://streamlabs.com/carryisliveBest way to experience stream ▶ https://goo.gl/szUAUZ The PRESTIGE MEMBER OF THE HOMO-BAKCHODIAN SOCIETY:GO TO▶️https://goo.gl/szUAUZ on the right side you will see JOIN hit that! CarryisLive: ▶ https://www.youtube.com/channel/UC0IW...Snapchat► heyAjeyInstagram► https://www.instagram.com/carryminati/Facebook ► https://www.facebook.com/CarryDeol/Twitter ► https://twitter.com/CarryMinatiPC SpecsProcessor Intel(R) Core(TM) i7-8086K CPU @ 4.00GHz Video Card NVIDIA GeForce GTX 1080 TI RAM 32 GB About CarryMinati: Youthoob certified memberThat's all Folks!"
"JLawo20mBjQ","Yaad Piya Ki Aane Lagi | Bheegi Bheegi Raton Mein | Cute Love Story By Unknown Boy Varun","2019-11-30T02:30:00.000Z","UC4DLvb5xZ9OLcVM1KC_R97g","unknown boy varun","10","19.01.12","Yaad Piya Ki Aane Lagi|Cute Love Story|Bheegi Bheegi Raton Mein|love story|true love|love story 2019|falgunipathaksongs|ubv","1141936","35241","1735","1151","https://i.ytimg.com/vi/JLawo20mBjQ/default.jpg","False","False","This is a Cute Love Story representation by Unknown Boy Varun of Yaad Piya Ki Aane Lagi song. Cast - Varun, Shree & DeepakSub Cast - OmVeer, Sunny, Vicky & SumitDirector - PRO'VACinematographer - Pratik TiwariEditor - Pratik TiwariStoryWriter - Varun Dev Bundela Special Thanks - Deepak & ShreePoster By ARC Creation♫Song Credits♫♪ Song: Yaad Piya Ki Aane Lagi ♪ Singers: Neha Kakkar♪ Music - Tanishk Bagchi♪ Programmed and Arranged by - Tanishk Bagchi ♪ Additional Programming - Ganesh Waghela ♪ Lyrics - Jaani♪ Guitars - Shomu Seal♪ Special Appearance: Faisu♪ Mixed and Mastered: Eric Pillai at Future Sound Of Bombay♪ Mix Assistant Engineers - Michael Edwin Pillai ♪ Dubbing Coordinator - Chayan Rio Ghosh♪ Song Recorded: T-Series Studio♪ Recorded By: Surajit Ghosh Mazumdar♪ Music Label: T-Series Instagrams : UBV Official: https://www.instagram.com/unknown_boy...Varun : https://www.instagram.com/varun_ubv/Pratik : https://www.instagram.com/pratik_ubv/ #Yaadpiyakiaanelagi #bheegibheegi #cutelovestory"
"k3629rNR2yA","Warner pummels Pakistan before Starc shines under lights | Second Domain Test","2019-11-30T11:30:46.000Z","UCkBY0aHJP9BwjZLDYxAQrKg","cricket.com.au","17","19.01.12","sp:ty=play|sp:dt=2019-11-29T03:30:00Z|sp:st=cricket|sp:li=icc|sp:ti:home=AUS|sp:ti:away=PAK|Australia|Pakistan|second Test|day two|Adelaide Oval|David Warner|Mitchell Starc","3219859","45790","1912","4242","https://i.ytimg.com/vi/k3629rNR2yA/default.jpg","False","False","David Warner smashed records on his way to a career-best 335 not out then watched on as the Australian quicks, led by Mitch Starc, tore apart Pakistan"
"jfzTbtsL2wM","I Want To Be Safe.","2019-12-01T07:16:01.000Z","UCy6El3LYdeAzdHbYs4S_1kg","Captain Nick","24","19.01.12","captain nick|niharicka|niharika|latest funny videos","244265","70723","229","3817","https://i.ytimg.com/vi/jfzTbtsL2wM/default.jpg","False","False","#Iwantobesafe"
